url,date_published,title,newsorg
https://egyptianstreets.com/2023/08/01/egypt-considers-a-potential-usd-1-billion-green-hydrogen-plant-deal/,2023-08-01,Egypt Considers a Potential USD 1 Billion Green Hydrogen Plant Deal,egyptianstreets.com
https://egyptianstreets.com/2023/08/02/emerging-clean-energy-hub-egypts-potential-as-a-regional-renewable-energy-leader/,2023-08-02,Emerging Clean Energy Hub: Egypt’s Potential as a Regional Renewable Energy Leader,egyptianstreets.com
https://www.dailynewsegypt.com/2023/08/02/auc-professors-develop-sustainable-construction-system-using-robotic-additive-manufacturing/,2023-08-02,AUC professors develop sustainable construction system using robotic additive manufacturing,dailynewsegypt.com
https://www.egyptindependent.com/egypt-to-see-significant-rise-in-temperatures-humidity-for-august-ema/,2023-08-02,"Egypt to see significant rise in temperatures, humidity for August: EMA",egyptindependent.com
https://www.dailynewsegypt.com/2023/08/02/nuclear-war-earth-climate/,2023-08-02,Nuclear war would be more devastating for Earth’s climate than cold war predictions – even with fewer weapons,dailynewsegypt.com
https://www.dailynewsegypt.com/2023/08/02/ancient-grain-unlocks-genetic-secrets-for-making-wheat-bread-more-resilient/,2023-08-02,Ancient grain unlocks genetic secrets for making wheat bread more resilient,dailynewsegypt.com
https://www.dailynewsegypt.com/2023/08/02/irrigation-minister-egypts-ambassador-to-south-sudan-review-water-projects-in-juba/,2023-08-02,"Irrigation Minister, Egypt’s ambassador to South Sudan review water projects in Juba",dailynewsegypt.com
https://www.dailynewsegypt.com/2023/08/02/cabinet-reviews-potential-and-plans-for-producing-renewable-energy-and-green-hydrogen/,2023-08-02,Cabinet reviews potential and plans for producing renewable energy and green hydrogen,dailynewsegypt.com
https://www.egyptindependent.com/more-than-a-million-displaced-as-chinas-hebei-region-reels-after-record-rains/,2023-08-04,More than a million displaced as China’s Hebei region reels after record rains,egyptindependent.com
https://www.dailynewsegypt.com/2023/08/04/niger-military-agreements-france/,2023-08-04,Niger's junta abolishes military agreements with France,dailynewsegypt.com
https://egyptianstreets.com/2023/08/05/the-desert-gardener-a-tale-of-conservation-and-rehabilitation-of-egypts-desert-plants/,2023-08-05,“The Desert Gardener”: a Tale of Conservation and Rehabilitation of Egypt’s Desert Plants,egyptianstreets.com
https://www.egyptindependent.com/amazon-deforestation-at-six-year-low-in-brazil-after-plunging-66-in-july/,2023-08-05,Amazon deforestation at six-year-low in Brazil after plunging 66% in July,egyptindependent.com
https://www.egyptindependent.com/greta-thunberg-pulls-out-of-edinburgh-book-festival-appearance-after-accusing-key-sponsor-of-greenwashing/,2023-08-05,Greta Thunberg pulls out of Edinburgh Book Festival appearance after accusing key sponsor of greenwashing,egyptindependent.com
https://egyptianstreets.com/2023/08/05/redefining-public-parks-leading-the-battle-against-urbanizations-impact-on-egypts-green-havens/,2023-08-05,‘Redefining Public Parks’: Leading the Battle Against Urbanization’s Impact on Egypt’s Green Havens,egyptianstreets.com
https://middleeastobserver.org/2023/07/21/amid-surging-wheat-prices-egypt-criticizes-russia-for-ending-ukraine-grain-export-deal/,2023-07-21,"Amid surging wheat prices, Egypt criticizes Russia for ending Ukraine grain-export deal",middleeastobserver.org
https://www.dailynewsegypt.com/2023/08/06/moharram-partners-offers-consulting-services-to-more-than-80-companies-in-19-sectors-across-20-countries-ceo/,2023-08-06,Moharram Partners offers consulting services to more than 80 companies in 19 sectors across 20 countries: CEO,dailynewsegypt.com
https://www.egyptindependent.com/deadly-floods-hit-chinas-major-grain-producing-region-fueling-food-security-concerns/,2023-08-07,"Deadly floods hit China’s major grain-producing region, fueling food security concerns",egyptindependent.com
https://www.egyptindependent.com/most-children-in-south-asia-are-exposed-to-extreme-high-temperatures-unicef-says/,2023-08-07,"Most children in South Asia are exposed to extreme high temperatures, UNICEF says",egyptindependent.com
https://www.aljazeera.net/midan/miscellaneous/science/2023/8/8/%d8%a7%d9%84%d8%af%d9%88%d8%b1%d8%a9-%d8%a7%d9%84%d9%8025-%d9%84%d9%84%d8%b4%d9%85%d8%b3-%d9%87%d9%84-%d9%84%d9%84%d9%86%d8%b4%d8%a7%d8%b7-%d8%a7%d9%84%d8%b4%d9%85%d8%b3%d9%8a,2023-08-08,الدورة الـ25 للشمس.. هل للنشاط الشمسي علاقة بموجات الحر التي تضربنا حاليا؟,aljazeera.net
https://www.egyptindependent.com/july-hit-a-crucial-warming-threshold-that-scientists-have-warned-the-world-should-stay-under/,2023-08-08,July hit a crucial warming threshold that scientists have warned the world should stay under,egyptindependent.com
https://www.egyptindependent.com/amazon-nations-fail-to-agree-on-a-common-goal-to-end-deforestation/,2023-08-09,Amazon nations fail to agree on a common goal to end deforestation,egyptindependent.com
https://egyptianstreets.com/2023/08/10/7-mediterranean-species-threatened-due-to-rising-temperatures/,2023-08-10,7 Mediterranean Species Threatened Due to Rising Temperatures,egyptianstreets.com
https://www.dailynewsegypt.com/2023/08/10/dry-conditions-contribute-to-rapid-spread-and-intensity-of-wildfires-expert/,2023-08-10,Dry conditions contribute to rapid spread and intensity of wildfires: Expert,dailynewsegypt.com
https://www.dailynewsegypt.com/2023/08/10/sweilam-el-orabi-review-water-cooperation-projects-in-africa/,2023-08-10,"Sweilam, El-Orabi review water cooperation projects in Africa",dailynewsegypt.com
https://www.dailynewsegypt.com/2023/08/10/opinion-imf-sounds-alarm-about-grain-crisis/,2023-08-10,Opinion| IMF sounds alarm about grain crisis,dailynewsegypt.com
https://www.dailynewsegypt.com/2023/08/10/horn-of-africa-reached-a-drought-tipping-point-11700-years-ago/,2023-08-10,"Horn of Africa reached a drought tipping point 11,700 years ago",dailynewsegypt.com
https://www.egyptindependent.com/india-to-invest-4-billion-in-production-of-green-hydrogen-in-egypt/,2023-08-09,India to invest $4 billion in production of green hydrogen in Egypt,egyptindependent.com
https://egyptianstreets.com/2023/08/11/egypt-submerges-military-equipment-in-the-red-sea-to-protect-coral-reefs/,2023-08-11,Egypt Submerges Military Equipment in the Red Sea to Protect Coral Reefs,egyptianstreets.com
https://www.egyptindependent.com/western-leaders-welcomed-chinas-presence-at-ukraine-peace-talks-but-beijings-relationship-with-europe-is-still-testy/,2023-08-12,Western leaders welcomed China’s presence at Ukraine peace talks. But Beijing’s relationship with Europe is still testy,egyptindependent.com
https://www.dailynewsegypt.com/2023/08/13/arab-youth-hackathon-invites-egyptian-innovators-to-tackle-climate-change/,2023-08-13,Arab Youth Hackathon invites Egyptian innovators to tackle climate change,dailynewsegypt.com
https://www.egyptindependent.com/ocean-heat-is-off-the-charts-so-where-are-the-hurricanes-forecasters-warn-a-change-is-coming/,2023-08-13,"Ocean heat is off the charts, so where are the hurricanes? Forecasters warn a change is coming",egyptindependent.com
https://www.egyptindependent.com/heavy-rains-bring-deadly-flash-flood-and-landslide-to-northwest-china/,2023-08-14,Heavy rains bring deadly flash flood and landslide to northwest China,egyptindependent.com
https://www.dailynewsegypt.com/2023/08/14/arab-youth-religion-family-identity/,2023-08-14,"Arab youth see religion, family as key to identity",dailynewsegypt.com
https://www.egyptindependent.com/egypts-gold-reserves-rise-by-24-percent-in-first-half-of-2023/,2023-08-14,Egypt’s gold reserves rise by 24 percent in first half of 2023,egyptindependent.com
https://www.dailynewsegypt.com/2023/08/14/us-appoints-sean-jones-as-new-usaid-mission-director-in-egypt/,2023-08-14,US appoints Sean Jones as new USAID Mission Director in Egypt,dailynewsegypt.com
https://www.egyptindependent.com/typhoon-lan-hits-western-japan-prompts-evacuation-warnings-for-237000-people/,2023-08-15,"Typhoon Lan hits western Japan, prompts evacuation warnings for 237,000 people",egyptindependent.com
https://www.egyptindependent.com/a-quarter-of-humanity-faces-extreme-water-stress-and-its-poised-to-get-worse-new-report-finds/,2023-08-16,"A quarter of humanity faces extreme water stress – and it’s poised to get worse, new report finds",egyptindependent.com
https://www.dailynewsegypt.com/2023/08/16/environment-minister-receives-delegation-from-french-university-of-cote-dazur/,2023-08-16,Environment Minister receives delegation from French University of Côte d'Azur,dailynewsegypt.com
https://egyptianstreets.com/2023/08/18/egypt-to-adopt-drought-tolerant-crops-to-combat-water-scarcity/,2023-08-18,Egypt to Adopt Drought Tolerant Crops to Combat Water Scarcity,egyptianstreets.com
https://www.egyptindependent.com/egypt-kenya-mull-preparations-for-africa-climate-summit/,2023-08-19,"Egypt, Kenya mull preparations for Africa Climate Summit",egyptindependent.com
https://www.egyptindependent.com/diving-activities-return-to-red-sea-and-south-sinai/,2023-08-19,Diving activities return to Red Sea and South Sinai,egyptindependent.com
https://www.egyptindependent.com/new-study-warns-against-risks-of-time-traveling-pathogens/,2023-08-19,New study warns against risks of ‘time-traveling pathogens’,egyptindependent.com
https://www.dailynewsegypt.com/2023/08/20/undp-itida-launch-new-project-to-accelerate-digital-innovation-in-egypt/,2023-08-20,"UNDP, ITIDA, launch new project to accelerate digital innovation in Egypt",dailynewsegypt.com
https://www.dailynewsegypt.com/2023/08/21/brics-summit-to-draw-global-attention/,2023-08-21,BRICS Summit to draw global attention,dailynewsegypt.com
https://www.egyptindependent.com/ecuador-votes-in-historic-referendum-on-oil-extraction-in-the-amazon/,2023-08-21,Ecuador votes in historic referendum on oil extraction in the Amazon,egyptindependent.com
https://www.egyptindependent.com/egypt-un-discuss-outcome-of-un-water-conference/,2023-08-21,"Egypt, UN discuss outcome of UN water conference",egyptindependent.com
https://www.dailynewsegypt.com/2023/08/21/an-expanded-brics-could-reset-world-politics-but-picking-new-members-isnt-straightforward/,2023-08-21,An expanded BRICS could reset world politics but picking new members isn’t straightforward,dailynewsegypt.com
https://www.dailynewsegypt.com/2023/08/22/egypts-irrigation-minister-discuss-water-concerns-with-ungas-presidents-advisor/,2023-08-22,Egypt’s Irrigation Minister discuss water concerns with UNGA’s president’s advisor,dailynewsegypt.com
https://www.dailynewsegypt.com/2023/08/22/egypt-will-be-voice-of-africa-in-aiib-meetings-finance-minister/,2023-08-22,Egypt will be voice of Africa in AIIB Meetings: Finance Minister,dailynewsegypt.com
https://www.aljazeera.net/midan/miscellaneous/science/2023/8/22/%d8%b9%d9%84%d9%89-%d8%ad%d8%a7%d9%81%d8%a9-%d8%a7%d9%84%d9%83%d8%a7%d8%b1%d8%ab%d8%a9-%d9%87%d9%84-%d9%8a%d8%a4%d8%af%d9%8a-%d8%aa%d8%ba%d9%8a%d8%b1-%d8%a7%d9%84%d9%85%d9%86%d8%a7%d8%ae,2023-08-22,"""على حافة الكارثة"".. هل يؤدي تغير المناخ إلى حرب كبرى في النيجر قريبا؟",aljazeera.net
https://www.dailynewsegypt.com/2023/08/23/cubas-fm-looks-forward-to-egypts-participation-in-77th-china-summit/,2023-08-23,Cuba's FM looks forward to Egypt's participation in 77th China summit,dailynewsegypt.com
https://www.egyptindependent.com/melting-austrian-glacier-gives-up-body-of-long-dead-man/,2023-08-23,Melting Austrian glacier gives up body of long-dead man,egyptindependent.com
https://www.dailynewsegypt.com/2023/08/23/irrigation-minister-calls-for-increasing-support-to-africas-water-sanitation-sector/,2023-08-23,"Irrigation Minister calls for increasing support to Africa’s water, sanitation sector",dailynewsegypt.com
https://www.dailynewsegypt.com/2023/08/24/opinion-camp-david-summit-and-efforts-to-form-asian-nato-to-confront-china/,2023-08-24,Opinion| Camp David Summit and efforts to form ‘Asian NATO’ to confront China,dailynewsegypt.com
https://www.egyptindependent.com/catastrophic-loss-huge-colonies-of-emperor-penguins-saw-no-chicks-survive-last-year-as-sea-ice-disappears/,2023-08-25,‘Catastrophic’ loss: Huge colonies of emperor penguins saw no chicks survive last year as sea ice disappears,egyptindependent.com
https://www.dailynewsegypt.com/2023/08/26/china-africa-strategy-hunan/,2023-08-26,China’s Africa strategy is shifting from extraction to investment – driven from the industry-rich Hunan region,dailynewsegypt.com
https://www.egyptindependent.com/environment-minister-reviews-ways-to-benefit-from-energy-saving-goods-received-as-grant-from-china/,2023-08-26,Environment Minister reviews ways to benefit from energy-saving goods received as grant from China,egyptindependent.com
https://www.dailynewsegypt.com/2023/08/27/cairo-and-mansoura-universities-won-first-place-as-the-best-environmentally-friendly-university/,2023-08-27,Cairo and Mansoura Universities won first place as the best environmentally friendly university,dailynewsegypt.com
https://www.egyptindependent.com/a-losing-battle-to-save-the-lungs-of-athens-as-wildfires-grip-greece/,2023-08-27,A losing battle to save the lungs of Athens as wildfires grip Greece,egyptindependent.com
https://www.egyptindependent.com/zimbabwes-president-mnangagwa-reelected-after-tense-contest/,2023-08-27,Zimbabwe’s President Mnangagwa reelected after tense contest,egyptindependent.com
https://www.aljazeera.net/midan/miscellaneous/2023/8/27/%d9%83%d8%a7%d8%b1%d8%ab%d8%a9-%d8%a7%d9%84%d9%85%d9%8a%d8%a7%d9%87-%d8%aa%d9%82%d8%aa%d8%b1%d8%a8-%d8%b3%d9%8a%d9%86%d8%a7%d8%b1%d9%8a%d9%88-%d9%82%d8%a7%d8%aa%d9%85-%d9%8a%d9%87%d8%af%d8%af,2023-08-27,كارثة المياه تقترب.. سيناريو قاتم يهدد أكثر من نصف سكان الأرض خلال ربع قرن فقط!,aljazeera.net
https://www.dailynewsegypt.com/2023/08/27/egypts-govt-should-not-borrow-money-to-buy-wheat-says-nasa-scientist-farouk-el-baz/,2023-08-27,"Egypt's gov't should not borrow money to buy wheat, says NASA scientist Farouk El-Baz",dailynewsegypt.com
https://www.dailynewsegypt.com/2023/08/28/brics-expansion-to-give-global-south-a-louder-voice-south-african-expert/,2023-08-28,BRICS expansion to give Global South a louder voice: South African expert,dailynewsegypt.com
https://www.youm7.com/story/2023/8/28/الرقابة-المالية-تصدر-معايير-قيد-جهات-التحقق-لإصدار-شهادات-الكربون/6286498,2023-08-28,الرقابة المالية تصدر معايير قيد جهات التحقق لإصدار شهادات الكربون الطوعية,youm7.com
https://www.almasryalyoum.com/news/details/2968161,2023-08-28,الرقابة المالية تصدر معايير قيد جهات التحقق والمصادقة لإصدار شهادات الكربون الطوعية,almasryalyoum.com
https://www.elfagr.org/4756932,2023-08-28,الرقابة المالية تصدر معايير قيد جهات التحقق والمصادقة المحلية والأجنبية لإصدار شهادات الكربون الطوعية,elfagr.org
https://www.dostor.org/4487027,2023-08-28,دراسة: أزمة المناخ تعني ربع منتجعات التزلج الأوروبية تواجه ندرة الثلوج,dostor.org
https://www.dailynewsegypt.com/2023/08/28/brics-africa-cdc-who-to-collaborate-on-pandemic-prevention-response/,2023-08-28,"BRICS, Africa CDC, WHO to collaborate on pandemic prevention, response",dailynewsegypt.com
https://www.egyptindependent.com/greek-police-arrest-dozens-for-arson-as-eus-largest-ever-wildfires-rage/,2023-08-29,Greek police arrest dozens for arson as EU’s largest-ever wildfires rage,egyptindependent.com
https://egyptianstreets.com/2023/08/29/egypt-building-weather-monitoring-stations-along-mediterranean-to-combat-climate-change/,2023-08-29,Egypt Building Weather Monitoring Stations Along Mediterranean to Combat Climate Change,egyptianstreets.com
https://www.dailynewsegypt.com/2023/08/30/opinion-unveiling-oppenheimer-from-now-i-become-death-to-not-to-destroy-the-world-the-san-francisco-promise/,2023-08-30,Opinion| Unveiling Oppenheimer: From 'Now I Become Death' to ‘Not to Destroy The World… ‘The San Francisco Promise’,dailynewsegypt.com
https://www.dailynewsegypt.com/2023/08/30/opinion-challenges-facing-brics/,2023-08-30,Opinion| Challenges facing BRICS,dailynewsegypt.com
https://www.dailynewsegypt.com/2023/08/30/climate-change-aggravates-water-stress-in-mena-region/,2023-08-30,Climate change aggravates water stress in MENA region,dailynewsegypt.com
https://www.dailynewsegypt.com/2023/08/30/egypt-sets-up-cabinet-unit-to-coordinate-with-brics/,2023-08-30,Egypt sets up cabinet unit to coordinate with BRICS,dailynewsegypt.com
https://www.dailynewsegypt.com/2023/08/31/intel-driving-business-transformation-digital-disruption/,2023-08-31,Intel’s art of driving business transformation in the age of digital disruption,dailynewsegypt.com
https://www.dailynewsegypt.com/2023/08/31/african-campaigners-call-for-shift-to-climate-resilient-livestock-systems/,2023-08-31,African campaigners call for shift to climate-resilient livestock systems,dailynewsegypt.com
https://egyptianstreets.com/2023/09/01/six-egyptian-agritech-startups-at-the-forefront-of-innovation-in-agriculture/,2023-09-01,Six Egyptian Agritech Startups at the Forefront of Innovation in Agriculture,egyptianstreets.com
https://www.egyptindependent.com/rare-protests-flare-in-regime-held-syria-as-assad-seeks-international-rehabilitation/,2023-09-02,Rare protests flare in regime-held Syria as Assad seeks international rehabilitation,egyptindependent.com
https://www.egyptindependent.com/worrying-statistics-on-the-worlds-water-crisis/,2023-09-02,Worrying statistics on the world's water crisis,egyptindependent.com
https://www.youm7.com/story/2023/9/2/دراسة-جعل-المدن-أكثر-خضرة-يؤثر-بشكل-كبير-على-معدلات/6291692,2023-09-02,دراسة: جعل المدن أكثر خضرة يؤثر بشكل كبير على معدلات الكربون,youm7.com
https://www.dailynewsegypt.com/2023/09/03/cbe-opens-door-for-establishment-of-green-banks-in-egypt/,2023-09-03,CBE opens door for establishment of green banks in Egypt,dailynewsegypt.com
https://www.egyptindependent.com/the-worlds-highest-navigable-lake-is-drying-out/,2023-09-04,The world’s highest navigable lake is drying out,egyptindependent.com
https://www.dailynewsegypt.com/2023/09/04/africa-climate-summit-african-carbon-markets/,2023-09-04,Africa Climate Summit: Mohieldin Says African Carbon Markets Important for Climate Financing,dailynewsegypt.com
https://www.dailynewsegypt.com/2023/09/04/egyptian-prime-minister-leads-delegation-to-africa-climate-summit-in-nairobi/,2023-09-04,Egyptian Prime Minister leads ministerial delegation to Africa Climate Summit in Nairobi,dailynewsegypt.com
https://www.egyptindependent.com/irrigation-minister-arrives-in-nairobi-to-partake-in-acs-2023/,2023-09-05,Irrigation minister arrives in Nairobi to partake in ACS 2023,egyptindependent.com
https://www.egyptindependent.com/zimbabwes-president-mnangagwa-sworn-in-after-disputed-polls/,2023-09-05,Zimbabwe’s President Mnangagwa sworn in after disputed polls,egyptindependent.com
https://www.egyptindependent.com/invasive-species-cost-the-world-423-billion-every-year-and-are-causing-environmental-chaos-un-report-finds/,2023-09-05,"Invasive species cost the world $423 billion every year and are causing environmental chaos, UN report finds",egyptindependent.com
https://www.egyptindependent.com/pm-egypt-keen-on-addressing-request-of-developing-countries-to-realize-climate-justice/,2023-09-06,PM: Egypt keen on addressing request of developing countries to realize climate justice,egyptindependent.com
https://www.egyptindependent.com/the-world-has-just-experienced-the-hottest-summer-on-record-by-a-significant-margin/,2023-09-06,The world has just experienced the hottest summer on record – by a significant margin,egyptindependent.com
https://www.dailynewsegypt.com/2023/09/06/cop28-champion-attends-africa-climate-week-to-promote-nature-based-solutions/,2023-09-06,COP28 Champion attends Africa Climate Week to promote nature-based solutions,dailynewsegypt.com
https://egyptianstreets.com/2023/09/06/7-leading-solar-energy-companies-revolutionizing-egypts-renewable-energy-landscape/,2023-09-06,7 Leading Solar Energy Companies Revolutionizing Egypt’s Renewable Energy Landscape,egyptianstreets.com
https://www.dailynewsegypt.com/2023/09/06/cop28-4bn-initiative-africa/,2023-09-06,COP28 President reveals $4.5bn UAE finance initiative to unlock Africa's clean energy potential,dailynewsegypt.com
https://www.dailynewsegypt.com/2023/09/06/ethiopia-shows-no-sign-of-accepting-solutions-to-gerd-crisis-shoukry/,2023-09-06,Ethiopia shows no sign of accepting solutions to GERD crisis: Shoukry,dailynewsegypt.com
https://www.dailynewsegypt.com/2023/09/06/france-africa-macron-anger/,2023-09-06,France in Africa: Why Macron’s policies increased distrust and anger,dailynewsegypt.com
https://www.dailynewsegypt.com/2023/09/07/al-mashat-discusses-cooperation-with-jpmorgan-chase-international-investors/,2023-09-07,"Al-Mashat discusses cooperation with JPMorgan Chase, international investors",dailynewsegypt.com
https://www.dailynewsegypt.com/2023/09/07/afdb-announces-1bn-fund-to-boost-climate-financing-for-africas-youth/,2023-09-07,AfDB announces $1bn fund to boost climate financing for Africa's youth,dailynewsegypt.com
https://www.dailynewsegypt.com/2023/09/07/gfanz-afdb-partnership-enhances-africas-capability-to-face-climate-finance-challenges-mohieldin/,2023-09-07,GFANZ - AfDB partnership enhances Africa’s capability to face climate finance challenges: Mohieldin,dailynewsegypt.com
https://www.dailynewsegypt.com/2023/09/07/africa-climate-summit-adopts-nairobi-declaration-calling-for-global-carbon-tax/,2023-09-07,Africa Climate Summit adopts 'Nairobi Declaration' calling for global carbon tax,dailynewsegypt.com
https://www.dostor.org/4495265,2023-09-07,دراسة حديثة: مخاوف من ارتفاع الحرارة بالقارة القطبية الجنوبية بشكل أسرع من المتوقع,dostor.org
https://www.egyptindependent.com/sisi-heads-to-india-for-g20-summit-discusses-needs-of-developing-nations/,2023-09-08,"Sisi heads to India for G20 summit, discusses needs of developing nations",egyptindependent.com
https://www.egyptindependent.com/more-than-800-rescued-after-extreme-flooding-in-greece-turns-villages-into-lakes/,2023-09-08,More than 800 rescued after extreme flooding in Greece turns villages into lakes,egyptindependent.com
https://www.egyptindependent.com/planet-warming-pollution-made-summer-heat-twice-as-likely-for-nearly-all-of-humanity/,2023-09-08,Planet-warming pollution made summer heat twice as likely for nearly all of humanity,egyptindependent.com
https://www.dailynewsegypt.com/2023/09/08/g20-egypt-sisi-india-delhi/,2023-09-08,"G20: Egypt's Al-Sisi arrives in India, as New Delhi gears up for summit",dailynewsegypt.com
https://www.dailynewsegypt.com/2023/09/08/g20-summit-egypt-to-push-forward-efforts-to-support-developing-countries/,2023-09-08,G20 Summit: Egypt to push forward efforts to support developing countries,dailynewsegypt.com
https://www.egyptindependent.com/india-is-hosting-the-g20-as-the-world-faces-crisis-for-modi-its-a-chance-to-shine/,2023-09-09,"India is hosting the G20 as the world faces crisis. For Modi, it’s a chance to shine",egyptindependent.com
https://www.egyptindependent.com/egypt-calls-on-the-g20-summit-to-support-developing-countries/,2023-09-09,Egypt calls on the G20 summit to support developing countries,egyptindependent.com
https://www.dailynewsegypt.com/2023/09/09/g20-leaders-summit-focuses-on-debt-economic-development-and-climate-change/,2023-09-09,"G20 Leaders Summit focuses on debt, economic development and climate change",dailynewsegypt.com
https://www.dailynewsegypt.com/2023/09/09/g20-summit-kicks-off-in-india-with-african-unions-participation/,2023-09-09,G20 summit kicks off in India with African Union’s participation,dailynewsegypt.com
https://egyptianstreets.com/2023/09/09/g20-summit-egypts-al-sisi-participates-african-union-formally-joins-as-permanent-member/,2023-09-09,"G20 Summit: Egypt’s Al-Sisi Participates, African Union Formally Joins as Permanent Member",egyptianstreets.com
https://www.dailynewsegypt.com/2023/09/10/egx-fra-join-african-climate-summit-in-kenya/,2023-09-10,"EGX, FRA join African Climate Summit in Kenya",dailynewsegypt.com
https://www.egyptindependent.com/sisi-at-g20-summit-asserts-necessity-of-formulating-future-arrangements-to-attain-joint-goals/,2023-09-11,Sisi at G20 summit asserts necessity of formulating future arrangements to attain joint goals,egyptindependent.com
https://www.dailynewsegypt.com/2023/09/11/egypt-netherlands-discuss-water-cooperation-climate-adaptation/,2023-09-11,"Egypt, Netherlands discuss water cooperation, climate adaptation",dailynewsegypt.com
https://www.dailynewsegypt.com/2023/09/12/egypt-to-issue-panda-bonds-worth-500m/,2023-09-12,Egypt to issue Panda bonds worth $500m,dailynewsegypt.com
https://www.dailynewsegypt.com/2023/09/13/fra-develops-legislative-frameworks-to-promote-sustainability-in-non-banking-activities/,2023-09-13,FRA develops legislative frameworks to promote sustainability in non-banking activities,dailynewsegypt.com
