url,date_published,title,newsorg
https://www.dailynewsegypt.com/2023/09/13/opinion-rise-of-new-powers-and-us-decline-challenges-and-opportunities/,2023-09-13,Opinion| Rise of new powers and US decline: Challenges and opportunities,dailynewsegypt.com
https://www.dailynewsegypt.com/2023/09/13/unctad-to-hold-world-investment-forum-to-rally-funds-for-climate-action/,2023-09-13,UNCTAD to hold World Investment Forum to rally funds for climate action,dailynewsegypt.com
https://www.egyptindependent.com/more-than-5000-presumed-dead-in-libya-after-catastrophic-flooding-breaks-dams-and-sweeps-away-homes/,2023-09-13,"More than 5,000 presumed dead in Libya after catastrophic flooding breaks dams and sweeps away homes",egyptindependent.com
https://www.egyptindependent.com/egypt-allocates-le30-mln-in-aid-to-libya-morocco-and-slovenia/,2023-09-13,"Egypt allocates LE30 mln in aid to Libya, Morocco and Slovenia",egyptindependent.com
https://www.egyptindependent.com/pm-opens-1st-edition-of-environmental-and-climate-forum-under-sisis-auspices/,2023-09-13,PM opens 1st edition of Environmental and Climate Forum under Sisi’s auspices,egyptindependent.com
https://www.egyptindependent.com/uk-government-under-pressure-to-take-tougher-line-on-china-amid-spying-allegations/,2023-09-13,UK government under pressure to take tougher line on China amid spying allegations,egyptindependent.com
https://www.dailynewsegypt.com/2023/09/14/africa-climate-summit-highlighted-climate-action-as-solution-to-food-energy-debt-crises-mohieldin/,2023-09-14,"Africa Climate Summit highlighted climate action as solution to food, energy, debt crises: Mohieldin",dailynewsegypt.com
https://www.egyptindependent.com/aging-dams-and-missed-warnings-a-lethal-mix-of-factors-caused-africas-deadliest-flood-disaster/,2023-09-15,Aging dams and missed warnings: A lethal mix of factors caused Africa’s deadliest flood disaster,egyptindependent.com
https://www.egyptindependent.com/prince-william-wants-to-be-a-global-statesman/,2023-09-15,Prince William wants to be a global statesman,egyptindependent.com
https://www.egyptindependent.com/gameela-ismail-plans-to-run-for-president/,2023-09-15,Gameela Ismail plans to run for president,egyptindependent.com
https://egyptianstreets.com/2023/09/15/egypt-set-to-launch-misrsat-2-satellite-to-monitor-climate-change/,2023-09-15,Egypt Set to Launch MisrSat-2 Satellite to Monitor Climate Change,egyptianstreets.com
https://egyptianstreets.com/2023/09/15/egypt-provides-aid-to-libya-morocco-amidst-ongoing-search-and-rescue-efforts/,2023-09-15,"Egypt Provides Aid to Libya, Morocco, Amidst Ongoing Search and Rescue Efforts",egyptianstreets.com
https://www.egyptindependent.com/ten-countries-and-territories-saw-severe-flooding-in-just-12-days-is-this-the-future-of-climate-change/,2023-09-17,Ten countries and territories saw severe flooding in just 12 days. Is this the future of climate change?,egyptindependent.com
https://www.dailynewsegypt.com/2023/09/17/egyptian-banking-sector-maintains-financial-solidity-resilience-cbe/,2023-09-17,"Egyptian banking sector maintains financial solidity, resilience: CBE",dailynewsegypt.com
https://www.dailynewsegypt.com/2023/09/17/stronger-cooperation-in-high-emissions-sectors-needed-to-meet-1-5c-climate-goal/,2023-09-17,Stronger cooperation in high-emissions sectors needed to meet 1.5°C climate goal,dailynewsegypt.com
https://www.dailynewsegypt.com/2023/09/17/developing-platform-to-determine-climate-risks-solutions-to-help-address-them-mohieldin-says-in-new-york-climate-week/,2023-09-17,"Developing platform to determine climate risks, solutions to help address them, Mohieldin says in New York Climate Week",dailynewsegypt.com
https://www.dailynewsegypt.com/2023/09/17/egypt-participates-in-barcelona-convention-meetings-for-marine-protection/,2023-09-17,Egypt participates in Barcelona Convention meetings for marine protection,dailynewsegypt.com
https://www.dailynewsegypt.com/2023/09/18/egypts-international-cooperation-minister-heads-to-new-york-for-climate-ambition-summit/,2023-09-18,Egypt's International Cooperation Minister heads to New York for Climate Ambition Summit,dailynewsegypt.com
https://www.egyptindependent.com/world-leaders-gather-at-the-un-this-week-heres-what-to-watch-for/,2023-09-18,World leaders gather at the UN this week. Here’s what to watch for,egyptindependent.com
https://www.dailynewsegypt.com/2023/09/18/microsoft-egypt-aims-to-provide-advanced-ai-models-build-solid-ai-ecosystem-mirna-arif/,2023-09-18,"Microsoft Egypt aims to provide advanced AI models, build solid AI ecosystem: Mirna Arif",dailynewsegypt.com
https://www.egyptindependent.com/5th-edition-of-sharm-rendezvous-insurance-forum-kicks-off/,2023-09-18,5th edition of Sharm Rendezvous Insurance Forum kicks off,egyptindependent.com
https://www.dailynewsegypt.com/2023/09/18/shoukry-cleverly-discuss-boosting-egypt-uk-ties-regional-issues/,2023-09-18,"Shoukry, Cleverly discuss boosting Egypt-UK ties, regional issues",dailynewsegypt.com
https://www.dailynewsegypt.com/2023/09/19/chapter-zero-egypt-launches-its-first-awareness-seminar-on-sustainable-development-climate-risk/,2023-09-19,"Chapter Zero Egypt launches its first awareness seminar on Sustainable Development, Climate Risk",dailynewsegypt.com
https://www.dailynewsegypt.com/2023/09/19/egypt-takes-strategic-approach-to-migration-assistant-fm/,2023-09-19,Egypt takes strategic approach to migration: Assistant FM,dailynewsegypt.com
https://www.dailynewsegypt.com/2023/09/19/world-leaders-adopt-political-declaration-to-eradicate-poverty-protect-planet/,2023-09-19,"World leaders adopt political declaration to eradicate poverty, protect planet",dailynewsegypt.com
https://www.dailynewsegypt.com/2023/09/20/climate-resilience-must-be-a-guiding-principle-of-urban-development-new-report-says/,2023-09-20,"Climate resilience must be a guiding principle of urban development, new report says",dailynewsegypt.com
https://www.dailynewsegypt.com/2023/09/20/climate-finance-in-developing-countries-mohieldin-calls-for-concessional-finance-and-de-risking-mechanisms/,2023-09-20,Climate finance in developing countries: Mohieldin calls for concessional finance and de-risking mechanisms,dailynewsegypt.com
https://www.youm7.com/story/2023/9/21/منتجع-تزلج-فرنسى-يغلق-أبوابه-نهائيا-بسبب-تغير-المناخ-وقلة/6307063,2023-09-21,منتجع تزلج فرنسى يغلق أبوابه نهائيا بسبب تغير المناخ وقلة تساقط الثلوج,youm7.com
https://egyptianstreets.com/2023/09/21/egyptian-minister-of-environment-to-co-chair-cop28-negotiations-on-climate-finance/,2023-09-21,Egyptian Minister of Environment to Co-Chair COP28 Negotiations on Climate Finance,egyptianstreets.com
https://www.dailynewsegypt.com/2023/09/22/cccpa-african-union-train-officials-on-climate-responsive-programming-for-sustaining-peace/,2023-09-22,"CCCPA, African Union train officials on ‘Climate Responsive Programming for Sustaining Peace’",dailynewsegypt.com
https://www.egyptindependent.com/mashat-affirms-necessity-of-addressing-issue-of-equitable-financing-for-development/,2023-09-23,Mashat affirms necessity of addressing issue of equitable financing for development,egyptindependent.com
https://www.dailynewsegypt.com/2023/09/24/egypts-environment-minister-calls-for-more-funding-to-address-climate-change-losses-damages/,2023-09-24,"Egypt’s Environment Minister calls for more funding to address climate change losses, damages",dailynewsegypt.com
https://www.egyptindependent.com/russian-foreign-minister-attacks-west-as-empire-of-lies/,2023-09-24,Russian foreign minister attacks West as ‘empire of lies’,egyptindependent.com
https://www.dailynewsegypt.com/2023/09/24/arab-region-has-great-opportunities-to-harness-digitalisation-ai-in-making-progress-in-implementing-climate-action-mahmoud-mohieldin/,2023-09-24,"Arab region has great opportunities to harness digitalisation, AI in making progress in implementing climate action: Mahmoud Mohieldin",dailynewsegypt.com
https://www.egyptindependent.com/the-ominous-signs-pointing-to-extreme-heat-and-fire-in-australia-this-summer/,2023-09-24,The ominous signs pointing to extreme heat and fire in Australia this summer,egyptindependent.com
https://www.dailynewsegypt.com/2023/09/25/egypts-al-mashat-delivers-opening-speech-at-high-level-conference-on-building-the-economies-of-the-future/,2023-09-25,Egypt's Al-Mashat delivers opening speech at high-level conference on Building the Economies of the Future,dailynewsegypt.com
https://www.elfagr.org/4774444,2023-09-25,The EFG Foundation and The National Institute for Governance and Sustainable Development Discuss Future Bilateral Cooperation,elfagr.org
https://www.egyptindependent.com/in-her-first-visit-to-egypt-swiss-secretariat-of-economic-affairs-explores-investment-opportunities-qa/,2023-09-25,"In her first visit to Egypt, Swiss Secretariat of Economic Affairs explores investment opportunities: Q",egyptindependent.com
https://www.dailynewsegypt.com/2023/09/25/egypt-seeks-cross-border-development-partnerships-with-aiib-finance-minister/,2023-09-25,Egypt seeks cross-border development partnerships with AIIB: Finance Minister,dailynewsegypt.com
https://www.egyptindependent.com/extreme-heat-scorches-large-parts-of-south-america-as-winter-ends/,2023-09-26,Extreme heat scorches large parts of South America as winter ends,egyptindependent.com
https://www.egyptindependent.com/at-conclusion-of-arab-youth-hackathon-usaid-expresses-pride-in-supporting-egyptian-entrepreneurs-in-pursuit-of-sustainable-future/,2023-09-26,"At conclusion of Arab Youth Hackathon, USAID expresses pride in supporting Egyptian entrepreneurs in pursuit of sustainable future",egyptindependent.com
https://middleeastobserver.org/2023/09/26/egypt-imf-reportedly-agreed-to-merge-first-two-reviews-of-reform-program/,2023-09-26,Egypt: IMF reportedly agreed to merge first two reviews of reform program,middleeastobserver.org
https://www.dailynewsegypt.com/2023/09/27/egypt-aims-to-boost-private-sectors-role-in-economic-activity-to-65-in-medium-term-finance-minister/,2023-09-27,Egypt aims to boost private sector’s role in economic activity to 65% in medium term: Finance Minister,dailynewsegypt.com
https://www.dailynewsegypt.com/2023/09/26/alpha-dhabi-acquires-majority-stake-in-metito-to-boost-water-solutions/,2023-09-26,Alpha Dhabi acquires majority stake in Metito to boost water solutions,dailynewsegypt.com
https://www.dailynewsegypt.com/2023/09/26/opinion-switzerland-a-reliable-partner-of-egypt-in-a-changing-world/,2023-09-26,"Opinion| Switzerland, a reliable partner of Egypt in a changing world",dailynewsegypt.com
https://www.dailynewsegypt.com/2023/09/26/aiibs-investment-portfolio-in-egypt-reaches-1-3bn-with-potential-for-over-1bn-in-various-sectors-maait/,2023-09-26,AIIB’s investment portfolio in Egypt reaches $1.3bn with potential for over $1bn in various sectors: Maait,dailynewsegypt.com
https://www.dailynewsegypt.com/2023/09/27/egypt-to-issue-new-bonds-for-climate-social-goals/,2023-09-27,"Egypt to issue new bonds for climate, social goals",dailynewsegypt.com
https://www.dailynewsegypt.com/2023/09/27/egypts-irrigation-minister-highlights-climate-challenges-for-water-sector/,2023-09-27,Egypt’s Irrigation Minister highlights climate challenges for water sector,dailynewsegypt.com
https://www.dailynewsegypt.com/2023/09/27/arab-league-chief-urges-more-funding-investment-for-food-security/,2023-09-27,"Arab League chief urges more funding, investment for food security",dailynewsegypt.com
https://www.dailynewsegypt.com/2023/09/27/researchers-build-and-test-a-framework-for-achieving-climate-resilience-across-diverse-fisheries/,2023-09-27,Researchers build and test a framework for achieving climate resilience across diverse fisheries,dailynewsegypt.com
https://www.egyptindependent.com/tensions-are-flaring-once-more-in-the-south-china-sea-heres-why-it-matters-for-the-world/,2023-09-29,Tensions are flaring once more in the South China Sea. Here’s why it matters for the world,egyptindependent.com
https://www.egyptindependent.com/us-condemns-vietnams-jailing-of-prominent-climate-activist-on-tax-charges/,2023-09-29,US condemns Vietnam’s jailing of prominent climate activist on tax charges,egyptindependent.com
https://egyptianstreets.com/2023/09/30/can-carbon-markets-like-egypts-help-the-environment/,2023-09-30,Can Carbon Markets Like Egypt’s Help the Environment?,egyptianstreets.com
https://www.egyptindependent.com/undp-signs-mou-with-microsoft-egypt/,2023-09-30,UNDP signs MoU with Microsoft Egypt,egyptindependent.com
https://www.egyptindependent.com/record-rain-in-new-york-city-generates-life-threatening-flooding-overwhelming-streets-and-subways/,2023-10-01,"Record rain in New York City generates ‘life-threatening’ flooding, overwhelming streets and subways",egyptindependent.com
https://www.dailynewsegypt.com/2023/09/30/gafi-plans-to-set-up-financial-service-center-in-new-capital-with-emirati-south-african-alliance/,2023-09-30,GAFI plans to set up financial service center in New Capital with Emirati-South African alliance,dailynewsegypt.com
https://www.dostor.org/4516354,2023-10-04,محافظ الغربية: 14 مشروعًا فائزًا ضمن المبادرة الوطنية للمشروعات الخضراء الذكية,dostor.org
https://www.youm7.com/story/2023/10/4/محافظ-الغربية-يشهد-مؤتمر-تكريم-الفائزين-بالمبادرة-الوطنية-للمشروعات-الخضراء/6325963,2023-10-04,محافظ الغربية يشهد مؤتمر تكريم الفائزين بالمبادرة الوطنية للمشروعات الخضراء,youm7.com
https://www.shorouknews.com/news/view.aspx?cdate=04102023&id=e0f535a3-964e-4671-838b-e151a8608fa4,2023-10-04,محافظ الغربية يكرم المشروعات الفائزة بالمبادرة الوطنية للمشروعات الخضراء الذكية بالمنوفية,shorouknews.com
https://www.elfagr.org/4779928,2023-10-04,محافظ الغربية يشهد مؤتمر تكريم المشروعات الفائزة بالمبادرة الوطنية للمشروعات الخضراء (صور),elfagr.org
https://www.egyptindependent.com/glacial-lake-bursts-in-india-leaving-100-missing-and-19-dead/,2023-10-06,Glacial lake bursts in India leaving 100 missing and 19 dead,egyptindependent.com
https://www.egyptindependent.com/mashat-attends-signing-of-seven-grant-agreements/,2023-10-07,Mashat attends signing of seven grant agreements,egyptindependent.com
https://www.dailynewsegypt.com/2023/10/08/arab-league-cccpa-conduct-new-training-for-arab-women-mediators-network/,2023-10-08,"Arab League, CCCPA conduct new training for Arab Women Mediators Network",dailynewsegypt.com
https://www.elfagr.org/4782109,2023-10-08,The EFG Foundation Wins First Place in Luxor at the Smart Green Project Competition for its Green Footprint Initiative,elfagr.org
https://www.egyptindependent.com/germanys-shifting-political-landscape-put-to-the-test-in-key-state-votes/,2023-10-08,Germany’s shifting political landscape put to the test in key state votes,egyptindependent.com
https://www.dailynewsegypt.com/2023/10/09/national-institute-for-governance-sustainable-development-efg-foundation-discuss-cooperation-in-sustainable-development/,2023-10-09,"National Institute for Governance Sustainable Development, EFG Foundation discuss cooperation in sustainable development",dailynewsegypt.com
https://www.egyptindependent.com/imf-lowers-growth-forecast-for-egyptian-economy-to-3-6/,2023-10-10,IMF lowers growth forecast for Egyptian economy to 3.6%,egyptindependent.com
https://www.dailynewsegypt.com/2023/10/11/18-projects-to-be-selected-for-smart-green-projects-initiative-by-15-october-planning-ministry/,2023-10-11,18 projects to be selected for ‘Smart Green Projects’ Initiative by 15 October: Planning Ministry,dailynewsegypt.com
https://egyptianstreets.com/2023/10/11/saudi-arabia-unveils-greenhouse-gases-credits-scheme-announced-at-cop27/,2023-10-11,Saudi Arabia Unveils Greenhouse Gases Credits Scheme Announced at COP27,egyptianstreets.com
https://www.egyptindependent.com/a-floating-village-is-stranded-on-a-dry-lakebed-as-extreme-drought-grips-the-amazon/,2023-10-11,A floating village is stranded on a dry lakebed as extreme drought grips the Amazon,egyptindependent.com
https://www.egyptindependent.com/video-photos-egyptian-director-produces-documentary-film-warning-of-climate-change/,2023-10-11,Video/Photos: Egyptian director produces documentary film warning of climate change,egyptindependent.com
https://www.dailynewsegypt.com/2023/10/11/enhancing-multilateral-development-banks-efforts-essential-for-green-recovery-maait/,2023-10-11,Enhancing multilateral development banks’ efforts essential for green recovery: Maait,dailynewsegypt.com
https://www.dailynewsegypt.com/2023/10/12/narrative-summit-explores-how-food-industries-can-boost-egyptian-exports/,2023-10-12,Narrative Summit explores how food industries can boost Egyptian exports,dailynewsegypt.com
https://egyptianstreets.com/2023/10/12/localizing-climate-action-giz-announces-competition-in-upper-egypt/,2023-10-12,Localizing Climate Action: GIZ Announces Competition in Upper Egypt,egyptianstreets.com
https://www.egyptindependent.com/new-zealand-votes-in-a-narrow-election-dominated-by-economic-woes-cost-of-living-crisis/,2023-10-14,"New Zealand votes in a narrow election dominated by economic woes, cost of living crisis",egyptindependent.com
https://www.dailynewsegypt.com/2023/10/14/filling-up-waterways-increases-coastal-cities-vulnerability-to-environmental-threats/,2023-10-14,Filling up waterways increases coastal cities' vulnerability to environmental threats.,dailynewsegypt.com
https://www.dailynewsegypt.com/2023/10/16/mena-faces-significant-water-challenges-egypts-irrigation-minister/,2023-10-16,MENA faces significant water challenges: Egypt’s Irrigation Minister,dailynewsegypt.com
https://www.egyptindependent.com/amazon-rivers-fall-to-lowest-levels-in-121-years-amid-a-severe-drought/,2023-10-17,Amazon rivers fall to lowest levels in 121 years amid a severe drought,egyptindependent.com
https://www.egyptindependent.com/egypt-approaching-water-scarcity-line-irrigation-minister-warns/,2023-10-17,"Egypt approaching water scarcity line, Irrigation Minister warns",egyptindependent.com
https://www.dailynewsegypt.com/2023/10/22/egyptian-government-plans-to-issue-700m-worth-of-green-bonds-in-2023/,2023-10-22,Egyptian government plans to issue $700m worth of green bonds in 2023,dailynewsegypt.com
https://www.egyptindependent.com/rapid-melting-in-west-antarctica-is-unavoidable-with-potentially-disastrous-consequences-for-sea-level-rise-study-finds/,2023-10-24,"Rapid melting in West Antarctica is ‘unavoidable,’ with potentially disastrous consequences for sea level rise, study finds",egyptindependent.com
https://www.elfagr.org/4793127,2023-10-25,الأمين العام لمجلس كنائس الشرق الأوسط: لا بد لنا من التوقف امام ظاهرة التغير المناخي المفتعل,elfagr.org
https://www.egyptindependent.com/hurricane-otis-unleashes-a-nightmare-scenario-category-5-strike-on-acapulco-and-southern-mexico/,2023-10-25,Hurricane Otis unleashes a ‘nightmare scenario’ Category 5 strike on Acapulco and southern Mexico,egyptindependent.com
https://www.dailynewsegypt.com/2023/10/26/how-banking-sector-supports-sustainable-development-green-economy-bank-leaders/,2023-10-26,"How banking sector supports sustainable development, green economy: Bank leaders",dailynewsegypt.com
https://www.dailynewsegypt.com/2023/10/26/just-energy-transition-requires-mobilizing-more-finances-investments-mahmoud-mohieldin/,2023-10-26,"Just energy transition requires mobilizing more finances, investments: Mahmoud Mohieldin",dailynewsegypt.com
https://www.egyptindependent.com/environment-minister-takes-part-in-three-basins-summit-on-behalf-of-president-sisi/,2023-10-28,Environment Minister takes part in Three Basins Summit on behalf of President Sisi,egyptindependent.com
https://www.egyptindependent.com/a-hidden-feedback-loop-under-antarcticas-glaciers-could-accelerate-sea-level-rise-scientists-find/,2023-10-28,"A hidden feedback loop under Antarctica’s glaciers could accelerate sea level rise, scientists find",egyptindependent.com
https://www.dailynewsegypt.com/2023/11/05/world-governments-summit-organization-launches-report-on-achieving-net-zero/,2023-11-05,World Governments Summit Organization launches report on achieving net zero,dailynewsegypt.com
https://www.dailynewsegypt.com/2023/11/05/egypts-first-harm-reduction-summit-kicks-off-in-november/,2023-11-05,Egypt’s first Harm Reduction Summit kicks off in November,dailynewsegypt.com
https://www.dailynewsegypt.com/2023/10/31/cop28-presidency-irena-gra-call-for-tripling-renewable-power-by-2030-to-keep-1-5-c-within-reach/,2023-10-31,"COP28 Presidency, IRENA, GRA call for tripling renewable power by 2030 to keep 1.5 °C within reach",dailynewsegypt.com
https://www.dailynewsegypt.com/2023/10/31/egypt-discusses-water-cooperation-with-eu-africa-during-cww/,2023-10-31,"Egypt discusses water cooperation with EU, Africa during CWW",dailynewsegypt.com
https://www.dailynewsegypt.com/2023/11/01/egypt-iea-sign-joint-programme-to-boost-clean-energy-cut-emissions/,2023-11-01,"Egypt, IEA sign joint programme to boost clean energy, cut emissions",dailynewsegypt.com
https://egyptianstreets.com/2023/11/01/livelihoods-of-half-a-billion-middle-easterners-at-risk-from-climate-change-wef-report/,2023-11-01,Livelihoods of Half a Billion Middle Easterners at Risk from Climate Change: WEF Report,egyptianstreets.com
https://www.dailynewsegypt.com/2023/11/06/cop27-focused-on-mobilizing-climate-finance-cop28-to-spotlight-just-energy-transition-mohieldin/,2023-11-06,"COP27 focused on mobilizing climate finance, COP28 to spotlight just energy transition: Mohieldin",dailynewsegypt.com
https://www.egyptindependent.com/dr-mohieldin-implementing-climate-action-in-arab-world-requires-activating-innovative-finance-investing-in-capacity-building-and-technological-solutions/,2023-11-08,"Dr. Mohieldin: implementing climate action in Arab world requires activating innovative finance, investing in capacity building and technological solutions",egyptindependent.com
https://www.egyptindependent.com/the-world-is-planning-to-blow-the-fossil-fuels-production-limit-that-would-keep-a-lid-on-global-heating-report-says/,2023-11-08,"The world is planning to blow the fossil fuels production limit that would keep a lid on global heating, report says",egyptindependent.com
https://www.dailynewsegypt.com/2023/11/09/adtic-develops-a-hotel-overlooking-the-pyramids-with-investments-exceeding-80m/,2023-11-09,ADTIC develops a hotel overlooking the Pyramids with investments exceeding $80m,dailynewsegypt.com
https://egyptianstreets.com/2023/11/10/stalemate-over-loss-and-damage-fund-breaks-days-before-cop28-in-dubai/,2023-11-10,Stalemate Over Loss and Damage Fund Breaks Days Before COP28 in Dubai,egyptianstreets.com
https://www.dailynewsegypt.com/2023/11/13/rudn-to-host-international-conference-on-un-sdgs-with-participation-of-experts-from-70-countries/,2023-11-13,"RUDN to host international conference on UN SDGs, with participation of experts from 70 countries",dailynewsegypt.com
https://egyptianstreets.com/2023/11/13/arces-egyptian-cultural-heritage-now-conference-opens-doors-at-auc-tahrir-campus/,2023-11-13,ARCE’s “Egyptian Cultural Heritage Now” Conference Opens Doors at AUC Tahrir Campus,egyptianstreets.com
https://www.dailynewsegypt.com/2023/11/14/intra-african-commerce-only-17-of-continents-foreign-trade-volume-ecs/,2023-11-14,Intra-African commerce only 17% of continent’s foreign trade volume: ECS,dailynewsegypt.com
https://www.dailynewsegypt.com/2023/11/14/al-sisi-calls-for-boosting-intra-african-trade/,2023-11-14,Al-Sisi calls for boosting intra-African trade,dailynewsegypt.com
https://www.egyptindependent.com/countries-emissions-plans-put-the-world-wildly-off-track-to-contain-global-heating-un-assessment-shows/,2023-11-14,"Countries’ emissions plans put the world ‘wildly off track’ to contain global heating, UN assessment shows",egyptindependent.com
https://egyptianstreets.com/2023/11/14/egypt-rolls-out-tax-incentives-for-green-hydrogen-production/,2023-11-14,Egypt Rolls Out Tax Incentives for Green Hydrogen Production,egyptianstreets.com
https://egyptianstreets.com/2023/11/18/from-brazil-to-egypt-working-class-women-find-their-voice-in-clarice-lispectors-novels/,2023-11-18,From Brazil to Egypt: Working-Class Women Find their Voice in Clarice Lispector’s Novels,egyptianstreets.com
https://www.egyptindependent.com/the-uae-is-hosting-the-worlds-biggest-annual-climate-summit-its-also-planning-a-massive-fossil-fuel-expansion/,2023-11-22,The UAE is hosting the world’s biggest annual climate summit. It’s also planning a massive fossil fuel expansion,egyptindependent.com
https://www.egyptindependent.com/egypt-qatar-discuss-boosting-co-operation/,2023-11-22,"Egypt, Qatar Discuss Boosting Co-operation",egyptindependent.com
https://www.egyptindependent.com/driving-energy-transition-security-and-decarbonisation-egypt-energy-show-2024/,2023-11-23,"Driving energy transition, security, and decarbonisation: Egypt Energy Show 2024",egyptindependent.com
https://www.egyptindependent.com/suella-braverman-britains-hardline-home-secretary-fired-as-ex-pm-david-cameron-makes-surprise-return-to-government/,2023-11-24,"Suella Braverman, Britain’s hardline home secretary, fired as ex-PM David Cameron makes surprise return to government",egyptindependent.com
