url,date_published,title,newsorg
https://www.dailynewsegypt.com/2023/01/03/over-use-of-antibiotics-kills-thousands-annually-in-egypt-and-sudan/,2023-01-03,Over-use of antibiotics kills thousands annually in Egypt and Sudan,dailynewsegypt.com
https://www.dailynewsegypt.com/2023/01/03/state-exits-62-economic-activities-to-leave-room-for-private-sector-finance-minister/,2023-01-03,State exits 62 economic activities to leave room for private sector: Finance Minister,dailynewsegypt.com
https://www.egyptindependent.com/last-surviving-apollo-7-astronaut-has-died/,2023-01-04,Last surviving Apollo 7 astronaut has died,egyptindependent.com
https://www.egyptindependent.com/egyps-2023-set-to-drive-the-energy-transition-conversation-and-address-the-reshaping-of-global-markets/,2023-01-09,EGYPS 2023 set to drive the energy transition conversation and address the reshaping of global markets,egyptindependent.com
https://www.egyptindependent.com/lightning-in-the-cataclysmic-tonga-volcano-eruption-shattered-all-records/,2023-01-09,Lightning in the ‘cataclysmic’ Tonga volcano eruption shattered ‘all records’,egyptindependent.com
https://www.egyptindependent.com/a-world-rapidly-warming-the-past-eight-years-were-the-eight-warmest-on-record-for-planet/,2023-01-10,‘A world rapidly warming’: The past eight years were the eight warmest on record for planet,egyptindependent.com
https://www.egyptindependent.com/dead-nasa-satellite-returns-to-earth-after-38-years/,2023-01-10,Dead NASA satellite returns to Earth after 38 years,egyptindependent.com
https://www.aljazeera.net/science/2023/1/11/%d9%85%d8%ad%d9%8a%d8%b7%d8%a7%d8%aa-%d8%a7%d9%84%d8%a7%d8%b1%d8%b6-%d8%aa%d9%88%d8%a7%d8%ac%d9%87-%d9%83%d8%a7%d8%b1%d8%ab%d8%a9-%d8%b6%d8%a7%d8%b1%d9%8a%d8%a9-%d8%b9%d8%a7%d9%85-2300,2023-01-11,كيف ستواجه محيطات الأرض كارثة ضارية عام 2300؟,aljazeera.net
https://egyptianstreets.com/2023/01/11/new-mansoura/,2023-01-11,New Mansoura City: The Latest Urban Addition to the Mediterranean Coast,egyptianstreets.com
https://www.egyptindependent.com/global-risks-report-2023-urges-on-collaborative-action-to-counter-cost-of-living-crisis/,2023-01-12,Global Risks Report 2023 urges on collaborative action to counter cost of living crisis,egyptindependent.com
https://www.egyptindependent.com/uae-appoints-oil-company-boss-as-president-of-the-cop28-climate-conference-alarming-climate-groups/,2023-01-13,"UAE appoints oil company boss as president of the COP28 climate conference, alarming climate groups",egyptindependent.com
https://www.egyptindependent.com/egypt-saudi-arabia-call-for-continuing-bilateral-coordination-to-face-challenges/,2023-01-13,"Egypt, Saudi Arabia call for continuing bilateral coordination to face challenges",egyptindependent.com
https://www.egyptindependent.com/uae-appoints-oil-company-boss-as-president-of-the-cop28-climate-conference-alarming-climate-groups-2/,2023-01-13,"UAE appoints oil company boss as president of the COP28 climate conference, alarming climate groups",egyptindependent.com
https://www.egyptindependent.com/egypt-seeks-to-finalize-agreements-on-funds-directed-to-nwfe-program/,2023-01-15,"Egypt seeks to finalize agreements on funds directed to “NWFE"" Program",egyptindependent.com
https://www.egyptindependent.com/europes-warm-winter-is-robbing-putin-of-a-trump-card/,2023-01-16,Europe’s warm winter is robbing Putin of a trump card,egyptindependent.com
https://www.egyptindependent.com/war-in-ukraine-sparked-a-historic-food-crisis-its-not-over/,2023-01-16,War in Ukraine sparked a historic food crisis. It's not over,egyptindependent.com
https://www.egyptindependent.com/shoukry-meets-new-unfccc-executive-secretary-in-abu-dhabi/,2023-01-16,Shoukry meets new UNFCCC Executive Secretary in Abu Dhabi,egyptindependent.com
https://www.aljazeera.net/midan/miscellaneous/2023/1/17/%d9%85%d9%87%d8%a7%d8%ac%d8%b1%d9%88-%d8%a7%d9%84%d9%85%d9%86%d8%a7%d8%ae-%d9%87%d9%84-%d8%b3%d9%8a%d9%88%d8%a7%d8%ac%d9%87-%d8%a7%d9%84%d8%b9%d8%a7%d9%84%d9%85,2023-01-17,مهاجرو المناخ.. هل سيواجه العالم اضطرابا اجتماعيا هائلا بحلول منتصف القرن؟,aljazeera.net
https://www.egyptindependent.com/amidst-threats-of-global-recession-world-economic-forum-seeks-viable-solutions-for-economic-crises/,2023-01-17,"Amidst threats of global recession, World Economic Forum seeks viable solutions for economic crises",egyptindependent.com
https://www.egyptindependent.com/uk-government-bans-single-use-plastic-plates-and-cutlery/,2023-01-17,UK government bans single-use plastic plates and cutlery,egyptindependent.com
https://www.egyptindependent.com/a-major-oil-exporter-is-hosting-a-un-climate-summit-opinions-are-divided/,2023-01-17,A major oil exporter is hosting a UN climate summit. Opinions are divided,egyptindependent.com
https://www.egyptindependent.com/inconsistent-with-human-survival-un-chief-slams-fossil-fuel-industry-expansion-in-davos-speech/,2023-01-18,‘Inconsistent with human survival’: UN chief slams fossil fuel industry expansion in Davos speech,egyptindependent.com
https://www.egyptindependent.com/shoukry-calls-for-finding-mechanisms-to-address-climate-change-challenges/,2023-01-18,Shoukry calls for finding mechanisms to address climate change challenges,egyptindependent.com
https://www.egyptindependent.com/davos-initiative-to-scale-up-climate-finance-builds-on-directions-set-at-cop27-mashat/,2023-01-18,Davos initiative to scale up climate finance builds on directions set at COP27: Mashat,egyptindependent.com
https://www.egyptindependent.com/mashat-in-davos-2023-climate-change-is-a-major-global-challenge/,2023-01-18,Mashat in Davos 2023: Climate change is a major global challenge,egyptindependent.com
https://www.egyptindependent.com/davos-2023-here-is-the-divided-world-after-coronavirus/,2023-01-18,Davos 2023: Here is the divided world after coronavirus,egyptindependent.com
https://www.egyptindependent.com/limited-egyptian-official-representation-in-davos/,2023-01-19,Limited Egyptian official representation in Davos,egyptindependent.com
https://www.egyptindependent.com/emigration-minwe-are-keen-on-cooperating-with-eu/,2023-01-19,Emigration min:We are keen on cooperating with EU,egyptindependent.com
https://www.egyptindependent.com/climate-activist-greta-thunberg-detained-by-police-in-germany-at-coal-mine-protest/,2023-01-18,Climate activist Greta Thunberg detained by police in Germany at coal mine protest,egyptindependent.com
https://www.egyptindependent.com/cairo-goldman-sachs-group-probe-fostering-cooperation/,2023-01-20,"Cairo, Goldman Sachs Group probe fostering cooperation",egyptindependent.com
https://www.egyptindependent.com/the-sad-call-from-davos-to-save-the-world/,2023-01-20,‘The sad call’ from Davos to save the world,egyptindependent.com
https://mubasher.aljazeera.net/news/miscellaneous/2023/1/23/%d9%88%d8%af%d8%a7%d8%b9%d8%a7-%d9%84%d9%84%d8%b7%d8%b1%d9%8a%d9%82%d8%a9-%d8%a7%d9%84%d8%aa%d9%82%d9%84%d9%8a%d8%af%d9%8a%d8%a9-%d8%af%d8%b1%d8%a7%d8%b3%d8%a9-%d8%b5%d8%a7%d8%af%d9%85%d8%a9,2023-01-23,دراسة صادمة لعشاق القهوة توصي بتعديل طريقة تحضيرها.. ما علاقتها بتغير المناخ؟,aljazeera.net
https://www.aljazeera.net/science/2023/1/24/%d8%b9%d9%84%d9%89-%d9%85%d8%af%d9%89-6-%d9%82%d8%b1%d9%88%d9%86-%d8%a7%d9%86%d8%ae%d9%81%d8%a7%d8%b6-%d8%ba%d9%8a%d8%b1-%d9%85%d8%b3%d8%a8%d9%88%d9%82-%d9%81%d9%8a-%d9%83%d8%aa%d9%84%d8%a9,2023-01-24,دراسة حديثة تكشف لماذا أصبح الجليد يأتي متأخرا ويذوب سريعا,aljazeera.net
https://egyptianstreets.com/2023/01/25/egypts-al-sisi-in-india-to-boost-strategic-partnerships-and-investments/,2023-01-25,Egypt’s Al-Sisi in India to Boost Strategic Partnerships and Investments,egyptianstreets.com
https://www.egyptindependent.com/sisi-we-celebrate-75th-anniversary-of-establishing-ties-with-india/,2023-01-25,Sisi: We celebrate 75th anniversary of establishing ties with India,egyptindependent.com
https://www.egyptindependent.com/from-china-to-japan-extreme-cold-is-gripping-east-asia-experts-say-its-the-new-norm/,2023-01-25,"From China to Japan, extreme cold is gripping East Asia. Experts say it’s the ‘new norm’",egyptindependent.com
https://www.egyptindependent.com/extreme-cold-kills-more-than-150-people-in-afghanistan-taliban-says/,2023-01-25,"Extreme cold kills more than 150 people in Afghanistan, Taliban says",egyptindependent.com
https://alwafd.news/أخبار-وتقارير/4667251-بركان-تونغا-كلمة-السر-وراء-ارتفاع-درجة-حرارة-العالم,2023-01-26,بركان تونغا كلمة السر وراء ارتفاع درجة حرارة العالم,alwafd.news
https://www.egyptindependent.com/sisi-we-celebrate-75th-anniversary-of-establishing-ties-with-india-2/,2023-01-26,Sisi: We celebrate 75th anniversary of establishing ties with India,egyptindependent.com
https://www.egyptindependent.com/health-min-cairo-univ-president-open-intl-conf-for-green-dentistry/,2023-01-26,"Health Min., Cairo Univ. President open int'l conf. for green dentistry",egyptindependent.com
https://egyptianstreets.com/2023/01/29/explainer-why-is-new-cairo-so-vulnerable-to-rain/,2023-01-29,Explainer: Why is New Cairo so Vulnerable to Rain?,egyptianstreets.com
https://www.egyptindependent.com/irrigation-min-lauds-constructive-cooperation-with-germany/,2023-01-30,Irrigation min. lauds constructive cooperation with Germany,egyptindependent.com
https://www.almasryalyoum.com/news/details/2806787,2023-01-31,سفر طلاب فريق «الفورمولا» جامعة حلوان إلى إنجلترا,almasryalyoum.com
https://www.youm7.com/story/2023/1/31/طلاب-فريق-الفورمولا-بكلية-التكنولوجيا-والتعليم-جامعة-حلوان-يغادرون-لإنجلترا/6066834,2023-01-31,طلاب فريق الفورمولا بكلية التكنولوجيا والتعليم جامعة حلوان يغادرون لإنجلترا,youm7.com
https://www.egyptindependent.com/irrigation-min-lauds-cooperation-with-germany/,2023-01-31,Irrigation min. lauds cooperation with Germany,egyptindependent.com
https://www.egyptindependent.com/environment-min-geff-launch-stimulates-private-funding-for-climate-projects/,2023-02-01,Environment min: GEFF launch stimulates private funding for climate projects,egyptindependent.com
https://www.egyptindependent.com/a-dire-forecast-scientists-used-ai-to-find-planet-could-cross-critical-warming-threshold-sooner-than-expected/,2023-02-01,A dire forecast: Scientists used AI to find planet could cross critical warming threshold sooner than expected,egyptindependent.com
https://egyptianstreets.com/2023/02/02/can-digital-remittances-improve-financial-security-in-egypt/,2023-02-02,Can Digital Remittances Improve Financial Security in Egypt?,egyptianstreets.com
https://www.aljazeera.net/science/2023/2/3/%d9%84%d8%a3%d9%86-%d8%ac%d9%88%d8%a7%d9%86%d8%a8-%d8%a7%d9%84%d8%b9%d8%a7%d9%84%d9%85-%d8%aa%d8%b1%d8%aa%d8%a8%d8%b7-%d8%a8%d8%a8%d8%b9%d8%b6%d9%87%d8%a7-%d8%a3%d9%83%d8%ab%d8%b1-%d9%85%d9%85%d8%a7,2023-02-03,علماء يكشفون أن ما يحدث في الأمازون يؤثر في الهيمالايا,aljazeera.net
https://www.madamasr.com/en/contributor/omar-refaat/,2023-01-19,Omar Refaat,madamasr.com
https://egyptianstreets.com/2023/02/05/world-youth-forum-redirects-5th-edition-budget-to-development-initiatives/,2023-02-05,World Youth Forum Redirects 5th Edition Budget to Development Initiatives,egyptianstreets.com
https://www.egyptindependent.com/egypt-cancels-world-youth-forum-over-economic-crisis/,2023-02-07,Egypt cancels World Youth Forum over economic crisis,egyptindependent.com
https://www.egyptindependent.com/atmospheric-rivers-arent-just-a-problem-for-california-theyre-changing-the-arctic-too/,2023-02-07,"Atmospheric rivers aren’t just a problem for California. They’re changing the Arctic, too",egyptindependent.com
https://www.egyptindependent.com/madbouli-reviews-report-on-environmental-activities/,2023-02-09,Madbouli reviews report on environmental activities,egyptindependent.com
https://www.aljazeera.net/midan/miscellaneous/science/2023/2/11/%d9%85%d9%86-%d8%a7%d9%84%d9%85%d8%a7%d9%85%d9%88%d8%ab-%d8%a5%d9%84%d9%89-%d8%b7%d8%a7%d8%a6%d8%b1-%d8%a7%d9%84%d8%af%d9%88%d8%af%d9%88-%d9%87%d9%84-%d9%8a%d9%86%d8%ac%d8%ad,2023-02-11,من الماموث إلى طائر الدودو.. هل ينجح العلماء في إعادة حيوانات منقرضة إلى الحياة؟,aljazeera.net
https://www.egyptindependent.com/president-sisi-witnesses-discussion-panel-on-importance-of-cooperation-in-energy-climate-change-spheres/,2023-02-12,"President Sisi witnesses discussion panel on importance of cooperation in energy, climate change spheres",egyptindependent.com
https://www.egyptindependent.com/egyptian-emirati-cooperation-in-eco-tourism-underway/,2023-02-14,Egyptian-Emirati cooperation in eco-tourism underway,egyptindependent.com
https://www.egyptindependent.com/president-sisi-stresses-importance-of-arab-brethrens-support-to-egypt/,2023-02-14,President Sisi stresses importance of Arab brethren's support to Egypt,egyptindependent.com
https://egyptianstreets.com/2023/02/14/10-years-on-the-papal-office-for-projects-supports-egypts-underprivileged/,2023-02-14,"10 Years On, the Papal Office for Projects Supports Egypt’s Underprivileged",egyptianstreets.com
https://www.aljazeera.net/science/2023/2/15/%d8%ad%d9%84%d9%88%d9%84-%d8%b9%d9%84%d9%85%d9%8a%d8%a9-%d9%84%d8%a5%d9%86%d9%87%d8%a7%d8%a1-%d8%a7%d9%84%d9%86%d8%b2%d8%a7%d8%b9-%d8%b7%d9%88%d9%8a%d9%84-%d8%a7%d9%84%d8%a3%d9%85%d8%af,2023-02-15,دراسة علمية تقترح إجراءات قد تحل أزمة سد النهضة إذا توافق السياسيون,aljazeera.net
https://www.aljazeera.net/science/2023/2/16/%d8%aa%d9%82%d9%84%d8%b5-%d8%a7%d9%84%d8%ba%d8%a7%d8%a8%d8%a7%d8%aa-%d8%a7%d9%84%d8%a7%d8%b3%d8%aa%d9%88%d8%a7%d8%a6%d9%8a%d8%a9-%d9%8a%d8%b2%d9%8a%d8%af,2023-02-16,حلقة مفرغة.. الغابات الاستوائية تدفع ثمن تغير المناخ وتزيد الانبعاثات الكربونية والاحترار,aljazeera.net
https://www.egyptindependent.com/mashat-discusses-nwfe-program-at-46th-ifad-governing-council/,2023-02-17,Mashat discusses NWFE Program at 46th IFAD Governing Council,egyptindependent.com
https://www.egyptindependent.com/nearly-30-dangerous-feedback-loops-could-permanently-shift-the-earths-climate-scientists-say/,2023-02-18,"Nearly 30 dangerous feedback loops could permanently shift the Earth’s climate, scientists say",egyptindependent.com
https://www.dostor.org/4316717,2023-02-19,جامعة الطفل بسوهاج تواصل فعالياتها بمحاضرات عن المشكلات البيئية المعاصرة,dostor.org
https://egyptianstreets.com/2023/02/19/climate-cooperation-peace-and-security-shoukry-heads-egyptian-delegation-to-36th-african-union-summit/,2023-02-19,"Climate, Cooperation, Peace and Security: FM Shoukry Heads Egyptian Delegation to 36th African Union Summit",egyptianstreets.com
https://www.egyptindependent.com/egypt-willing-to-provide-technical-support-to-kenyas-water-management-efforts/,2023-02-22,Egypt willing to provide technical support to Kenya's water management efforts,egyptindependent.com
https://www.egyptindependent.com/antarctic-sea-ice-hit-record-lows-again-scientists-wonder-if-its-the-beginning-of-the-end/,2023-02-22,Antarctic sea ice hit record lows again. Scientists wonder if it’s ‘the beginning of the end’,egyptindependent.com
https://www.egyptindependent.com/egypt-norway-ink-deal-on-green-ammonia-production/,2023-02-24,"Egypt, Norway ink deal on green ammonia production",egyptindependent.com
https://www.egyptindependent.com/earthquake-of-magnitude-4-1-on-richter-scale-hits-egypt/,2023-02-24,Earthquake of magnitude 4.1 on Richter scale hits Egypt,egyptindependent.com
https://www.egyptindependent.com/nriag-denies-us-haarp-behind-recent-devastating-earthquakes/,2023-02-24,NRIAG denies US HAARP behind recent devastating earthquakes,egyptindependent.com
https://www.egyptindependent.com/saving-water-can-help-us-deal-with-the-climate-crisis-heres-how-to-reduce-your-use/,2023-02-25,Saving water can help us deal with the climate crisis. Here’s how to reduce your use,egyptindependent.com
https://www.egyptindependent.com/extreme-climate-events-prompted-state-to-adopt-long-term-water-management-strategy-irrigation-min/,2023-02-28,Extreme climate events prompted State to adopt long-term water management strategy,egyptindependent.com
https://www.egyptindependent.com/greta-thunberg-has-joined-a-protest-against-wind-farms-heres-why/,2023-03-01,Greta Thunberg has joined a protest against wind farms. Here’s why.,egyptindependent.com
https://www.egyptindependent.com/turkeys-red-crescent-criticized-for-selling-tents-to-charity-instead-of-giving-them-to-quake-victims/,2023-03-01,Turkey’s Red Crescent criticized for selling tents to charity instead of giving them to quake victims,egyptindependent.com
https://www.egyptindependent.com/mashat-implementing-several-projects-for-green-transition/,2023-03-02,Mashat: Implementing several projects for green transition,egyptindependent.com
https://www.egyptindependent.com/shoukry-speaks-in-radio-interview-in-india-about-intl-climate-action/,2023-03-03,Shoukry speaks in radio interview in India about int'l climate action,egyptindependent.com
https://www.egyptindependent.com/countries-agree-historic-oceans-treaty-to-protect-the-high-seas/,2023-03-05,Countries agree historic oceans treaty to protect the high seas,egyptindependent.com
https://www.egyptindependent.com/one-of-indias-trash-mountains-is-on-fire-again-and-residents-are-choking-on-its-toxic-fumes/,2023-03-07,One of India’s trash mountains is on fire again and residents are choking on its toxic fumes,egyptindependent.com
https://www.youm7.com/story/2023/3/8/بحث-جديد-الطعام-الذى-نأكله-يدمر-المناخ-وإليك-كيفية-إصلاحه/6107020,2023-03-08,بحث جديد: الطعام الذى نأكله يدمر المناخ وإليك كيفية إصلاحه,youm7.com
https://www.youm7.com/story/2023/3/8/بحث-جديد-طعامنا-يدمر-المناخ-وإليك-كيفية-إصلاحه/6107020,2023-03-08,بحث جديد: طعامنا يدمر المناخ وإليك كيفية إصلاحه,youm7.com
https://www.egyptindependent.com/threat-of-rising-seas-to-asian-megacities-could-be-way-worse-than-we-thought-study-warns/,2023-03-08,"Threat of rising seas to Asian megacities could be way worse than we thought, study warns",egyptindependent.com
https://www.egyptindependent.com/petroleum-min-urges-joining-intl-efforts-to-sustain-energy-supplies/,2023-03-10,Petroleum min. urges joining int'l efforts to sustain energy supplies,egyptindependent.com
https://www.egyptindependent.com/european-union-agrees-to-push-for-global-phase-out-of-fossil-fuels-ahead-of-cop28-climate-conference/,2023-03-11,European Union agrees to push for global phase out of fossil fuels ahead of COP28 climate conference,egyptindependent.com
https://www.egyptindependent.com/outgoing-president-of-micronesia-accuses-china-of-bribery-threats-and-political-warfare/,2023-03-12,"Outgoing president of Micronesia accuses China of bribery, threats and ‘political warfare’",egyptindependent.com
https://www.egyptindependent.com/president-sisi-egypt-ready-to-provide-all-necessary-facilities-for-danish-companies/,2023-03-14,President Sisi: Egypt ready to provide all necessary facilities for Danish companies,egyptindependent.com
https://www.egyptindependent.com/hail-zelenskyy/,2023-03-14,Hail Zelenskyy,egyptindependent.com
https://www.egyptindependent.com/shoukry-cop27-key-step-in-shifting-from-pledges-to-implementation/,2023-03-15,Shoukry: COP27 'key step' in shifting from pledges to implementation,egyptindependent.com
https://www.egyptindependent.com/only-13-countries-and-territories-had-healthy-air-quality-in-2022/,2023-03-15,Only 13 countries and territories had ‘healthy’ air quality in 2022,egyptindependent.com
https://www.egyptindependent.com/egypt-south-africa-discuss-enhancing-coordination-on-global-economic-issues/,2023-03-18,"Egypt, South Africa discuss enhancing coordination on global economic issues",egyptindependent.com
https://www.egyptindependent.com/irrigation-minister-heads-for-ny-to-take-part-in-un-2023-water-conference/,2023-03-20,Irrigation minister heads for NY to take part in UN 2023 Water Conference,egyptindependent.com
https://www.egyptindependent.com/the-climate-time-bomb-is-ticking-the-world-is-running-out-of-time-to-avoid-catastrophe-new-un-report-warns/,2023-03-20,"‘The climate time-bomb is ticking’: The world is running out of time to avoid catastrophe, new UN report warns",egyptindependent.com
https://www.egyptindependent.com/sweilam-egypt-knees-on-highlighting-water-issues-at-regional-intl-forums/,2023-03-23,"Sweilam: Egypt knees on highlighting water issues at regional, int'l forums",egyptindependent.com
https://egyptianstreets.com/2023/03/23/world-bank-and-agree-on-a-new-7-billion-five-year-plan-to-support-egypts-development/,2023-03-23,World Bank and Egypt Agree on a New $7 Billion Five-Year Plan to Support Egypt’s Development,egyptianstreets.com
https://www.youm7.com/story/2023/3/25/دراسة-تكشف-عن-تفاصيل-الاقتصاد-العالمي-للعمل-المناخي/6126183,2023-03-25,دراسة تكشف عن تفاصيل الاقتصاد العالمي للعمل المناخي,youm7.com
https://www.dailynewsegypt.com/2023/03/26/egypt-participates-in-earth-hour-initiative-2/,2023-03-26,Egypt participates in Earth Hour initiative,dailynewsegypt.com
https://www.egyptindependent.com/aoi-discussions-on-localizing-technology-for-producing-electric-car-in-arab-countries/,2023-03-26,AOI: Discussions on localizing technology for producing electric car in Arab countries,egyptindependent.com
https://www.dailynewsegypt.com/2023/03/28/transitional-committee-of-cop27-holds-1st-meeting-on-loss-and-damage-fund-in-luxor/,2023-03-28,Transitional Committee of COP27 holds 1st meeting on ‘Loss and Damage Fund’ in Luxor,dailynewsegypt.com
https://www.dailynewsegypt.com/2023/03/28/signify-collaborates-with-egyptian-organisations-to-promote-energy-efficiency/,2023-03-28,Signify collaborates with Egyptian organisations to promote energy efficiency,dailynewsegypt.com
https://www.youm7.com/story/2023/3/28/خبراء-بيئة-ارتفاع-سطح-البحر-بسبب-تغير-المناخ-سيعزل-مليون/6130574,2023-03-28,خبراء بيئة: ارتفاع سطح البحر بسبب تغير المناخ سيعزل مليون أمريكى عن الحياة,youm7.com
https://www.aljazeera.net/science/2023/3/28/%d8%ae%d8%b7%d8%b1-%d8%a7%d9%84%d9%81%d9%8a%d8%b6%d8%a7%d9%86%d8%a7%d8%aa-%d9%8a%d8%b2%d9%8a%d8%af-%d8%b9%d8%b4%d8%b1-%d9%85%d8%b1%d8%a7%d8%aa-%d9%81%d9%8a-%d8%ba%d8%b6%d9%88%d9%86-30,2023-03-28,دراسة حديثة: خطر الفيضانات يزيد 10 مرات في غضون 30 عاما,aljazeera.net
https://www.dailynewsegypt.com/2023/03/28/australian-government-strikes-deal-on-climate-policy/,2023-03-28,Australian government strikes deal on climate policy,dailynewsegypt.com
https://www.dailynewsegypt.com/2023/03/28/egx-signs-mou-to-expand-scope-of-regional-climate-action/,2023-03-28,EGX signs MoU to expand scope of regional climate action,dailynewsegypt.com
https://www.egyptindependent.com/report-will-cbe-raise-interest-rate-at-its-next-meeting/,2023-03-28,Report: Will CBE raise interest rates at its next meeting?,egyptindependent.com
https://www.egyptindependent.com/cold-windy-weather-expected-for-3-days-in-egypt/,2023-03-29,Cold windy weather expected for 3 days in Egypt,egyptindependent.com
https://www.egyptindependent.com/history-in-the-making-un-poised-to-take-unprecedented-vote-on-the-climate-crisis/,2023-03-29,‘History in the making’: UN poised to take unprecedented vote on the climate crisis,egyptindependent.com
https://egyptianstreets.com/2023/03/30/ramadan-fasting-ditching-overconsumption-for-mindfulness-and-self-discipline/,2023-03-30,Ramadan Fasting: Ditching Overconsumption for Mindfulness and Self-Discipline,egyptianstreets.com
https://www.egyptindependent.com/environment-ministry-unodc-discuss-cooperation-to-implement-cop27-initiatives/,2023-03-30,"Environment Ministry, UNODC discuss cooperation to implement COP27 initiatives",egyptindependent.com
https://www.dailynewsegypt.com/2023/04/04/cib-partners-with-ifc-in-managing-climate-risk-boosting-sustainability/,2023-04-04,"CIB partners with IFC in managing climate risk, boosting sustainability",dailynewsegypt.com
https://www.dailynewsegypt.com/2023/04/05/the-war-on-tigray-wiped-out-decades-of-environmental-progress-how-to-start-again/,2023-04-05,The war on Tigray wiped out decades of environmental progress: How to start again,dailynewsegypt.com
https://www.dailynewsegypt.com/2023/04/05/egypts-irrigation-minister-reviews-preparations-for-upcoming-cairo-water-week/,2023-04-05,Egypt's Irrigation Minister reviews preparations for upcoming Cairo Water Week,dailynewsegypt.com
https://www.dailynewsegypt.com/2023/04/05/keeping-global-warming-to-2c-might-prevent-80-of-heat-related-deaths-in-mena/,2023-04-05,Keeping global warming to 2°C might prevent 80% of heat-related deaths in MENA,dailynewsegypt.com
https://www.egyptindependent.com/cairo-is-unrivaled-city-british-min/,2023-04-05,Cairo is unrivaled city,egyptindependent.com
