url,date_published,title,newsorg
https://www.dailynewsegypt.com/2023/06/15/mahmoud-mohieldin-european-officials-tackle-ways-to-implement-cop27-outputs/,2023-06-15,"Mahmoud Mohieldin, European officials tackle ways to implement COP27 outputs",dailynewsegypt.com
https://egyptianstreets.com/2023/06/15/in-photos-living-among-egyptian-honeybees/,2023-06-15,In Photos: Living Among Egyptian Honeybees,egyptianstreets.com
https://www.egyptindependent.com/china-eyes-blinkens-imminent-visit-with-deep-distrust-and-low-expectations/,2023-06-16,China eyes Blinken’s imminent visit with deep distrust and low expectations,egyptindependent.com
https://www.egyptindependent.com/concrete-is-a-huge-source-of-carbon-emissions-these-researchers-are-working-to-make-it-greener/,2023-06-16,Concrete is a huge source of carbon emissions. These researchers are working to make it greener,egyptindependent.com
https://www.egyptindependent.com/triple-digit-heat-across-texas-is-forecast-to-break-energy-records/,2023-06-17,Triple-digit heat across Texas is forecast to break energy records,egyptindependent.com
https://www.egyptindependent.com/hundreds-of-pakistanis-dead-in-mediterranean-migrant-boat-disaster-official-says/,2023-06-19,"Hundreds of Pakistanis dead in Mediterranean migrant boat disaster, official says",egyptindependent.com
https://www.egyptindependent.com/as-switzerlands-glaciers-melt-voters-approve-new-climate-law-to-cut-planet-heating-pollution/,2023-06-19,"As Switzerland’s glaciers melt, voters approve new climate law to cut planet-heating pollution",egyptindependent.com
https://www.dailynewsegypt.com/2023/06/19/african-cities-and-climate-change-the-real-debate-is-who-should-pay-to-fix-the-problem/,2023-06-19,African cities and climate change: The real debate is who should pay to fix the problem,dailynewsegypt.com
https://www.dailynewsegypt.com/2023/06/19/china-provides-egypt-with-20-million-yuan-worth-of-goods-for-environmental-affairs/,2023-06-19,China provides Egypt with 20 million yuan worth of goods for environmental affairs,dailynewsegypt.com
https://www.egyptindependent.com/heat-drought-and-fire-europes-year-of-extremes-in-2022-will-not-be-a-one-off-new-report-finds/,2023-06-20,"Heat, drought and fire: Europe’s year of extremes in 2022 will not be a ‘one-off,’ new report finds",egyptindependent.com
https://www.dailynewsegypt.com/2023/06/21/egypt-launches-initiative-for-conserving-coral-reefs-in-red-sea/,2023-06-21,Egypt launches initiative for conserving coral reefs in Red Sea,dailynewsegypt.com
https://www.egyptindependent.com/himalayan-glaciers-could-lose-up-to-80-percent-of-their-ice-by-2100-as-temperatures-rise-report-warns/,2023-06-20,"Himalayan glaciers could lose up to 80 percent of their ice by 2100 as temperatures rise, report warns",egyptindependent.com
https://www.dailynewsegypt.com/2023/06/21/al-sisi-heads-to-paris-to-participate-in-new-global-financial-pact-summit/,2023-06-21,Al-Sisi heads to Paris to participate in New Global Financial Pact Summit,dailynewsegypt.com
https://www.egyptindependent.com/dozens-die-in-single-district-in-northern-india-amid-severe-heatwave/,2023-06-21,Dozens die in single district in northern India amid severe heatwave,egyptindependent.com
https://www.dailynewsegypt.com/2023/06/22/mahmoud-mohieldin-calls-for-new-financial-system-to-increase-investment-and-reduce-developing-countries-debt/,2023-06-22,Mahmoud Mohieldin calls for new financial system to increase investment and reduce developing countries' debt,dailynewsegypt.com
https://www.dailynewsegypt.com/2023/06/22/covid-19-geopolitical-shocks-affected-egypts-plans-to-manage-debt-al-sisi/,2023-06-22,"COVID-19, geopolitical shocks affected Egypt's debt management plan: Al-Sisi",dailynewsegypt.com
https://www.egyptindependent.com/thousands-of-dead-fish-have-washed-up-on-a-thai-beach-experts-say-climate-change-may-be-to-blame/,2023-06-23,Thousands of dead fish have washed up on a Thai beach. Experts say climate change may be to blame,egyptindependent.com
https://www.egyptindependent.com/maait-sustainable-debt-alliance-is-strong-momentum-to-green-investments-in-developing-states/,2023-06-24,Maait: 'Sustainable Debt Alliance' is strong momentum to green investments in developing states,egyptindependent.com
https://www.dailynewsegypt.com/2023/06/24/sustainable-debt-coalition-is-strong-impetus-for-green-investments-in-developing-countries-maait/,2023-06-24,Sustainable Debt Coalition is strong impetus for green investments in developing countries: Maait,dailynewsegypt.com
https://www.dailynewsegypt.com/2023/06/25/egypt-germany-sign-debt-swap-deal-worth-e54m-to-promote-green-energy-transition/,2023-06-25,"Egypt, Germany sign debt swap deal worth €54m to promote green energy transition",dailynewsegypt.com
https://www.dailynewsegypt.com/2023/06/25/egypts-al-sisi-indias-modi-elevate-relations-to-strategic-partnership/,2023-06-25,"Egypt's Al-Sisi, India's Modi elevate relations to strategic partnership",dailynewsegypt.com
https://www.egyptindependent.com/humans-approaching-limits-of-survivability-as-sweltering-heatwaves-engulf-parts-of-asia/,2023-06-26,Humans approaching limits of ‘survivability’ as sweltering heatwaves engulf parts of Asia,egyptindependent.com
https://www.egyptindependent.com/planet-heating-pollution-from-global-energy-sector-continues-to-rise-as-fossil-fuels-dominate-report-finds/,2023-06-26,"Planet-heating pollution from global energy sector continues to rise as fossil fuels dominate, report finds",egyptindependent.com
https://www.dailynewsegypt.com/2023/06/26/egypts-environment-minister-sanofi-officials-discuss-joint-cooperation/,2023-06-26,"Egypt’s Environment Minister, Sanofi officials, discuss joint cooperation",dailynewsegypt.com
https://www.egyptindependent.com/rainforest-destruction-soared-in-2022-despite-global-pledges-to-halt-deforestation-new-report-finds/,2023-06-28,"Rainforest destruction soared in 2022 despite global pledges to halt deforestation, new report finds",egyptindependent.com
https://www.dailynewsegypt.com/2023/06/29/95-of-egypts-real-estate-is-unregistered-eba/,2023-06-29,95% of Egypt's real estate is unregistered: EBA,dailynewsegypt.com
https://www.egyptindependent.com/china-is-set-to-shatter-its-wind-and-solar-target-five-years-early-new-report-finds/,2023-07-01,"China is set to shatter its wind and solar target five years early, new report finds",egyptindependent.com
https://www.egyptindependent.com/astronauts-history-making-mission-is-the-latest-step-for-a-nation-with-grand-space-ambitions/,2023-07-01,Astronaut’s history-making mission is the latest step for a nation with grand space ambitions,egyptindependent.com
https://egyptianstreets.com/2023/07/01/renewable-energy-and-cleaner-transport-egypt-updates-its-climate-commitments/,2023-07-01,Renewable Energy and Cleaner Transport: Egypt Updates its Climate Commitments,egyptianstreets.com
https://www.dailynewsegypt.com/2023/07/01/pastoralists-are-an-asset-to-the-world-and-we-have-a-lot-to-learn-from-them/,2023-07-01,Pastoralists are an asset to the world – and we have a lot to learn from them,dailynewsegypt.com
https://www.egyptindependent.com/greta-thunberg-has-accused-russia-of-ecocide-in-ukraine-but-what-does-that-mean/,2023-07-02,Greta Thunberg has accused Russia of ‘ecocide’ in Ukraine. But what does that mean?,egyptindependent.com
https://www.dailynewsegypt.com/2023/07/04/birds-raise-fewer-young-when-spring-arrives-earlier-in-a-warming-world/,2023-07-04,Birds raise fewer young when spring arrives earlier in a warming world,dailynewsegypt.com
https://www.egyptindependent.com/irrigation-min-pacwa-starts-its-training-activities/,2023-07-04,Irrigation min: PACWA starts its training activities,egyptindependent.com
https://www.dailynewsegypt.com/2023/07/04/earths-shield-ozone-layer-on-track-to-recover-within-40-years/,2023-07-04,Earth's Shield: Ozone layer on track to recover within 40 years,dailynewsegypt.com
https://www.egyptindependent.com/el-nino-is-here-and-the-world-must-prepare-for-more-extreme-heat-un-weather-agency-warns/,2023-07-05,"El Niño is here and the world must prepare for more extreme heat, UN weather agency warns",egyptindependent.com
https://www.egyptindependent.com/al-qusier-state-working-on-expanding-production-of-highly-productive-seeds/,2023-07-05,al-Qusier: State working on expanding production of highly productive seeds,egyptindependent.com
https://www.egyptindependent.com/the-planet-saw-its-hottest-day-ever-this-week-the-record-will-be-broken-again-and-again/,2023-07-05,The planet saw its hottest day ever this week. The record will be broken again and again,egyptindependent.com
https://www.dailynewsegypt.com/2023/07/05/arab-nations-have-significant-potential-to-invest-in-green-hydrogen-and-ammonia-eissa/,2023-07-05,Arab nations have significant potential to invest in green hydrogen and ammonia: Eissa,dailynewsegypt.com
https://www.egyptindependent.com/shipping-has-sailed-under-the-radar-when-it-comes-to-climate-action-that-could-all-change-this-week/,2023-07-07,Shipping has sailed under the radar when it comes to climate action. That could all change this week,egyptindependent.com
https://www.dailynewsegypt.com/2023/07/08/egypts-environment-minister-discusses-plans-for-cop28/,2023-07-08,Egypt's Environment Minister discusses plans for COP28,dailynewsegypt.com
https://www.egyptindependent.com/environment-minister-mulls-logistic-preparations-for-egypts-participation-at-cop28/,2023-07-08,Environment Minister mulls logistic preparations for Egypt’s participation at COP28,egyptindependent.com
https://www.egyptindependent.com/global-heat-in-uncharted-territory-as-scientists-warn-2023-could-be-the-hottest-year-on-record/,2023-07-08,Global heat in ‘uncharted territory’ as scientists warn 2023 could be the hottest year on record,egyptindependent.com
https://www.egyptindependent.com/earth-witnesses-highest-temperatures-ever-experts-fear-its-going-to-get-even-hotter/,2023-07-09,Earth witnesses highest temperatures ever - experts fear its going to get even hotter,egyptindependent.com
https://www.dailynewsegypt.com/2023/07/09/egypt-and-unido-discuss-industrial-development-strategy/,2023-07-09,Egypt and UNIDO discuss industrial development strategy,dailynewsegypt.com
https://www.dailynewsegypt.com/2023/07/10/bees-get-early-wakeup-call-from-warming-climate/,2023-07-10,Bees get early wakeup call from warming climate,dailynewsegypt.com
https://www.egyptindependent.com/climate-activists-block-golf-course-holes-with-seedlings-and-cement-to-protest-water-use/,2023-07-10,Climate activists block golf course holes with seedlings and cement to protest water use,egyptindependent.com
https://www.dailynewsegypt.com/2023/07/10/environment-ministry-signs-cooperation-protocol-with-estidama-association/,2023-07-10,Environment Ministry signs cooperation protocol with Estidama Association,dailynewsegypt.com
https://www.egyptindependent.com/temperatures-to-hit-unprecedented-levels-this-week-warns-tv-host/,2023-07-11,"Temperatures to hit unprecedented levels this week, warns TV host",egyptindependent.com
https://www.egyptindependent.com/floods-and-mudslides-kill-six-in-japan-as-scientists-warn-extreme-rainfall-events-will-get-worse/,2023-07-11,Floods and mudslides kill six in Japan as scientists warn extreme rainfall events will get worse,egyptindependent.com
https://www.egyptindependent.com/egypt-to-receive-15-mln-in-us-grant-to-counter-climate-change/,2023-07-11,Egypt to receive $15 mln in US grant to counter climate change,egyptindependent.com
https://mubasher.aljazeera.net/news/miscellaneous/2023/7/11/%d8%a7%d9%84%d9%87%d9%86%d8%af-%d9%85%d9%82%d8%aa%d9%84-%d8%a7%d9%84%d8%b9%d8%b4%d8%b1%d8%a7%d8%aa-%d8%a8%d8%b3%d8%a8%d8%a8-%d9%81%d9%8a%d8%b6%d8%a7%d9%86%d8%a7%d8%aa,2023-07-11,الهند.. مقتل العشرات بسبب فيضانات وفقدان الاتصال بـ120 إسرائيليا (فيديو),aljazeera.net
https://www.dailynewsegypt.com/2023/07/11/egypts-international-cooperation-minister-calls-for-increased-private-sector-investment-in-sustainable-development/,2023-07-11,Egypt’s International Cooperation Minister calls for increased private sector investment in sustainable development,dailynewsegypt.com
https://www.dailynewsegypt.com/2023/07/12/chapter-zero-egypt-launched-to-promote-climate-governance/,2023-07-12,Chapter Zero Egypt launched to promote climate governance,dailynewsegypt.com
https://www.dailynewsegypt.com/2023/07/12/gcf-plays-vital-role-in-mobilising-finance-for-climate-action-mahmoud-mohieldin/,2023-07-12,GCF plays vital role in mobilising finance for climate action: Mahmoud Mohieldin,dailynewsegypt.com
https://www.egyptindependent.com/europe-agrees-landmark-nature-and-climate-deal-after-tense-negotiations/,2023-07-13,Europe agrees landmark nature and climate deal after tense negotiations,egyptindependent.com
https://www.dailynewsegypt.com/2023/07/13/ebrd-supports-egypts-private-sector-with-532m-al-mashat/,2023-07-13,EBRD supports Egypt’s private sector with $532m: Al-Mashat,dailynewsegypt.com
https://www.dailynewsegypt.com/2023/07/13/environment-minister-heads-to-brussels-for-pre-cop28-meetings/,2023-07-13,Environment Minister heads to Brussels for pre-COP28 meetings,dailynewsegypt.com
https://www.egyptindependent.com/minister-egypt-updated-ndc-plan-to-increase-electricity-generated-from-renewables-to-42-by-2030/,2023-07-15,Minister: Egypt updated NDC plan to increase electricity generated from renewables to 42% by 2030,egyptindependent.com
https://www.egyptindependent.com/europe-swept-by-blistering-and-potentially-record-breaking-temperatures/,2023-07-15,Europe swept by blistering and potentially record-breaking temperatures,egyptindependent.com
https://www.egyptindependent.com/nearly-62000-people-died-from-record-breaking-heat-in-europe-last-summer-its-a-lesson-for-the-us-too/,2023-07-15,"Nearly 62,000 people died from record-breaking heat in Europe last summer. It’s a lesson for the US, too",egyptindependent.com
https://www.dailynewsegypt.com/2023/07/15/al-sisi-participates-in-african-unions-5th-mid-year-coordination-meeting-in-kenya/,2023-07-15,Al-Sisi participates in African Union’s 5th Mid-Year coordination meeting in Kenya,dailynewsegypt.com
https://www.egyptindependent.com/john-kerry-to-step-into-searing-china-heat-as-worlds-two-biggest-polluters-try-to-fix-fractured-ties/,2023-07-16,John Kerry to step into searing China heat as world’s two biggest polluters try to fix fractured ties,egyptindependent.com
https://www.dailynewsegypt.com/2023/07/16/green-economy-essential-to-achieve-sustainable-development-eeaas-ceo/,2023-07-16,Green economy essential to achieve sustainable development: EEAA’s CEO,dailynewsegypt.com
https://www.dailynewsegypt.com/2023/07/16/al-sisi-calls-for-enhancing-african-industry-to-engage-in-global-value-added-chains/,2023-07-16,Al-Sisi calls for enhancing African industry to engage in global value-added chains,dailynewsegypt.com
https://www.dailynewsegypt.com/2023/07/17/actual-climate-action-implementation-needs-enhanced-global-regional-national-efforts-mahmoud-mohieldin/,2023-07-17,"Actual climate action implementation needs enhanced global, regional, national efforts: Mahmoud Mohieldin",dailynewsegypt.com
https://www.dailynewsegypt.com/2023/07/17/el-nino-climate-tipping-points/,2023-07-17,What El Niño means for the world’s perilous climate tipping points,dailynewsegypt.com
https://www.dailynewsegypt.com/2023/07/18/mahmoud-mohieldin-says-global-finance-reform-needed-for-just-green-transitions/,2023-07-18,Mahmoud Mohieldin says global finance reform needed for just green transitions,dailynewsegypt.com
https://www.dailynewsegypt.com/2023/07/18/egypt-japan-hold-second-high-level-policy-dialogue-for-development-cooperation/,2023-07-18,"Egypt, Japan hold second high-level policy dialogue for development cooperation",dailynewsegypt.com
https://www.egyptindependent.com/biden-to-welcome-israels-herzog-to-white-house/,2023-07-18,Biden to welcome Israel’s Herzog to White House,egyptindependent.com
https://www.egyptindependent.com/this-is-just-the-beginning-extreme-heat-around-the-world-as-fires-rage-in-southern-europe/,2023-07-18,‘This is just the beginning’: Extreme heat around the world as fires rage in southern Europe,egyptindependent.com
https://www.egyptindependent.com/soaring-temperatures-to-record-rainfall-asia-reels-as-climate-crisis-takes-hold/,2023-07-18,Soaring temperatures to record rainfall: Asia reels as climate crisis takes hold,egyptindependent.com
https://www.dailynewsegypt.com/2023/07/19/opinion-social-media-terrorism/,2023-07-19,Opinion| Social media terrorism,dailynewsegypt.com
https://www.dailynewsegypt.com/2023/07/19/acwa-power-granted-land-for-10-gw-wind-project-in-egypt/,2023-07-19,ACWA Power granted land for 10 GW wind project in Egypt,dailynewsegypt.com
https://www.dailynewsegypt.com/2023/07/19/maait-calls-for-developing-global-financial-structure-to-provide-innovative-products/,2023-07-19,Maait calls for developing global financial structure to provide innovative products,dailynewsegypt.com
https://www.egyptindependent.com/unprecedented-heat-wave-to-continue-over-a-week-ema-official/,2023-07-19,Unprecedented heat wave to continue over a week: EMA official,egyptindependent.com
https://www.egyptindependent.com/floodwaters-reach-iconic-taj-mahal-as-northern-india-reels-from-massive-deluge/,2023-07-19,Floodwaters reach iconic Taj Mahal as northern India reels from massive deluge,egyptindependent.com
https://www.egyptindependent.com/is-this-extreme-weather-the-new-normal-theres-no-such-thing-some-scientists-say/,2023-07-19,"Is this extreme weather the ‘new normal?’ There’s no such thing, some scientists say",egyptindependent.com
https://www.egyptindependent.com/egypt-launches-ubuntu-iniatiative-to-help-countries-ease-debt-burdens/,2023-07-19,Egypt launches 'Ubuntu Iniatiative' to help countries ease debt burdens,egyptindependent.com
https://www.egyptindependent.com/underground-climate-change-is-deforming-the-ground-beneath-buildings-study-finds/,2023-07-18,"‘Underground climate change’ is deforming the ground beneath buildings, study finds",egyptindependent.com
https://egyptianstreets.com/2023/07/20/bir-tawil-the-stateless-land-of-many-and-no-rulers/,2023-07-20,Bir Tawil: the Stateless Land of Many and No Rulers,egyptianstreets.com
https://www.egyptindependent.com/egypt-launches-project-to-study-mosquito-disease-vectors-in-red-sea-hurghadaegypt-launches-project-to-study-disease-vectors-in-red-sea-hurghada/,2023-07-22,"Egypt launches project to study mosquito disease vectors in Red Sea, Hurghada",egyptindependent.com
https://www.dailynewsegypt.com/2023/07/22/how-to-make-homes-cooler-without-cranking-up-the-air-conditioning/,2023-07-22,How to make homes cooler without cranking up the air conditioning,dailynewsegypt.com
https://www.dailynewsegypt.com/2023/07/22/ebrd-official-says-egypts-green-transition-on-right-track/,2023-07-22,EBRD official says Egypt's green transition on right track,dailynewsegypt.com
https://www.egyptindependent.com/temperatures-across-egypt-will-to-continue-rise-in-the-coming-days-ema-official/,2023-07-23,Temperatures across Egypt will to continue rise in the coming days: EMA official,egyptindependent.com
https://www.egyptindependent.com/greece-evacuates-thousands-of-tourists-in-rhodes-as-wildfire-burns/,2023-07-23,Greece evacuates thousands of tourists in Rhodes as wildfire burns,egyptindependent.com
https://www.egyptindependent.com/far-right-could-enter-government-as-spain-goes-to-the-polls/,2023-07-23,Far-right could enter government as Spain goes to the polls,egyptindependent.com
https://www.egyptindependent.com/china-and-the-us-are-finally-talking-again-but-can-they-really-work-together/,2023-07-24,China and the US are finally talking again – but can they really work together?,egyptindependent.com
https://www.dailynewsegypt.com/2023/07/25/ecaru-qalaa-holdings-and-axens-to-carry-out-technical-economic-studies-for-second-generation-biofuel-project/,2023-07-25,"ECARU, Qalaa Holdings, and Axens to carry out technical, economic studies for second-generation biofuel project",dailynewsegypt.com
https://www.dostor.org/4457563,2023-07-25,زراعة القناة تفتح باب التقدم للالتحاق ببرنامج الماجستير في 3 برامج جديدة,dostor.org
https://www.almasryalyoum.com/news/details/2941768,2023-07-25,«زراعة القناة»: فتح باب التقدم للالتحاق ببرنامج الماجستير الأكاديمي في «تغير المناخ والزراعة المستدامة»,almasryalyoum.com
https://www.egyptindependent.com/heat-waves-in-us-and-europe-would-have-been-virtually-impossible-without-climate-change-new-report-finds/,2023-07-25,"Heat waves in US and Europe would have been ‘virtually impossible’ without climate change, new report finds",egyptindependent.com
https://www.egyptindependent.com/wildfires-heat-and-giant-hail-as-italy-grapples-with-extreme-weather/,2023-07-26,"Wildfires, heat and giant hail as Italy grapples with extreme weather",egyptindependent.com
https://www.egyptindependent.com/wednesdays-temperatures-to-be-peak-of-egypts-heatwave-ema/,2023-07-26,Wednesday’s temperatures to be peak of Egypt's heatwave: EMA,egyptindependent.com
https://www.egyptindependent.com/extreme-heat-in-us-is-killing-people-threatening-coral-reefs-and-fueling-wildfires-that-compromise-air-quality/,2023-07-26,"Extreme heat in US is killing people, threatening coral reefs and fueling wildfires that compromise air quality",egyptindependent.com
https://www.egyptindependent.com/a-crucial-system-of-ocean-currents-is-heading-for-a-collapse-that-would-affect-every-person-on-the-planet/,2023-07-26,A crucial system of ocean currents is heading for a collapse that ‘would affect every person on the planet’,egyptindependent.com
https://www.dailynewsegypt.com/2023/07/26/renewable-energy-could-offer-a-win-win-solution-for-gerd-crisis/,2023-07-26,"Renewable energy could offer a ""win-win"" solution for GERD crisis",dailynewsegypt.com
https://www.dailynewsegypt.com/2023/07/26/irrigation-minister-french-ambassador-in-cairo-discuss-bilateral-cooperation-in-water-sector/,2023-07-26,"Irrigation Minister, French ambassador in Cairo discuss bilateral cooperation in water sector",dailynewsegypt.com
https://www.dailynewsegypt.com/2023/07/26/al-sisi-17-african-leaders-participate-in-africa-russia-summit-in-st-petersburg/,2023-07-26,"Al-Sisi, 17 African leaders participate in Africa – Russia summit in St. Petersburg",dailynewsegypt.com
https://www.dailynewsegypt.com/2023/07/27/british-council-london-school-of-economics-organises-faith-and-climate-workshop-in-egypt/,2023-07-27,"British Council, London School of Economics organises Faith and Climate Workshop in Egypt",dailynewsegypt.com
https://egyptianstreets.com/2023/07/27/from-challenges-to-ambitions-an-egyptian-adventurers-e-bike-trip-to-cop28/,2023-07-27,From Challenges to Ambitions: an Egyptian Adventurer’s E-Bike Trip to COP28,egyptianstreets.com
https://www.egyptindependent.com/mashat-vietnamese-deputy-premiers-visit-to-egypt-shows-strength-depth-of-ties/,2023-07-28,"Mashat: Vietnamese deputy premier's visit to Egypt shows strength, depth of ties",egyptindependent.com
https://www.egyptindependent.com/this-month-is-the-planets-hottest-on-record-by-far-and-hottest-in-around-120000-years-scientists-say/,2023-07-28,"This month is the planet’s hottest on record by far – and hottest in around 120,000 years, scientists say",egyptindependent.com
https://egyptianstreets.com/2023/07/29/cairo-chaos-and-comedy-reviewing-confessions-of-a-knight-errant-drifters-thieves-and-ali-babas-treasure/,2023-07-29,"Cairo, Chaos, and Comedy: Reviewing ‘Confessions of a Knight Errant: Drifters, Thieves, and Ali Baba’s Treasure’",egyptianstreets.com
https://www.egyptindependent.com/antarctica-is-missing-an-argentina-sized-amount-of-sea-ice-and-scientists-are-scrambling-to-figure-out-why/,2023-07-30,Antarctica is missing an Argentina-sized amount of sea ice – and scientists are scrambling to figure out why,egyptindependent.com
https://www.dailynewsegypt.com/2023/07/30/cop28-president-designate-urges-g20-to-lead-climate-action/,2023-07-30,COP28 president-designate urges G20 to lead climate action,dailynewsegypt.com
https://www.dostor.org/4462052,2023-07-30,تقرير دولى يحذر من استمرار ارتفاع الحرارة عالميًا: «القادم أسوأ»,dostor.org
https://www.dailynewsegypt.com/2023/07/31/eeaa-chief-highlights-egypts-efforts-in-cop27-during-g20-ministerial-meeting/,2023-07-31,EEAA chief highlights Egypt’s efforts in COP27 during G20 ministerial meeting,dailynewsegypt.com
https://www.egyptindependent.com/cairo-university-ranks-1st-in-competition-for-best-environmentally-friendly-university/,2023-07-31,Cairo University ranks 1st in competition for best environmentally friendly university,egyptindependent.com
https://www.dailynewsegypt.com/2023/08/01/cib-participates-in-escwa-multi-stakeholder-platform-for-protecting-biodiversity/,2023-08-01,CIB participates in ESCWA multi-stakeholder platform for protecting biodiversity,dailynewsegypt.com
https://www.egyptindependent.com/the-uk-once-vowed-to-be-a-global-climate-leader-now-rishi-sunak-is-stoking-a-culture-war-on-green-policies/,2023-08-01,The UK once vowed to be a global climate leader. Now Rishi Sunak is stoking a culture war on green policies,egyptindependent.com
https://www.dailynewsegypt.com/2023/08/01/climate-change-violence-children/,2023-08-01,Climate change contributes to violence against children – here’s how,dailynewsegypt.com
