url,date_published,title,newsorg
https://www.lejournaldetanger.com/try-this-suck-your-final-concept-takeaway-or-ae/,2023-01-02,"Try this: suck your final concept, takeaway or a€?morala€? the two collectively show.",lejournaldetanger.com
https://www.lejournaldetanger.com/recently-this-lady-has-proceeded-to-help-you/,2023-01-18,"Recently, this lady has proceeded to help you assert one Trump won the latest 2020 election",lejournaldetanger.com
https://www.lejournaldetanger.com/light-is-even-a-key-point-inside-sexual-readiness/,2023-01-19,Light is even a key point inside sexual readiness,lejournaldetanger.com
https://lnt.ma/u-s-europe-tussle-over-frenzy-of-clean-energy-subsidies/,2023-01-25,"U.S., Europe Tussle Over Frenzy of Clean-Energy Subsidies",lnt.ma
https://leseco.ma/business/le-freedom-of-mobility-forum-devoile-les-membres-de-son-conseil-consultatif.html,2023-01-26,Le Freedom of Mobility Forum dévoile les membres de son Conseil consultatif,leseco.ma
https://lnt.ma/dont-count-on-china-to-save-the-world-economy/,2023-02-15,Don’t Count on China to Save the World Economy,lnt.ma
https://www.oujdacity.net/debat-article-154928-fr/what-are-the-causes-of-drought-in-the-eastern-region-of-morocco.html,2023-03-15,What are the causes of drought in the eastern region of Morocco ?,oujdacity.net
https://lnt.ma/moment-historique-attendu-mercredi-a-lonu-pour-la-justice-climatique/,2023-03-29,"Moment ""historique"" attendu mercredi à l'ONU pour la justice climatique",lnt.ma
https://lnt.ma/world-bank-warns-of-lost-decade-for-global-economy/,2023-04-05,World Bank Warns of Lost Decade for Global Economy,lnt.ma
https://www.oujdacity.net/national-article-155489-fr/water-scarecity-in-the-world.html,2023-04-26,Water scarecity in the world,oujdacity.net
https://leseco.ma/opinion/bonnes-nouvelles.html,2023-04-27,Bonnes nouvelles,leseco.ma
https://lnt.ma/ibm-google-give-150-million-for-u-s-japan-quantum-computing-push-as-china-looms/,2023-05-17,"IBM, Google Give $150 Million for U.S.-Japan Quantum-Computing Push as China Looms",lnt.ma
https://lnt.ma/jpmorgan-makes-one-of-the-biggest-bets-ever-on-carbon-removal/,2023-05-23,JPMorgan Makes One of the Biggest Bets Ever on Carbon Removal,lnt.ma
https://www.libe.ma/Les-courants-oceaniques-profonds-ralentissent-plus-tot-que-prevu_a138882.html,2023-06-03,Les courants océaniques profonds ralentissent plus tôt que prévu,libe.ma
https://leseco.ma/business/enjeux-climatiques-le-forum-medcop-climat-sinvite-a-tanger.html,2023-06-09,"le Forum ""MedCOP Climat"" s'invite à Tanger",leseco.ma
https://www.lopinion.ma/Bloomberg-New-Economy-Gateway-Africa-Pour-une-economie-africaine-resiliente-et-durable_a41246.html,2023-06-15,Bloomberg New Economy Gateway Africa,lopinion.ma
https://lnt.ma/pro-take-forget-the-sec-international-climate-reporting-standards-could-become-the-global-baseline/,2023-06-27,"Pro Take: Forget the SEC, International Climate Reporting Standards Could Become the Global Baseline",lnt.ma
https://aujourdhui.ma/societe/le-chef-de-lonu-alerte-sur-leffondrement-climatique,2023-09-08,Le chef de l’ONU alerte sur «l’effondrement climatique»,aujourdhui.ma
https://lnt.ma/climat-des-etats-insulaires-en-appellent-au-droit-de-la-mer/,2023-09-11,Climat: des États insulaires en appellent au droit de la mer,lnt.ma
https://www.lopinion.ma/Marrakech-RADEEMA-Gestion-des-ressources-en-vue-d-une-ville-durable_a45565.html,2023-10-25,Gestion des ressources en vue d'une ville durable,lopinion.ma
https://aujourdhui.ma/societe/indice-de-performance-climatique-2024-le-maroc-dans-le-top-ten-mondial,2023-12-13,Indice de performance climatique 2024,aujourdhui.ma
https://leseco.ma/maroc/leadership-climatique-le-maroc-dans-le-top-10-mondial-du-ccpi-2024.html,2023-12-12,Leadership climatique,leseco.ma
https://lematin.ma/economie/climate-change-performance-index-2024-le-maroc-premier-en-afrique/204138,2023-12-11,Climate Change Performance Index 2024,lematin.ma
https://www.leconomiste.com/flash-infos/ccpi-2024-le-maroc-classe-9e-au-monde,2023-12-11,Le Maroc classé 9e au monde,leconomiste.com
https://www.lopinion.ma/CCPI-2024-Le-Maroc-9eme-meilleur-pays-au-monde_a47531.html,2023-12-11,"Le Maroc, 9ème meilleur pays au monde",lopinion.ma
https://www.lopinion.ma/Engagement-Climatique-Exemplaire-Le-Maroc-Maintient-sa-Position-dans-le-Top-10-Mondial_a47527.html,2023-12-11,Engagement Climatique Exemplaire,lopinion.ma
https://aujourdhui.ma/societe/engagement-societal-cest-parti-pour-le-casablanca-climate-leadership-forum-2023,2023-11-23,Engagement sociétal: C’est parti pour le Casablanca Climate Leadership Forum 2023,aujourdhui.ma
