url,date_published,title,newsorg
https://thepoint.gm/africa/gambia/headlines/gambia-charts-roadmap-for-climate-mitigation-actions,2023-11-07,Gambia charts roadmap for climate mitigation actions,thepoint.gm
https://thepoint.gm/africa/gambia/headlines/salinity-is-harming-agricultural-production-for-key-crops,2023-11-09,‘Salinity is harming agricultural production for key crops’,thepoint.gm
https://thepoint.gm/africa/gambia/headlines/mayor-lowe-receives-prestigious-gpm-award,2023-11-17,Mayor Lowe receives prestigious GPM award,thepoint.gm
https://thepoint.gm/africa/gambia/headlines/intl-economic-confab-kick-starts-in-nouakchott,2023-11-20,Int’l economic confab kick-starts in Nouakchott,thepoint.gm
https://standard.gm/gambia-secures-pavilion-office-space-at-cop28/,2023-11-22,"Gambia Secures Pavilion, Office Space At COP28 – The Standard Newspaper",standard.gm
https://standard.gm/think-equal-project-trains-ecd-teachers-on-narrative-positioning-teaching/,2023-11-22,"Think Equal Project Trains ECD Teachers On Narrative, Positioning Teaching – The Standard Newspaper",standard.gm
https://thepoint.gm/africa/gambia/headlines/gambia-receives-us60m-to-boost-sustainable-growth-climate-resilience,2023-11-22,"Gambia receives US$60M to boost sustainable growth, climate resilience",thepoint.gm
https://standard.gm/empowerment-beyond-the-screens-lets-shape-a-better-future-together/,2023-11-23,Empowerment Beyond The Screens: Let's Shape A Better Future Together – The Standard Newspaper,standard.gm
https://standard.gm/the-world-greatly-needs-fidels-word-today/,2023-11-23,The World Greatly Needs Fidel's Word Today! – The Standard Newspaper,standard.gm
https://foroyaa.net/35-graduate-on-beekeeping-honey-harvesting/,2023-11-23,35 Graduate on Beekeeping & Honey Harvesting,foroyaa.net
https://standard.gm/meet-and-greet/,2023-11-24,Meet-and-greet – The Standard Newspaper,standard.gm
https://standard.gm/towards-a-brighter-tomorrow-indias-g20-presidency-and-the-dawn-of-a-new-multilateralism/,2023-11-30,Towards A Brighter Tomorrow: India's G20 Presidency And The Dawn Of A New Multilateralism – The Standard Newspaper,standard.gm
https://standard.gm/minister-explains-decision-to-de-gazette-nyanibere-forest/,2023-11-30,Minister Explains Decision To De-gazette Nyanibere Forest – The Standard Newspaper,standard.gm
https://thepoint.gm/africa/gambia/headlines/sierra-leone-central-bank-grapples-with-ill-economy,2023-12-29,Sierra Leone: Central Bank grapples with ill economy,thepoint.gm
https://standard.gm/do-we-care/,2023-12-29,Do We Care? – The Standard Newspaper,standard.gm
https://foroyaa.net/environmental-degradation-forest-loss-a-recipe-for-calamity/,2023-12-28,"Environmental Degradation, Forest Loss – a Recipe for Calamity",foroyaa.net
https://standard.gm/retrospective/,2023-12-21,Retrospective – The Standard Newspaper,standard.gm
https://thepoint.gm/africa/gambia/headlines/3-diplomats-present-credentials-to-barrow-2,2023-12-21,3 diplomats present credentials to Barrow,thepoint.gm
https://foroyaa.net/government-allocates-d10-million-for-drilling-of-boreholes-says-finance-minister/,2023-12-18,"Government Allocates D10 Million for Drilling of Boreholes, Says Finance Minister",foroyaa.net
https://thepoint.gm/africa/gambia/headlines/gach-boss-nominated-for-global-diplomat-award,2023-12-18,GACH boss nominated for Global Diplomat Award,thepoint.gm
https://standard.gm/jawara-nominated-for-global-diplomat-award/,2023-12-15,Jawara Nominated For Global Diplomat Award – The Standard Newspaper,standard.gm
https://standard.gm/govt-to-review-fisheries-sector/,2023-12-14,GOV'T TO REVIEW FISHERIES SECTOR – The Standard Newspaper,standard.gm
https://standard.gm/afrobarometer-inaugural-presence-at-cop28-amplifies-africanvoices-on-climate-change-and-spurs-climate-action-collaboration/,2023-12-14,Afrobarometer Inaugural Presence At COP28 Amplifies Africanvoices On Climate Change And Spurs Climate Action Collaboration – The Standard Newspaper,standard.gm
https://foroyaa.net/the-gambia-disturbed-by-debt-distress/,2023-12-13,“The Gambia Disturbed By Debt Distress’’,foroyaa.net
https://standard.gm/binta-barry-the-first-female-african-football-ambassador-of-we-play-green/,2023-12-12,Binta Barry: The First Female African Football Ambassador Of We Play Green – The Standard Newspaper,standard.gm
https://thepoint.gm/africa/gambia/headlines/forbes-names-fatou-bensouda-in-its-100-most-influential-women-list,2023-12-12,Forbes names Fatou Bensouda in its 100 most influential women list,thepoint.gm
https://standard.gm/are-recent-inflationary-pressures-in-gambia-imported-ordomestically-generated-what-can-be-done-in-either-case-part-1-continuation/,2023-12-08,Are Recent Inflationary Pressures In Gambia Imported Ordomestically Generated? What Can Be Done In Either Case? (Part 1 Continuation) – The Standard Newspaper,standard.gm
https://standard.gm/peace-is-necessary-to-save-the-planet-cuba-states-at-cop28/,2023-12-07,"Peace Is Necessary To Save The Planet, Cuba States At COP28 – The Standard Newspaper",standard.gm
https://standard.gm/eu-funded-wrestling-arenas-ignite-athriving-sports-culture-in-the-gambia/,2023-11-29,EU-FUNDED WRESTLING ARENAS IGNITE ATHRIVING SPORTS CULTURE IN THE GAMBIA,standard.gm
https://standard.gm/africa-moves-to-tackle-covid-19-shockswith-strong-push-for-vaccine-manufacturing/,2023-11-29,Africa Moves To Tackle Covid-19 Shockswith Strong Push For Vaccine Manufacturing – The Standard Newspaper,standard.gm
https://standard.gm/climate-change-resilience/,2023-11-27,Climate Change Resilience – The Standard Newspaper,standard.gm
https://standard.gm/polish-embassys-intervention-in-mitigating-climate-change-in-touba-wuli/,2023-11-27,Polish Embassy's Intervention In Mitigating Climate Change In Touba Wuli – The Standard Newspaper,standard.gm
https://standard.gm/environmentalist-warns-banjul-at-high-threat-from-sea-rise/,2023-11-27,Environmentalist Warns Banjul At 'high Threat' From Sea Rise – The Standard Newspaper,standard.gm
https://foroyaa.net/the-world-greatly-needs-fidels-word-today/,2023-11-24,The world greatly needs Fidel's word today! – Foroyaa Newspaper,foroyaa.net
https://standard.gm/meccnar-hosts-technical-meeting-for-climate-action/,2023-11-21,MECCNAR Hosts Technical Meeting For Climate Action – The Standard Newspaper,standard.gm
