id,publish_date,title,url,language,media_name,media_url,indexed_date
0c20f1fc5ad4425970ba2c792db16102a36ddaf8d0100368f2e0b0d3a772d144,2024-03-11,Liberia: House Calms Fishermen’s Rage,https://www.liberianobserver.com/liberia-house-calms-fishermens-rage,en,liberianobserver.com,liberianobserver.com,2024-03-13 11:45:21.834941+00:00
420482e166c332f6b4028f4c5f1db1ae6e505b2b836cac6203c3c34dc59af26d,2024-03-10,Red Cross celebrates women's leadership and service to humanity,https://thenewdawnliberia.com/red-cross-celebrates-womens-leadership-and-service-to-humanity/,en,thenewdawnliberia.com,thenewdawnliberia.com,2024-03-13 06:03:56.108723+00:00
c776ac5f809fb07a4a7230ff1b7b020d5b0db215132e7cbedbc34bb7bde9d9fa,2024-03-09,Wegovy: Revolutionizing the Fight Against Obesity and Heart Disease,https://inprofiledaily.com/wegovy-against-obesity-and-heart/,en,inprofiledaily.com,inprofiledaily.com,2024-03-11 01:46:41.432471+00:00
21eb2b4d91527b6c827b4312b05c7a06c0f5904bf9493b585e53c52549ae428d,2024-03-07,‘‘De-risking Foreign Investments for Renewable Energy in Libya’’ workshop,https://libyaherald.com/2024/03/de-risking-foreign-investments-for-renewable-energy-in-libya-workshop/,en,libyaherald.com,libyaherald.com,2024-03-10 06:55:28.101708+00:00
e5170f236fa406fe2451ddb2547e3f66becc8b7d65565040f45c841459a0369a,2024-03-07,Launch of Libya’s ‘‘Energy Transition and Climate Change’’ projects,https://libyaherald.com/2024/03/launch-of-libyas-energy-transition-and-climate-change-projects/,en,libyaherald.com,libyaherald.com,2024-03-10 06:55:18.421488+00:00
4cfad2defae41b0a0b23debf7d84a2ae8c17cc30de682f72604196d9a3ee7e4f,2024-03-08,Op-Ed – International Women’s Day 2024: “Invest In Women: Ending The Patriarchy Requires Money On The Table”,https://thenewdawnliberia.com/op-ed-international-womens-day-2024-invest-in-women-ending-the-patriarchy-requires-money-on-the-table/,en,thenewdawnliberia.com,thenewdawnliberia.com,2024-03-10 06:42:45.473094+00:00
14f0b7121be3f2210a54ca801ec781f90a0a8638f0dd3c444902f76a1acb3ae4,2024-03-08,NEEV-Liberia Seeks Collaboration with Transport Ministry-Rolls Out Plans to Boost Liberia Transport Sector,https://frontpageafricaonline.com/opinion/press-release/neev-liberia-seeks-collaboration-with-transport-ministry-rolls-out-plans-to-boost-liberia-transport-sector/,en,frontpageafricaonline.com,frontpageafricaonline.com,2024-03-10 04:56:22.483247+00:00
b1060d347402f432edb3e1502d2fbe28d4d0cd828e4e392394b870e8cc3c10be,2024-03-08,The fight for women’s rights over the past fifty years is a story of progress,https://gnnliberia.com/the-fight-for-womens-rights-over-the-past-fifty-years-is-a-story-of-progress/,en,gnnliberia.com,gnnliberia.com,2024-03-10 03:27:47.781253+00:00
796cd9d594b33d3e6b287b62eadb624fc27fe81e7c972c998e0e58bff5baa112,2024-03-06,2024 Global Wellness Trends,https://inprofiledaily.com/2024-global-wellness/,en,inprofiledaily.com,inprofiledaily.com,2024-03-08 09:13:30.388786+00:00
2b7d581b027f1c3743d5783fa68286fbe2fa6d2da8fa8e7c15b130667551106e,2024-03-05,Liberia: EPA Convenes Retreat on Carbon Market Framework,https://www.liberianobserver.com/liberia-epa-convenes-retreat-carbon-market-framework,en,liberianobserver.com,liberianobserver.com,2024-03-07 06:09:26.627855+00:00
db31fa5dcb9ed7325ca3eab9609445247f8ac3dcb5af6acae41840153f3dc43b,2024-01-22,"Full Text Of President Joseph N. Boakai Inaugural Address January 22, 2024 - Global News Network Liberia",https://gnnliberia.com/full-text-of-president-joseph-n-boakai-inaugural-address-january-22-2024/,en,gnnliberia.com,gnnliberia.com,2024-03-06 23:21:05.410999+00:00
e6ba5ddf30fed8e6a7b0d05a07bf314c19466921932eeeb8bd55d6adbdc65a60,2024-01-22,FULL TEXT: Pres. Joseph N. Boakai's Inaugural Address,https://www.liberianobserver.com/full-text-pres-joseph-n-boakais-inaugural-address,en,liberianobserver.com,liberianobserver.com,2024-03-06 23:20:50.591014+00:00
a09e0a11fa2d98a83dc199394f90181303c769871cce08e03489a1959b325bba,2024-01-21,"Liberia Gets New President On Monday, January 22",https://gnnliberia.com/liberia-gets-new-president-monday-january-22/,en,gnnliberia.com,gnnliberia.com,2024-03-06 23:20:50.561009+00:00
102f62fe3cbbe978ea24600d45e5a57323e5e8dc145d2b2ca932a1a1a30db59b,2024-01-22,Full text of president Boakai speech,https://www.newrepublicliberia.com/full-text-of-president-boakai-speech/,en,newrepublicliberia.com,newrepublicliberia.com,2024-03-06 23:20:49.386873+00:00
52fbd375ac01ee31766015fa40db65f85385acf8e91af2b73101ae42cbcb628a,2024-01-22,"Inaugural Address Of Honorable Joseph Nyuma Boakai, Sr 26th President of the Republic of Liberia January 22, 2024",https://thenewdawnliberia.com/inaugural-address-of-honorable-joseph-nyuma-boakai/,en,thenewdawnliberia.com,thenewdawnliberia.com,2024-03-06 23:20:49.353710+00:00
33f5f0a4034cf44fe546a6a9179a177b424e7e589d2151960d0079a0cdf081c7,2024-01-19,Liberia: Who’s In; Who’s Out – Incoming President Boakai Faces Dilemma Over State-Owned Enterprises,https://frontpageafricaonline.com/front-slider/liberia-whos-in-whos-out-incoming-president-boakai-faces-dilemma-over-state-owned-enterprises/,en,frontpageafricaonline.com,frontpageafricaonline.com,2024-03-06 23:19:57.975108+00:00
7a79531804e656e169c5c771d5e2b89c1378cd2d4bebaf104fa4e1d76c869610,2024-03-04,ARC Ltd. Celebrates 10 Years of Pioneering Climate Risks Solutions Across Africa,https://gnnliberia.com/arc-ltd-celebrates-10-years-of-pioneering-climate-risks-solutions-across-africa/,en,gnnliberia.com,gnnliberia.com,2024-03-06 04:15:01.400844+00:00
b17f069abfb1b547d75441f786c747ea06f2169e89e8ea417327ba0e99524dcf,2024-03-02,Liberia: Harvard Business School Launches Tony Elumelu Foundation Case Study,https://frontpageafricaonline.com/news/liberia-harvard-business-school-launches-tony-elumelu-foundation-case-study/,en,frontpageafricaonline.com,frontpageafricaonline.com,2024-03-04 05:49:50.391768+00:00
0358feb1078e931a251c668f086fdb3b9d294b82d23c73e8a3cc25a80402d1cb,2024-03-01,Ethiopia: African Development Fund grants $46 million to improve access to water and sanitation for pastoral communities in the Borana region,https://thenewdawnliberia.com/ethiopia-african-development-fund-grants-46-million-to-improve-access-to-water-and-sanitation-for-pastoral-communities-in-the-borana-region/,en,thenewdawnliberia.com,thenewdawnliberia.com,2024-03-04 03:48:02.617462+00:00
8356d670eb787ce21130e4c7e2c5bc0c136b87fc795b1ebe6d2d8ceb41a35716,2024-03-01,"World Bank Group Prepares Major Overhaul to Guarantee Business Reforms aim to deliver simplicity and access, supported by CEOs and G20 Expert Group",https://gnnliberia.com/world-bank-group-prepares-major-overhaul-to-guarantee-business-reforms-aim-to-deliver-simplicity-and-access-supported-by-ceos-and-g20-expert-group/,en,gnnliberia.com,gnnliberia.com,2024-03-03 07:04:06.637239+00:00
d457f0e28e960b482467b2c63c981b257a2f5fb48a74a37a261479994f09ec2b,2024-02-29,RICCE Participates in National Dialogue on Nationally Determined Contributions with Focus on Forest,https://gnnliberia.com/ricce-participates-in-national-dialogue-on-nationally-determined-contributions-with-focus-on-forest/,en,gnnliberia.com,gnnliberia.com,2024-03-03 07:04:03.466022+00:00
d63a3dea83373ab95362f6dca8ba87ee4c833cf02d28467fed901df2ac86945c,2024-02-29,"Liberia: Weah Returns from Month-Long Vacation, ‘Reinvigorated’",https://www.liberianobserver.com/liberia-weah-returns-month-long-vacation-reinvigorated,en,liberianobserver.com,liberianobserver.com,2024-03-02 07:04:53.794525+00:00
7757041741a252c5efb3c02ab46d9bd53018662be58296a7f2cf3b1ece65d953,2024-02-27,At National Dialogue To Support NDCs Target: UNDP Renews Commitment To Support Liberia’s Carbon Readiness,https://gnnliberia.com/at-national-dialogue-to-support-ndcs-target-undp-renews-commitment-to-support-liberias-carbon-readiness/,en,gnnliberia.com,gnnliberia.com,2024-03-01 05:18:50.613292+00:00
1802b6748b29045d0f1fc6bd8b3bd75a791f302fe72cd6cde565dbe20ae29c52,2024-02-28,UNDP Renews Commitment to Support Liberia’s Carbon Readiness,https://frontpageafricaonline.com/news/undp-renews-commitment-to-support-liberias-carbon-readiness/,en,frontpageafricaonline.com,frontpageafricaonline.com,2024-03-01 04:23:21.489093+00:00
45e6a96ea9b36b08cb6fb4ee30c70ae0872d1068c3448b8e05136d1fe676f32a,2024-02-27,Liberia News: EVERGREEN AGRO ENTERPRISE LAUDS PRES. BOAKAI,https://www.newrepublicliberia.com/liberia-news-evergreen-agro-enterprise-lauds-pres-boakai/,en,newrepublicliberia.com,newrepublicliberia.com,2024-02-29 04:33:49.627863+00:00
d4553654592951fb7e54ab270a88f3a233793ddf6fc47bf9d9227c0b7d8629fc,2024-02-21,Liberia Celebrates World Wetland Day with Urgent Calls for Ecosystem Protection,https://frontpageafricaonline.com/news/liberia-celebrates-world-wetland-day-with-urgent-calls-for-ecosystem-protection/,en,frontpageafricaonline.com,frontpageafricaonline.com,2024-02-23 05:18:24.687974+00:00
a0e0f59a170399ffa3a8e31a64a7cb7ff81702b9c1c3d8472c5f81e48a08bc82,2024-02-19,"Kenya Restricts Importation of Used Electric Vehicles to 80% Battery Life, Other Requirements",https://gnnliberia.com/kenya-restricts-importation-of-used-electric-vehicles-to-80-battery-life-other-requirements/,en,gnnliberia.com,gnnliberia.com,2024-02-21 02:25:01.961942+00:00
60fba1eb47e761b85d52b8d679fa56ca7751f6063a7d616684a5b9a6f1d1df94,2024-02-16,BRAC Executive Director Expresses Organization’s Commitment to ‘Continue Impacting Lives’ in Liberia During High Power Visit,https://frontpageafricaonline.com/news/brac-executive-director-expresses-organizations-commitment-to-continue-impacting-lives-in-liberia-during-high-power-visit/,en,frontpageafricaonline.com,frontpageafricaonline.com,2024-02-18 04:08:09.449306+00:00
5d62389b9ce63d79e49e16c43f0ec4b47d64ac6c9e147983d44c7606f06f6c2d,2024-02-15,"EPA, GEF End Regional Confab In Liberia Today -More Support For Targeted Projects Insight - Global News Network Liberia",https://gnnliberia.com/epa-gef-end-regional-confab-in-liberia-today-more-support-for-targeted-projects-insight/,en,gnnliberia.com,gnnliberia.com,2024-02-17 08:31:56.477792+00:00
477f34f8f7412a3694d593e15ff1f109c29e8244a78b207ee1e83908e6a9def7,2024-02-14,ECOWAS-UNDP technical consultation initiates efforts to develop West Africa resilience strategy,https://thenewdawnliberia.com/ecowas-undp-technical-consultation/,en,thenewdawnliberia.com,thenewdawnliberia.com,2024-02-16 07:06:04.008728+00:00
59529aa93ef6b17b6eb10ed9d057ec6cbc08ce1c56bfd28340dbf0e791f83bb8,2024-02-14,Red Cross joins Radio Day celebration,https://thenewdawnliberia.com/red-cross-joins-radio-day-celebration/,en,thenewdawnliberia.com,thenewdawnliberia.com,2024-02-16 07:06:02.482869+00:00
d12ad5e77595db6133b6e6edb2d1d8f1f4290efe4a6f5116e9412f11a3a7b026,2024-02-14,EPA GEF commence constituents workshop,https://thenewdawnliberia.com/epa-gef-commence-constituents-workshop/,en,thenewdawnliberia.com,thenewdawnliberia.com,2024-02-16 07:06:00.302256+00:00
bd3935b27160b3bdede336633bd836e63dcbeb702aba34885197e00019f33af8,2024-02-14,Environmental Protection Agency Hosts First Global Environment Facility Workshop in Liberia,https://frontpageafricaonline.com/news/environmental-protection-agency-hosts-first-global-environment-facility-workshop-in-liberia/,en,frontpageafricaonline.com,frontpageafricaonline.com,2024-02-16 04:48:07.355438+00:00
479adabac9ae5c29e762843469f452d051d43ec4edd7f7ee8367523649786530,2024-02-14,Liberia: GEF Convenes in Monrovia,https://www.liberianobserver.com/liberia-gef-convenes-monrovia,en,liberianobserver.com,liberianobserver.com,2024-02-16 03:53:06.357207+00:00
38dbcc4a74efd0c71157891544e062d3ffa363a6c4f5aa211e9cc7b3b7d99c78,2024-02-13,Liberia: Commerce Minister Seeks Collaboration to Enhance Vibrant Business Climate,https://www.liberianobserver.com/liberia-commerce-minister-seeks-collaboration-enhance-vibrant-business-climate,en,liberianobserver.com,liberianobserver.com,2024-02-15 04:14:34.171937+00:00
a30869b643f561cb0e2e0cd108c1b3ea7c6ca0474956cbb562b139a970dc3ee5,2024-02-13,ARC Ltd. And US Government partner to safeguard food security and expand parametric insurance in Africa,https://gnnliberia.com/arc-ltd-and-us-government-partner-to-safeguard-food-security-and-expand-parametric-insurance-in-africa/,en,gnnliberia.com,gnnliberia.com,2024-02-15 03:01:20.492807+00:00
f9b0579502b9a0e2cac980f7762657ee42755780ef4aada4c1b430dd811f1a91,2024-02-11,NOC starts first phase of its campaign to plant a million trees,https://libyaherald.com/2024/02/noc-starts-first-phase-of-its-campaign-to-plant-a-million-trees/,en,libyaherald.com,libyaherald.com,2024-02-13 06:16:45.480391+00:00
8f41692710852eaf7fadb10a0fe5e236853da3c966c6deaa1d5adb6278b7d4dd,2024-02-09,Liberia: Organizations Representing Forest Communities Keen on Who Becomes Next FDA Managing Director,https://frontpageafricaonline.com/opinion/press-release/liberia-organizations-representing-forest-communities-keen-on-who-becomes-next-fda-managing-director/,en,frontpageafricaonline.com,frontpageafricaonline.com,2024-02-11 02:43:08.873244+00:00
521974ee005c2667960427e1afc260e1d088eb8457ebc3e9461af4512187aa95,2024-02-07,Government of the Republic of Guinea announces groundbreaking Round Table of Donors event in Dubai,https://gnnliberia.com/government-of-the-republic-of-guinea-announces-groundbreaking-round-table-of-donors-event-in-dubai/,en,gnnliberia.com,gnnliberia.com,2024-02-09 07:57:39.330627+00:00
4975d320cf835f0440a50884a14cb83e8ff7ee15fbd1792934506de6cf1e56ae,2024-02-07,Liberia: The Heat Wave that Halted Liberia’s Presidential Inauguration,https://www.liberianobserver.com/liberia-heat-wave-halted-liberias-presidential-inauguration,en,liberianobserver.com,liberianobserver.com,2024-02-09 06:49:23.065561+00:00
08036e13b509b0bd90e9ae3982238dbd70756fc5d94289238ae505605210c9e0,2024-02-07,House to probe NaFAA-LAFA crisis,https://thenewdawnliberia.com/house-to-probe-nafaa-lafa-crisis/,en,thenewdawnliberia.com,thenewdawnliberia.com,2024-02-09 04:40:59.781311+00:00
3b9aae74f97391d17161eb3db207855761fb350d53c4e04bf745d80ab673c885,2024-02-06,"Liberia: New National Port Authority Boss Looking To Address High Fees On Containers, Clearing",https://frontpageafricaonline.com/news/liberia-new-national-port-authority-boss-looking-to-address-high-fees-on-containers-clearing/,en,frontpageafricaonline.com,frontpageafricaonline.com,2024-02-08 04:37:06.257979+00:00
0d05d5063920795cefbe42f6c320cabee43c22100e3c5d1eb68e515ebb389098,2024-02-06,Climate Change Nearly Kill Boakai?,https://gnnliberia.com/climate-change-nearly-kill-boakai/,en,gnnliberia.com,gnnliberia.com,2024-02-08 03:17:06.613238+00:00
8693d126f08c5a1332f8974b1d650e3c39361e5987e4d4ac1fbe0da901083a9b,2024-02-05,Liberia: Stakeholders Unite to Integrate Climate Change Action into Land Formalization Framework,https://frontpageafricaonline.com/news/liberia-stakeholders-unite-to-integrate-climate-change-action-into-land-formalization-framework/,en,frontpageafricaonline.com,frontpageafricaonline.com,2024-02-07 06:52:12.926993+00:00
74b5c84148fdcda10099885a989eb7553dbbfd43a0dff55adb84982655a7b992,2024-02-05,Liberia: Rural Communities Want a Say in Who Becomes FDA’s Next MD,https://www.liberianobserver.com/liberia-rural-communities-want-say-who-becomes-fdas-next-md,en,liberianobserver.com,liberianobserver.com,2024-02-07 03:27:58.955828+00:00
37ad05118367cf3dd4fbbc2e8129c77da808d4479da21359ac415da1b702db50,2024-02-05,Liberia: Illegal Miners Mine Sand in Historic Beach Graveyard,https://www.liberianobserver.com/liberia-illegal-miners-mine-sand-historic-beach-graveyard,en,liberianobserver.com,liberianobserver.com,2024-02-07 03:27:58.231003+00:00
2b5cfa733634c5ce380de6e3146f424e926d4a2bb823776a025dca955efc33ff,2024-02-02,Liberia: Farmers Call for More Sectoral Support,https://www.liberianobserver.com/liberia-farmers-call-more-sectoral-support,en,liberianobserver.com,liberianobserver.com,2024-02-04 09:42:46.930395+00:00
eea7c24d4f4a5209fb0b511cbfeedf4662a7be2cab2434be516060238af5d0f4,2024-02-02,Liberia to Host GEF Events,https://www.liberianobserver.com/liberia-host-gef-events,en,liberianobserver.com,liberianobserver.com,2024-02-04 09:42:36.391458+00:00
093c629fb3e47fe225c2a18a3baf5b4f6fadde959d4d38ba13eb9f9d282c3890,2024-01-31,Italy announces $6 billion plan to strengthen partnership with Africa at Italy-Africa Summit,https://thenewdawnliberia.com/italy-announces-6-billion-plan-to-strengthen-partnership-with-africa-at-italy-africa-summit/,en,thenewdawnliberia.com,thenewdawnliberia.com,2024-02-04 01:15:45.098378+00:00
bd34937382462f6be06536af198a14daf57e6b7b29dbbc10b97496856a89f032,2024-01-31,"Liberia: Landesa, Partners Rally Support for Inclusive Climate Action and Land Rights",https://frontpageafricaonline.com/news/liberia-landesa-partners-rally-support-for-inclusive-climate-action-and-land-rights/,en,frontpageafricaonline.com,frontpageafricaonline.com,2024-02-02 07:20:54+00:00
8333955c38a0021764107194d444f979a0dc020a137b97261f79f45ffc64b0d7,2024-01-31,"Liberia: Back on Assignment in Uganda, Ex-Foreign Minister Not Interested in Govt Job",https://frontpageafricaonline.com/news/liberia-back-on-assignment-in-uganda-ex-foreign-minister-not-interested-in-govt-job/,en,frontpageafricaonline.com,frontpageafricaonline.com,2024-02-02 07:20:54+00:00
a7870b46ad60608a0ad611f2327c5ae82ed852373c601026b8486a562fc22bed,2024-01-30,Land Rights for Inclusive Climate Action and Sustainable Development Conference Kicks Off in Monrovia,https://frontpageafricaonline.com/opinion/press-release/land-rights-for-inclusive-climate-action-and-sustainable-development-conference-kicks-off-in-monrovia/,en,frontpageafricaonline.com,frontpageafricaonline.com,2024-02-01 07:09:23+00:00
ce74adc4cb6f4093cb62f677704f49a40a1cdd516e42f312424a061ff3ffdcc9,2024-01-30,"Liberia: Pres. Boakai Declares War against Drugs, Says He’ll Take the Lead in Taking a Drug Test",https://frontpageafricaonline.com/news/liberia-pres-boakai-declares-war-against-drugs-says-hell-take-the-lead-in-taking-a-drug-test/,en,frontpageafricaonline.com,frontpageafricaonline.com,2024-02-01 07:09:20+00:00
22f120985c67564b79d41ab9a27d83dbc78a3f52efda2fd4a4bbb1f9b540e076,2024-01-30,Liberia’s debt at US$2.21bn,https://thenewdawnliberia.com/liberias-debt-at-us2-21bn/,en,thenewdawnliberia.com,thenewdawnliberia.com,2024-02-01 06:21:38+00:00
409e641c5e07e98234a688aad416da794ae1f703e550fa5bdf74cf0b86d7339e,2024-01-29,"President Boakai Delivers State Of The Nation Address, Declares War On 'Kush' - Global News Network Liberia",https://gnnliberia.com/president-boakai-delivers-state-of-the-nation-address-declares-war-on-kush/,en,gnnliberia.com,gnnliberia.com,2024-02-01 04:36:13+00:00
0d07e92489875a09f2a70578e3817c7712cd1d59ea69a8c7589dc08e5002fc6a,2024-01-29,FULL TEXT: President Boakai's First Annual Message,https://www.liberianobserver.com/full-text-president-boakais-first-annual-message,en,liberianobserver.com,liberianobserver.com,2024-01-31 08:14:01+00:00
a58a2fd44f2a13b7121dd619694ae3e14315d2382e17b9dabcf66db55ec566c6,2024-01-29,Breaking News: Boakai disputes Weah’s US40M balance story,https://thenewdawnliberia.com/boakai-disputes-weahs-us40m-balance-story/,en,thenewdawnliberia.com,thenewdawnliberia.com,2024-01-31 08:08:16+00:00
9b0eac927dce459f95ff64592f2e63946f875fa658e9e4459d1ce7feab1ed721,2024-01-29,Liberia: Government Inaction Brings US$26m Coastal Defense Project to a Standstill,https://frontpageafricaonline.com/news/liberia-government-inaction-brings-us26m-coastal-defense-project-to-a-standstill/,en,frontpageafricaonline.com,frontpageafricaonline.com,2024-01-31 08:01:53+00:00
7285adb4e5a35fd71b900c90769de3d02ead07a37c5d26ef04ca219332410d39,2024-01-25,Whein Town residents decry hazardous conditions,https://thenewdawnliberia.com/whein-town-residents-decry-hazardous-conditions/,en,thenewdawnliberia.com,thenewdawnliberia.com,2024-01-27 03:41:35+00:00
48fb634a166ce06242354f8526e1a8d5db02e36b077001250a6dee4a4d25e820,2024-01-24,Ambassador Greenfield Reiterates U.S. Commitment to Liberia Following Meeting with President Boakai,https://frontpageafricaonline.com/news/ambassador-greenfield-reiterates-u-s-commitment-to-liberia-following-meeting-with-president-boakai/,en,frontpageafricaonline.com,frontpageafricaonline.com,2024-01-26 09:55:51+00:00
db40332929699e3276025215bf4bed0951781961f115d80f3404c51ba20c88ee,2024-01-24,Liberia: US Top Diplomat Wants Business Leaders Hold Gov’t Accountable,https://www.liberianobserver.com/liberia-us-top-diplomat-wants-business-leaders-hold-govt-accountable,en,liberianobserver.com,liberianobserver.com,2024-01-26 05:11:57+00:00
83c9373062f40c01717c97fd318d77bf2aa9a220e871c5fa41809c6b7cf33fec,2024-01-24,Liberia News: Mixed Reactions Over JNB’s Leadership,https://www.newrepublicliberia.com/liberia-news-mixed-reactions-over-jnbs-leadership/,en,newrepublicliberia.com,newrepublicliberia.com,2024-01-26 04:58:09+00:00
63208bfb840fc5a1ed75b416e83d134566eb8e8818234316678f936418e58af9,2024-01-22,How To Prevent New Cold War In Africa,https://gnnliberia.com/how-to-prevent-new-cold-war-in-africa/,en,gnnliberia.com,gnnliberia.com,2024-01-25 04:10:12+00:00
1e22e230510871699b64513a9fbcd05a9bfc99041452b5249edd30c62364e99d,2024-01-19,Liberia: Outgoing Public Works Minister Outlines Gains Made in Road and Infrastructural Development under the Weah Regime,https://frontpageafricaonline.com/front-slider/liberia-outgoing-public-works-minister-outlines-gains-made-in-road-and-infrastructural-development-under-the-weah-regime/,en,frontpageafricaonline.com,frontpageafricaonline.com,2024-01-21 03:55:41+00:00
0fbcc93734e771625cfca834bda5f989418955b7f78ab606e8ee85d7d9ba0402,2024-01-18,Liberia: Imminent Water Crisis Hits Monrovia And Surrounding Areas,https://frontpageafricaonline.com/news/liberia-imminent-water-crisis-hits-monrovia-and-surrounding-areas/,en,frontpageafricaonline.com,frontpageafricaonline.com,2024-01-20 06:29:41+00:00
8057c09445cc42d718e6abc673a020439e45c810af288b73883ab08ef5429583,2024-01-18,Liberians’ Access to Electricity Among Lowest in West Africa as Renewable Energy Companies Bridge Gap,https://frontpageafricaonline.com/news/liberians-access-to-electricity-among-lowest-in-west-africa-as-renewable-energy-companies-bridge-gap/,en,frontpageafricaonline.com,frontpageafricaonline.com,2024-01-20 06:29:40+00:00
e8da1d95be4c856adeccb28a2bede8e66e3bc754526d37b0d839ef2a107c60a6,2024-01-17,Eastern Libyan government explores cooperation with Turkish solar energy company Cora,https://libyaherald.com/2024/01/eastern-libyan-government-explores-cooperation-with-turkish-solar-energy-company-cora/,en,libyaherald.com,libyaherald.com,2024-01-20 05:49:13+00:00
7b11b2d87e94424717462317801e556ca4ede96b27b782e20a755b1399ba3664,2024-01-16,Burberry Group Plc Faces Challenging Times Amidst Luxury Market Slowdown,https://inprofiledaily.com/burberry-faces-challenging-times/,en,inprofiledaily.com,inprofiledaily.com,2024-01-19 02:10:27+00:00
3b0675e3140939e6f02b77d8d14c59d89255f598ca73e81769c306dd612ae480,2024-01-16,Daily Observer Journalist Attends Taz Panter Africa Workshop in Berlin,https://www.liberianobserver.com/daily-observer-journalist-attends-taz-panter-africa-workshop-berlin,en,liberianobserver.com,liberianobserver.com,2024-01-18 06:25:23+00:00
c029a3004d0b5a0add23fa6d90bc4954c93e13f9ee0d907dc7ff733b5f4b663d,2024-01-15,Liberian Human Rights Advocate in Canada Emphasizes President-elect Boakai's Administration Success Hinges on Key Priorities,https://frontpageafricaonline.com/diaspora/liberian-human-rights-advocate-in-canada-emphasizes-president-elect-boakais-administration-success-hinges-on-key-priorities/,en,frontpageafricaonline.com,frontpageafricaonline.com,2024-01-17 03:31:08+00:00
f8f43fd713bf08140e87dcaafff5e4102ac70440485db6949c93bcfa62f96f20,2024-01-12,WATCH: Celebrity comedians call for TotalEnergies to be kicked out of AFCON,https://thenewdawnliberia.com/watch-celebrity-comedians-call-for-totalenergies-to-be-kicked-out-of-afcon/,en,thenewdawnliberia.com,thenewdawnliberia.com,2024-01-15 03:11:02+00:00
4fe4792b729cf0cbf6f645580ca947ef0d9deaa0e1c84933edcd5cbc95d2b8a8,2024-01-12,Youth Gears Up To Produce Climate-Justified Friendly And Sustainable Solutions,https://frontpageafricaonline.com/news/youth-gears-up-to-produce-climate-justified-friendly-and-sustainable-solutions/,en,frontpageafricaonline.com,frontpageafricaonline.com,2024-01-14 11:26:19+00:00
40a58064932aef6151b9af5a7bbedd7c23348c88d0df915233818eb84e9355c4,2024-01-12,Analyzing Liberia's 2023 Post-Elections Era: Emphasizing Economic Development and Progress Towards Sustainable Development,https://frontpageafricaonline.com/opinion/commentary/analyzing-liberias-2023-post-elections-era-emphasizing-economic-development-and-progress-towards-sustainable-development/,en,frontpageafricaonline.com,frontpageafricaonline.com,2024-01-14 11:26:19+00:00
f1e4254c06667b1f56561302ab8f81387af7b9ce04e9bb78e48b8a128a1e1c1e,2024-01-09,BlueInvest Africa 2024: Calling African Entrepreneurs,https://thenewdawnliberia.com/blueinvest-africa-2024-calling-african-entrepreneurs/,en,thenewdawnliberia.com,thenewdawnliberia.com,2024-01-12 08:40:34+00:00
9d56cb092036b9c50aca4990ef94f6101909b3c70d570542a66812863a05c1b5,2024-01-10,Liberia: Nature For Kids Executive Director Inspires Children On Growing Up To Guide Nature,https://frontpageafricaonline.com/news/liberia-nature-for-kids-executive-director-inspires-children-on-growing-up-to-guide-nature/,en,frontpageafricaonline.com,frontpageafricaonline.com,2024-01-12 03:38:38+00:00
d4d7a8a695e6f7eb4d3fd693808ba74a6d9836643f7beeb9abacd05274f44189,2024-01-08,Africa In 2024: A Year Of Mixed Fortunes,https://gnnliberia.com/africa-in-2024-a-year-of-mixed-fortunes/,en,gnnliberia.com,gnnliberia.com,2024-01-10 05:30:32+00:00
