id,publish_date,title,url,language,media_name,media_url,indexed_date
00d3756129a024f2ab04d17377cc0cb35c5abc1f09104f65e7687c54a91c5e4c,2024-12-31,"President Boakai Congratulates Ghana’s President-Elect, H.E. John Dramani Mahama, as the two Discuss Regional and Bilateral Issues",https://gnnliberia.com/president-boakai-congratulates-ghanas-president-elect-h-e-john-dramani-mahama-as-the-two-discuss-regional-and-bilateral-issues/,en,gnnliberia.com,gnnliberia.com,2025-01-01 21:17:19.310924+00:00
a09123b0a230a6028d87bd2e877e2903e17157be57bfd5c7db1f644476214520,2024-12-31,"Liberia: President Boakai Meets with Ghana’s President-Elect Mahama, Promises to Strengthens Regional and Bilateral Issues",https://frontpageafricaonline.com/news/liberia-president-boakai-meets-with-ghanas-president-elect-mahama-promises-to-strengthens-regional-and-bilateral-issues/,en,frontpageafricaonline.com,frontpageafricaonline.com,2024-12-31 14:28:51.696795+00:00
eeb71975f7a5ab5ffcdd580417eea0706d91ef270b55be64b80823f856bc05d6,2024-12-29,India’s Growth Story 2024,https://inprofiledaily.com/indias-growth-story-2024/,en,inprofiledaily.com,inprofiledaily.com,2024-12-30 17:33:33.876481+00:00
8425e0decbcc73bf852109f957afb0117e046fe8636291b491df1f85d7da0b49,2024-12-30,"Liberia: Reduction of Waste, Partners with PCC to Combat Plastic Waste",https://frontpageafricaonline.com/environment/liberia-reduction-of-waste-partners-with-pcc-to-combat-plastic-waste/,en,frontpageafricaonline.com,frontpageafricaonline.com,2024-12-30 14:26:55.655532+00:00
4c8fb371fe170d00c21aa5e730724156e8b4babca2a1b0ec4bdd3ec62576f6e7,2024-12-27,Incredible Success! - Global News Network Liberia,https://gnnliberia.com/incredible-success/,en,gnnliberia.com,gnnliberia.com,2024-12-27 19:28:16.032581+00:00
1c1d023c69fa84aefecc0bd8b84da120c9d39a1e3cb460b9d63ae9f607693ca3,2024-12-25,Zara Dar’s Bold Career Move,https://inprofiledaily.com/zara-dars-bold-move/,en,inprofiledaily.com,inprofiledaily.com,2024-12-25 17:30:29.807797+00:00
e14b22496d0949430c93620d9f92da19fdb5ab958a013837de372aa0fbe576c2,2024-12-24,Liberia: No Christmas Cheer For Growing Number of Liberians in Poverty,https://frontpageafricaonline.com/news/liberia-no-christmas-cheer-for-growing-number-of-liberians-in-poverty/,en,frontpageafricaonline.com,frontpageafricaonline.com,2024-12-24 12:26:21.838517+00:00
70efe6319e6d373683891f819b0890d902b24af5d33b542c4c4dd31fdc41eb3d,2024-12-23,Christmas & Rising Dementia Cases 2024,https://inprofiledaily.com/christmas-rising-dementia-cases/,en,inprofiledaily.com,inprofiledaily.com,2024-12-23 17:36:13.480686+00:00
f47ed479f030a2e17dba9e3b9532684bf9260a313b3a11f1834dfbd1eab5683f,2024-12-21,Expansion of Athera Venture Partners,https://inprofiledaily.com/expansion-of-athera-venture-partners/,en,inprofiledaily.com,inprofiledaily.com,2024-12-21 19:47:28.335609+00:00
ca0b497f7bb1563875b6e3256956fd7a0b9cc26249aa5794b5369f2a15e84600,2024-12-19,PM Aldabaiba launches ‘‘Green Libya Initiative’’ – includes planting 100 million trees,https://libyaherald.com/2024/12/pm-aldabaiba-launches-green-libya-initiative-includes-planting-100-million-trees/,en,libyaherald.com,libyaherald.com,2024-12-20 03:27:22.864591+00:00
f24d1bc70c141b14d8a402d162c28e4aed5014dc1ea6f39abc25e8953e574bf3,2024-12-17,Exploring the Growing Threat of Bird Flu,https://inprofiledaily.com/growing-threat-of-bird-flu/,en,inprofiledaily.com,inprofiledaily.com,2024-12-18 11:20:26.317439+00:00
d78a028006e630033a18e2290572e3a7861d6f9d928577a81fa0ef771b656925,2024-12-17,The Role of Liberian Youths in National Unity and National Consciousness: A Comparative Analysis with Global Peers,https://thenewdawnliberia.com/the-role-of-liberian-youths-in-national-unity-and-national-consciousness/,en,thenewdawnliberia.com,thenewdawnliberia.com,2024-12-18 00:19:59.260696+00:00
0c01c1c5413c351fdd39daa3f24f35840ea141f5d934cfac7a95826b28e1f2ee,2024-12-17,UNDP organises workshop to develop Libya’s energy-efficient building codes,https://libyaherald.com/2024/12/undp-organises-workshop-to-develop-libyas-energy-efficient-building-codes/,en,libyaherald.com,libyaherald.com,2024-12-17 18:31:19.699480+00:00
a0b8f9769b93b4fd4ceb02f915965063a45a1c057b7ec7ec84a2d34fb8b7b057,2024-12-17,Combating IUU fishing tops govt. priorities,https://thenewdawnliberia.com/combating-iuu-fishing-tops-govt-priorities/,en,thenewdawnliberia.com,thenewdawnliberia.com,2024-12-17 18:23:20.956937+00:00
cb7331cb6e0afc9bc06f7294d8656bf8d353cd1fa1adb8788d891e0d21737324,2024-12-17,Boakai calls for collective action against unregulated fishing,https://thenewdawnliberia.com/boakai-calls-for-collective-action-against-unregulated-fishing/,en,thenewdawnliberia.com,thenewdawnliberia.com,2024-12-17 18:22:43.973722+00:00
2c05b38631129981e43aafd9ce153040a650cfa03a515891e097a9de421b0419,2024-12-16,"Liberia New: Pres. Boakai Alarms over Illegal, Loose Fishing Activities",https://www.newrepublicliberia.com/liberia-new-pres-boakai-alarms-over-illegal-loose-fishing-activities/,en,newrepublicliberia.com,newrepublicliberia.com,2024-12-16 13:25:48.405618+00:00
e1b8b681f1149947959cd9aba03ad63fb8e35509404bd249ac6fe1267e093785,2024-12-16,"Liberian Red Cross welcomes additional $592,000 Funding for GIRL Project from Swedish Embassy",https://thenewdawnliberia.com/liberian-red-cross-welcomes-additional-592000-funding-for-girl-project/,en,thenewdawnliberia.com,thenewdawnliberia.com,2024-12-16 04:24:44.029713+00:00
64d55df6d868dd6579ce3878c9b69f38de995ea1beec5257e6e16a634895bd6e,2024-12-14,President Boakai Hosts 15th Ministerial Conference of the Fisheries Committee for the West Central Gulf of Guinea (FCWC),https://gnnliberia.com/president-boakai-hosts-15th-ministerial-conference-of-the-fisheries-committee-for-the-west-central-gulf-of-guinea-fcwc/,en,gnnliberia.com,gnnliberia.com,2024-12-14 19:26:07.634270+00:00
2c93f947219014c29fec9bd796c72f7f9cb4578b9867326aff6cb1002d50d131,2024-12-13,Mining: ArcelorMittal Liberia Showcases Support for Farmers at National Agriculture Fair,https://www.newrepublicliberia.com/mining-arcelormittal-liberia-showcases-support-for-farmers-at-national-agriculture-fair/,en,newrepublicliberia.com,newrepublicliberia.com,2024-12-13 13:27:30.911336+00:00
68bd0760ba040a915fc9698d6884d2ace136be5c11d86a7cb2504d516142a6a7,2024-12-13,U.S. - Liberia Country Coordination Meeting Advances Security Cooperation and Military Partnership - Global News Network Liberia,https://gnnliberia.com/u-s-liberia-country-coordination-meeting-advances-security-cooperation-and-military-partnership/,en,gnnliberia.com,gnnliberia.com,2024-12-13 13:22:45.391738+00:00
d913b1dabc8b43088a244fd7febf4ac3b443ee4317dbc6b643e9b1d008d295da,2024-12-13,Liberia: This Year’s Rainy Season Was Worst in Memory But Experts Say Worse is to Come; Call for Massive Government Investment in Adaptation,https://frontpageafricaonline.com/news/liberia-this-years-rainy-season-was-worst-in-memory-but-experts-say-worse-is-to-come-call-for-massive-government-investment-in-adaptation/,en,frontpageafricaonline.com,frontpageafricaonline.com,2024-12-13 10:24:19.125736+00:00
ade27116d76ebb68dd314902a1e12065481a98911f3fcf0f1cbb376fe6f05bac,2024-12-13,Liberia: U.S. Africa Command and Armed Forces of Liberia Hold Inaugural Country Coordination Meeting in Monrovia,https://frontpageafricaonline.com/security/liberia-u-s-africa-command-and-armed-forces-of-liberia-hold-inaugural-country-coordination-meeting-in-monrovia/,en,frontpageafricaonline.com,frontpageafricaonline.com,2024-12-13 10:23:26.667588+00:00
6f476f6dd6d6a8c07089942a8a7c7ec874227d9aa151c458e9233d5a55cb5fc8,2024-12-12,"Remarks by World Bank Country Manager, Georgia Wallen Liberia MSME Conference 2024",https://gnnliberia.com/remarks-by-world-bank-country-manager-georgia-wallen-liberia-msme-conference-2024/,en,gnnliberia.com,gnnliberia.com,2024-12-12 17:32:16.905005+00:00
3cbe31eb8244c9d033c4167088e13561a3925e81c58321d3bab33260b2e0020d,2024-12-12,FCWC 15th ministerial conference begins in Monrovia,https://thenewdawnliberia.com/fcwc-15th-ministerial-conference-begins-in-monrovia/,en,thenewdawnliberia.com,thenewdawnliberia.com,2024-12-12 16:25:43.622631+00:00
25b487c6acc6e8fafa39d7fcbf7ae70c7d91538042c0ce560a3735de62a78f08,2024-12-09,Article: A Disturbing Reality,https://thenewdawnliberia.com/article-a-disturbing-reality/,en,thenewdawnliberia.com,thenewdawnliberia.com,2024-12-10 01:22:25.557842+00:00
6f65f9be7247efd8a9155c88573427c4b8cfd1e0b1965d3857c31247968467b7,2024-12-09,Liberian Farmers Proffer Solutions to Improve Agriculture in Liberia at National Farmers’ Conference,https://frontpageafricaonline.com/agric-matters/liberian-farmers-proffer-solutions-to-improve-agriculture-in-liberia-at-national-farmers-conference/,en,frontpageafricaonline.com,frontpageafricaonline.com,2024-12-09 12:33:26.602533+00:00
e1eef261bd7108b1229f3a8524470cbfa4812c05c085e8373b8b5beb6b44b772,2024-12-05,Government of Liberia and IFAD Sign US$5.3 Million European Union Grant for Agricultural Development,https://gnnliberia.com/government-of-liberia-and-ifad-sign-us5-3-million-european-union-grant-for-agricultural-development/,en,gnnliberia.com,gnnliberia.com,2024-12-05 17:35:18.507163+00:00
cf0fa44b80fe1c5a9b22a3c6e25ee34eb311a1cf6394e38e0070eca9c9e4706c,2024-12-05,Gov't signs US$5.3M grant with IFAD,https://thenewdawnliberia.com/govt-signs-us5-3m-grant-with-ifad/,en,thenewdawnliberia.com,thenewdawnliberia.com,2024-12-05 13:24:59.691165+00:00
4db2f64a884e9c70c423c8611797c4e7bf367d78522eac60e19477f99867ff37,2024-12-04,"EPA, UNDP and Partners Validate Climate Resilience Project",https://gnnliberia.com/epa-undp-and-partners-validate-climate-resilience-project/,en,gnnliberia.com,gnnliberia.com,2024-12-04 23:20:57.904826+00:00
a90535219a0c99c7fc4374b51f98c6e745ba1cea2c031f1504b2335b7bd84848,2024-12-04,Farmers shouldn’t consider themselves poor,https://thenewdawnliberia.com/farmers-shouldnt-consider-themselves-poor/,en,thenewdawnliberia.com,thenewdawnliberia.com,2024-12-04 18:34:10.898993+00:00
fc3a2f5553608d075462862e97f1a9b2651521f0dc38aa05138f900dcd21249a,2024-12-03,Liberia News: Ex-Foreign Minister Badmouths Current Administration,https://www.newrepublicliberia.com/liberia-news-ex-foreign-minister-badmouths-current-administration/,en,newrepublicliberia.com,newrepublicliberia.com,2024-12-03 11:46:03.093589+00:00
6608b387d09e41bf055bf47fe559d79a09213a7dd2555c4c72198511ccd0db67,2024-12-02,Community Forestry Management Team Monitors Lofa Project Sites,https://gnnliberia.com/community-forestry-management-team-monitors-lofa-project-sites/,en,gnnliberia.com,gnnliberia.com,2024-12-02 17:22:04.564882+00:00
c9288c0d1fa9f15d2ee06bc6c29a080a6bcb255aa9f27e4dae7e822b1887848d,2024-12-02,"Liberia: YOTAN, Partners Host 3rd Liberian Youth SDG Summit Focused on Empowering Future Leaders",https://frontpageafricaonline.com/news/liberia-yotan-partners-host-3rd-liberian-youth-sdg-summit-focused-on-empowering-future-leaders/,en,frontpageafricaonline.com,frontpageafricaonline.com,2024-12-02 12:21:01.808667+00:00
0259f3d5e522e17f30d4453eb9203075ffb5e79515af58cf3b415a224f2152c2,2024-12-02,Liberia News: Good News for Coffee Farmers,https://www.newrepublicliberia.com/liberia-news-good-news-for-coffee-farmers/,en,newrepublicliberia.com,newrepublicliberia.com,2024-12-02 11:28:57.497323+00:00
b600723e3c91486d554adda89c01cac15c9a766e05f8434b76588e154bb8038a,2024-11-27,NEC ED shares experience from US elections,https://thenewdawnliberia.com/nec-ed-shares-experience-from-us-elections/,en,thenewdawnliberia.com,thenewdawnliberia.com,2024-11-27 07:26:05.617244+00:00
7e95278f819c96217112c2fe7e94a9d402f39364253b74b1df89094e8f830cd7,2024-11-26,World Bank Liberia Country Manager Remarks at Official launch of the Climate Integration and Financing Office,https://gnnliberia.com/world-bank-liberia-country-manager-remarks-at-official-launch-of-the-climate-integration-and-financing-office/,en,gnnliberia.com,gnnliberia.com,2024-11-26 23:26:06.178516+00:00
52c1404f959caddcdac69b17b4b4c3fadb0cb67fead631be7ed0c1d46e868e76,2024-11-26,Calls for EU not to End Timber Treaty with Liberia,https://frontpageafricaonline.com/environment/calls-for-eu-not-to-end-timber-treaty-with-liberia/,en,frontpageafricaonline.com,frontpageafricaonline.com,2024-11-26 12:25:33.896197+00:00
621776ca3ee83ef6f6b4f1a1a2f09411ed636a6ede6179bd70917e09c6c9b7a0,2024-11-24,Sebastian Gorka Rejoins Trump’s Team,https://inprofiledaily.com/sebastian-gorka-rejoins-trumps/,en,inprofiledaily.com,inprofiledaily.com,2024-11-25 11:17:34.467173+00:00
a66ecc3d1bbb2a7f66c413a3c42cfa7e1a814d0890980d7abefc2d7588a0b28a,2024-11-25,Negotiators Strike a Controversial $300 Billion Climate Finance Deal at COP29 as Carbon Trading is Approved,https://frontpageafricaonline.com/news/negotiators-strike-a-controversial-300-billion-climate-finance-deal-at-cop29-as-carbon-trading-is-approved/,en,frontpageafricaonline.com,frontpageafricaonline.com,2024-11-25 09:24:03.637702+00:00
6ffd51a30beafbf35ed7588609a6ab6c37ea3604584d047d134f8efd89eb24b4,2024-11-22,Liberia: Government Reaffirms Commitment to Financial Inclusion at UN Women’s Multi-Stakeholder Dialogue,https://frontpageafricaonline.com/gender-issues/liberia-government-reaffirms-commitment-to-financial-inclusion-at-un-womens-multi-stakeholder-dialogue/,en,frontpageafricaonline.com,frontpageafricaonline.com,2024-11-23 14:28:45.337068+00:00
3b1d5af6f3602d226a3c7c7c357eec0a9961ed0791a3047ed0f32798230a60b8,2024-11-21,Liberia: A pitstop along the journey at COP 29,https://thenewdawnliberia.com/liberia-a-pitstop-along-the-journey-at-cop-29/,en,thenewdawnliberia.com,thenewdawnliberia.com,2024-11-21 16:18:37.727477+00:00
3ce8bb4f55aab34595c700fd7d5fe899b2e1ffea4103b5e3570eaffa0a972ee8,2024-11-21,Liberia: A pitstop along the journey at COP 29,https://gnnliberia.com/liberia-a-pitstop-along-the-journey-at-cop-29/,en,gnnliberia.com,gnnliberia.com,2024-11-21 13:35:57.286436+00:00
e48cd34e7d9d27e3242a07a5bbad9d28be1bfd0f5e0810a124110dbbb8980469,2024-11-18,Commentary: On Being Computer Literate,https://thenewdawnliberia.com/commentary-on-being-computer-literate/,en,thenewdawnliberia.com,thenewdawnliberia.com,2024-11-18 12:17:12.647505+00:00
5a1036e482f0b740711da78c78523f5600152758e3c3acef09b8efdb816742ce,2024-11-16,Ukraine’s Strategic Push for Peace,https://inprofiledaily.com/ukraines-strategic-push-peace/,en,inprofiledaily.com,inprofiledaily.com,2024-11-17 11:18:10.026125+00:00
049e79435b225642bed530c6bd2c85ec445837a6e37def9a73d9e13387e6de5d,2024-11-16,African Risk Capacity Ltd. CEO Lesley Ndlovu on the 2024 TIME100 Climate List,https://gnnliberia.com/african-risk-capacity-ltd-ceo-lesley-ndlovu-on-the-2024-time100-climate-list/,en,gnnliberia.com,gnnliberia.com,2024-11-16 23:20:59.900500+00:00
e6053c19aa943411e89d3d0c77a0fbdcedb06bf85ed3f9177fd5d372b2774d75,2024-11-15,Liberia never broke ties with Russia,https://thenewdawnliberia.com/liberia-never-broke-ties-with-russia/,en,thenewdawnliberia.com,thenewdawnliberia.com,2024-11-15 16:28:25.550609+00:00
733c10241d031e4cfd480cc278789c4f9e30958ac85705aa3726d4a0f727ae0a,2024-11-15,UNDP and Partners Examine Drivers of Development Study,https://gnnliberia.com/undp-and-partners-examine-drivers-of-development-study/,en,gnnliberia.com,gnnliberia.com,2024-11-15 15:35:54.431514+00:00
ff951175cbaf171b7b66975c46c2f77956d843903a9b0446ed876573f6ae2034,2024-11-15,Liberia: Women Farmers in Bong County Decry Being Forced to Lease Land for Farming,https://frontpageafricaonline.com/agric-matters/liberia-women-farmers-in-bong-county-decry-being-forced-to-lease-land-for-farming/,en,frontpageafricaonline.com,frontpageafricaonline.com,2024-11-15 13:22:35.913608+00:00
e6f35f0e6734d162d1bc4548b8d9417a3f2adc8246889faeff46a9d8785727f3,2024-11-14,EU Funded Project Trains Local Organizations on Carbon Markets,https://gnnliberia.com/eu-funded-project-trains-local-organizations-on-carbon-markets/,en,gnnliberia.com,gnnliberia.com,2024-11-14 17:23:23.722454+00:00
931924882443c7c00781ec0582a87abad334ae9cb83d8541e4008cdc35bce390,2024-11-13,ARC Ltd. advocates for innovative disaster risk insurance solutions at COP29 to bolster Africa’s climate resilience,https://gnnliberia.com/arc-ltd-advocates-for-innovative-disaster-risk-insurance-solutions-at-cop29-to-bolster-africas-climate-resilience/,en,gnnliberia.com,gnnliberia.com,2024-11-13 19:31:29.043237+00:00
a26798308b87d23aa682362711b3cf1ce64e67947e2aa61292d1a3cb8b1a52b1,2024-11-13,VP Koung arrives in Baku for COP29,https://thenewdawnliberia.com/vp-koung-arrives-in-baku-for-cop29/,en,thenewdawnliberia.com,thenewdawnliberia.com,2024-11-13 14:27:38.410236+00:00
4c03b3976143e2309251af18217cdf5d520d432b045b181da24a55eb54fd89ed,2024-11-12,University of Liberia Launches Climate Action Curriculum and Laboratory,https://frontpageafricaonline.com/education/university-of-liberia-launches-climate-action-curriculum-and-laboratory/,en,frontpageafricaonline.com,frontpageafricaonline.com,2024-11-12 10:21:29.585172+00:00
777ab037387f80e0c06f9d4df7b569f0d60c55ea7ab2ebb38232c69d245253d7,2024-11-11,Liberia: Forest Communities Angered by Exclusion from Carbon Credit Negotiations,https://frontpageafricaonline.com/news/liberia-forest-communities-angered-by-exclusion-from-carbon-credit-negotiations/,en,frontpageafricaonline.com,frontpageafricaonline.com,2024-11-11 15:31:17.062272+00:00
83fc6aca59ea0a3c8d709912da474f08bbf6da67fd0abaf5f21045c3130982c1,2024-11-08,Racist Texts Sent to Austin Students Spark Outrage and Investigation,https://inprofiledaily.com/racist-texts-sent-to-austin-students-spark-outrage-and-investigation/,en,inprofiledaily.com,inprofiledaily.com,2024-11-09 11:18:20.886510+00:00
b7211f91d8688963f1080ff1f686c53a5e8ab268833a73b3fe910224e9725041,2024-11-08,"High-level Libyan delegation participates in the Mediterranean Forum on Decarbonisation: DecarboMed, in Tunis from 24 to 25 Sep",https://libyaherald.com/2024/11/147272/,en,libyaherald.com,libyaherald.com,2024-11-09 01:19:06.947776+00:00
2f644068c59cc7e5385748f9cbd82cb118112aa8635ab67551be07d4f227abf6,2024-11-08,Italian Navy Vessel Borsini call at Freeport of Monrovia,https://thenewdawnliberia.com/italian-navy-vessel-borsini-call-at-freeport-of-monrovia/,en,thenewdawnliberia.com,thenewdawnliberia.com,2024-11-08 18:26:28.547523+00:00
92e59e5b9056ce82ce2dfc8f2996b5cddd507e11eba562526096f90e13828ac1,2024-11-08,"Liberia: Top U.S. Military Commander Langley Visits Liberia, Reaffirms U.S. Support in Meetings with President Boakai and Defense Ministry’s Officials",https://frontpageafricaonline.com/news/liberia-top-u-s-military-commander-langley-visits-liberia-reaffirms-u-s-support-in-meetings-with-president-boakai-and-defense-ministrys-officials/,en,frontpageafricaonline.com,frontpageafricaonline.com,2024-11-08 12:28:30.828670+00:00
4d8410a5e08fce4b6964e877bdfcf0c2a7c1b01fdcd5c168463ca25510947156,2024-11-07,"1,759 international companies, including Libyan companies, participating in EIMA agricultural exhibition in Bologna",https://libyaherald.com/2024/11/1759-international-companies-including-libyan-companies-participating-in-eima-agricultural-exhibition-in-bologna/,en,libyaherald.com,libyaherald.com,2024-11-08 08:35:23.148395+00:00
99066473be9a72ca4203204f823a8aef04e3204813b40fa8aba79383272ce876,2024-11-06,Kamala Harris to Concede in 2024 Presidential Election After Defeat to Donald Trump,https://inprofiledaily.com/kamala-harris-to-concede-in-2024-presidential-election-after-defeat-to-donald-trump/,en,inprofiledaily.com,inprofiledaily.com,2024-11-07 10:53:37.988591+00:00
f44ee07c5aac7cdaa158e08ba137a8f4b439582f5cc693cd52a8fe25e1020842,2024-11-06,"Liberia: EU Envoy Trumpets Milestone as Italian Navy Vessel, Borsini Call at Freeport of Monrovia",https://frontpageafricaonline.com/opinion/press-release/liberia-eu-envoy-trumpets-milestone-as-italian-navy-vessel-borsini-call-at-freeport-of-monrovia/,en,frontpageafricaonline.com,frontpageafricaonline.com,2024-11-06 21:17:21.410700+00:00
11d72828d09b814c460b2ea228d437b9e14929e6973d461d04e59b30401ef9b0,2024-11-02,First Cheque’s Strategic Investment,https://inprofiledaily.com/first-cheques-strategic-investment/,en,inprofiledaily.com,inprofiledaily.com,2024-11-03 10:36:45.676786+00:00
a0d2a14a966f8260af649488343e9028ef6eddcbae7e51b46bfd0d0632e1293c,2024-11-01,"Liberia: Red Cross Conducts Road Traffic Accident Simulation Exercise In Fishtown, River Gee",https://frontpageafricaonline.com/news/liberia-red-cross-conducts-road-traffic-accident-simulation-exercise-in-fishtown-river-gee/,en,frontpageafricaonline.com,frontpageafricaonline.com,2024-11-01 11:44:58.808127+00:00
9c2f72ce9c11e73f5d98d2ee6631b0259d65d093dcd140d6f8b8904aa8a70556,2024-11-01,Liberia: Road Pavement Using Soil-Based Pavement Material Introduced,https://frontpageafricaonline.com/news/liberia-road-pavement-using-soil-based-pavement-material-introduced/,en,frontpageafricaonline.com,frontpageafricaonline.com,2024-11-01 11:44:43.827818+00:00
bb2e44727be41aee1ed8763615d9bf748587def239a8c3e16e34da29dc4fe789,2024-10-31,Journalists attend training on fisheris and aquaculture reporting,https://thenewdawnliberia.com/journalists-attend-training-on-fisheris-and-aquaculture-reporting/,en,thenewdawnliberia.com,thenewdawnliberia.com,2024-11-01 00:21:29.653430+00:00
44b64022c8726698cfe3135dbf00786885dedd225ed45427301a56b4cfb89895,2024-10-31,New EU Seeds4Liberia Project Enhances Food Security,https://thenewdawnliberia.com/new-eu-seeds4liberia-project-enhances-food-security/,en,thenewdawnliberia.com,thenewdawnliberia.com,2024-11-01 00:20:47.033120+00:00
d966e1c878b27ebaf3392513c0437b3d4cca0af8d0a5141a8abee8f51ba86bfe,2024-10-31,Liberia Reaffirms Commitment to Humanitarian Principles at 34th International Red Cross and Red Crescent Conference,https://frontpageafricaonline.com/news/liberia-reaffirms-commitment-to-humanitarian-principles-at-34th-international-red-cross-and-red-crescent-conference/,en,frontpageafricaonline.com,frontpageafricaonline.com,2024-10-31 10:53:35.234280+00:00
dfb1640fb7e05610e36b2dcac43a836d14142e9bda59ef4556e1ad5c57819e85,2024-10-31,"Liberia: As Climate Change Impacts Worsen, National Climate Summit Aims to Encourage a New, More Resilient Approach to Farming",https://frontpageafricaonline.com/news/liberia-as-climate-change-impacts-worsen-national-climate-summit-aims-to-encourage-a-new-more-resilient-approach-to-farming/,en,frontpageafricaonline.com,frontpageafricaonline.com,2024-10-31 10:51:43.600126+00:00
e0f7b8998dbf832154c10e003752d3d3f57310c5519e641679cd3a66729e70e5,2024-10-30,"LSMFP, NAFAA Train Journalists on Specialized Reporting on Fisheries - Global News Network Liberia",https://gnnliberia.com/lsmfp-nafaa-train-journalists-on-specialized-reporting-on-fisheries/,en,gnnliberia.com,gnnliberia.com,2024-10-31 04:25:38.418588+00:00
daba77482b86a8b72ec13c6f6cbf4818d6ccbcb8bdb6600788b7c71f8666d7a3,2024-10-29,EPA partners dialogue on Green Climate Fund Readiness,https://thenewdawnliberia.com/epa-partners-dialogue-on-green-climate-fund-readiness/,en,thenewdawnliberia.com,thenewdawnliberia.com,2024-10-29 04:21:23.371172+00:00
f818592298bdd14aa296e54d2e1e1b1b3ea5b144e3ab18a54540e5855990653d,2024-10-28,As I See It: We Welcome the Doctoral Programs at the University of Liberia,https://thenewdawnliberia.com/we-welcome-the-doctoral-programs-at-the-university-of-liberia/,en,thenewdawnliberia.com,thenewdawnliberia.com,2024-10-28 16:17:29.208032+00:00
c541caa93b6bd90c598568eb6b4842543d21e74ab0d488e23d05b90c262c3217,2024-10-28,EU to End Timber Agreement with Liberia,https://frontpageafricaonline.com/front-slider/eu-to-end-timber-agreement-with-liberia/,en,frontpageafricaonline.com,frontpageafricaonline.com,2024-10-28 08:22:33.562759+00:00
9f3eee5c61b3f0c47597fbf0cce01546e52b81e7ce869d77c1aad41be3c067f7,2024-10-25,3 Africans Vie for Commonwealth Top Post,https://gnnliberia.com/3-africans-vie-for-commonwealth-top-post/,en,gnnliberia.com,gnnliberia.com,2024-10-25 17:25:09.465887+00:00
66f0c145408aba1a6de8e8cecc6aeb8273c01bf8448a4af102f672fc01a3032f,2024-10-25,From emergency relief to sustainable development: working together for the people of Liberia,https://frontpageafricaonline.com/opinion/press-release/from-emergency-relief-to-sustainable-development-working-together-for-the-people-of-liberia/,en,frontpageafricaonline.com,frontpageafricaonline.com,2024-10-25 13:42:44.857990+00:00
a4186d85cc4dfbf4655cf890e5ebc9a488cae46d00a2513ce2e3cd60b262e917,2024-10-22,Legal Battle Against Perplexity AI,https://inprofiledaily.com/legal-battle-perplexity-ai/,en,inprofiledaily.com,inprofiledaily.com,2024-10-23 10:58:29.422281+00:00
1621942569d511b81ccafbed0475f81ed011be2b682eed7bc4db37af0ac0f331,2024-10-17,GoL denies losing bid for UN Security Council seat,https://thenewdawnliberia.com/gol-denies-losing-bid-for-un-security-council-seat/,en,thenewdawnliberia.com,thenewdawnliberia.com,2024-10-17 12:20:06.484372+00:00
83a597634c82b05af8f0cdc1d5ddf64fe8ad5a594e2ae1a6645a0127896f0a64,2024-10-16,LVMH Confronts Sharp Decline,https://inprofiledaily.com/lvmh-confronts-sharp-decline/,en,inprofiledaily.com,inprofiledaily.com,2024-10-17 10:56:40.654958+00:00
e086b1ecdfe25c75a7a8d2b3d5cf9472d5b226eddcd04690d55512759cf1fba4,2024-10-16,Liberia: Boakai Sounds Trumpet,https://www.newrepublicliberia.com/liberia-boakai-sounds-trumpet/,en,newrepublicliberia.com,newrepublicliberia.com,2024-10-16 11:02:39.881749+00:00
67ede9128c97924f30a91b5d18ef6c926905679f3190cea57e61df108eac9b2d,2024-10-15,Liberia: President Boakai at the 2024 World Food Forum Ensures Liberia Willingness to Contribute to Global Food Security,https://frontpageafricaonline.com/news/liberia-president-boakai-at-the-2024-world-food-forum-ensures-liberia-willingness-to-contribute-to-global-food-security/,en,frontpageafricaonline.com,frontpageafricaonline.com,2024-10-15 15:26:17.940691+00:00
