id,publish_date,title,url,language,media_name,media_url,indexed_date
aa7658e5e5f03984478af139d1747c0f49937e7c12926d5b965d8a633675e81c,2024-05-21,"Return the Bones, Restore the Nation: HRH Princess Eugene Majuru on Dan Hicks, Ancestral Remains, and Zimbabwe’s Fight for Memory",https://newsofthesouth.com/return-the-bones-restore-the-nation-hrh-princess-eugene-majuru-on-dan-hicks-ancestral-remains-and-zimbabwes-fight-for-memory/,en,newsofthesouth.com,newsofthesouth.com,2025-11-20 02:19:48.543207+00:00
5bcee16eb5f170ccaf53f394a0413802d0ac18f2a210891fc61e7b25716a663a,2024-05-21,Global Recognition as Zim Minister Barbara Rwodzi Appointed Vice President,https://newsofthesouth.com/global-recognition-as-zim-minister-barbara-rwodzi-appointed-vice-president/,en,newsofthesouth.com,newsofthesouth.com,2025-11-10 14:22:24.163548+00:00
e0892a1daaec94ab2cd8285236071b620fc39a7495bf36d2e80d36f0c5bb36cb,2024-05-21,UK retailers unprepared for environmental risks,https://newsofthesouth.com/uk-retailers-unprepared-for-environmental-risks/,en,newsofthesouth.com,newsofthesouth.com,2025-09-30 22:20:08.377736+00:00
16db81915c859f4865d712bf02dde07158fdff8d91e5e94dfb3723ed9eb9bc3b,2024-05-21,Zimbabwe’s Livability Crisis: Unpacking the Challenges and Charting a Path to Recovery,https://newsofthesouth.com/zimbabwes-livability-crisis-unpacking-the-challenges-and-charting-a-path-to-recovery/,en,newsofthesouth.com,newsofthesouth.com,2025-07-18 07:18:53.375017+00:00
5479d93920992f2dd5c1cbf6db18fe3b702aa07b02c147e1ce7779faf9031434,2024-05-21,"InnoVent Diaz onshore windfarm will produce clean energy for 6% of Namibia’s energy consumption, avoiding the emission of 200,000 tons of CO₂ annually",https://newsofthesouth.com/innovent-diaz-onshore-windfarm-will-produce-clean-energy-for-6-of-namibias-energy-consumption-avoiding-the-emission-of-200000-tons-of-co%E2%82%82-annually/,en,newsofthesouth.com,newsofthesouth.com,2025-06-23 23:28:17.885013+00:00
2b8b1d910c17e33b8c68df19f175e58373368858d924ef64b37eb6e9371f19ac,2024-05-21,Zambezi: The Lifeline of Southern Africa – A River of Wonders and Vital Resources,https://newsofthesouth.com/zambezi-the-lifeline-of-southern-africa-a-river-of-wonders-and-vital-resources/,en,newsofthesouth.com,newsofthesouth.com,2025-06-20 13:32:20.279190+00:00
8cc97a711dfbc608d4a5ed04480e7019ed1537d12c5caa9ec1cac2f44eff769a,2024-05-21,FLAIR Summit Ignites a New Era of Collaborative Women’s Leadership for African Progress,https://newsofthesouth.com/flair-summit-ignites-a-new-era-of-collaborative-womens-leadership-for-african-progress/,en,newsofthesouth.com,newsofthesouth.com,2025-06-18 14:36:17.873936+00:00
a0081e6f329408dcf1b5d1d3e34f28c854760d837a89746a0b9e071265d1620b,2024-05-21,"Pretoria Spared Worst of Deadly Floods, Eastern Cape Ravaged as South Africa Grapples with Extreme Weather",https://newsofthesouth.com/pretoria-spared-worst-of-deadly-floods-eastern-cape-ravaged-as-south-africa-grapples-with-extreme-weather/,en,newsofthesouth.com,newsofthesouth.com,2025-06-13 02:27:02.779829+00:00
41476ca1cd0529c425158530ccd8bbc8b81762ccb1e7937ac99ce2dabba95d36,2024-05-21,World Food Safety Day 2025: the vital role of science in ensuring safe food,https://newsofthesouth.com/world-food-safety-day-2025-the-vital-role-of-science-in-ensuring-safe-food/,en,newsofthesouth.com,newsofthesouth.com,2025-06-07 16:18:45.254221+00:00
6453e6ce4e4a4fa23119455dba1394799e60120a9bc60ee730b5de4a6922db87,2024-05-21,Uganda’s Crossroads: Museveni’s Apology and the Quest for Genuine Change,https://newsofthesouth.com/ugandas-crossroads-musevenis-apology-and-the-quest-for-genuine-change/,en,newsofthesouth.com,newsofthesouth.com,2025-05-27 17:31:43.666364+00:00
f35a7e62413a292c77f66f14f1e6f822b476dd53b028e6e17cffcf321e2aab77,2024-05-21,Harmonies of Expression: Zimbabwean and European Artists Unite for Climate Action,https://newsofthesouth.com/harmonies-of-expression-zimbabwean-and-european-artists-unite-for-climate-action/,en,newsofthesouth.com,newsofthesouth.com,2025-05-23 16:33:09.654253+00:00
6bab7d378204830cd3f95278dd2720db23a2359baf557b9aebc73adf4711dfa6,2024-05-21,Ethiopia Unveils Strategic Initiative to Green Its Financial System and Drive Sustainable Investment,https://newsofthesouth.com/ethiopia-unveils-strategic-initiative-to-green-its-financial-system-and-drive-sustainable-investment/,en,newsofthesouth.com,newsofthesouth.com,2025-05-20 23:23:19.407679+00:00
b018a1c083ee631b5033517ba77b6bc731f6bb9ea09a79dccc4e77367241adad,2024-05-21,Flair Summit 2025 to Illuminate Women’s Leadership and Resilience in London,https://newsofthesouth.com/flair-summit-2025-to-illuminate-womens-leadership-and-resilience-in-london/,en,newsofthesouth.com,newsofthesouth.com,2025-05-19 11:32:25.798384+00:00
2d2a1d6f31d29a2dbf62163c4916565a62082aed2d696c96f2975c245307a9d9,2024-05-21,Africa Liberation Week 2025: Africans Rising to host over 850 Actions,https://newsofthesouth.com/africa-liberation-week-2025-africans-rising-to-host-over-850-actions/,en,newsofthesouth.com,newsofthesouth.com,2025-05-17 18:28:43.260445+00:00
0cbf0fa5c6d8854485d4b9efd36b728bfd1fa72e619bd26b20b70d7ba7c9e2d3,2024-05-21,Transforming Irrigation Systems in Southern Africa (TISA): Lessons from a Decade-Long Intervention,https://newsofthesouth.com/transforming-irrigation-systems-in-southern-africa-tisa-lessons-from-a-decade-long-intervention/,en,newsofthesouth.com,newsofthesouth.com,2025-05-12 18:18:44.314139+00:00
c37f33ccf10e7f701193ba9922345742516e7007d99031c837225b06f2492c76,2024-05-21,"Zimbabwe’s Kundai Benhura Makes History, Crowned Miss Africa 2025",https://newsofthesouth.com/zimbabwes-kundai-benhura-makes-history-crowned-miss-africa-2025/,en,newsofthesouth.com,newsofthesouth.com,2025-05-12 10:27:03.158357+00:00
84b1c78f0fbc125b04e2dfd47d374c909a7f74cf7ab8b51d46185b3b6e51292b,2024-05-21,New Era for the African Union Commission: Chairperson Mahmoud Ali Youssouf to Outline Strategic Vision,https://newsofthesouth.com/new-era-for-the-african-union-commission-chairperson-mahmoud-ali-youssouf-to-outline-strategic-vision/,en,newsofthesouth.com,newsofthesouth.com,2025-05-12 02:22:50.858163+00:00
e245d9950bca902ad47662cddbdd76e443e37e1653d9c8d2e6673fe48f9b6cde,2024-05-21,Sorghum United Foundation Launches Groundbreaking Eco-Adventure Game – Sorgho Squad: Rise of the Eco-Heroes,https://newsofthesouth.com/sorghum-united-foundation-launches-groundbreaking-eco-adventure-game-sorgho-squad-rise-of-the-eco-heroes/,en,newsofthesouth.com,newsofthesouth.com,2025-05-08 16:26:33.185610+00:00
9816cf5ca1e186119b4b39eea2545ecba11fa3002040843f57eaf2574f3161f5,2024-05-21,"Big 5 South Africa Impact Awards announce 51 finalists highlighting construction industry expertise, leadership and progression",https://newsofthesouth.com/big-5-south-africa-impact-awards-announce-51-finalists-highlighting-construction-industry-expertise-leadership-and-progression/,en,newsofthesouth.com,newsofthesouth.com,2025-05-08 16:25:49.840452+00:00
d9fcb7bb8971fbe39402cff26dbfe61d2516184b1297113373e92ffc22ad91fd,2024-05-21,Zimbabwean Achiever Professor Saurombe Becomes Youngest Female PhD Graduate in Africa,https://newsofthesouth.com/zimbabwean-achiever-professor-saurombe-becomes-youngest-female-phd-graduate-in-africa/,en,newsofthesouth.com,newsofthesouth.com,2025-05-08 09:22:36.899549+00:00
d28a487852383e278e3b5fcaa0c4025fcb1f8967f1f3b8d94838ac1fac6e9562,2024-05-21,Paving The Way to COP 30 Multilateral Development Banks Advance Plans To Scale Sustainable Development in Cities,https://newsofthesouth.com/paving-the-way-to-cop-30-multilateral-development-banks-advance-plans-to-scale-sustainable-development-in-cities/,en,newsofthesouth.com,newsofthesouth.com,2025-05-02 14:17:36.446390+00:00
453166bb84163241ee25ac3f7cd40308b47a051c601983cb90f9c58b7925c175,2024-05-21,"Zimbabwe’s Stay-Away Conundrum: A Complex Web of Economic Reality, Citizen Engagement, and Leadership Accountability",https://newsofthesouth.com/zimbabwes-stay-away-conundrum-a-complex-web-of-economic-reality-citizen-engagement-and-leadership-accountability/,en,newsofthesouth.com,newsofthesouth.com,2025-04-27 23:34:37.202350+00:00
d9f6f2d753e3f643e89bcf9196f3e6734b1378b3968b26fb1dc253b5b66bed3f,2024-05-21,Bold New Strategies for Empowering Women in Leadership: Acclaimed Executive Coach Issues an Urgent Call for Change,https://newsofthesouth.com/bold-new-strategies-for-empowering-women-in-leadership-acclaimed-executive-coach-issues-an-urgent-call-for-change/,en,newsofthesouth.com,newsofthesouth.com,2025-04-25 19:27:20.344217+00:00
60d552be9f10f1ef4001e300602fd9b35ce1a62f1e16c86a275b4cb5a00fe392,2024-05-21,"World Malaria Day Ends with Us: Reinvest, Reimagine, Reignite’",https://newsofthesouth.com/world-malaria-day-ends-with-us-reinvest-reimagine-reignite/,en,newsofthesouth.com,newsofthesouth.com,2025-04-25 19:26:53.954397+00:00
c755f6f7cfb1cefdd386c7abac8d67fe23937a470fc0c05be063ec686ca1e065,2024-05-21,World Mourns as Pope Francis Passes Away on Easter Monday,https://newsofthesouth.com/world-mourns-as-pope-francis-passes-away-on-easter-monday/,en,newsofthesouth.com,newsofthesouth.com,2025-04-21 20:36:07.145305+00:00
c4e77595ecf66912c49e47603e40511cc4f9926fc0a25a9a9ee07faaf7976a07,2024-05-21,Independence Celebrations Spark Fury Amid Economic Crisis in Zimbabwe,https://newsofthesouth.com/independence-celebrations-spark-fury-amid-economic-crisis-in-zimbabwe/,en,newsofthesouth.com,newsofthesouth.com,2025-04-17 11:18:33.662871+00:00
1efa4f779d25ddfc15ddac451a5ef572083cb5c510ae80030ecc058d9b8f91ac,2024-05-21,Mnangagwa Swears in New Ministers for Environment and Matabeleland South,https://newsofthesouth.com/mnangagwa-swears-in-new-ministers-for-environment-and-matabeleland-south/,en,newsofthesouth.com,newsofthesouth.com,2025-04-16 04:18:45.910063+00:00
5777b190208ca0d18492a079f2488e0794351b20293678cb3fe049ea17c40d82,2024-05-21,ZANU PF Candidate Tsitsi Tawomhera Wins Glen View South By Election,https://newsofthesouth.com/zanu-pf-candidate-tsitsi-tawomhera-wins-glen-view-south-by-election/,en,newsofthesouth.com,newsofthesouth.com,2025-04-13 16:18:23.004507+00:00
b13beb1f6930711b0fdd9f05c5fadc3a3caccd9433ae17a573168e5f21dc74da,2024-05-21,"Zimbabwe Reaps Rewards of Bumper Harvest, Eyes Return to Breadbasket Status",https://newsofthesouth.com/zimbabwe-reaps-rewards-of-bumper-harvest-eyes-return-to-breadbasket-status/,en,newsofthesouth.com,newsofthesouth.com,2025-04-10 06:20:38.403066+00:00
5ec9fe95f3c051b0d637d59cae6b8490bb05b74e9f61e5ff9090d80ba2059ae7,2024-05-21,Humanity at a Crossroads: Urgent Threats Demand Interconnected Solutions,https://newsofthesouth.com/humanity-at-a-crossroads-urgent-threats-demand-interconnected-solutions/,en,newsofthesouth.com,newsofthesouth.com,2025-04-05 20:37:49.048963+00:00
29772bfab107234af69b2a69f94c51049440a1f87227cfa714d91dda8aaab6bc,2024-05-21,Victoria Falls Hosts Pivotal 3rd Africa Education Summit,https://newsofthesouth.com/victoria-falls-hosts-pivotal-3rd-africa-education-summit/,en,newsofthesouth.com,newsofthesouth.com,2025-04-05 00:26:55.595389+00:00
4b3e87534f312d52e6c110b59b312c050c84b43a71919d5edf1d5cb8e7d0c5c5,2024-05-21,UK Nurses Seek “Down Under” Relief as UK Conditions Strain Healthcare Professionals,https://newsofthesouth.com/uk-nurses-seek-down-under-relief-as-uk-conditions-strain-healthcare-professionals/,en,newsofthesouth.com,newsofthesouth.com,2025-04-01 12:25:45.847816+00:00
f2a479879c334137c0a01c6a928fee8883324f646632f5617407ec47538bc8d0,2024-05-21,How Zimbabwe Can Effectively Harvest Rainwater,https://newsofthesouth.com/how-zimbabwe-can-effectively-harvest-rainwater/,en,newsofthesouth.com,newsofthesouth.com,2025-04-01 03:25:03.224067+00:00
a34643f03fdac0abdcc54fa619cfda3da22e6c554ce4d4accb081587301de19f,2024-05-21,Zimbabwe Police Signal Apparent Shift Ahead of March 31 Protests,https://newsofthesouth.com/zimbabwe-police-signal-apparent-shift-ahead-of-march-31-protests/,en,newsofthesouth.com,newsofthesouth.com,2025-03-31 02:22:37.781277+00:00
df6c72064793e49b14684024decc20e200eb2dfa7c4459f8a2658ce2a44bcab4,2024-05-21,A Roadmap for Eradicating Starvation and Malnutrition in Zimbabwe,https://newsofthesouth.com/a-roadmap-for-eradicating-starvation-and-malnutrition-in-zimbabwe/,en,newsofthesouth.com,newsofthesouth.com,2025-03-28 00:17:38.615349+00:00
1eb5605dbd5ab1c5edf5ff86fbfaf380122616702fa07347365ad634a9958df1,2024-05-21,War Veteran’s Allegations Spark Hope and Anticipation in Zimbabwe,https://newsofthesouth.com/war-veterans-allegations-spark-hope-and-anticipation-in-zimbabwe/,en,newsofthesouth.com,newsofthesouth.com,2025-03-26 21:37:33.035018+00:00
6d7ed1308971cc8e3c5e2f3051b533d9db0eebacd5abffc9280929bdb5b2d96a,2024-05-21,Sanyatwe Appointed Zimbabwe`s Sports Minister: Concerted Effort Can Develop Zim Sports,https://newsofthesouth.com/sanyatwe-appointed-zimbabwes-sports-minister-concerted-effort-can-develop-zim-sports/,en,newsofthesouth.com,newsofthesouth.com,2025-03-25 20:55:25.436514+00:00
2b54e86c46c6e8d59bc0dab6996105762cbfc48deff3ee4f2bb03649c5d2eb9e,2024-05-21,AIB Global Assists Cities Develop Climate Resilient Urban Projects In East Africa,https://newsofthesouth.com/aib-global-assists-cities-develop-climate-resilient-urban-projects-in-east-africa/,en,newsofthesouth.com,newsofthesouth.com,2025-03-20 00:25:15.533746+00:00
366efc021e214fa9caec4207df1789a243eb6b683842cea900a326ea0731b5ca,2024-05-21,ICRISAT Welcomes Dr Himanshu Pathak as New Director General,https://newsofthesouth.com/icrisat-welcomes-dr-himanshu-pathak-as-new-director-general/,en,newsofthesouth.com,newsofthesouth.com,2025-03-08 17:24:31.100627+00:00
f5f4f3696056c355a29597228a523d5ea1cf07af84c084061950d20578712139,2024-05-21,Global Gateway: Partnership between EBID and EIB to promote climate action and environmental sustainability projects in the ECOWAS region,https://newsofthesouth.com/global-gateway-partnership-between-ebid-and-eib-to-promote-climate-action-and-environmental-sustainability-projects-in-the-ecowas-region/,en,newsofthesouth.com,newsofthesouth.com,2025-03-04 01:18:42.815343+00:00
46f49f68a1aeeada9840543970f7a0fc7a8bfe5d7134dca99363eab728cd3fd3,2024-05-21,Kenya Upgrades East Africa’s busiest trade and transport route from Kwa Jomvu to Mariakani Under Global Gateway Initiative,https://newsofthesouth.com/kenya-upgrades-east-africas-busiest-trade-and-transport-route-from-kwa-jomvu-to-mariakani-under-global-gateway-initiative/,en,newsofthesouth.com,newsofthesouth.com,2025-02-28 06:17:22.870503+00:00
8647443b98be7475d8e6b66fcdb9ce61819c28cdba03a9b28f64da9172e170d5,2024-05-21,EIB backs Africa Finance Corporation $750 Million Climate Resilient Infrastructure Fund,https://newsofthesouth.com/eib-backs-africa-finance-corporation-750-million-climate-resilient-infrastructure-fund/,en,newsofthesouth.com,newsofthesouth.com,2025-02-28 06:17:09.175441+00:00
224c0f12f4298da1a1526f3332bbd974cb782283fd2cec780a4233467773e6c3,2024-05-21,"Drop in SA Unemployment rate Welcomed, But Sustainable Solutions Must Focus on the Private Sector",https://newsofthesouth.com/drop-in-sa-unemployment-rate-welcomed-but-sustainable-solutions-must-focus-on-the-private-sector/,en,newsofthesouth.com,newsofthesouth.com,2025-02-20 20:29:41.661628+00:00
628090fefac640ae575568ae3137d75fa1eac7dfbea61c6dc380b20c12ba1c32,2024-12-31,Govt initiatives guarantee food security,https://www.zimbabwesituation.com/news/govt-initiatives-guarantee-food-security/,en,zimbabwesituation.com,zimbabwesituation.com,2024-12-31 16:36:43.525466+00:00
35f08170b0f95284e43c8c099be1f1d146fab31502888cd1b4075e81e3f3b9bb,2024-12-31,Mnangagwa praises church for patriotism,https://bulawayo24.com/index-id-news-sc-national-byo-249461.html,en,bulawayo24.com,bulawayo24.com,2024-12-31 16:28:49.375906+00:00
31f990f60fca78902de2c27bdb16a3a210a67bfbc87549b4e7b7d85849344dc3,2024-12-31,Zimbabwe's tourism sector leads GDP growth in 2024,https://bulawayo24.com/index-id-news-sc-national-byo-249465.html,en,bulawayo24.com,bulawayo24.com,2024-12-31 16:28:39.216704+00:00
a61aed360933d400a06a5762609b606aa44b5f0491a44a5deabba9d9e92c0c52,2024-12-31,Zimbabwe warns of armyworm outbreak,https://bulawayo24.com/index-id-news-sc-national-byo-249481.html,en,bulawayo24.com,bulawayo24.com,2024-12-31 16:28:34.101549+00:00
4d4bb83942da2080f40a8f0ea1f813b7a190443db4251381344974694652c947,2024-12-31,Mnangagwa deeply rooted in biblical scripture,https://bulawayo24.com/index-id-news-sc-national-byo-249458.html,en,bulawayo24.com,bulawayo24.com,2024-12-31 16:25:19.079361+00:00
01ed365269c90ee42767cf277accf1446c817e7f72769c9bd39c52e906f239d7,2024-12-31,ZNCC calls for more IPP support,https://www.zimbabwesituation.com/news/zncc-calls-for-more-ipp-support/,en,zimbabwesituation.com,zimbabwesituation.com,2024-12-31 10:30:20.452272+00:00
fc69ce80cfcd6684106b96b969f97425cb8ae0693c0678011889e8eda390eff1,2024-12-29,Mnangagwa donates rice to hungry citizens,https://bulawayo24.com/index-id-news-sc-local-byo-249421.html,en,bulawayo24.com,bulawayo24.com,2024-12-30 14:31:00.441806+00:00
3167f097be64f3bf7e28d3a73a84253d0df8e3dec9d18d46c682292858c0566d,2024-12-30,Tourism sector leads GDP growth in 2024,https://www.zimbabwesituation.com/news/tourism-sector-leads-gdp-growth-in-2024/,en,zimbabwesituation.com,zimbabwesituation.com,2024-12-30 10:17:11.626672+00:00
b48da762242e9f132681777e53e964a33f56478dbb2342b88b3138ea682f774f,2024-12-30,Mnangagwa Seizes Pulpit In Bulawayo…,https://www.zimeye.net/2024/12/30/mnangagwa-seizes-pulpit-in-bulawayo/,en,zimeye.net,zimeye.net,2024-12-30 05:17:28.678346+00:00
9acd01f06a8fe776fe7c2eeb4e42347be25306056d2319d9825301d316346892,2024-12-27,Mnangagwa donates rice to hungry citizens,https://bulawayo24.com/news/local/249421,en,bulawayo24.com,bulawayo24.com,2024-12-29 16:23:30.709612+00:00
1566c158869de3cd8e5ec1e9db44d404269d03977293d6cb89324f4565dee498,2024-12-29,Women leading battle against climate change,https://dailynews.co.zw/women-leading-battle-against-climate-change/,en,dailynews.co.zw,dailynews.co.zw,2024-12-29 10:17:31.867536+00:00
3cd1ccbb8c5d23e37e46b450c6e8998b01176e69a4a82bde807064173e0b81cb,2024-12-29,Tram-train production draws closer,https://www.zimbabwesituation.com/news/tram-train-production-draws-closer/,en,zimbabwesituation.com,zimbabwesituation.com,2024-12-29 07:24:59.253897+00:00
fd98c68fa630b8c2227e5498f838a4a7c9b2c201c36482be62e99eb554ae1629,2024-12-27,Mondlane Exposes Frelimo’s Mnangagwa Style Of Releasing 1500 Prisoners To Falsely Accuse Opposition,https://www.zimeye.net/2024/12/27/mondlane-exposes-frelimos-mnangagwa-style-of-releasing-1500-prisoners-to-falsely-accuse-opposition-full-speech/,en,zimeye.net,zimeye.net,2024-12-27 18:22:11.596101+00:00
31f05bd2e5977c08a7204e01ce3ad3b2ed6753a0f03d26692c676024e9e302f0,2024-12-28,"Guest Opinion: A boost, not a shock: China partnering with fellow developing countries for economic takeoff",https://www.zimbabwestar.com/news/274890332/guest-opinion-a-boost-not-a-shock-china-partnering-with-fellow-developing-countries-for-economic-takeoff,en,zimbabwestar.com,zimbabwestar.com,2024-12-27 17:25:33.293143+00:00
67812f0ca8fcde77cb6f1f3a1d668ce724e3d5543dda8d033df7d0f4bf13bd00,2024-12-28,"Guest Opinion: A boost, not a shock: China partnering with fellow developing countries for economic takeoff",https://www.zimbabwenews.net/news/274890332/guest-opinion-a-boost-not-a-shock-china-partnering-with-fellow-developing-countries-for-economic-takeoff,en,zimbabwenews.net,zimbabwenews.net,2024-12-27 16:23:09.473075+00:00
c1565fde0dad0fe0d42ed1a2884c4812f02841d1bd40215321aef39785a0ac28,2024-12-26,Musician Clive Malunga Defies Zanu PF Threats…,https://www.zimeye.net/2024/12/26/musician-clive-malunga-defies-zanu-pf-threats/,en,zimeye.net,zimeye.net,2024-12-26 11:21:19.688077+00:00
256cb0dbcd34a0206a80919bd4100c0f5cb37c8d9a6e1fb39170efc61e4bf849,2024-12-23,New cooking tools reduce wastage while improving taste,https://bulawayo24.com/index-id-opinion-sc-columnist-byo-249311.html,en,bulawayo24.com,bulawayo24.com,2024-12-25 11:33:04.333976+00:00
f9c7f34f787df17ddb4aab06fc9fb9167a964a9c7f50a2b225193995e3dbf27d,2024-12-23,Zimbabwe govt signs nine irrigation deals,https://bulawayo24.com/index-id-news-sc-national-byo-249322.html,en,bulawayo24.com,bulawayo24.com,2024-12-25 11:31:19.005397+00:00
b0ac94177c426b9d70cd1b8ec9bc32b2772f17e2a7819761fa1939a46c68bdd3,2024-12-23,Chamisa says Unity Day has lost its lustre,https://bulawayo24.com/index-id-news-sc-national-byo-249336.html,en,bulawayo24.com,bulawayo24.com,2024-12-25 11:30:29.017729+00:00
638494aeff7a0f2b44ff52fdabeda7a17efbf8ebc09fed432a2b2713d8dd1a4c,2024-12-23,"CCC, Zanu-PF MPs pass Mthuli Ncube's budget",https://bulawayo24.com/index-id-news-sc-national-byo-249319.html,en,bulawayo24.com,bulawayo24.com,2024-12-25 11:30:24.027881+00:00
922fc4b375ad0fec71d01b57b3ae1426d91e4aed578bb2507d1f3823f54e2116,2024-12-25,Bringing Diagnostics To The People,https://masvingomirror.com/bringing-diagnostics-to-the-people/?utm_source=rss&utm_medium=rss&utm_campaign=bringing-diagnostics-to-the-people,en,masvingomirror.com,masvingomirror.com,2024-12-25 07:23:52.710361+00:00
7814d89ea9c949b34b09885a2813e1af83851940df5e4c89225ea1de71717e5a,2024-12-24,Airforce urged to prepare for new security threats,https://www.zimbabwesituation.com/news/airforce-urged-to-prepare-for-new-security-threats/,en,zimbabwesituation.com,zimbabwesituation.com,2024-12-24 15:24:02.555729+00:00
cc807924cdefdc2557d340bf05c87d7596c5160644a7ffaa70e2e8ab51594f12,2024-12-24,Learn from 2024 exchange rate mistakes: Experts,https://www.zimbabwesituation.com/news/learn-from-2024-exchange-rate-mistakes-experts/,en,zimbabwesituation.com,zimbabwesituation.com,2024-12-24 08:23:12.208661+00:00
00a61aed20260e8236afa2bc9d69658cadffd92e339db8876981dcc4395ea2df,2024-12-24,Zimbabwe kicks-off project to reduce mercury use in artisanal and small-scale gold mining,https://www.thezimbabwean.co/2024/12/zimbabwe-kicks-off-project-to-reduce-mercury-use-in-artisanal-and-small-scale-gold-mining/,en,thezimbabwean.co,thezimbabwean.co,2024-12-24 08:18:37.357635+00:00
a386cce4d0d5725c1b8ea408f75d45fb13263268ad56572284cc469cf29eb7de,2024-12-22,Zimbabwe govt signs nine irrigation deals,https://bulawayo24.com/news/national/249322,en,bulawayo24.com,bulawayo24.com,2024-12-23 16:28:11.701927+00:00
5ff3c315ed7ae0e7f6bf5410499f448f30081f37ac80106c40f073f3ed979148,2024-12-22,Chamisa says Unity Day has lost its lustre,https://bulawayo24.com/news/national/249336,en,bulawayo24.com,bulawayo24.com,2024-12-23 16:27:37.386755+00:00
71433344899d638e0f61b0fd981e4b8388fb9051cc1e90f54f451c79117f8f6d,2024-12-22,"CCC, Zanu-PF MPs pass Mthuli Ncube's budget",https://bulawayo24.com/news/national/249319,en,bulawayo24.com,bulawayo24.com,2024-12-23 16:27:07.745918+00:00
5b21b48786a2ee7483c6001d8a1b6e452b16d747098bcde55bbc8d1cd8106589,2024-12-22,New cooking tools reduce wastage while improving taste,https://bulawayo24.com/opinion/columnist/249311,en,bulawayo24.com,bulawayo24.com,2024-12-23 16:26:57.572254+00:00
130f03ca5e31668a36509d23533536a35b5e7c4abff6c84a9deb5afa2a7df6b7,2024-12-23,"Cyclone Chido Ravages Mozambique, Leaves 94 Dead",https://iharare.com/cyclone-chido-ravages-mozambique-leaves-94-dead/,en,iharare.com,iharare.com,2024-12-23 11:21:37.058384+00:00
abab69a840e3cf4023a78be106e2faa16b3500b10a5371805c5cd587eea60464,2024-12-23,"Cyclone Chido kills 94 people, leaves 622,000 people affected",https://www.myzimbabwe.co.zw/news/178110-cyclone-chido-kills-94-people-leaves-622000-people-affected.html?utm_source=rss&utm_medium=rss&utm_campaign=cyclone-chido-kills-94-people-leaves-622000-people-affected,en,myzimbabwe.co.zw,myzimbabwe.co.zw,2024-12-23 10:29:53.762585+00:00
7da2e112af634a4011d71b16306166d4d9df6faed0aac7cec43cdf73ff297201,2024-12-23,Zimbabwe kicks-off project to reduce mercury use in artisanal and small-scale gold mining,https://www.newzimbabwe.com/zimbabwe-kicks-off-project-to-reduce-mercury-use-in-artisanal-and-small-scale-gold-mining/,en,newzimbabwe.com,newzimbabwe.com,2024-12-23 03:20:39.131845+00:00
00e793c2e4be79ae693ddc835ef0598d0ea2d262d8b5d2430fc865468fc2076b,2024-12-22,Nedbank holds tree planting day in Zvishavane,https://masvingomirror.com/nedbank-holds-tree-planting-day-in-zvishavane/?utm_source=rss&utm_medium=rss&utm_campaign=nedbank-holds-tree-planting-day-in-zvishavane,en,masvingomirror.com,masvingomirror.com,2024-12-22 17:54:16.040460+00:00
6759eb29316cc0eed5ed4ea4167bec33b75b31f5140838a72a513fd7fbbc4cca,2024-12-22,Fundhouse launches Gutu scholarship program,https://masvingomirror.com/fundhouse-launches-gutu-scholarship-program/?utm_source=rss&utm_medium=rss&utm_campaign=fundhouse-launches-gutu-scholarship-program,en,masvingomirror.com,masvingomirror.com,2024-12-22 17:53:49.496667+00:00
ebf496ccd720eac9d5b507ced5b042116182fd9276963bdfa8885ae9f74a0116,2024-12-22,"We’re diverse, but one: President",https://www.zimbabwesituation.com/news/were-diverse-but-one-president/,en,zimbabwesituation.com,zimbabwesituation.com,2024-12-22 12:28:40.970823+00:00
21de8e7c2bd2b0a796f21c290a1e2978506061692979b0acc3213f64d97ae412,2024-12-22,Zimbabwe Red Cross ushers in new board,https://www.zimbabwesituation.com/news/zimbabwe-red-cross-ushers-in-new-board/,en,zimbabwesituation.com,zimbabwesituation.com,2024-12-22 12:28:08.930267+00:00
e1830d148ed3049ee14b801cde11dd3aa17b1a3a8aa77ed446d44f82b6f9ce27,2024-12-22,Moving from Elections to Development in Zimbabwe,https://www.newzimbabwe.com/moving-from-elections-to-development-in-zimbabwe/,en,newzimbabwe.com,newzimbabwe.com,2024-12-22 05:27:32.014870+00:00
9779d40b3003d7ad8f2c45c7608b4de2420def0f838c83be2b5ba03dda9c4a5c,2024-12-20,Mnangagwa calls for unity in ZANU-PF,https://bulawayo24.com/index-id-news-sc-national-byo-249228.html,en,bulawayo24.com,bulawayo24.com,2024-12-21 18:23:14.137170+00:00
