url,date_published,title,newsorg
https://nation.africa/kenya/blogs-opinion/cutting-edge/stimulus-package-should-be-better-spent-3598404,2021-10-27,Stimulus package should be better spent,nation.africa
https://www.businessdailyafrica.com/bd/economy/kenya-receives-sh17bn-climate-change-fight-3598348,2021-10-27,Kenya receives Sh17bn loan from World Bank for climate change fight,businessdailyafrica.com
https://nation.africa/kenya/news/help-communities-respond-to-disasters-on-time-3598078,2021-10-27,"Collaboration key in dealing with disasters, stakeholders say",nation.africa
https://www.theeastafrican.co.ke/tea/news/east-africa/south-sudan-youth-look-at-a-future-driven-by-tech-3597702,2021-10-27,"Beyond the war in South Sudan, youth look at a future driven by technology",theeastafrican.co.ke
https://nation.africa/kenya/gender/feminists-no-progress-in-global-warming-without-women-s-input-3597634,2021-10-27,Feminists: No progress in global warming without women’s input,nation.africa
https://www.the-star.co.ke/news/2021-10-27-uhuru-kenya-to-become-continental-leader-in-sustainable-development/,2021-10-27,Uhuru: Kenya to become continental leader in sustainable development,the-star.co.ke
https://www.businessdailyafrica.com/bd/corporate/technology/technology-transforming-medical-education-3597686,2021-10-27,How technology is transforming medical education,businessdailyafrica.com
https://www.theeastafrican.co.ke/tea/news/east-africa/new-48-fellows-to-join-global-ford-programme-3597612,2021-10-27,New 48 fellows to join global Ford programme,theeastafrican.co.ke
https://www.capitalfm.co.ke/news/2021/10/kenya-aims-at-being-continental-leader-in-sustainable-development-president-kenyatta-says/,2021-10-27,"Kenya aims at being continental leader in sustainable development, President Kenyatta says",capitalfm.co.ke
https://www.capitalfm.co.ke/news/2021/10/climate-change-actions-towards-net-zero-climate-transition/,2021-10-27,Climate Change Actions towards Net Zero Climate transition,capitalfm.co.ke
https://www.capitalfm.co.ke/news/2021/10/kenya-receives-sh16bn-funding-from-world-bank-for-climate-change-action/,2021-10-27,Kenya receives Sh16bn funding from World Bank for climate change action,capitalfm.co.ke
https://www.kbc.co.ke/uhuru-kenya-aims-at-being-continental-leader-in-sustainable-development/,2021-10-27,Uhuru: Kenya aims at being continental leader in sustainable development,kbc.co.ke
https://nation.africa/kenya/gender/hunger-forces-afghans-to-sell-young-daughters-into-marriage-3597352,2021-10-27,Hunger forces Afghans to sell young daughters into marriage,nation.africa
https://www.the-star.co.ke/news/world/2021-10-27-queen-elizabeth-pulls-out-of-cop26-following-advice-to-rest/,2021-10-27,Queen Elizabeth pulls out of COP26 following advice to rest,the-star.co.ke
https://nation.africa/kenya/sports/talkup/great-wrc-season-masks-covic-19-spanner-in-the-works-3597144,2021-10-26,Great WRC season masks Covic-19 spanner in the works,nation.africa
https://www.the-star.co.ke/counties/rift-valley/2021-10-27-turkanas-oil-gas-well-pads-pose-environmental-dangers-to-locals/,2021-10-27,"Turkana's Oil, Gas well pads pose environmental dangers to locals",the-star.co.ke
https://www.the-star.co.ke/news/2021-10-27-world-bank-gives-kenya-sh16b-to-support-climate-change-action/,2021-10-27,World Bank gives Kenya Sh16b to support climate change action,the-star.co.ke
http://www.kenyastar.com/news/271599821/cop26-climate-summit-what-at-stake-for-planet-earth,2021-10-29,COP26 Climate Summit: What&#039;s at Stake for Planet Earth,kenyastar.com
https://nation.africa/kenya/blogs-opinion/blogs/take-action-towards-net-zero-climate-transition-3600024,2021-10-28,Take action towards ‘net zero’ climate transition,nation.africa
https://nation.africa/kenya/blogs-opinion/editorials/redouble-efforts-to-avert-deaths-from-starvation-3600020,2021-10-28,Redouble efforts to avert deaths from starvation,nation.africa
https://www.businessdailyafrica.com/bd/opinion-analysis/letters/listen-developing-countries-climate-talks-3599924,2021-10-28,Listen to developing countries at climate talks,businessdailyafrica.com
https://www.businessdailyafrica.com/bd/lifestyle/food-drinks/french-feast-kenyan-twist-3599582,2021-10-28,French feast with a Kenyan twist,businessdailyafrica.com
https://www.the-star.co.ke/opinion/star-blogs/2021-10-28-adagi-paul-climate-change-remains-a-threat/,2021-10-28,ADAGI PAUL: Climate change remains a threat,the-star.co.ke
https://www.the-star.co.ke/opinion/2021-10-28-a-shift-to-electric-mobility-cop26/,2021-10-28,A shift to Electric Mobility: COP26,the-star.co.ke
https://nation.africa/kenya/news/africa/climate-change-compounds-africa-s-enduring-refugee-problem-3599154,2021-10-28,Climate change compounds Africa’s enduring refugee problem,nation.africa
https://www.theeastafrican.co.ke/tea/business/british-banks-exit-africa-over-risky-investments-3598880,2021-10-28,British banks exit Africa as unstable currencies and ‘risks’ raise costs of operations,theeastafrican.co.ke
https://www.theeastafrican.co.ke/tea/news/east-africa/kenya-uhuru-kenyatta-to-lead-climate-talks-at-un-conference-3599514,2021-10-28,Kenya's Uhuru Kenyatta to convene climate talks at UN conference,theeastafrican.co.ke
https://www.capitalfm.co.ke/news/2021/10/biden-announces-1-75-trillion-us-spending-deal-ahead-of-europe-trip/,2021-10-28,Biden announces $1.75 trillion US spending deal ahead of Europe trip,capitalfm.co.ke
https://www.businessdailyafrica.com/bd/news/world/uhuru-lead-climate-talks-un-conference-3599246,2021-10-28,Uhuru to lead climate talks at UN conference,businessdailyafrica.com
https://www.kenyans.co.ke/news/69883-outrage-world-bank-gives-another-loan-kenya,2021-10-27,Outrage as World Bank Gives Kenya Another Loan,kenyans.co.ke
https://www.capitalfm.co.ke/news/2021/10/five-climate-change-myths/,2021-10-28,Five climate change myths,capitalfm.co.ke
https://nation.africa/kenya/news/climate-change-to-induce-migration-of-86m-africans-world-bank-warns-3598788,2021-10-28,"Climate change to induce migration of 86m Africans, World Bank warns",nation.africa
https://www.theeastafrican.co.ke/tea/science-health/climate-change-will-displace-impoverish-even-more-africans-3598814,2021-10-28,"Climate change will displace, impoverish even more Africans",theeastafrican.co.ke
https://www.theeastafrican.co.ke/tea/science-health/karamoja-turns-to-new-sorghum-variety-to-fight-food-insecurity-3598824,2021-10-28,Karamoja turns to new sorghum variety to fight food insecurity,theeastafrican.co.ke
https://nation.africa/kenya/counties/baringo/new-study-says-rising-lake-levels-cost-country-sh4bn-3598630,2021-10-27,New study says rising lake levels cost country Sh4bn,nation.africa
https://nation.africa/kenya/counties/kenya-lost-sh4bn-to-damage-caused-by-rift-valley-waters-3598708,2021-10-28,Kenya lost Sh4bn to damage caused by Rift Valley waters,nation.africa
https://www.standardmedia.co.ke/world/article/2001427493/more-victims-complain-of-sexual-abuse-in-congo-scandal-who-expert,2021-10-28,More victims complain of sexual abuse in Congo scandal,standardmedia.co.ke
https://www.standardmedia.co.ke/world/article/2001427491/world-bank-halts-sudan-operations-in-blow-to-coup-leaders-strike-calls-gain-support,2021-10-28,"World Bank halts Sudan operations in blow to coup leaders, strike calls gain support",standardmedia.co.ke
https://www.standardmedia.co.ke/world/article/2001427492/biden-likely-to-head-to-cop26-without-a-final-u-s-climate-deal,2021-10-28,Biden likely to head to COP26 without a final U.S. climate deal,standardmedia.co.ke
https://nairobiwire.com/2021/10/uhuru-kenya-to-be-a-continental-leader-in-sustainable-development.html,2021-10-28,Uhuru – Kenya to be a Continental Leader In Sustainable Development,nairobiwire.com
https://nation.africa/kenya/news/menengai-residents-to-benefit-from-direct-use-of-geothermal-energy-3601332,2021-10-29,Menengai residents to benefit from direct use of geothermal energy,nation.africa
https://www.kbc.co.ke/queen-advised-rest-two-more-weeks/,2021-10-29,Queen advised to rest for two more weeks,kbc.co.ke
http://www.kenyastar.com/news/271609049/kenyan-youth-participate-in-culture-preservation,2021-10-30,Kenyan youth participate in culture preservation,kenyastar.com
https://www.standardmedia.co.ke/world/article/2001427666/queen-elizabeth-told-to-rest-for-at-least-two-more-weeks,2021-10-29,Queen Elizabeth told to rest for at least two more weeks,standardmedia.co.ke
https://www.kbc.co.ke/biden-we-were-clumsy-over-france-submarine-row/,2021-10-29,Biden: We were clumsy over France submarine row,kbc.co.ke
https://www.businessdailyafrica.com/bd/sponsored/tana-river-county-goes-for-innovative-village-concept-to-beat-climate-disasters-3600976,2021-10-29,Tana River County goes for innovative village concept to beat climate disasters,businessdailyafrica.com
https://www.kdrtv.co.ke/world/president-joe-biden-meets-pope-francis-at-vatican/,2021-10-29,President Joe Biden Meets Pope Francis At Vatican,kdrtv.co.ke
https://www.the-star.co.ke/news/world/2021-10-29-pope-pacific-islands-urge-action-as-rich-nations-ring-climate-alarm/,2021-10-29,"Pope, Pacific Islands urge action as rich nations ring climate alarm",the-star.co.ke
https://www.the-star.co.ke/counties/north-eastern/2021-10-29-drought-hit-herders-embrace-farming-as-coping-strategy/,2021-10-29,Drought-hit herders embrace farming as coping strategy,the-star.co.ke
https://nation.africa/kenya/brand-book/stories-of-transformation-in-mombasa-county-3600554,2021-10-29,Stories of Transformation: Highlights of how county government is improving the quality of life in Mombasa,nation.africa
https://www.capitalfm.co.ke/news/2021/10/promises-power-plants-and-politics-chinas-position-ahead-of-cop26/,2021-10-29,"Promises, power plants and politics: China's position ahead of COP26 » Capital News",capitalfm.co.ke
https://www.kbc.co.ke/pope-calls-for-radical-action-on-climate-change/,2021-10-29,Pope calls for radical action on climate change,kbc.co.ke
https://www.capitalfm.co.ke/news/2021/10/biden-to-meet-ally-pope-francis-ahead-of-g20-summit/,2021-10-29,Biden to meet ally Pope Francis ahead of G20 summit,capitalfm.co.ke
https://www.kbc.co.ke/president-kenyatta-calls-for-renewal-of-africas-security-architecture/,2021-10-29,President Kenyatta calls for renewal of Africa’s security architecture,kbc.co.ke
https://nation.africa/kenya/blogs-opinion/opinion/africa-could-be-uninhabitable-failing-action-on-climate-change-3602116,2021-10-30,Africa could be uninhabitable failing action on climate change,nation.africa
https://www.theeastafrican.co.ke/tea/oped/comment/bold-climate-action-is-the-only-choice-for-a-greener-africa-3601854,2021-10-30,Bold climate action is the only choice for a greener Africa,theeastafrican.co.ke
https://www.theeastafrican.co.ke/tea/science-health/inconsistent-pledges-pull-back-climate-change-effort-3601954,2021-10-30,Inconsistent pledges pull back climate change effort,theeastafrican.co.ke
https://www.theeastafrican.co.ke/tea/science-health/kenya-readies-for-171m-to-manage-climate-risk-3601972,2021-10-30,Kenya readies for $171m to manage climate risk,theeastafrican.co.ke
https://www.kbc.co.ke/cop26-kenya-to-push-for-fulfillment-of-paris-climate-agreement/,2021-10-30,COP26: Kenya to push for fulfillment of Paris Climate Agreement,kbc.co.ke
https://www.kbc.co.ke/kenya-to-advocate-for-implementation-of-paris-climate-agreement/,2021-10-30,Kenya to advocate for implementation of Paris Climate Agreement,kbc.co.ke
https://nation.africa/kenya/blogs-opinion/blogs/dubai-expo-charts-a-path-to-cop26-3602196,2021-10-30,Dubai Expo charts a path to COP26,nation.africa
https://www.the-star.co.ke/news/2021-10-30-kenya-to-push-for-fulfilment-of-paris-climate-agreement-during-cop26-in-glasgow/,2021-10-30,Kenya to push for fulfilment of Paris Climate Agreement during COP26 in Glasgow,the-star.co.ke
https://nation.africa/kenya/news/africa/al-shabaab-profiting-from-climate-change-un-panel-of-experts-on-somalia-says-3601668,2021-10-30,"Al -Shabaab profiting from climate change, UN Panel of Experts on Somalia says",nation.africa
https://kenyan-post.com/2021/10/uhuru-finally-breaks-silence-on-waigurus-defection-to-rutos-uda-amid-the-looming-arrest-of-the-kirinyaga-governor/,2021-10-30,UHURU finally breaks silence on WAIGURU’s defection to RUTO’s UDA amid the looming arrest of the Kirinyaga Governor,kenyan-post.com
https://www.capitalfm.co.ke/news/2021/10/pm-modi-invites-pope-francis-to-india/,2021-10-30,PM Modi invites Pope Francis to India,capitalfm.co.ke
https://www.capitalfm.co.ke/news/2021/10/g20-key-for-momentum-at-glasgow-climate-meet/,2021-10-30,G20 key for momentum at Glasgow climate meet,capitalfm.co.ke
https://www.the-star.co.ke/news/star-farmer/2021-10-30-lets-care-for-our-animals-and-environment/,2021-10-30,Let’s care for our animals and environment,the-star.co.ke
https://nation.africa/kenya/life-and-style/weekend/a-ban-on-natives-eating-nile-perch-and-the-crucial-indaba-in-glasgow-3601088,2021-10-29,"A ban on natives eating Nile perch, and the crucial ‘indaba’ in Glasgow",nation.africa
https://nation.africa/kenya/blogs-opinion/blogs/it-is-time-the-world-walked-the-talk-on-climate-change-3603040,2021-10-31,It is time the world walked the talk on climate change,nation.africa
https://nation.africa/kenya/brand-book/tana-river-eco-village-project-3603054,2021-10-31,Tana River goes for innovative village concept to beat climate disasters,nation.africa
https://nation.africa/kenya/news/the-world-must-do-more-to-stand-chance-of-limiting-global-warming-to-1-5-c-3603156,2021-10-31,The world must do more to stand chance of limiting global warming to 1.5°C,nation.africa
https://www.capitalfm.co.ke/news/2021/10/g20-under-pressure-to-deliver-on-climate-ahead-of-un-talks/,2021-10-31,G20 agrees on 1.5 degree target ahead of UN climate talks,capitalfm.co.ke
https://www.capitalfm.co.ke/news/2021/10/kenyatta-to-lead-talks-on-africas-crucial-role-in-tackling-climate-crisis-at-cop26/,2021-10-31,Kenyatta to lead talks on Africa's crucial role in tackling climate crisis at COP26 » Capital News,capitalfm.co.ke
https://www.the-star.co.ke/news/2021-10-31-uhuru-to-attend-un-climate-talks-in-glasgow/,2021-10-31,Uhuru to attend UN Climate talks in Glasgow,the-star.co.ke
https://www.kbc.co.ke/president-kenyatta-to-attend-the-un-climate-talks-hosted-by-the-uk/,2021-10-31,President Kenyatta to attend the UN Climate talks hosted by the UK,kbc.co.ke
https://www.kbc.co.ke/cop26-moment-of-truth-as-world-meets-for-climate-summit/,2021-10-31,COP26: 'Moment of truth' as world meets for climate summit,kbc.co.ke
https://www.theeastafrican.co.ke/tea/oped/comment/climate-will-change-us-at-her-own-terms-if-we-don-t-change-3602082,2021-10-30,Climate will change us at her own terms if we don’t change,theeastafrican.co.ke
https://nation.africa/kenya/blogs-opinion/blogs/the-time-to-act-to-save-the-planet-is-now-3602472,2021-10-31,The time to act to save the planet is now,nation.africa
https://nation.africa/kenya/news/africa/climate-change-pressure-fueling-conflict-in-horn-of-africa-3602504,2021-10-31,Climate change pressure fueling conflict in horn of Africa,nation.africa
https://www.theeastafrican.co.ke/tea/oped/comment/does-ea-really-need-the-crude-oil-pipeline-project-3602066,2021-10-30,"Does EA really need the crude oil pipeline project? No, stop it.",theeastafrican.co.ke
https://www.standardmedia.co.ke/world/article/2001427713/g20-leaders-meet-after-two-years-with-climate-covid-and-economy-in-focus,2021-10-30,"G20 leaders meet after two years, with climate, COVID and economy in focus",standardmedia.co.ke
https://www.kbc.co.ke/kenya-to-be-africas-voice-on-climate-change-at-unsc-uhuru-says/,2021-11-01,"Kenya to be Africa's voice on climate change at UNSC, Uhuru says",kbc.co.ke
https://www.the-star.co.ke/news/2021-11-01-kenyas-wathuti-makes-emotional-call-for-climate-change-action/,2021-11-01,Kenya's Wathuti makes emotional call for climate change action,the-star.co.ke
https://www.standardmedia.co.ke/world/article/2001427928/21-storey-building-collapses-in-nigeria-at-least-100-people-trapped,2021-11-01,"21-storey building collapses in Nigeria, at least 100 people trapped",standardmedia.co.ke
https://www.the-star.co.ke/news/2021-11-01-uhuru-tables-africas-concerns-on-climate-change-action-at-cop26/,2021-11-01,Uhuru tables Africa's concerns on climate change action at COP26,the-star.co.ke
https://www.standardmedia.co.ke/article/2001427910/board-formed-to-pave-way-for-use-of-medical-funds-collected-by-hospitals,2021-11-01,Board formed to pave way for use of medical funds collected by hospitals,standardmedia.co.ke
https://www.standardmedia.co.ke/politics/article/2001427914/isiolo-governor-mohamed-kuti-endorsed-by-elders-for-a-second-term,2021-11-01,Isiolo Governor Mohamed Kuti endorsed by elders for a second term,standardmedia.co.ke
https://nation.africa/kenya/news/communities-restoring-the-ecosystem-3603798,2021-11-01,Communities restoring the ecosystem,nation.africa
https://www.the-star.co.ke/news/2021-11-01-act-children-will-not-eat-words-kenyas-wathuti-tells-cop26/,2021-11-01,"Act, children will not eat words, Kenya's Wathuti tells COP26",the-star.co.ke
https://www.capitalfm.co.ke/news/2021/11/queen-elizabeth-ii-seen-driving-easing-health-fears/,2021-11-01,"Queen Elizabeth II seen driving, easing health fears",capitalfm.co.ke
https://www.standardmedia.co.ke/world/article/2001427887/one-minute-to-midnight-says-johnson-as-climate-conference-opens,2021-11-01,"""One minute to midnight"" says Johnson as climate conference opens",standardmedia.co.ke
https://www.the-star.co.ke/news/2021-11-01-we-cant-treat-nature-like-a-toilet-guterres-tells-cop26/,2021-11-01,We can't treat nature like a toilet,the-star.co.ke
https://www.the-star.co.ke/news/2021-11-01-africas-first-climate-adaptation-credit-facility-launched-in-kenya/,2021-11-01,Africa's first climate adaptation credit facility launched in Kenya,the-star.co.ke
https://www.the-star.co.ke/news/2021-11-01-photos-uhuru-in-glasgow-for-cop26-climate-meet/,2021-11-01,(PHOTOS) Uhuru in Glasgow for COP26 climate meet,the-star.co.ke
https://www.standardmedia.co.ke/ktnnews/video/2000222064/bottomline-africa-battling-climate-change,2021-11-01,Bottomline Africa: Battling climate change,standardmedia.co.ke
https://www.standardmedia.co.ke/ktnnews/video/2000222063/bottomline-africa-uganda-s-ebikes,2021-11-01,Bottomline Africa: Uganda's ebikes,standardmedia.co.ke
https://www.businessdailyafrica.com/bd/opinion-analysis/columnists/kenya-moves-locally-climate-action-3603574,2021-11-01,Kenya moves to locally led climate action,businessdailyafrica.com
https://www.businessdailyafrica.com/bd/lifestyle/society/losing-somalia-boundary-blue-economy-3603764,2021-11-01,What losing Somalia boundary row means for our blue economy,businessdailyafrica.com
https://www.businessdailyafrica.com/bd/markets/market-news/climate-smart-farm-pay-dividends-kenya-planet-3603468,2021-11-01,Climate-smart farm investments will pay dividends for Kenya and Planet,businessdailyafrica.com
https://www.kbc.co.ke/climate-change-rising-waters-in-rift-valley-lakes/,2021-11-01,Climate Change: Rising waters in Rift Valley lakes,kbc.co.ke
https://www.capitalfm.co.ke/news/2021/11/kenya-to-push-for-fulfilment-of-paris-climate-agreement-during-cop26-in-glasgow/,2021-11-01,Kenya to push for fulfilment of Paris Climate Agreement during COP26 in Glasgow,capitalfm.co.ke
https://www.capitalfm.co.ke/news/2021/11/world-leaders-in-glasgow-for-last-best-hope-climate-summit/,2021-11-01,"World leaders in Glasgow for 'last, best hope' climate summit » Capital News",capitalfm.co.ke
https://www.the-star.co.ke/news/2021-11-01-cop26-agenda-kenya-to-push-greater-climate-action-for-africa/,2021-11-01,COP26 Agenda: Kenya to push greater climate action for Africa,the-star.co.ke
https://nation.africa/kenya/news/why-africa-must-be-at-heart-of-climate-talks-in-glasgow--3603122,2021-10-31,Why Africa must be at heart of climate talks in Glasgow,nation.africa
https://www.standardmedia.co.ke/article/2001427816/too-much-focus-on-hustlers-ignores-our-ailing-corporates,2021-11-01,Too much focus on ‘hustlers’ ignores our ailing corporates,standardmedia.co.ke
https://www.kbc.co.ke/conservancies-benefit-by-involving-local-communities-and-women-in-conservation-efforts/,2021-10-31,Conservancies benefit by involving local communities and women in conservation efforts,kbc.co.ke
https://www.kbc.co.ke/g20-pledge-climate-action-but-make-few-commitments/,2021-11-01,G20 pledge climate action but make few commitments,kbc.co.ke
https://www.the-star.co.ke/news/2021-11-01-uhuru-joins-world-leaders-in-glasgow-for-climate-summit/,2021-11-01,Uhuru joins world leaders in Glasgow for climate summit,the-star.co.ke
https://www.businessdailyafrica.com/bd/economy/cbk-climate-risk-management-rules-kenya-s-banking-3605736,2021-11-02,Why CBK’s climate risk management rules will pay off for Kenya’s banking,businessdailyafrica.com
https://www.businessdailyafrica.com/bd/opinion-analysis/editorials/make-cooking-gas-affordable-3605618,2021-11-02,Make cooking gas affordable,businessdailyafrica.com
https://www.businessdailyafrica.com/bd/opinion-analysis/columnists/cop26-communication-role-play-3605552,2021-11-02,COP26 and why communication has role to play,businessdailyafrica.com
https://www.businessdailyafrica.com/bd/opinion-analysis/ideas-debate/balance-climate-talks-commitments-3605574,2021-11-02,Balance climate talks with commitments,businessdailyafrica.com
https://www.businessdailyafrica.com/bd/opinion-analysis/letters/plan-seasonal-climatic-swings-3605544,2021-11-02,Let us plan for seasonal climatic swings,businessdailyafrica.com
https://www.businessdailyafrica.com/bd/data-hub/state-agency-eyes-geothermal-heat-farming-manufacturing-3605486,2021-11-02,"State agency eyes geothermal heat to fire up farming, manufacturing",businessdailyafrica.com
https://www.the-star.co.ke/opinion/leader/2021-11-03-arrest-trucks-with-timber-and-charcoal/,2021-11-03,Arrest trucks with timber and charcoal,the-star.co.ke
https://www.the-star.co.ke/business/kenya/2021-11-03-kengen-boss-showcases-kenyas-quest-for-clean-energy-at-cop26/,2021-11-03,Kengen boss showcases Kenya's quest for clean energy at COP26,the-star.co.ke
https://www.the-star.co.ke/business/kenya/2021-11-03-cs-juma-tips-cop26-on-kenyas-low-cabon-cooking-solutions/,2021-11-03,CS Juma tips COP26 on Kenya's low carbon cooking solutions,the-star.co.ke
https://nation.africa/kenya/news/kenya-to-fully-transition-to-clean-energy-by-2030-says-uhuru-3605896,2021-11-02,"Kenya to fully transition to clean energy by 2030, says Uhuru",nation.africa
https://www.the-star.co.ke/news/2021-11-02-kenyan-youths-to-present-climate-change-reports-at-cop26/,2021-11-02,Kenyan youths to present climate change reports at COP26,the-star.co.ke
https://www.the-star.co.ke/in-pictures/2021-11-02-photos-uhuru-meets-world-leaders-at-cop26/,2021-11-02,(PHOTOS) Uhuru meets world leaders at COP26,the-star.co.ke
https://www.theeastafrican.co.ke/tea/oped/comment/reset-leaders-minds-to-solve-uganda-s-transport-challenges-3605448,2021-11-02,Unlocking Uganda’s traffic gridlock starts with resetting leaders’ minds,theeastafrican.co.ke
https://www.kbc.co.ke/kenya-to-fully-transition-to-clean-energy-by-2030-president-kenyatta-says/,2021-11-02,"Kenya to fully transition to clean energy by 2030, President Kenyatta says",kbc.co.ke
https://www.theeastafrican.co.ke/tea/oped/comment/financing-small-businesses-way-to-africa-s-climate-resilience-3605392,2021-11-02,Financing small businesses the way to Africa’s climate resilience,theeastafrican.co.ke
https://www.standardmedia.co.ke/article/2001428004/lsk-threatens-to-go-after-top-security-officials-over-missing-lawyer,2021-11-02,LSK threatens to go for top security officials over missing lawyer,standardmedia.co.ke
https://www.the-star.co.ke/news/2021-11-02-cop26-kenya-signs-world-pledge-to-end-deforestation-by-2030/,2021-11-02,COP26: Kenya signs world pledge to end deforestation by 2030,the-star.co.ke
https://www.standardmedia.co.ke/article/2001428000/sh240-factory-gives-hope-for-cashew-nut-farmers-at-coast,2021-11-02,Sh240 factory gives hope for cashew nut farmers at Coast,standardmedia.co.ke
https://www.standardmedia.co.ke/ktnnews/video/2000222123/cop26-summit-talks-global-leaders-share-key-messages-on-climate-change-posing-serious-risks,2021-11-02,COP26 summit talks: Global leaders share key messages on climate change posing serious risks,standardmedia.co.ke
https://www.the-star.co.ke/news/2021-11-02-uhuru-briefed-on-progress-of-kenya-uk-health-alliance/,2021-11-02,Uhuru briefed on progress of Kenya-UK health alliance,the-star.co.ke
https://www.kbc.co.ke/president-kenyatta-briefed-on-progress-of-kenya-uk-health-alliance/,2021-11-02,President Kenyatta briefed on progress of Kenya-UK health alliance,kbc.co.ke
https://www.standardmedia.co.ke/article/2001427979/iebc-says-it-won-t-extend-voter-registration,2021-11-02,IEBC says it won’t extend voter registration exercise,standardmedia.co.ke
https://www.the-star.co.ke/news/2021-11-02-eliud-kipchoge-asks-rich-countries-to-work-with-africa-on-climate-change/,2021-11-02,Eliud Kipchoge asks rich countries to work with Africa on climate change,the-star.co.ke
https://www.capitalfm.co.ke/news/2021/11/laughing-or-crying-biden-wears-heart-on-sleeve/,2021-11-02,"Laughing or crying, Biden wears heart on sleeve",capitalfm.co.ke
https://www.standardmedia.co.ke/article/2001427972/over-100-global-leaders-pledge-to-end-deforestation-by-2030,2021-11-02,Over 100 global leaders pledge to end deforestation by 2030,standardmedia.co.ke
