url,date_published,title,newsorg
https://www.journaldumali.com/2021/10/21/le-burkina-faso-construit-sa-plus-grande-centrale-solaire/,2021-10-21,Le Burkina Faso construit sa plus grande centrale solaire,journaldumali.com
https://www.maliweb.net/non-classe/this-licence-shall-terminate-automatically-on-termination-of-this-agreement-2927726.html,2021-05-05,This licence shall terminate automatically on termination of this Agreement.,maliweb.net
https://www.maliweb.net/non-classe/when-is-it-appropriate-to-enter-into-a-voluntary-closing-agreement-2927724.html,2021-05-05,When is it appropriate to enter into a voluntary closing agreement?,maliweb.net
https://lecourrier.ch/2021/07/15/agir-sur-la-regulation-economique/,2021-07-15,Agir sur la régulation économique,lecourrier.ch
https://maliactu.net/mali-hommage-a-adam-thiam/,2021-03-25,Hommage à Adam Thiam,maliactu.net
https://www.maliweb.net/contributions/hommage-a-adam-thiam-2922344.html,2021-03-25,Hommage à Adam Thiam,maliweb.net
https://www.maliweb.net/environnement/protection-de-lenvironnement-trois-mois-pour-assainir-le-fleuve-niger-2913627.html,2021-01-25,maliweb.net - Protection de l’environnement,maliweb.net
https://www.journaldumali.com/2021/01/26/maroc-lancement-dun-programme-dincubation-pour-soutenir-des-startups-vertes/,2021-01-26,Maroc : lancement d'un programme d'incubation pour soutenir des startups vertes,journaldumali.com
