url,date_published,title,newsorg
https://pmnewsnigeria.com/2021/10/14/lets-repair-planet-earth-prince-william-slams-bezos-others-the-in-space-race/,2021-10-14,"Let's repair planet earth: Prince William slams Bezos, others the in space race",pmnewsnigeria.com
https://von.gov.ng/2021/10/14/climate-change-bill-senate-gives-nod-to-legislation/,2021-10-14,Climate Change Bill: Senate gives nod to legislation,von.gov.ng
https://von.gov.ng/2021/10/14/national-food-reserve-to-increase-to-219900mt-in-2022-%e2%80%95-minister/,2021-10-14,"National Food Reserve To Increase To 219,900MT In 2022 ― Minister",von.gov.ng
https://ionigeria.com/prince-william-slams-jeff-bezos-and-elon-musk-over-space-tourism-saying-fix-the-planet-first/?utm_source=rss&utm_medium=rss&utm_campaign=prince-william-slams-jeff-bezos-and-elon-musk-over-space-tourism-saying-fix-the-planet-first,2021-10-14,Prince William slams Jeff Bezos and Elon Musk over ‘space tourism’ saying ‘fix the planet first’,ionigeria.com
https://www.newtelegraphng.com/prince-william-great-minds-should-focus-on-saving-earth-not-space-travel/,2021-10-14,Prince William: Great minds should focus on saving Earth not space travel,newtelegraphng.com
https://independent.ng/senate-confirms-nwoha-as-south-east-commissioner-in-nasc/,2021-10-14,Senate Confirms Nwoha As South East Commissioner In NASC,independent.ng
https://www.sunnewsonline.com/pia-beyond-fanfare-and-reservations/,2021-10-14,PIA: Beyond Fanfare And Reservations,sunnewsonline.com
https://guardian.ng/news/world/biden-to-meet-with-kenyatta-first-african-leader-to-visit/,2021-10-14,"Biden to meet with Kenyatta, first African leader to visit",guardian.ng
https://www.sunnewsonline.com/breakfast-under-the-lemon-tree-with-my-son/,2021-10-14,Breakfast under the lemon tree with my son,sunnewsonline.com
https://independent.ng/nigeria-earmarks-n350trn-for-capital-projects-from-2021-2025/,2021-10-14,Nigeria Earmarks N350trn For Capital Projects From 2021-2025,independent.ng
https://guardian.ng/opinion/good-news-from-ouagadougou/,2021-10-14,Good news from Ouagadougou,guardian.ng
http://www.thetidenewsonline.com/2021/10/15/rivers-monarch-denies-ordering-mob-attack-on-court-bailiff/,2021-10-15,Rivers Monarch Denies Ordering Mob Attack On Court Bailiff,thetidenewsonline.com
http://www.thetidenewsonline.com/2021/10/15/cleric-tasks-govts-churches-on-capacity-building-2/,2021-10-15,"Cleric Tasks Govts, Churches On Capacity Building",thetidenewsonline.com
http://www.thetidenewsonline.com/2021/10/15/fg-approves-n2-5bn-take-off-grant-for-senior-citizens/,2021-10-15,FG Approves N2.5bn Take-Off Grant For Senior Citizens,thetidenewsonline.com
http://www.thetidenewsonline.com/2021/10/15/gunmen-kill-monarch-in-etche-wife-in-police-custody/,2021-10-15,Gunmen Kill Monarch In Etche Wife In Police Custody,thetidenewsonline.com
http://www.thetidenewsonline.com/2021/10/15/2022-budget-we-need-sustainable-exchange-rate-to-survive-sekibo/,2021-10-15,2022 Budget: We Need Sustainable Exchange Rate To Survive -Sekibo,thetidenewsonline.com
http://www.thetidenewsonline.com/2021/10/15/pap-buhari-renews-dikios-appointment-as-ia/,2021-10-15,PAP: Buhari Renews Dikio’s Appointment As IA,thetidenewsonline.com
http://www.thetidenewsonline.com/2021/10/15/2021-world-food-day-fg-woos-entrepreneurs-investors-to-agric/,2021-10-15,"2021 World Food Day: FG Woos Entrepreneurs, Investors To Agric",thetidenewsonline.com
http://www.thetidenewsonline.com/2021/10/15/omo-agege-assures-2022-budget-passage-before-dec-16-as-estimate-scales-second-reading/,2021-10-15,Omo-Agege Assures 2022 Budget Passage Before Dec 16 …As Estimate Scales Second Reading,thetidenewsonline.com
http://www.thetidenewsonline.com/2021/10/15/13243-terrorists-with-families-surrender-in-neast-army-confirms/,2021-10-15,"13,243 Terrorists With Families Surrender In N’East, Army Confirms",thetidenewsonline.com
http://www.thetidenewsonline.com/2021/10/15/troops-crush-51-illegal-refineries-arrest-23-oil-thieves-in-six-states/,2021-10-15,"Troops Crush 51 Illegal Refineries, Arrest 23 Oil Thieves In Six States",thetidenewsonline.com
http://www.thetidenewsonline.com/2021/10/15/nigerias-rig-count-rises-20-8-to-29-in-q3/,2021-10-15,Nigeria’s Rig Count Rises 20.8% To 29 In Q3,thetidenewsonline.com
http://www.thetidenewsonline.com/2021/10/15/nigerian-makes-top-10-for-1m-global-student-prize/,2021-10-15,Nigerian Makes Top 10 For $.1m Global Student Prize,thetidenewsonline.com
https://www.vanguardngr.com/2021/10/fg-tasks-affluence-women-on-plight-of-less-privileged-rural-women-2/,2021-10-15,FG tasks affluence women on plight of less privileged rural women,vanguardngr.com
https://globalvillageextra.com/en/index.php/2021/10/15/covid-19-uk-nigeria-agrees-to-increase-partnership/,2021-10-15,"COVID-19: UK, Nigeria Agrees To Increase Partnership",globalvillageextra.com
https://www.opinionnigeria.com/fg-restates-commitment-to-ensuring-biosafety/,2021-10-15,FG restates commitment to ensuring biosafety,opinionnigeria.com
https://www.vanguardngr.com/2021/10/post-covid-19-increase-fdi-in-non-oil-sectors-uk-tells-nigeria/,2021-10-15,"Post-COVID-19: Increase FDI in non-oil sectors, UK tells Nigeria",vanguardngr.com
https://guardian.ng/opinion/2023-election-the-nigerian-youth-must-wake-up/,2021-10-15,2023 election: The Nigerian youth must wake up,guardian.ng
https://www.channelstv.com/2021/10/15/fix-earth-instead-prince-william-tells-space-tourists/,2021-10-15,"Fix Earth Instead, Prince William Tells Space Tourists",channelstv.com
https://www.blueprint.ng/nigeria-loses-n38trn-to-climate-change-actionaid/,2021-10-15,Nigeria loses N38trn to climate change-ActionAid,blueprint.ng
https://www.today.ng/news/nigeria/nigeria-hold-talks-increasing-fdi-post-coronavirus-economy-394228,2021-10-15,"UK, Nigeria hold talks on increasing FDI in post coronavirus economy",today.ng
https://businessday.ng/business-economy/article/natl-devt-plan-fg-wants-n300trn-from-private-sector-but-policies-harsh/,2021-10-15,Nat’l devt plan: FG wants N300trn from private sector but policies harsh,businessday.ng
https://thewillnigeria.com/news/uk-nigeria-hold-talks-on-increasing-fdi-in-post-covid-19-economy/?utm_source=rss&utm_medium=rss&utm_campaign=uk-nigeria-hold-talks-on-increasing-fdi-in-post-covid-19-economy,2021-10-15,"UK, Nigeria Hold Talks On Increasing FDI In Post COVID-19 Economy",thewillnigeria.com
https://www.pulse.ng/apo/seychelles-high-commissioner-accredited-to-the-republic-of-south-africa/2q20n50,2021-10-15,Seychelles High Commissioner accredited to the Republic of South Africa,pulse.ng
https://dailypost.ng/2021/10/15/world-bank-breaks-record-with-157bn-support-for-100-countries-in-2021/,2021-10-15,World Bank breaks record with $157bn support for 100 countries in 2021,dailypost.ng
https://www.pulse.ng/apo/undp-africa-director-calls-for-increased-investment-in-new-approach-to-accelerate/7ytpc7s,2021-10-15,UNDP Africa Director calls for increased investment in new approach to accelerate Nigeria's development,pulse.ng
https://www.vanguardngr.com/2021/10/agric-sector-lifts-4-2m-nigerians-out-of-poverty-in-2-yrs-minister/,2021-10-15,Agric sector lifts 4.2m Nigerians out of poverty in 2 yrs —Minister,vanguardngr.com
https://www.blueprint.ng/alternative-power-as-nigerias-energy-transition-gathers-steam-%ef%bb%bf/,2021-10-15,Alternative power: As Nigeria’s energy transition gathers steam… ﻿,blueprint.ng
https://www.today.ng/news/nigeria/nigerian-government-develops-agricultural-policy-drive-sector-394185,2021-10-15,Nigerian government develops new agricultural policy to drive the sector,today.ng
https://www.sunnewsonline.com/food-crisis-actionaid-stages-campaign-against-climate-change/,2021-10-15,Food crisis: Actionaid stages campaign against climate change,sunnewsonline.com
https://independent.ng/fg-develops-new-agricultural-policy-to-drive-the-sector/,2021-10-15,FG Develops New Agricultural Policy To Drive The Sector,independent.ng
https://www.thenews-chronicle.com/fg-restates-commitment-to-ensuring-biosafety/,2021-10-15,FG restates commitment to ensuring biosafety,thenews-chronicle.com
https://newsdiaryonline.com/senate-confirms-nwoha-as-south-east-commissioner-in-nasc/,2021-10-15,Senate confirms Nwoha As South East Commissioner in NASC,newsdiaryonline.com
https://businessday.ng/africa/article/us-adds-17b-doses-of-jj-vaccine-to-au-basket/,2021-10-15,US adds 17b doses of J&J vaccine to AU basket,businessday.ng
https://www.pulse.ng/apo/the-international-organization-for-migration-announces-prominent-panel-of-judges-for/exr6c3l,2021-10-15,The International Organization for Migration announces prominent panel of Judges for the 2021 West and Central Africa Migration Journalism Award,pulse.ng
https://pmnewsnigeria.com/2021/10/15/nigerian-student-akintewe-named-finalist-for-100k-global-student-prize/,2021-10-15,Nigerian student Akintewe named finalist for $100K Global Student Prize,pmnewsnigeria.com
https://von.gov.ng/2021/10/15/president-biden-kenyas-kenyatta-meets-at-white-house/,2021-10-15,"President Biden, Kenya’s Kenyatta meets at White House",von.gov.ng
https://newsdiaryonline.com/nema-calls-for-proactive-measures-to-prevent-disasters-in-niger-kwara/,2021-10-15,"NEMA calls for proactive measures to prevent disasters in Niger, Kwara",newsdiaryonline.com
https://guardian.ng/news/water-engineers-advocate-good-governance-structure-to-tackle-sector-challenges/,2021-10-15,Water engineers advocate good governance structure to tackle sector challenges,guardian.ng
https://www.thisdaylive.com/index.php/2021/10/13/underwriter-promotes-sustainable-lifestyle/,2021-10-13,Underwriter Promotes Sustainable Lifestyle,thisdaylive.com
https://punchng.com/nema-calls-for-proactive-measures-to-prevent-disasters-in-niger-kwara/,2021-10-15,"NEMA calls for proactive measures to prevent disasters in Niger, Kwara",punchng.com
https://von.gov.ng/2021/10/15/experts-express-worry-over-indiscriminate-disposal-of-hazardous-chemicals/,2021-10-15,Experts express worry over indiscriminate disposal of hazardous chemicals,von.gov.ng
https://www.africanexaminer.com/over-800-million-people-are-hungry-globally-german-ngo/,2021-10-15,Over 800 Million People Are Hungry Globally – German NGO,africanexaminer.com
https://guardian.ng/features/agro-care/world-food-day-conflicts-push-12-8m-nigerians-to-hunger/,2021-10-15,World Food Day: Conflicts push 12.8m Nigerians to hunger,guardian.ng
https://independent.ng/red-cross-blames-disaster-on-nigerians-attitude-toward-early-warning/,2021-10-15,Red Cross Blames Disaster On Nigerians’ Attitude Toward Early Warning,independent.ng
https://economicconfidential.com/2021/10/covid-pushes-global-debt/,2021-10-15,COVID-19 Pushes Global Debt To $256trn – IMF,economicconfidential.com
https://tribuneonlineng.com/yemi-alade-ed-sheeran-coldplay-to-perform-at-prince-williams-earthshot-prize-awards-on-sunday-2/,2021-10-15,"Yemi Alade, Ed Sheeran, Coldplay to perform at Prince Williams’ ‘Earthshot prize awards’ on Sunday",tribuneonlineng.com
https://www.sunnewsonline.com/making-the-health-sector-work/,2021-10-15,Making the health sector work,sunnewsonline.com
https://guardian.ng/news/nigeria-to-lose-n38trillion-to-climate-change-activities-by-2050/,2021-10-17,Nigeria to lose N38trillion to climate change activities by 2050,guardian.ng
https://tribuneonlineng.com/endsars-gives-hope-to-the-traumatised-nigerian-youth-seeking-justice-rinu-oduala/,2021-10-17,#EndSARS gives hope to the traumatised Nigerian youth seeking justice —Rinu Oduala,tribuneonlineng.com
https://punchng.com/nigerians-need-escape-route-from-poverty/,2021-10-16,Nigerians need escape route from poverty,punchng.com
https://pmnewsnigeria.com/2021/10/16/rise-in-solar-industry-offers-insight-into-realities-of-lagos-energy-map-tijani/,2021-10-16,Rise in solar industry offers insight into realities of Lagos' energy map,pmnewsnigeria.com
https://www.vanguardngr.com/2021/10/nigeriall-loose-n38trn-to-climate-change-by-2050-if-actionaid/,2021-10-15,Nigeria'll loose N38trn to climate change by 2050 if…— ActionAid,vanguardngr.com
https://www.today.ng/news/world/rising-global-poverty-moral-indictment-394440,2021-10-16,UN: Rising global poverty a ‘moral indictment’,today.ng
https://newsdiaryonline.com/un-chief-decries-rising-levels-of-global-extreme-poverty-as-a-moral-indictment/,2021-10-16,UN chief decries rising levels of global extreme poverty as a ‘moral indictment’,newsdiaryonline.com
https://www.herald.ng/current-extreme-poverty-moral-indictment-of-our-times-un-chief-tells-world-leaders/,2021-10-16,Current extreme poverty ‘moral indictment of our times’,herald.ng
https://ionigeria.com/nigerian-wins-top-3-in-commonwealth-wide-ideas-contest/?utm_source=rss&utm_medium=rss&utm_campaign=nigerian-wins-top-3-in-commonwealth-wide-ideas-contest,2021-10-16,Nigerian wins top 3 in Commonwealth-wide ideas contest,ionigeria.com
https://independent.ng/un-chief-calls-for-stronger-steps-to-combat-hunger/,2021-10-16,UN Chief Calls For Stronger Steps To Combat Hunger,independent.ng
https://newswirengr.com/2021/10/16/leicester-piled-pressure-on-ole-gunnar-solskjaer-as-manchester-united-collapse/?utm_source=rss&utm_medium=rss&utm_campaign=leicester-piled-pressure-on-ole-gunnar-solskjaer-as-manchester-united-collapse,2021-10-16,Leicester piled pressure on Ole Gunnar Solskjaer as Manchester United Collapse,newswirengr.com
https://globalvillageextra.com/en/index.php/2021/10/16/leicester-pile-pressure-on-solskjaer-as-man-utd-collapse/,2021-10-16,Leicester Pile Pressure On Solskjaer As Man Utd Collapse,globalvillageextra.com
https://www.pulse.ng/sports/football/leicester-pile-pressure-on-solskjaer-as-not-good-enough-man-utd-crash/zhcnscb,2021-10-16,Leicester pile pressure on Solskjaer as 'not good enough' Man Utd crash,pulse.ng
https://guardian.ng/sport/leicester-pile-pressure-on-solskjaer-as-man-utd-crash/,2021-10-16,Leicester pile pressure on Solskjaer as Man Utd crash,guardian.ng
https://www.channelstv.com/2021/10/16/leicester-pile-pressure-on-solskjaer-as-man-utd-collapse/,2021-10-16,Leicester Pile Pressure On Solskjaer As Man Utd Collapse,channelstv.com
https://www.today.ng/news/nigeria/pdp-chieftain-begs-ngf-incessant-increase-cooking-gas-394410,2021-10-16,PDP chieftain begs to NGF over incessant increase of cooking gas,today.ng
https://www.pulse.ng/apo/zimbabwe-commemorates-world-food-day/mmel19s,2021-10-16,Zimbabwe commemorates World Food Day,pulse.ng
https://www.sunnewsonline.com/climate-change-zuru-patriotic-forum-donates-250-economic-trees-to-ribah-girls-college/,2021-10-16,Climate change: Zuru Patriotic Forum donates 250 economic trees to Ribah Girls College,sunnewsonline.com
https://newmail-ng.com/president-buhari-appreciates-undp-for-assistance-to-nigeria/?utm_source=rss&utm_medium=rss&utm_campaign=president-buhari-appreciates-undp-for-assistance-to-nigeria,2021-10-15,President Buhari appreciates UNDP for assistance to Nigeria,newmail-ng.com
https://www.vanguardngr.com/2021/10/200-brands-to-experience-facelift-with-byb-iv/,2021-10-16,200 brands to experience facelift with BYB IV,vanguardngr.com
https://www.today.ng/news/nigeria/minister-4-2-nigerians-lifted-poverty-years-394342,2021-10-16,Minister: 4.2 million Nigerians lifted out of poverty in two years,today.ng
https://leadership.ng/4-2m-nigerians-lifted-out-of-poverty-in-2-years-says-agric-minister/,2021-10-16,"4.2m Nigerians Lifted Out Of Poverty In 2 Years, Says Agric Minister",leadership.ng
https://independent.ng/architects-can-pull-nigeria-out-of-the-woods-nwafor-assures/,2021-10-16,"Architects Can Pull Nigeria Out Of The Woods, Nwafor Assures",independent.ng
https://theeagleonline.com.ng/nigerian-wins-top-3-in-commonwealth-wide-ideas-contest/?utm_source=rss&utm_medium=rss&utm_campaign=nigerian-wins-top-3-in-commonwealth-wide-ideas-contest,2021-10-16,Nigerian wins Top 3 in Commonwealth-wide ideas contest,theeagleonline.com.ng
https://www.pulse.ng/apo/mozambique-becomes-first-country-to-receive-emission-reductions-payments-from-forest/jqt3nrq,2021-10-16,Mozambique Becomes First Country To Receive Emission Reductions Payments From Forest Carbon Partnership Facility,pulse.ng
https://www.vanguardngr.com/2021/10/what-akinwumi-adesina-told-buhari-2/,2021-10-16,What Akinwumi Adesina told Buhari,vanguardngr.com
https://thenationonlineng.net/200-brands-to-experience-facelift-with-byb-iv/,2021-10-16,200 brands to experience facelift with BYB IV,thenationonlineng.net
https://leadership.ng/towards-actualising-nigerias-30-year-energy-transition-plan/,2021-10-16,Towards Actualising Nigeria’s 30-year Energy Transition Plan,leadership.ng
https://thenationonlineng.net/lagos-trains-stakeholders-on-business-opportunities-in-solar-technology/,2021-10-16,Lagos trains stakeholders on business opportunities in solar technology,thenationonlineng.net
https://bizwatchnigeria.ng/invest-in-youth-women-creative-industry-undp-advises-govt/?utm_source=rss&utm_medium=rss&utm_campaign=invest-in-youth-women-creative-industry-undp-advises-govt,2021-10-16,"Invest in Youth, Women, Creative Industry, UNDP Advises Govt",bizwatchnigeria.ng
https://dailypost.ng/2021/10/15/covid-19-uk-nigeria-agrees-on-need-to-increase-fdi/,2021-10-15,"COVID-19: UK, Nigeria agrees on need to increase FDI",dailypost.ng
https://punchng.com/nigeria-cant-jump-into-development-says-buhari/,2021-10-15,"Nigeria can’t jump into development, says Buhari",punchng.com
https://leadership.ng/us-iicd-others-support-artistic-repurposing-of-waste-with-technology/,2021-10-16,"US, IICD, Others Support Artistic Repurposing Of Waste With Technology",leadership.ng
http://www.thetidenewsonline.com/2021/10/17/unical-vc-lauds-sug-promises-to-lead-with-fear-of-god/,2021-10-17,UNICAL VC Lauds SUG …Promises To Lead With Fear Of God,thetidenewsonline.com
http://www.thetidenewsonline.com/2021/10/17/nema-distributes-relief-materials-to-510-victims-of-windstorm-in-imo/,2021-10-17,NEMA Distributes Relief Materials To 510 Victims Of Windstorm In Imo,thetidenewsonline.com
https://businessday.ng/columnist/article/the-irritating-distraction-at-the-annual-meetings-in-washington/,2021-10-18,The irritating distraction at the annual meetings in Washington,businessday.ng
https://thenationonlineng.net/nigerians-seek-fed-govts-intervention-over-rising-food-cooking-gas-prices/,2021-10-17,"Nigerians seek Fed Govt’s intervention over rising food, cooking gas prices",thenationonlineng.net
https://punchng.com/coca-cola-hbc-targets-net-zero-emission-with-e250m-investment/,2021-10-17,Coca-Cola HBC targets net-zero emission with €250m investment,punchng.com
https://von.gov.ng/2021/10/17/undp-calls-for-more-investment-to-accelerate-nigerias-development/,2021-10-17,UNDP calls for more investment to accelerate Nigeria’s development,von.gov.ng
https://www.blueprint.ng/experts-make-case-for-agroecology-in-nigeria/,2021-10-17,Experts make case for agroecology in Nigeria,blueprint.ng
https://www.thenews-chronicle.com/today-is-international-day-for-the-eradication-of-poverty/,2021-10-17,Today is International Day for the Eradication of Poverty,thenews-chronicle.com
https://www.thenews-chronicle.com/cheap-grace-and-climate-change-australia-and-cop26/,2021-10-17,Cheap Grace and Climate Change: Australia and COP26,thenews-chronicle.com
https://www.vanguardngr.com/2021/10/nigeria-adopts-nature-based-solutions-to-tackle-climate-change/,2021-10-17,Nigeria adopts nature based solutions to tackle climate change,vanguardngr.com
http://nigeriancurrent.com/2021/10/17/devaluation-is-grossly-overrated-by-simon-kolawole/,2021-10-17,Devaluation is grossly overrated by Simon Kolawole,nigeriancurrent.com
https://www.premiumtimesng.com/opinion/490265-finally-scenarios-for-the-people-by-chukwumerije-okereke-richard-dion.html,2021-10-17,"Finally, scenarios for the people, By Chukwumerije Okereke & Richard Dion",premiumtimesng.com
https://leadership.ng/climate-change-zuru-forum-donates-250-economic-trees-to-kebbi-school/,2021-10-17,Climate Change: Zuru Forum Donates 250 Economic Trees To Kebbi School,leadership.ng
https://www.herald.ng/n-east-residents-groan-over-high-cost-of-food-items/,2021-10-17,N/East residents groan over high cost of food items,herald.ng
https://thewillnigeria.com/news/world-bank-group-commits-157bn-to-protect-the-poor/?utm_source=rss&utm_medium=rss&utm_campaign=world-bank-group-commits-157bn-to-protect-the-poor,2021-10-17,World Bank Group Commits $157bn to Protect The Poor,thewillnigeria.com
https://www.pulse.ng/apo/world-food-day-time-for-global-leaders-to-invest-in-africas-agriculture-by-beth/vsq63pk,2021-10-17,World Food Day: Time for global leaders to invest in Africa's agriculture (By Beth Dunford),pulse.ng
https://leadership.ng/coca-cola-moves-to-reward-nigerian-customers-at-70th-anniversary/,2021-10-17,Coca-Cola Moves To Reward Nigerian Customers At 70th Anniversary,leadership.ng
https://www.vanguardngr.com/2021/10/our-kitchen-is-on-firewe-continue-to-fight/,2021-10-17,"Our kitchen is on fire,we continue to fight",vanguardngr.com
https://www.vanguardngr.com/2021/10/climate-finance-at-cop26-key-issues-for-africa/,2021-10-17,Climate Finance at COP26: Key issues for Africa,vanguardngr.com
https://www.vanguardngr.com/2021/10/inconvenient-truths-about-nigeria-1/,2021-10-17,Inconvenient truths about Nigeria (1),vanguardngr.com
https://punchng.com/leicester-city-vs-man-united-pressure-mounts-on-solskjaer-after-loss/,2021-10-17,Leicester City vs Man United: Pressure mounts on Solskjaer after loss,punchng.com
https://punchng.com/north-east-residents-groan-over-high-cost-of-food-items/,2021-10-17,North-East residents groan over high cost of food items,punchng.com
https://authorityngr.com/2021/10/17/nigeria-has-adopted-nature-based-solutions-to-tackle-climate-change-onuigbo/?utm_source=rss&utm_medium=rss&utm_campaign=nigeria-has-adopted-nature-based-solutions-to-tackle-climate-change-onuigbo,2021-10-17,Nigeria has adopted nature-based solutions to tackle climate change – Onuigbo,authorityngr.com
https://guardian.ng/news/nimet-boss-decries-vandalisation-of-sensors-in-airports/,2021-10-17,NiMET boss decries vandalisation of sensors in airports,guardian.ng
https://guardian.ng/news/world-food-day-industrialist-tasks-fg-on-resilient-robust-food-safety-systems/,2021-10-17,"World Food Day: Industrialist tasks FG on resilient, robust food safety systems",guardian.ng
https://independent.ng/coca-cola-hbc-e250m-targets-net-zero-emissions/,2021-10-19,Coca-Cola HBC €250m Targets Net Zero Emissions,independent.ng
https://businessday.ng/energy/article/global-1-7-billion-hydrogen-fund-shows-how-nigeria-develop-clean-energy-infrastructure/,2021-10-19,Global $1.7 billion hydrogen fund shows how Nigeria develop clean energy infrastructure,businessday.ng
https://businessday.ng/energy/article/coca-cola-hbc-targets-100-renewable-electricity-by-2040/,2021-10-19,Coca-Cola HBC targets 100% renewable electricity by 2040,businessday.ng
https://economicconfidential.com/2021/10/bank-support-nigeria/,2021-10-18,"World Bank Reviews $157bn Support To Nigeria, Others",economicconfidential.com
https://www.newtelegraphng.com/ui-at-last-storm-settled-over-vcs-appointment/,2021-10-19,"UI: At last, storm settled over VC’s appointment",newtelegraphng.com
https://247ureports.com/2021/10/climate-change-kano-agro-pastoral-project-promotes-climate-smart-agricultural-practices/,2021-10-18,Climate Change: Kano Agro Pastoral Project Promotes Climate-Smart Agricultural Practices,247ureports.com
https://www.sunnewsonline.com/nigeria-us-meet-on-security-trade-others/,2021-10-18,"Nigeria, US meet on security, trade, others",sunnewsonline.com
https://globalvillageextra.com/en/index.php/2021/10/18/duke-of-cambridge-announces-1st-ever-earthshot-prize-winners/,2021-10-18,"Duke Of Cambridge Announces 1st-Ever ""Earthshot Prize"" Winners",globalvillageextra.com
https://www.channelstv.com/2021/10/18/u-s-to-collaborate-with-nigeria-to-fight-terrorism/,2021-10-18,U.S. To Collaborate With Nigeria To Fight Terrorism,channelstv.com
https://www.vanguardngr.com/2021/10/opec-arda-optimistic-of-africas-role-in-global-energy-landscape/,2021-10-18,"OPEC, ARDA optimistic of Africa’s role in global energy landscape",vanguardngr.com
https://www.pulse.ng/apo/new-protected-area-buffers-mauritanias-shifting-sands/0ehexy0,2021-10-18,New protected area buffers Mauritania's shifting sands,pulse.ng
https://www.pulse.ng/apo/statement-by-nsc-spokesperson-emily-horne-on-senior-administration-official-travel-to/npb8451,2021-10-18,"Statement by NSC Spokesperson Emily Horne on Senior Administration Official Travel to Nigeria, Equatorial Guinea, and Mauritania",pulse.ng
https://authorityngr.com/2021/10/18/why-covid-19-mortality-is-low-in-nigeria-homef/?utm_source=rss&utm_medium=rss&utm_campaign=why-covid-19-mortality-is-low-in-nigeria-homef,2021-10-18,Why Covid-19 mortality is low in Nigeria – HOMEF,authorityngr.com
https://www.vanguardngr.com/2021/10/insufficient-rain-might-cause-food-deficiency-in-2021-farmers-cry-out/,2021-10-18,"Insufficient rain might cause food deficiency in 2021, farmers cry out",vanguardngr.com
https://www.vanguardngr.com/2021/10/hunger-looms-as-drought-hits-kano-rice-farmers/,2021-10-18,"Hunger looms, as drought hits Kano rice farmers",vanguardngr.com
https://theeagleonline.com.ng/hp-launches-mentor-a-teacher-programme-in-nigeria/?utm_source=rss&utm_medium=rss&utm_campaign=hp-launches-mentor-a-teacher-programme-in-nigeria,2021-10-18,HP launches ‘Mentor-a-Teacher programme’ in Nigeria,theeagleonline.com.ng
https://von.gov.ng/2021/10/18/nigerian-government-calls-for-more-safe-drinking-and-portable-water/,2021-10-18,Nigerian government calls for safe portable water.,von.gov.ng
