url,date_published,title,newsorg
http://www.thetidenewsonline.com/2021/12/10/clean-energy-for-cleaner-earth/,2021-12-10,Clean Energy For Cleaner Earth,thetidenewsonline.com
https://www.nigeriasun.com/news/271908088/climate-change-aggravating-factor-for-terrorism-un-chief,2021-12-10,Climate change aggravating factor for terrorism: UN chief,nigeriasun.com
http://www.thetidenewsonline.com/2021/12/10/phed-mulls-massive-disconnection-of-debtor-customers-to-sustain-arrest-prosecution-of-energy-thieves/,2021-12-10,"PHED Mulls Massive Disconnection Of Debtor Customers …To Sustain Arrest, Prosecution Of Energy Thieves",thetidenewsonline.com
http://www.thetidenewsonline.com/2021/12/10/group-backs-ncdmbs-query-against-saipem/,2021-12-10,Group Backs NCDMB’s Query Against SAIPEM,thetidenewsonline.com
http://www.thetidenewsonline.com/2021/12/10/wike-challenges-fg-on-foreign-loans-as-mimiko-inaugurates-rumuola-flyover/,2021-12-10,Wike Challenges FG On Foreign Loans …As Mimiko Inaugurates Rumuola Flyover,thetidenewsonline.com
https://radionigeria.gov.ng/2021/12/10/stakeholders-call-for-urgent-action-on-climate-change-disasters/,2021-12-10,Stakeholders call for urgent action on climate change disasters,radionigeria.gov.ng
https://www.aproko247.com/2021/12/09/huawei-iucn-launch-tech4nature-for-nature-conservation/,2021-12-09,"Huawei, IUCN Launch Tech4Nature for Nature Conservation",aproko247.com
https://thenationonlineng.net/omicron-forces-sanwo-olu-to-suspend-planned-peace-walk/,2021-12-10,Omicron forces Sanwo-Olu to suspend planned peace walk,thenationonlineng.net
https://independent.ng/again-fg-considers-building-1200mw-nuclear-power-plant/,2021-12-10,"Again, FG Considers Building 1,200MW Nuclear Power Plant",independent.ng
https://www.nigeriasun.com/news/271908653/jussie-smollett-guilty-in-hate-hoax-trial,2021-12-10,Jussie Smollett guilty in hate hoax trial,nigeriasun.com
https://www.nigeriasun.com/news/271909214/india-highlights-terrorism-climate-change-at-unsc-open-debate,2021-12-10,"India highlights terrorism, climate change at UNSC open debate",nigeriasun.com
https://www.nigeriasun.com/news/271909262/us-state-secy-blinken-bothsiderism-makes-religious-freedom-face-acute-crisis,2021-12-10,US State Secy Blinken's 'bothsiderism' makes religious freedom face acute crisis,nigeriasun.com
https://www.vanguardngr.com/2021/12/eecca-holds-post-cop26-workshop-500-million-tree-planting-flag-off/,2021-12-10,"EECCA holds post COP26 workshop, 500 million tree-planting flag-off",vanguardngr.com
https://guardian.ng/news/world/white-house-braces-for-latest-us-inflation-surge/,2021-12-10,White House braces for latest US inflation surge,guardian.ng
https://guardian.ng/news/shell-shareholders-vote-on-move-to-london/,2021-12-10,Shell shareholders vote on move to London,guardian.ng
https://guardian.ng/features/the-guardians-special-focus-on-most-impactful-and-award-winning-ceos-that-contributed-to-nigerias-gdp-growth-in-2021-part-3/,2021-12-10,The Guardian's special focus on Most Impactful and Award-winning CEOs that contributed to Nigeria's GDP growth in 2021 Part 3,guardian.ng
https://thenationonlineng.net/nigeria-to-grow-gas-reserves-to-600-trillion-cubic-feet-minister/,2021-12-09,Nigeria to grow gas reserves to 600 trillion cubic feet — Minister,thenationonlineng.net
https://radionigeria.gov.ng/2021/12/10/ecowas-tasks-member-states-on-regional-integration/,2021-12-10,ECOWAS tasks member states on Regional Integration,radionigeria.gov.ng
https://von.gov.ng/2021/12/10/ecowas-council-of-ministers-to-review-regional-challenges/,2021-12-10,ECOWAS Council of Ministers to review regional challenges,von.gov.ng
https://tribuneonlineng.com/eecca-to-hold-workshop-flag-off-planting-of-500m-trees-tuesday/,2021-12-10,"EECCA to hold workshop, flag off planting of 500m trees Tuesday",tribuneonlineng.com
https://www.sunnewsonline.com/biden-to-focus-on-elections-media-as-summit-for-democracy-wraps/,2021-12-10,"Biden to focus on elections, media as summit for democracy wraps",sunnewsonline.com
https://solar-energy.newsdayngonline.com/this-snowboard-maker-is-harnessing-solar-energy-from-the-desert-to-go-green-euronews/,2021-12-10,This snowboard maker is harnessing solar energy from the desert to go green – Euronews,newsdayngonline.com
https://punchng.com/child-poverty-recovering-from-covid-19ll-take-seven-years-unicef/,2021-12-10,Child poverty: Recovering from COVID-19’ll take seven years – UNICEF,punchng.com
https://von.gov.ng/2021/12/10/human-rights-day-un-seeks-equality-dignity-for-humans/,2021-12-10,"Human Rights Day: UN seeks equality, dignity for humans",von.gov.ng
https://theeagleonline.com.ng/513501-2/,2021-12-10,-,theeagleonline.com.ng
https://www.today.ng/news/nigeria/human-rights-siege-global-crises-proliferate-402047,2021-12-10,UN: Human rights under siege as global crises proliferate,today.ng
https://www.aproko247.com/2021/12/10/shows-evidence-of-money-borrowed-wike-tells-fg/,2021-12-10,Shows Evidence of Money Borrowed – Wike Tells FG,aproko247.com
https://promptnewsonline.com/diversity-education-and-autonomy-developing-nigeria-in-the-years-ahead-by-atiku-abubakar/,2021-12-10,"Diversity, Education and Autonomy: Developing Nigeria in the Years Ahead, by Atiku Abubakar",promptnewsonline.com
https://authorityngr.com/2021/12/10/fg-launches-vaccination-for-idps-begins-administration-of-booster-dose-friday/,2021-01-01,"FG launches vaccination for IDPs, begins administration of booster dose Friday",authorityngr.com
https://libertytvradio.com/nigeria-to-grow-gas-reserves-to-600-trillion-cubic-feet-minister/,2021-12-10,Nigeria To Grow Gas Reserves To 600 Trillion Cubic Feet — Minister,libertytvradio.com
https://guardian.ng/ama-press-releases/ford-foundation-announces-new-fund-to-strengthen-natural-resources-governance-in-west-africa/,2021-12-10,Ford Foundation announces new fund to strengthen natural resources governance in West Africa,guardian.ng
https://investing.newsdayngonline.com/why-esg-investing-just-makes-sense-forbes/,2021-12-10,Why ESG Investing Just Makes Sense – Forbes,newsdayngonline.com
https://punchng.com/ecowas-action-plan-can-tame-insurgency-in-nigeria-others-council/,2021-12-10,"ECOWAS action plan can tame insurgency in Nigeria, others — Council",punchng.com
https://hallmarknews.com/the-nigerian-capital-market-celebrates-emergence-of-its-first-central-counterparty/,2021-12-10,The Nigerian Capital Market Celebrates Emergence of Its First...,hallmarknews.com
https://www.nigeriasun.com/news/271916141/un-recap-december-5-10-2021,2021-12-11,"UN Recap: December 5-10, 2021",nigeriasun.com
https://leadership.ng/fg-fao-begin-nltp-pilot-scheme-with-model-ranch-in-niger/,2021-12-11,"FG, FAO Begin NLTP Pilot Scheme With Model Ranch In Niger",leadership.ng
https://www.newtelegraphng.com/bullying-at-schools/,2021-12-11,Bullying at schools,newtelegraphng.com
https://thenationonlineng.net/debts-vaccines-and-climate/,2021-12-11,"Debts, vaccines and climate",thenationonlineng.net
https://thenationonlineng.net/row-as-farmers-demand-insurance-cover-for-herdsmen-attacks-climate-change-others/,2021-12-11,"Row as farmers demand insurance cover for herdsmen attacks, climate change, others",thenationonlineng.net
https://globalvillageextra.com/en/index.php/2021/12/11/biden-makes-late-night-tv-debut-as-president/,2021-12-11,Biden Makes Late-night TV Debut As President,globalvillageextra.com
https://www.channelstv.com/2021/12/11/young-graduates-can-solve-nigerias-biggest-problems-says-osinbajo/,2021-12-11,"Young Graduates Can Solve Nigeria’s Biggest Problems, Says Osinbajo",channelstv.com
https://punchng.com/oau-60-young-people-are-charting-nigerias-brighter-future-says-osinbajo/,2021-12-11,"OAU @60: Young people are charting Nigeria's brighter future, says Osinbajo",punchng.com
https://theeagleonline.com.ng/oau-at-60-young-nigerians-graduates-are-charting-nigerias-brighter-future-osinbajo/,2021-12-11,"OAU at 60: Young Nigerians, graduates are charting Nigeria’s brighter future-Osinbajo",theeagleonline.com.ng
https://www.thenews-chronicle.com/earths-soil-worsening-says-fao/,2021-12-11,"Earth’s Soil Worsening, Says FAO",thenews-chronicle.com
https://www.thenews-chronicle.com/scaling-through-tough-times-the-endless-struggles-of-a-nigerian-citizen/,2021-12-11,Scaling Through Tough Times: the endless struggles of a Nigerian citizen,thenews-chronicle.com
https://pmnewsnigeria.com/2021/12/12/over-100-dead-in-worst-u-s-tornadoes-kentucky-governor/,2021-12-12,Over 100 dead in worst U.S. tornadoes: Kentucky Governor,pmnewsnigeria.com
https://www.premiumtimesng.com/news/headlines/500335-nigerian-govt-should-enforce-schooling-just-as-it-does-with-vaccination-atiku.html,2021-12-11,Nigerian govt should 'enforce' schooling just as it does with vaccination,premiumtimesng.com
https://guardian.ng/news/gas-price-may-skyrocket-as-government-hits-importers-with-n27b-tax/,2021-12-12,Gas price may skyrocket as government hits importers with N27b tax,guardian.ng
https://von.gov.ng/2021/12/12/economic-development-iom-calls-for-safe-orderly-migration/,2021-12-12,"Economic Development: IOM calls for safe, orderly migration",von.gov.ng
https://www.vanguardngr.com/2021/12/oil-spills-revelation-in-n-deltan-thousands-of-babies-others-dead-akene-environmentalist/,2021-12-12,"OIL SPILLS REVELATION IN N-DELTA:N Thousands of babies, others dead – Akene, environmentalist",vanguardngr.com
https://investing.newsdayngonline.com/what-is-esg-environmental-social-and-governance-investing-kenan-institute-says-wral-tech-wire/,2021-12-12,"What is ESG (environmental, social, and governance) investing? Kenan Institute says … – WRAL Tech Wire",newsdayngonline.com
https://pmnewsnigeria.com/2021/12/12/osinbajo-young-nigerians-can-chart-brighter-future-for-nigeria/,2021-12-12,Osinbajo: Young Nigerians can chart brighter future for Nigeria,pmnewsnigeria.com
https://punchng.com/with-innovative-ideas-youths-can-solve-local-global-challenges-buhari/,2021-12-12,"With innovative ideas, youths can solve local, global challenges –Buhari",punchng.com
https://www.informationng.com/2021/12/with-innovative-ideas-youths-can-solve-local-global-challenges-buhari.html,2021-12-12,"With Innovative Ideas, Youths Can Solve Local, Global Challenges –Buhari",informationng.com
https://newswirengr.com/2021/12/12/vice-president-osinbajo-saysgraduates-can-solve-nigerias-problems/,2021-12-12,Vice President Osinbajo says Graduates can solve Nigeria’s Problems,newswirengr.com
https://tribuneonlineng.com/were-tormented-by-numerous-challenges-buhari/,2021-12-12,We’re tormented by numerous challenges — Buhari,tribuneonlineng.com
https://www.newtelegraphng.com/germanys-new-chancellor-calls-on-party-to-back-ruling-coalition/,2021-12-12,Germany's new Chancellor calls on party to back ruling coalition,newtelegraphng.com
https://www.today.ng/news/world/70-people-dead-tornado-rocks-kentucky-402210,2021-12-12,Over 70 people dead as tornado rocks Kentucky,today.ng
https://www.today.ng/?p=402209,2021-12-12,VP Osinbajo: Young Nigerians can chart brighter future for the country,today.ng
https://thewillnigeria.com/news/electoral-reform-amendment-bill-intrigues-overshadow-direct-primary-clause/,2021-12-12,Electoral Reform Amendment Bill: Intrigues Overshadow Direct Primary Clause,thewillnigeria.com
https://von.gov.ng/2021/12/12/un-in-south-sudan-evaluates-impact-on-climate-change/,2021-12-12,UN in South Sudan evaluates impact on climate change,von.gov.ng
https://nationaldailyng.com/vp-osinbajo-expresses-confidence-in-young-graduates-solving-nigerias-devt-problems/,2021-12-12,VP Osinbajo expresses confidence in young graduates solving Nigeria’s devt problems,nationaldailyng.com
https://www.today.ng/news/nigeria/president-buhari-tormented-numerous-challenges-402237,2021-12-12,President Buhari: We’re tormented by numerous challenges,today.ng
http://saharareporters.com/2021/12/12/exclusive-junketing-president-buhari%E2%80%99s-team-leaves-turkey-today-plans-china-trip,2021-12-12,"EXCLUSIVE: Junketing President Buhari’s Team Leaves For Turkey Today, Plans China Trip",saharareporters.com
https://www.premiumtimesng.com/news/top-news/500488-over-70-people-dead-as-tornado-rocks-kentucky.html,2021-12-12,Over 70 people dead as tornado rocks Kentucky,premiumtimesng.com
https://von.gov.ng/2021/12/12/ecowas-nigeria-seeks-collective-action-to-tackle-regional-challenges/,2021-12-12,ECOWAS: Nigeria Seeks Collective Action To Tackle Regional Challenges,von.gov.ng
https://www.thecable.ng/buhari-ecowas-leaders-meet-in-abuja-to-discuss-political-crises-in-mali-guinea-conakry,2021-12-12,"Buhari, ECOWAS leaders meet in Abuja to discuss political crises in Mali, Guinea Conakry",thecable.ng
https://www.vanguardngr.com/2021/12/oil-spills-revelation-in-n-deltathousands-of-babies-others-dead-akene-environmentalist/,2021-12-12,"OIL SPILLS REVELATION IN N-DELTA:Thousands of babies, others dead – Akene, environmentalist",vanguardngr.com
https://von.gov.ng/2021/12/12/young-nigerians-are-charting-nigerias-brighter-future-vp-osinbajo/,2021-12-12,Young Nigerians are charting Nigeria’s brighter future–VP Osinbajo,von.gov.ng
https://www.channelstv.com/2021/12/12/rwanda-turns-to-electric-motorbikes-to-drive-down-emissions/,2021-12-12,Rwanda Turns To Electric Motorbikes To Drive Down Emissions,channelstv.com
https://www.blueprint.ng/fg-friesland-wamco-pactll-improve-dairy-sector/,2021-12-12,"FG, Friesland Wamco pact’ll improve dairy sector",blueprint.ng
https://www.pulse.ng/news/local/buhari-to-ecowas-leaders-we-must-forge-stronger-solidarity-to-tackle-new-challenges/9fxsrjp,2021-12-12,Buhari to ECOWAS leaders: We must forge stronger solidarity to tackle new challenges,pulse.ng
https://thenationonlineng.net/buhari-to-ecowas-leaders-we-must-forge-stronger-solidarity-to-tackle-new-challenges/,2021-12-12,Buhari to ECOWAS leaders: We must forge stronger solidarity to tackle new challenges,thenationonlineng.net
https://promptnewsonline.com/buhari-to-ecowas-leaders-we-must-forge-stronger-solidarity-to-tackle-new-challenges/,2021-12-12,Buhari to ECOWAS leaders: We must forge stronger solidarity to tackle new challenges,promptnewsonline.com
https://tribuneonlineng.com/don-charges-accountants-on-professional-ethics/,2021-12-12,Don charges accountants on professional ethics,tribuneonlineng.com
https://www.vanguardngr.com/2021/12/buhari-to-ecowas-leaders-we-must-forge-stronger-solidarity-to-tackle-new-challenges/,2021-12-12,Buhari to ECOWAS leaders: We must forge stronger solidarity to tackle new challenges,vanguardngr.com
https://www.premiumtimesng.com/news/more-news/500552-buhari-to-ecowas-leaders-we-must-forge-stronger-solidarity-to-tackle-new-challenges.html,2021-12-12,Buhari to ECOWAS Leaders: We must forge stronger solidarity to tackle new challenges,premiumtimesng.com
https://www.premiumtimesng.com/opinion/500404-diversity-education-and-autonomy-developing-nigeria-in-the-years-ahead-by-atiku-abubakar.html,2021-12-12,"Diversity, education and autonomy: Developing Nigeria in the years ahead, By Atiku Abubakar",premiumtimesng.com
https://www.blueprint.ng/first-central-counterparty-debuts-in-capital-market/,2021-12-12,First central counterparty debuts in capital market,blueprint.ng
https://www.vanguardngr.com/2021/12/nnpc-weekly-kyari-advocate-tackling-global-energy-crises-with-more-investment-in-oil-gas/,2021-12-12,"NNPC weekly: Kyari advocate tackling global energy crises with more investment in oil, gas",vanguardngr.com
https://www.today.ng/?p=402280,2021-12-12,US tornadoes: Race to rescue survivors as toll rises,today.ng
https://theeagleonline.com.ng/buhari-urges-stronger-partnership-among-ecowas-countries-to-tackle-health-economic-security-challenges/,2021-12-12,"Buhari urges stronger partnership among ECOWAS countries to tackle health, economic, security challenges",theeagleonline.com.ng
https://thewillnigeria.com/news/buhari-calls-for-cooperation-to-tackle-regional-challenges/,2021-12-12,Buhari Calls For Cooperation To Tackle Regional Challenges,thewillnigeria.com
https://pmnewsnigeria.com/2021/12/12/buhari-craves-stronger-partnerships-in-ecowas/,2021-12-12,Buhari craves stronger partnerships in ECOWAS,pmnewsnigeria.com
https://promptnewsonline.com/buhari-tasks-ecowas-leaders-to-work-together-to-surmount-problems-of-sub-region/,2021-12-12,Buhari tasks ECOWAS leaders to work together to surmount problems of sub-region,promptnewsonline.com
https://solar-energy.newsdayngonline.com/fortistci-adds-new-solar-energy-partners-magnetic-media/,2021-12-12,FortisTCI adds new Solar Energy partners – Magnetic Media,newsdayngonline.com
https://www.vanguardngr.com/2021/12/west-african-leaders-must-collaborate-to-overcome-common-challenges-buhari/,2021-12-12,West African leaders must collaborate to overcome common challenges,vanguardngr.com
https://solar-energy.newsdayngonline.com/biden-administration-says-solar-energy-has-the-potential-to-power-40-of-us-electricity-by-2035-cnn/,2021-12-13,Biden administration says solar energy has the potential to power 40% of US electricity by 2035 – CNN,newsdayngonline.com
https://pmnewsnigeria.com/2021/12/13/miss-india-harnaaz-sandhu-crowned-miss-universe-2021/,2021-12-13,Miss India Harnaaz Sandhu crowned Miss Universe 2021,pmnewsnigeria.com
https://tribuneonlineng.com/cbn-deputy-governor-harps-on-importance-of-financial-system/,2021-12-13,CBN Deputy Governor harps on importance of Financial system,tribuneonlineng.com
https://thenationonlineng.net/nigerian-capital-market-set-for-derivatives-trading/,2021-12-13,Nigerian capital market set for derivatives trading,thenationonlineng.net
https://www.sunnewsonline.com/covid-19-ecowas-records-674556-infections-10000-deaths-so-far-akufo-addo/,2021-12-13,"COVID-19: ECOWAS records 674,556 infections, 10,000 deaths so far – Akufo-Addo",sunnewsonline.com
https://von.gov.ng/2021/12/13/charcoal-producers-begin-massive-reforestation/,2021-12-13,Charcoal producers begin massive reforestation,von.gov.ng
https://punchng.com/indias-harnaaz-sandhu-crowned-miss-universe-2021/,2021-12-13,India's Harnaaz Sandhu crowned Miss Universe 2021,punchng.com
https://guardian.ng/news/young-nigerians-equipped-to-solve-local-global-challenges-osinbajo/,2021-12-13,"Young Nigerians equipped to solve local, global challenges–Osinbajo",guardian.ng
https://www.pulse.ng/news/local/young-nigerians-equipped-to-solve-local-global-challenges-osinbajo/8wnzjw2,2021-12-13,"Young Nigerians equipped to solve local, global challenges – Osinbajo",pulse.ng
https://solar-energy.newsdayngonline.com/huge-solar-energy-farm-next-to-rochdale-canal-given-green-light-manchester-evening-news/,2021-12-13,Huge solar energy farm next to Rochdale Canal given green light – Manchester Evening News,newsdayngonline.com
https://www.africanexaminer.com/indias-harnaaz-sandhu-crowned-miss-universe-2021/,2021-12-13,India’s Harnaaz Sandhu Crowned Miss Universe 2021,africanexaminer.com
https://guardian.ng/news/world/biden-declares-major-disaster-in-kentucky-after-tornadoes-kill-dozens/,2021-12-13,Biden declares major disaster in Kentucky after tornadoes kill dozens,guardian.ng
https://hallmarknews.com/us-state-of-kentucky-devastated-by-night-of-tornadoes-more-than-100-likely-dead/,2021-12-13,"US state of Kentucky devastated by night of tornadoes, more than...",hallmarknews.com
https://www.ripplesnigeria.com/jet-systems-gets-recognition-wins-at-naja-awards/,2021-12-13,"JET Systems gets recognition, wins at NAJA Awards",ripplesnigeria.com
https://investing.newsdayngonline.com/support-builds-for-reversing-trumps-limits-on-esg-investing-ee-news/,2021-12-13,Support builds for reversing Trump’s limits on ESG investing – E&E News,newsdayngonline.com
https://www.informationng.com/2021/12/dangote-cements-cdp-climate-rating-upgraded-to-b.html,2021-12-13,Dangote Cement’s CDP Climate Rating Upgraded to B-,informationng.com
https://www.vanguardngr.com/2021/12/surveyors-institute-vitapur-initiate-fresh-move-to-address-challenges-in-construction-sector/,2021-12-13,"Surveyors’ Institute, Vitapur, initiate fresh move to address challenges in construction sector",vanguardngr.com
https://www.sunnewsonline.com/fg-undp-applaud-abdulrazaq-as-kwara-launches-10-year-sustainable-devt-plan/,2021-12-13,"FG, UNDP applaud AbdulRazaq as Kwara launches 10-year sustainable devt plan",sunnewsonline.com
https://www.blueprint.ng/gefs-200m-support-as-game-changer-in-climate-change-covid-19-fight/,2021-12-13,"GEF’s $200m support as game changer in climate change, Covid-19 fight",blueprint.ng
https://www.dataphyte.com/latest-reports/development/analysis-why-nigeria-must-tackle-food-essential-commodities-inflation-before-2022/,2021-12-13,"Analysis: Why Nigeria Must Tackle Food, Essential Commodities Inflation before 2022",dataphyte.com
https://www.nigeriasun.com/news/271933826/india-votes-against-unsc-draft-resolution-to-securitize-climate-action,2021-12-14,India votes against UNSC draft resolution to securitize climate action,nigeriasun.com
https://radionigeria.gov.ng/2021/12/13/kwara-govt-unveils-10-year-development-plan/,2021-12-13,Kwara govt unveils 10-year development plan,radionigeria.gov.ng
https://www.nigeriasun.com/news/271935559/russia-vetoes-un-resolution-on-climates-impact-on-global-security,2021-12-14,Russia Vetoes UN Resolution on Climate&#039;s Impact on Global Security,nigeriasun.com
https://www.nigeriasun.com/news/271935144/country-will-always-support-serious-climate-justice-tirumurti-after-india-rejects-unsc-draft-resolution,2021-12-14,"'Country will always support serious climate justice', Tirumurti after India rejects UNSC draft resolution",nigeriasun.com
https://www.nigeriasun.com/news/271934467/unsc-does-not-adopt-resolution-on-climate-after-russia-casts-veto,2021-12-14,UNSC does not adopt resolution on climate after Russia casts veto,nigeriasun.com
https://von.gov.ng/2021/12/13/kwara-launches-n4-7-trillion-sustainable-development-plan/,2021-12-13,Kwara launches N4.7 trillion Sustainable Development Plan,von.gov.ng
https://hallmarknews.com/nigerias-green-bond-market-rises-above-n55bn-mark/,2021-12-13,Nigeria’s green bond market rises above N55bn mark,hallmarknews.com
https://solar-energy.newsdayngonline.com/alesp-wants-to-eliminate-paper-use-and-use-solar-energy-to-reduce-expenses-the-sabre-the-sabre/,2021-12-14,Alesp wants to eliminate paper use and use solar energy to reduce expenses – The Sabre – The Sabre,newsdayngonline.com
https://tribuneonlineng.com/inside-fao-funded-nltp-that-keeps-herders-farmers-in-same-place/,2021-12-14,"Inside FAO-funded NLTP that keeps herders, farmers in same place",tribuneonlineng.com
https://von.gov.ng/2021/12/14/fao-funded-nltp-that-keeps-herders-farmers/,2021-12-14,"FAO Funded NLTP That Keeps Herders, Farmers.",von.gov.ng
https://independent.ng/fg-undp-applaud-abdulrazaq-as-kwara-launches-10-year-sustainable-devt-plan/,2021-12-14,"FG, UNDP Applaud Abdulrazaq As Kwara Launches 10-Year Sustainable Devt Plan",independent.ng
https://www.nigeriasun.com/news/271936516/nicaraguans-hail-resumption-of-diplomatic-relations-with-china,2021-12-14,Nicaraguans hail resumption of diplomatic relations with China,nigeriasun.com
https://thenationonlineng.net/nigeria-seeks-to-expand-n56b-green-bond-market/,2021-12-14,Nigeria seeks to expand N56b green bond market,thenationonlineng.net
https://www.vanguardngr.com/2021/12/water-infrastructure-at-risk-requires-n6trn-worth-of-investment-fg/,2021-12-14,"Water infrastructure at risk, requires N6trn worth of investment",vanguardngr.com
https://libertytvradio.com/president-buhari-task-ecowas-leaders-to-forge-stronger-solidarity/,2021-12-13,President Buhari Task ECOWAS Leaders To Forge Stronger Solidarity,libertytvradio.com
https://punchng.com/international-peace-difficult-to-maintain-without-meeting-needs-of-young-people-un-official/,2021-12-14,International peace difficult to maintain without meeting needs of young people -UN official,punchng.com
https://www.sunnewsonline.com/cbn-calls-for-creation-of-climate-related-derivatives/,2021-12-14,CBN calls for creation of climate-related derivatives,sunnewsonline.com
https://thenationonlineng.net/financing-africas-transition-to-sustainable-energy/,2021-12-14,Financing Africa’s transition to sustainable energy,thenationonlineng.net
https://thenationonlineng.net/breaking-corruption-chain-of-enablers-facilitators/,2021-12-14,"Breaking corruption chain of enablers, facilitators",thenationonlineng.net
https://www.pulse.ng/business/nigerias-green-bond-market-exceeds-n55bn-mark-in-4-years/s7s6v0v,2021-12-14,Nigeria’s green bond market exceeds N55bn mark in 4 years,pulse.ng
https://nairametrics.com/2021/12/14/green-bond-market-surpasses-n55-billion-in-4-years-ngx/,2021-12-14,Green bond market surpasses N55 billion in 4 years – NGX,nairametrics.com
https://www.today.ng/news/world/confirms-record-38c-temperature-arctic-402509,2021-12-14,UN confirms record 38C temperature for the Arctic,today.ng
https://www.blueprint.ng/collaboration-as-a-tool-for-implementing-the-glasgow-climate-pact/,2021-12-14,Collaboration as a tool for implementing the Glasgow Climate Pact,blueprint.ng
https://theeagleonline.com.ng/convocation-fasina-has-settled-inherited-rift-between-fuoye-management-and-our-union-nasu/,2021-12-14,Convocation: Fasina has settled inherited rift between FUOYE management and our union –NASU,theeagleonline.com.ng
http://saharareporters.com/2021/12/14/89-people-killed-mysterious-disease-hits-south-sudan,2021-12-14,89 People Killed As Mysterious Disease Hits South Sudan,saharareporters.com
https://tribuneonlineng.com/kwara-launches-10-year-sustainable-development-plan/,2021-12-14,Kwara launches 10-year sustainable development plan,tribuneonlineng.com
