url,date_published,title,newsorg
https://africaprimenews.com/2021/11/11/nigeria-reaffirms-commitment-to-sendai-disaster-risk-reduction-framework-at-cop26/#comment-77367,2021-11-11,Nigeria Reaffirms Commitment To Sendai Disaster Risk Reduction Framework at COP26,africaprimenews.com
https://africaprimenews.com/2021/05/18/post-covid-19-pandemic-nigeria-and-france-must-seize-the-chance-to-strengthen-military-and-economic-ties/#comment-76542,2021-05-18,"POST-COVID-19 PANDEMIC, NIGERIA AND FRANCE MUST SEIZE THE CHANCE TO STRENGTHEN MILITARY AND ECONOMIC TIES",africaprimenews.com
https://africaprimenews.com/2021/10/09/uganda-at-59-after-the-british-left-we-colonised-ourselves/#comment-74096,2021-10-09,"UGANDA AT 59: After The British Left, We Colonised Ourselves",africaprimenews.com
https://www.itv.com/goodmorningbritain,2021-12-06,Good Morning Britain,itv.com
http://www.thetidenewsonline.com/2021/11/22/fg-urges-architects-to-reduce-environmental-impacts-of-buildings/,2021-11-22,FG Urges Architects To Reduce Environmental Impacts Of Buildings,thetidenewsonline.com
http://www.thetidenewsonline.com/2021/11/22/hyprep-begins-complex-sites-clean-up-in-2022-as-senate-advises-ogonisto-own-projects/,2021-11-22,HYPREP Begins Complex Sites’ Clean-Up In 2022 …As Senate Advises OgonisTo Own Projects,thetidenewsonline.com
https://libertytvradio.com/lpg-expansion-fg-to-inject-10-million-gas-cylinders-in-12-pilot-states-osinbajo/,2021-11-23,LPG Expansion: FG To Inject 10 Million Gas Cylinders In 12 Pilot States – Osinbajo,libertytvradio.com
https://libertytvradio.com/federal-government-to-inject-10-million-gas-cylinders-in-next-1-year/,2021-11-23,Federal Government To Inject 10 Million Gas Cylinders In Next 1 Year,libertytvradio.com
https://ynaija.com/all-eyes-on-you-eco-friendly-brands-are-the-future-of-commerce/,2021-11-19,Eco-friendly brands are the future of commerce » YNaija,ynaija.com
https://www.thenews-chronicle.com/why-energy-transition-must-be-guided-by-reason/,2021-11-23,Why Energy Transition Must Be Guided By Reason,thenews-chronicle.com
https://247ureports.com/2021/11/why-we-questioned-n16b-erosion-management-loan-repayment-ekweremadu/,2021-11-23,Why We Questioned N16B Erosion Management loan repayment – Ekweremadu,247ureports.com
https://leadership.ng/el-rufai-others-affirm-support-for-africa-uae-trade-investment-forum/,2021-11-23,"El-Rufai, Others Affirm Support For Africa-UAE Trade, Investment Forum",leadership.ng
https://leadership.ng/gdp-agriculture-in-sluggish-growth-as-insecurity-remains-a-threat/,2021-11-23,GDP: Agriculture In Sluggish Growth As Insecurity Remains A Threat,leadership.ng
https://leadership.ng/nigerian-auto-coys-to-start-exporting-vehicles-across-africa-naddc-boss/,2021-11-23,Nigerian Auto Coys To Start Exporting Vehicles Across Africa,leadership.ng
https://investing.newsdayngonline.com/future-returns-millennials-and-sustainable-investing-barrons/,2021-11-23,Future Returns: Millennials and Sustainable Investing – Barron’s,newsdayngonline.com
https://www.premiumtimesng.com/business/business-news/497046-oil-prices-surge-as-u-s-opens-reserves-to-force-prices-down.html,2021-11-23,Oil prices surge as U.S. opens reserves to force prices down,premiumtimesng.com
https://thenationonlineng.net/fed-govt-plans-injection-of-10m-gas-cylinders-in-12-states-says-osinbajo/,2021-11-23,"Fed Govt plans injection of 10m gas cylinders in 12 states, says Osinbajo",thenationonlineng.net
https://punchng.com/osinbajo-alaafin-launch-centre-for-yoruba-arts-in-ibadan/,2021-11-23,"Osinbajo, Alaafin launch Centre for Yoruba Arts in Ibadan",punchng.com
https://theeagleonline.com.ng/lagos-open-for-collaboration-investments-from-willing-partners-says-sanwo-olu/,2021-11-23,"Lagos open for collaboration, investments from willing partners, says Sanwo-Olu",theeagleonline.com.ng
https://solar-energy.newsdayngonline.com/bath-area-schools-to-use-solar-energy-in-effort-to-save-40000-annually-pressherald-com/,2021-11-23,Bath-area schools to use solar energy in effort to save $40000 annually – pressherald.com,newsdayngonline.com
http://www.thetidenewsonline.com/2021/11/24/police-lobby-for-cctv-in-stations-2/,2021-11-24,Police Lobby For CCTV In Stations,thetidenewsonline.com
http://www.thetidenewsonline.com/2021/11/24/ncc-to-determine-call-determination-rates-for-sns-providers/,2021-11-24,NCC To Determine Call Determination Rates For SNS Providers,thetidenewsonline.com
http://www.thetidenewsonline.com/2021/11/24/fg-trains-10000-women-pwds-on-ict/,2021-11-24,"FG Trains 10,000 Women, PWDs On ICT",thetidenewsonline.com
http://www.thetidenewsonline.com/2021/11/24/innovators-canvass-support-for-ict-start-ups/,2021-11-24,Innovators Canvass Support For ICT Start-Ups,thetidenewsonline.com
https://punchng.com/develop-transport-facilities-with-subsidy-savings-stakeholders/,2021-11-23,Develop transport facilities with subsidy savings –stakeholders,punchng.com
https://punchng.com/lagos-woos-foreign-investors-promises-action-on-climate-change/,2021-11-23,"Lagos woos foreign investors, promises action on climate change",punchng.com
https://www.sunnewsonline.com/women-children-worst-hit-by-activities-of-insurgents-buhari-laments/,2021-11-22,"Women, children worst hit by activities of insurgents, Buhari laments",sunnewsonline.com
https://www.vanguardngr.com/2021/11/lagos-is-ready-for-business-sanwo-olu-assures-sweden-denmark-finland/,2021-11-24,"Lagos is ready for business, Sanwo- Olu assures Sweden, Denmark, Finland",vanguardngr.com
https://tribuneonlineng.com/ikeazor-reiterates-role-of-data-on-environmental-management/,2021-11-23,Ikeazor reiterates role of data on environmental management,tribuneonlineng.com
https://punchng.com/osinbajo-says-with-covid-19-climate-change-nigeria-at-crossroads/,2021-11-24,"Osinbajo says with COVID-19, climate change, Nigeria at crossroads",punchng.com
https://guardian.ng/business-services/insurance/lcci-lagos-commit-to-agribusiness-value-chain-food-security/,2021-11-24,"LCCI, Lagos commit to agribusiness value-chain, food security",guardian.ng
https://www.vanguardngr.com/2021/11/2022-budget-senate-uncovers-padded-n4-5billion-police-barack-project-in-ndlea-budget/,2021-11-24,2022 Budget: Senate uncovers padded N4.5billion Police Barack Project in NDLEA budget,vanguardngr.com
https://tribuneonlineng.com/nation-building-between-restructuring-and-autonomy-1/,2021-11-24,Nation-building: Between restructuring and autonomy (1),tribuneonlineng.com
https://tribuneonlineng.com/nigerians-pleading-with-apc-to-take-them-back-to-pre-2015-period-shagari-ex-minister/,2021-11-24,"Nigerians pleading with APC to take them back to pre-2015 period —Shagari, ex-minister",tribuneonlineng.com
https://tribuneonlineng.com/still-on-the-rising-cost-of-cooking-gas/,2021-11-24,Still on the rising cost of cooking gas,tribuneonlineng.com
https://www.vanguardngr.com/2021/11/yoruba-customs-traditions-going-extinct-alaafin-oyo/,2021-11-24,"Yoruba customs, traditions going extinct — Alaafin Oyo",vanguardngr.com
https://leadership.ng/sanwo-olu-woos-investors-at-nordic-nigeria-summit/,2021-11-24,Sanwo-Olu Woos Investors At Nordic-Nigeria Summit,leadership.ng
https://investing.newsdayngonline.com/state-treasurer-slams-banks-for-not-investing-in-fossil-fuels-parkersburg-news/,2021-11-24,State Treasurer slams banks for not investing in fossil fuels – Parkersburg News,newsdayngonline.com
https://tribuneonlineng.com/desertification-bauchi-assembly-approves-motion-directing-state-government-to-direct-20-lgcs-plant-trees-to-save-human-existence/,2021-11-24,Desertification: Bauchi Assembly approves motion directing state government to direct 20 LGCs plant trees to save human existence,tribuneonlineng.com
https://www.pulse.ng/apo/guinea-conakry-deserves-a-just-energy-transition-and-more-oil-and-gas-investment/l3zgyby,2021-11-24,"Guinea-Conakry Deserves a Just Energy Transition and More Oil and Gas Investment During the MSGBC Oil, Gas and Power Forum in Dakar",pulse.ng
https://guardian.ng/ama-press-releases/west-africas-circular-economy-efforts-at-the-forefront-of-fostering-a-more-sustainable-future/,2021-11-24,West Africa’s circular economy efforts at the forefront of fostering a more sustainable future,guardian.ng
https://www.channelstv.com/2021/11/24/petrolhead-novelist-trampolinist-for-post-merkel-cabinet/,2021-11-24,"Petrolhead, Novelist, Trampolinist For Post-Merkel Cabinet",channelstv.com
https://investing.newsdayngonline.com/stock-picks-to-buy-future-investing-themes-10-year-leaders-rbc-business-insider/,2021-11-24,"Stock Picks to Buy, Future Investing Themes, 10 Year Leaders: RBC – Business Insider",newsdayngonline.com
https://newsdiaryonline.com/strike-by-research-institutes-workers-threat-to-food-security-researchers/,2021-11-24,Strike by research institutes’ workers threat to food security – Researchers,newsdiaryonline.com
https://www.vanguardngr.com/2021/11/climate-change-act-will-put-nigeria-on-toes-create-wealth-for-all-sam-onuigbo/,2021-11-24,Climate Change Act will put Nigeria on toes; create wealth for all,vanguardngr.com
https://www.thenews-chronicle.com/cost-of-cooking-gas-okowa-sends-strong-message-to-fg/,2021-11-24,Cost of cooking gas: Okowa sends strong message to FG,thenews-chronicle.com
https://www.thenews-chronicle.com/west-africas-circular-economy-efforts-at-the-forefront-of-fostering-a-more-sustainable-future/,2021-11-24,West Africa’s circular economy efforts at the forefront of fostering a more sustainable future,thenews-chronicle.com
https://www.thenews-chronicle.com/a-just-energy-transition-for-guinea-conakry/,2021-11-24,A Just Energy Transition for Guinea-Conakry,thenews-chronicle.com
https://punchng.com/reps-to-create-10-year-road-map-for-economic-diversification/,2021-11-24,Reps to create 10-year road map for economic diversification,punchng.com
https://www.bellanaija.com/2021/11/bnsxsunlight21sustainably-fashionable-gathering/,2021-11-24,#BNSxSUNLIGHT21: Everything To Know About The BellaNaija Style x SUNLIGHT “Sustainably Fashionable” Gathering,bellanaija.com
https://www.opinionnigeria.com/a-blueprint-on-containing-nuclear-weapon-proliferation-by-moshood-olajide/,2021-11-24,A Blueprint on Containing Nuclear Weapon Proliferation -By Moshood Olajide,opinionnigeria.com
https://tribuneonlineng.com/climate-change-reps-to-provide-10-year-economic-framework-to-develop-non-oil-sector/,2021-11-24,Climate change: Reps to provide 10-year economic framework to develop non-oil sector,tribuneonlineng.com
https://www.nigerianeye.com/2021/11/reps-to-create-10-year-road-map-for.html,2021-11-24,Reps to create 10-year road map for economic diversification,nigerianeye.com
https://promptnewsonline.com/climate-change-rep-advices-fg-to-harness-other-sources-of-revenue/,2021-11-24,Climate Change: Rep advices FG to harness other sources of revenue,promptnewsonline.com
https://ionigeria.com/jeff-bezos-gives-us100-million-to-obama-foundation-in-donation-spree/,2021-11-24,Jeff Bezos gives US$100 million to Obama Foundation in donation spree,ionigeria.com
https://www.blueprint.ng/2021-focac-building-the-philosophy-of-a-shared-future-for-humanity/,2021-11-24,2021 FOCAC: Building the philosophy of a shared future for humanity,blueprint.ng
https://dailypost.ng/2021/11/24/desertification-bauchi-assembly-calls-on-state-govt-to-direct-20-lgas-to-plant-trees/,2021-11-24,Desertification: Bauchi Assembly calls on state govt to direct 20 LGAs to plant trees,dailypost.ng
https://www.ripplesnigeria.com/opinion-behold-the-junketing-president/,2021-11-24,"OPINION: Behold, The Junketing President!",ripplesnigeria.com
https://tribuneonlineng.com/reps-move-to-develop-10-year-roadmap-on-economic-diversification-revenue-generation/,2021-11-24,"Reps move to develop 10-year roadmap on economic diversification, revenue generation",tribuneonlineng.com
https://www.vanguardngr.com/2021/11/investments-sanwo-olu-seeks-collaboration-with-sweden-denmark-finland/,2021-11-23,"Investments: Sanwo-Olu seeks collaboration with Sweden, Denmark, Finland",vanguardngr.com
https://newsdiaryonline.com/undp-lauds-imo-for-sustaining-economic-revitalisation-programme/,2021-11-24,UNDP lauds Imo for sustaining Economic Revitalisation Programme,newsdiaryonline.com
https://www.premiumtimesng.com/news/top-news/497171-eu-to-support-nigeria-in-establishing-sgbv-courts.html,2021-11-24,EU to support Nigeria in establishing SGBV courts,premiumtimesng.com
https://punchng.com/avoiding-the-rivers-of-fire/,2021-11-24,Avoiding the rivers of fire,punchng.com
https://punchng.com/swedens-first-female-pm-elect-resigns-hours-after-appointment/,2021-11-24,Sweden's first female PM-elect resigns hours after appointment,punchng.com
https://investing.newsdayngonline.com/how-to-learn-about-sustainable-investing-in-corvallis-corvallis-gazette-times/,2021-11-24,How to learn about ‘sustainable investing’ in Corvallis – Corvallis Gazette Times,newsdayngonline.com
https://thenationonlineng.net/food-insecurity-in-nigeria/,2021-11-25,Food insecurity in Nigeria,thenationonlineng.net
https://www.sunnewsonline.com/?p=807377,2021-11-25,China-Africa 8th ministerial conference: Matters arising,sunnewsonline.com
https://www.vanguardngr.com/2021/11/edo-rep-member-cautions-fg-on-climate-change/,2021-11-25,Edo Rep member cautions FG on climate change,vanguardngr.com
https://thenationonlineng.net/cop26-glasgow-pact-and-nigerias-plans-toward-climate-change/,2021-11-25,#COP26: Glasgow pact and Nigeria’s plans toward climate change,thenationonlineng.net
https://guardian.ng/features/stem-as-stepping-stone-for-nigerian-girls/,2021-11-25,STEM as stepping stone for Nigerian girls,guardian.ng
https://von.gov.ng/2021/11/25/covid-19-climate-change-already-disrupting-life-vp-osinbajo/,2021-11-25,"COVID-19, climate change already disrupting life -VP Osinbajo",von.gov.ng
https://www.pulse.ng/apo/the-9th-humanitarian-symposium-to-review-best-practices-and-africas-solutions-in/hqxsqb4,2021-11-25,The 9th Humanitarian Symposium to review best practices and Africa's solutions in addressing climate change in the humanitarian space,pulse.ng
https://www.pulse.ng/news/local/climate-clock-world-appoints-sdg-advocate-chuks-anyaduba-as-director-for-projects-and/ljcql94,2021-11-25,"Climate Clock World appoints SDG advocate Chuks Anyaduba as Director for Projects & Partnerships, Climate Clock Nigeria",pulse.ng
https://guardian.ng/news/swedens-pm-elect-magdalena-andersson-resigns-hours-after-being-appointed/,2021-11-25,Sweden's PM-elect resigns hours after being appointed,guardian.ng
https://punchng.com/eu-threatening-to-reject-nigerias-cocoa-say-farmers/,2021-11-25,"EU threatening to reject Nigeria's cocoa, say farmers",punchng.com
https://www.nigerianbulletin.com/threads/cop26-glasgow-pact-and-nigeria%E2%80%99s-plans-toward-climate-change-%E2%80%93-the-nation-newspaper.453077/,2021-11-25,#COP26: Glasgow pact and Nigeria’s plans toward climate change – The Nation Newspaper,nigerianbulletin.com
https://punchng.com/climate-change-edo-rep-urges-fg-to-explore-other-sources-of-revenue-generation/,2021-11-25,Climate change: Edo Rep urges FG to explore other sources of revenue generation,punchng.com
https://leadership.ng/nigeria-losses-100m-yearly-to-un-revamped-cocoa-sector-cfan/,2021-11-25,Nigeria Losses $100m Yearly To Un-revamped Cocoa Sector – CFAN,leadership.ng
https://leadership.ng/firm-recommits-to-closing-service-gaps-in-engineering-standards/,2021-11-25,Firm Recommits To Closing Service Gaps In Engineering Standards,leadership.ng
https://authorityngr.com/2021/11/25/china-keeps-stable-healthy-development-of-its-national-carbon-emissions-trading-market/,2021-01-01,"China keeps stable, healthy development of its national carbon emissions trading market",authorityngr.com
https://tribuneonlineng.com/climate-change-rep-member-warns-over-imminent-danger/,2021-11-25,Climate change: Rep member warns over imminent danger,tribuneonlineng.com
https://tribuneonlineng.com/climate-change-law-my-expectations-are-limited-nnimmo-bassey/,2021-11-25,Climate change law: My expectations are limited — Nnimmo Bassey,tribuneonlineng.com
https://tribuneonlineng.com/cop26-uk-to-support-nigeria-on-decarbonisation-of-power-sector/,2021-11-25,COP26: UK to support Nigeria on decarbonisation of power sector,tribuneonlineng.com
https://authorityngr.com/2021/11/25/eu-pledges-to-deepen-partnership-with-nigeria/,2021-01-01,EU pledges to deepen partnership with Nigeria,authorityngr.com
https://globalvillageextra.com/en/index.php/2021/11/25/nigeria-loses-100m-yearly-to-un-revamped-cocoa-sector-cfan/,2021-11-25,Nigeria Loses $100m Yearly To Un-revamped Cocoa Sector – CFAN,globalvillageextra.com
https://hallmarknews.com/in-reality-what-does-cop26-mean-for-small-businesses/,2021-11-25,In Reality – What Does COP26 Mean for Small Businesses?,hallmarknews.com
https://globalvillageextra.com/en/index.php/2021/11/25/swedens-pm-elect-resigns-hours-after-being-appointed/,2021-11-25,Sweden’s PM-elect Resigns Hours After Being Appointed,globalvillageextra.com
https://www.pulse.ng/apo/safeguarding-the-planet/g4m9b8j,2021-11-25,Safeguarding the Planet,pulse.ng
https://promptnewsonline.com/eib-president-werner-hoyer-cabinet-secretary-open-east-africa-hub/,2021-11-25,"EIB President Werner Hoyer, Cabinet Secretary open East Africa Hub",promptnewsonline.com
https://www.sunnewsonline.com/?p=807773,2021-11-25,"Climate Change Act: REPRC-EfD commend Buhari, National Assembly",sunnewsonline.com
https://www.sunnewsonline.com/oil-spill-fg-to-hand-down-stiffer-punishments-to-oil-companies/,2021-11-25,Oil Spill: FG to hand down stiffer punishments to oil companies,sunnewsonline.com
https://von.gov.ng/2021/11/25/nigeria-backs-climate-change-act-environment-minister/,2021-11-25,Nigeria backs Climate Change Act-Environment Minister,von.gov.ng
https://www.pulse.ng/apo/us-commits-to-support-tanzanias-youth-as-usaid-turns-60/1fcv91v,2021-11-25,US Commits to Support Tanzania's Youth as USAID Turns 60,pulse.ng
https://www.sunnewsonline.com/climate-change-rep-member-warns-fg-of-imminent-danger/,2021-11-25,Climate Change: Rep member warns FG of imminent danger,sunnewsonline.com
http://saharareporters.com/2021/11/25/behold-junketing-president-ozodinukwe-okenwa,2021-11-25,"Behold, The Junketing President! By Ozodinukwe Okenwa",saharareporters.com
https://leadership.ng/oml-29-oil-spill-federal-govt-mulls-stiffer-punishments-for-oil-coys/,2021-11-25,OML 29 Oil Spill: Federal Govt Mulls Stiffer Punishments For Oil Coys,leadership.ng
https://www.blueprint.ng/pardon-nigerias-national-strategic-interest/,2021-11-25,"Pardon, Nigeria’s national strategic Interest?",blueprint.ng
https://tribuneonlineng.com/zero-oil-plan-will-bring-economic-diversification-―-osinbajo/,2021-11-25,Zero-oil plan will bring economic diversification ― Osinbajo,tribuneonlineng.com
https://pmnewsnigeria.com/2021/11/25/nigerian-economic-diversification-on-course-osinbajo/,2021-11-25,Nigerian economic diversification on course,pmnewsnigeria.com
https://promptnewsonline.com/fg-seeks-stiffer-penalties-for-crude-oil-spill-gas-flaring-minister/,2021-11-25,"FG seeks stiffer penalties for crude oil spill, gas flaring – Minister",promptnewsonline.com
https://globalvillageextra.com/en/index.php/2021/11/25/behold-the-junketing-president/,2021-11-25,"Behold, The Junketing President!",globalvillageextra.com
https://punchng.com/ecowas-to-fund-71-of-budget-with-community-levy/,2021-11-25,ECOWAS to fund 71% of budget with community levy,punchng.com
https://punchng.com/nigeria-on-course-with-economic-diversification-says-osinbajo/,2021-11-25,"Nigeria on course with economic diversification, says Osinbajo",punchng.com
https://thewillnigeria.com/news/fg-considers-stiffer-punishment-for-oil-spill/,2021-11-25,FG Considers Stiffer Punishment For Oil Spill,thewillnigeria.com
https://theeagleonline.com.ng/with-focus-on-non-oil-exports-economic-diversification-on-course-osinbajo/,2021-11-25,"With focus on non-oil exports, economic diversification on course-Osinbajo",theeagleonline.com.ng
https://solar-power.newsdayngonline.com/helienes-solar-power-components-business-set-to-shine-as-it-helps-the-us-build-back-better-proactive-investors-usa-canada/,2021-11-25,Heliene”s solar power components business set to shine as it helps the US “Build Back Better” – Proactive Investors USA & Canada,newsdayngonline.com
https://von.gov.ng/2021/11/25/nigerias-diversification-on-course-focus-on-non-oil-export-vp-osinbajo/,2021-11-25,"“Nigeria’s diversification on course, focus on non-oil export” – VP Osinbajo",von.gov.ng
https://punchng.com/fg-state-collaborate-on-autogas-stations/,2021-11-25,"FG, state collaborate on autogas stations",punchng.com
https://www.sunnewsonline.com/spillage-fg-talks-tough-vows-to-punish-oil-coys/,2021-11-26,"Spillage: FG talks tough, vows to punish oil coys",sunnewsonline.com
https://thenationonlineng.net/devastation-of-niger-delta-is-like-hiroshimas-says-minister/,2021-11-26,"Devastation of Niger Delta is like Hiroshima’s, says minister",thenationonlineng.net
https://www.vanguardngr.com/2021/11/oil-spills-stiffer-penalties-coming-for-oil-firms-fg/,2021-11-26,Oil spills: Stiffer penalties coming for oil firms — FG,vanguardngr.com
https://www.ripplesnigeria.com/we-are-getting-away-from-oil-and-gas-era-osinbajo/,2021-11-26,We are getting away from oil and gas era —Osinbajo,ripplesnigeria.com
https://punchng.com/amid-planned-petrol-subsidy-removal-obasanjo-says-nigeria-must-commit-to-renewable-energy/,2021-11-26,"Amid planned petrol subsidy removal, Obasanjo says Nigeria must commit to renewable energy",punchng.com
https://dailypost.ng/2021/11/26/nigeria-should-produce-electricity-from-energy-our-time-on-earth-limited-obasanjo/,2021-11-26,"Nigeria should produce electricity from energy, our time on earth limited",dailypost.ng
https://www.aproko247.com/2021/11/26/sanwo-olu-commissions-40-metric-tons-gas-plant-in-ikorodu/,2021-11-26,Sanwo-Olu Commissions 40 Metric Tons Gas Plant in Ikorodu,aproko247.com
https://thenationonlineng.net/elimination-of-child-labour-critical-to-west-africas-development-say-experts/,2021-11-26,"Elimination of child labour critical to West Africa’s development, say experts",thenationonlineng.net
https://thenationonlineng.net/fed-govt-deepens-gas-utilisation-to-attract-investment/,2021-11-26,Fed Govt deepens gas utilisation to attract investment,thenationonlineng.net
https://www.premiumtimesng.com/regional/ssouth-west/497485-sanwo-olu-commissions-40-metric-tons-lpg-plant.html,2021-11-26,Sanwo-Olu commissions 40-metric tons LPG plant,premiumtimesng.com
https://www.today.ng/business/energy/lagos-governor-commissions-40-metric-tons-lpg-plant-400476,2021-11-26,Lagos governor commissions 40-metric tons LPG plant,today.ng
https://thewillnigeria.com/news/boko-haram-will-soon-recruit-out-of-school-children-obasanjo-warns/,2021-11-26,Boko Haram Will Soon Recruit Out-of-school Children – Obasanjo Warns,thewillnigeria.com
https://globalvillageextra.com/en/index.php/2021/11/26/obasanjo-says-nigeria-must-commit-to-renewable-energy/,2021-11-26,Obasanjo Says Nigeria Must Commit To Renewable Energy,globalvillageextra.com
https://radionigeria.gov.ng/2021/11/26/ecowas/,2021-11-26,West Africa excels in development indices-ECOWAS,radionigeria.gov.ng
https://www.blueprint.ng/stakeholders-urge-lagos-govt-to-save-rabaka-other-coastal-communities/,2021-11-26,"Stakeholders urge Lagos govt to save Rabaka, other coastal communities",blueprint.ng
https://globalvillageextra.com/en/index.php/2021/11/26/lagos-commissions-gas-plant-to-boost-supply-of-cooking-gas/,2021-11-26,Lagos Commissions Gas Plant To Boost Supply Of Cooking Gas,globalvillageextra.com
https://newsdiaryonline.com/fg-unrelenting-in-restoring-nigeria-to-economic-growth-osinbajo/,2021-11-26,FG unrelenting in restoring Nigeria to economic growth – Osinbajo,newsdiaryonline.com
https://www.vanguardngr.com/2021/11/eu-to-fund-special-court-for-sexual-and-gender-based-violence-in-nigeria/,2021-11-26,EU to fund special court for sexual and gender-based violence in Nigeria,vanguardngr.com
https://www.pulse.ng/apo/transforming-africas-agrifood-systems-requires-coordinated-policies-across-sectors/c8gbm52,2021-11-26,Transforming Africa's Agrifood Systems Requires Coordinated Policies Across Sectors,pulse.ng
https://dailypost.ng/2021/11/26/varsity-don-calls-for-establishment-of-national-lakes-service-commission/,2021-11-26,Varsity Don calls for establishment of national lakes service commission,dailypost.ng
https://dailypost.ng/2021/11/26/how-nigeria-can-create-wealth-good-paying-jobs-vp-osinbajo/,2021-11-26,"How Nigeria can create wealth, good paying jobs",dailypost.ng
https://von.gov.ng/2021/11/26/productivity-value-addition-key-to-development-plan-vp-osinbajo/,2021-11-26,"Productivity: Value addition, key to Development Plan – VP Osinbajo",von.gov.ng
https://www.pulse.ng/apo/empowering-communities-to-reduce-household-air-pollution/meqcy7e,2021-11-26,Empowering Communities to Reduce Household Air Pollution,pulse.ng
http://www.thetidenewsonline.com/2021/11/26/this-generation-youths/,2021-11-26,This Generation Youths,thetidenewsonline.com
https://www.vanguardngr.com/2021/11/fg-unrelenting-in-restoring-nigeria-to-economic-growth-osinbajo/,2021-11-26,FG unrelenting in restoring Nigeria to economic growth – Osinbajo,vanguardngr.com
https://theeagleonline.com.ng/sanwo-olu-commissions-40-metric-tons-gas-plant-in-ikorodu/,2021-11-26,Sanwo-Olu commissions 40 metric tons gas plant in Ikorodu,theeagleonline.com.ng
https://promptnewsonline.com/africa-investment-forum-a-continent-its-destiny-and-capital-by-fredrick-nwabufo/,2021-11-26,"Africa Investment Forum: A continent; its destiny and capital, by Fredrick Nwabufo",promptnewsonline.com
