url,date_published,title,newsorg
https://guardian.ng/news/osinbajo-world-bank-md-discuss-climate-change-energy-access/,2021-11-12,"Osinbajo, World Bank MD discuss climate change, energy access",guardian.ng
https://www.premiumtimesng.com/news/top-news/495003-eu-adopts-energy-transition-similar-to-osinbajos-stance-but-climate-activists-kick.html,2021-11-12,EU adopts energy transition similar to Osinbajo's stance but climate activists kick,premiumtimesng.com
https://www.channelstv.com/2021/11/12/enhancing-capacity-for-local-vaccine-production-crucial-for-africa-says-osinbajo/,2021-11-12,"Enhancing Capacity For Local Vaccine Production Crucial For Africa, Says Osinbajo",channelstv.com
https://pmnewsnigeria.com/2021/11/12/jonathan-charges-world-leaders-on-climate-financing-emission-cuts/,2021-11-12,"Jonathan charges world leaders on climate financing, emission cuts",pmnewsnigeria.com
https://promptnewsonline.com/osinbajo-world-bank-md-discuss-climate-change-energy-access/,2021-11-12,"Osinbajo, World Bank MD discuss climate change, energy access",promptnewsonline.com
https://guardian.ng/news/world-needs-trillions-to-face-climate-threat-draft-un-report/,2021-11-12,World needs trillions to face climate threat: draft UN report,guardian.ng
https://leadership.ng/separatist-groups-enjoying-global-sympathy-nsa-raises-alarm/,2021-11-12,"Separatist Groups Enjoying Global Sympathy, NSA Raises Alarm",leadership.ng
https://promptnewsonline.com/institute-to-establish-environment-safety-research-centre/,2021-11-12,"Institute to establish environment, safety research centre",promptnewsonline.com
https://independent.ng/jonathan-tasks-world-leaders-on-climate-financing-emission-cut/,2021-11-12,"Jonathan Tasks World Leaders On Climate Financing, Emission Cut",independent.ng
https://thewillnigeria.com/news/separatist-groups-enjoying-global-sympathy-nsa/?utm_source=rss&utm_medium=rss&utm_campaign=separatist-groups-enjoying-global-sympathy-nsa,2021-11-12,Separatist Groups Enjoying Global Sympathy – NSA,thewillnigeria.com
https://www.blueprint.ng/osinbajo-world-bank-md-discuss-climate-change-energy-access/,2021-11-12,"Osinbajo, World Bank MD discuss climate change, energy access",blueprint.ng
https://www.thenews-chronicle.com/cop26-and-africas-energy-poverty-a-roadmap-to-ending-energy-poverty-by-2030/,2021-11-12,COP26 and Africa’s Energy Poverty: A Roadmap to Ending Energy Poverty by 2030,thenews-chronicle.com
https://ynaija.com/egypt-to-host-cop27-international-climate-conference-in-2022-ministry-5-things-that-should-matter-today/,2021-11-12,Egypt to host COP27 international climate conference in 2022 -ministry,ynaija.com
https://solar-energy.newsdayngonline.com/does-solar-energy-have-a-bright-future-or-is-it-still-just-a-fantasy-yahoo-news/,2021-11-12,Does solar energy have a bright future? Or is it still just a fantasy? – Yahoo News,newsdayngonline.com
https://www.vanguardngr.com/2021/11/former-president-jonathan-tasks-world-leaders-on-climate-financing-emission-cuts/,2021-11-12,"Former President Jonathan tasks world leaders on climate financing, emission cuts",vanguardngr.com
https://www.channelstv.com/2021/11/12/uk-turns-pessimistic-as-cop26-misses-deadline/,2021-11-12,UK Turns Pessimistic As COP26 Misses Deadline,channelstv.com
https://guardian.ng/news/fg-will-keep-its-climate-change-commitments-osinbajo/,2021-11-12,FG will keep its climate change commitments – Osinbajo,guardian.ng
https://www.ripplesnigeria.com/nigeria-will-fulfill-its-climate-change-commitments-osinbajo/,2021-11-12,Nigeria will fulfill its climate change commitments –Osinbajo,ripplesnigeria.com
https://www.vanguardngr.com/2021/11/fg-will-keep-its-climate-change-commitments-osinbajo/,2021-11-12,FG will keep its climate change commitments – Osinbajo,vanguardngr.com
https://ionigeria.com/factionalisation-of-terrorist-groups-causing-additional-burden-nsa/?utm_source=rss&utm_medium=rss&utm_campaign=factionalisation-of-terrorist-groups-causing-additional-burden-nsa,2021-11-12,Factionalisation Of Terrorist Groups Causing Additional Burden – NSA,ionigeria.com
https://theeagleonline.com.ng/climate-change-and-energy-transition-we-are-focused-on-what-works-for-our-people-says-osinbajo/?utm_source=rss&utm_medium=rss&utm_campaign=climate-change-and-energy-transition-we-are-focused-on-what-works-for-our-people-says-osinbajo,2021-11-12,"Climate change and energy transition: We are focused on what works for our people, says Osinbajo",theeagleonline.com.ng
https://www.newtelegraphng.com/climate-change-were-focused-on-what-works-for-our-people-osinbajo/,2021-11-12,Climate Change: We're focused on what works for our people,newtelegraphng.com
https://globalvillageextra.com/en/index.php/2021/11/12/uk-turns-pessimistic-as-cop26-misses-deadline/,2021-11-12,UK Turns Pessimistic As COP26 Misses Deadline,globalvillageextra.com
https://www.channelstv.com/2021/11/12/climate-change-fg-is-focused-on-what-works-for-nigerians-says-osinbajo/,2021-11-12,"Climate Change: FG Is Focused On What Works For Nigerians, Says Osinbajo",channelstv.com
https://von.gov.ng/2021/11/12/nigeria-remains-commited-to-climate-change-resolutions-vp-osinbajo/,2021-11-12,Nigeria remains committed to climate change resolutions – VP Osinbajo,von.gov.ng
https://www.sunnewsonline.com/cop26-and-global-action-to-save-the-environment/,2021-11-13,COP26 and global action to save the environment,sunnewsonline.com
https://www.newtelegraphng.com/jonathan-charges-world-leaders-on-climate-financing-emission-cuts/,2021-11-13,"Jonathan charges world leaders on climate financing, emission cuts",newtelegraphng.com
https://libertytvradio.com/us-secretary-of-state-to-visit-nigeria-kenya-and-senegal/,2021-11-12,"US Secretary Of State To Visit Nigeria, Kenya, And Senegal",libertytvradio.com
https://libertytvradio.com/cop26-climate-summit-in-final-stretch-with-1-5c-goal-at-risk/,2021-11-12,Cop26: Climate Summit In Final Stretch With 1.5C Goal At Risk,libertytvradio.com
https://www.sunnewsonline.com/jonathan-tasks-world-leaders-on-climate-financing-emission-cuts/,2021-11-13,"Jonathan tasks world leaders on climate financing, emission cuts",sunnewsonline.com
https://authorityngr.com/2021/11/12/we-have-never-prevented-freedom-of-expression-nsa/?utm_source=rss&utm_medium=rss&utm_campaign=we-have-never-prevented-freedom-of-expression-nsa,2021-11-12,We have never prevented freedom of expression – NSA,authorityngr.com
https://www.vanguardngr.com/2021/11/cop26-ijaw-diaspora-council-demands-fg-intl-community-to-urgently-stop-ravaging-oil-spillage-in-nembe/,2021-11-13,"COP26: Ijaw Diaspora Council demands FG, int’l community to urgently stop ravaging oil spillage in Nembe",vanguardngr.com
https://thenationonlineng.net/climate-change-nigeria-will-fulfill-commitments-in-a-way-that-benefit-nigerians-osinbajo/,2021-11-13,Climate change: Nigeria will fulfill commitments in a way that benefit Nigerians —Osinbajo,thenationonlineng.net
https://punchng.com/fg-will-keep-its-climate-change-commitments-osinbajo/,2021-11-13,FG will keep its climate change commitments –Osinbajo,punchng.com
https://www.ripplesnigeria.com/osinbajo-slams-religious-leaders-over-hate-speech/,2021-11-13,Osinbajo slams religious leaders over hate speech,ripplesnigeria.com
https://leadership.ng/connecting-africa-through-sealink-project-2/,2021-11-13,Connecting Africa Through Sealink Project,leadership.ng
https://www.sunnewsonline.com/why-terrorists-separatist-groups-becoming-popular-nsa/,2021-11-13,"Why terrorists, separatist groups becoming popular – NSA",sunnewsonline.com
https://www.today.ng/news/nigeria/nsa-terrorists-separatist-groups-popular-398793,2021-11-13,"NSA: Why terrorists, separatist groups becoming popular",today.ng
https://independent.ng/marathon-negotiations-expected-as-cop26-runs-into-overtime/,2021-11-13,Marathon Negotiations Expected As COP26 Runs Into Overtime,independent.ng
https://independent.ng/biden-chinas-xi-will-hold-virtual-meeting-on-monday/,2021-11-13,"Biden, China’s Xi Will Hold Virtual Meeting On Monday",independent.ng
https://www.icirnigeria.org/britain-to-help-nigeria-access-100-billion-climate-fund/,2021-11-13,Britain to help Nigeria access $100 billion climate fund,icirnigeria.org
https://dailypost.ng/2021/11/13/nigeria-will-fulfil-climate-commitments-osinbajo-insists/,2021-11-13,Nigeria will fulfil climate commitments,dailypost.ng
https://thewillnigeria.com/news/international-aviation-climate-ambition-reflects-airlines-net-zero-goal/?utm_source=rss&utm_medium=rss&utm_campaign=international-aviation-climate-ambition-reflects-airlines-net-zero-goal,2021-11-13,International Aviation Climate Ambition Reflects Airlines’ Net-Zero Goal,thewillnigeria.com
https://www.premiumtimesng.com/opinion/495115-cop26-and-the-salience-of-president-buharis-message-by-jerome-okolo.html,2021-11-13,"COP26 and the salience of President Buhari's message, By Jerome Okolo",premiumtimesng.com
https://www.nigerianeye.com/2021/11/nigeria-will-fulfil-climate-commitments.html,2021-11-13,Nigeria will fulfil climate commitments – Osinbajo insists,nigerianeye.com
http://www.nigeriasun.com/news/271718688/cameroon-to-allow-25000-fans-into-wc-qualifier-against-cote-divoire,2021-11-13,"Cameroon to allow 25,000 fans into WC qualifier against Cote d&#039;Ivoire",nigeriasun.com
https://guardian.ng/news/cop26-talks-stumble-on-climate-cash-cliffhanger/,2021-11-13,COP26 talks stumble on climate cash 'cliffhanger',guardian.ng
http://www.nigeriasun.com/news/271719857/cop26-african-youth-demand-rich-nations-fulfill-promises,2021-11-14,COP26: African Youth Demand Rich Nations Fulfill Promises,nigeriasun.com
https://nairametrics.com/2021/11/13/buhari-departs-paris-for-south-africa-for-intra-africa-trade-fair/,2021-11-13,Buhari departs Paris for South Africa to attend Intra-African Trade Fair,nairametrics.com
https://tribuneonlineng.com/fg-has-never-prevented-freedom-of-expression-%e2%80%95-nsa/,2021-11-13,FG has never prevented freedom of expression ― NSA,tribuneonlineng.com
https://independent.ng/un-climate-conference-heads-tentatively-towards-a-deal/,2021-11-13,UN Climate Conference Heads Tentatively Towards A Deal,independent.ng
https://authorityngr.com/2021/11/13/what-has-been-agreed-at-cop26/?utm_source=rss&utm_medium=rss&utm_campaign=what-has-been-agreed-at-cop26,2021-11-13,What has been agreed at COP26,authorityngr.com
https://independent.ng/lasu-begins-race-for-best-african-varsity-with-12-aceitse-proposals-approved-by-narst-international-conference/,2021-11-13,LASU Begins Race For Best African Varsity With 12 ACEITSE Proposals Approved By NARST International Conference,independent.ng
https://punchng.com/nimasa-seeks-national-policy-on-waste-management/,2021-11-13,NIMASA seeks national policy on waste management,punchng.com
https://www.channelstv.com/2021/11/13/cop26-deal-in-sight-as-nations-rally-for-compromise/,2021-11-13,COP26 Deal In Sight As Nations Rally For Compromise,channelstv.com
https://theeagleonline.com.ng/nimasa-seeks-national-policy-on-waste-management/?utm_source=rss&utm_medium=rss&utm_campaign=nimasa-seeks-national-policy-on-waste-management,2021-11-13,NIMASA seeks national policy on waste management,theeagleonline.com.ng
https://investing.newsdayngonline.com/for-christians-all-investing-is-impact-investing-daily-signal/,2021-11-13,"For Christians, All Investing Is Impact Investing – Daily Signal",newsdayngonline.com
https://newsday.com.ng/nerc-increases-cost-of-electricity-metres-by-almost-100/,2021-11-13,NERC increases cost of electricity metres by almost 100%,newsday.com.ng
https://newsday.com.ng/nigerian-idol-returns-for-7th-season/,2021-11-13,Nigerian Idol returns for 7th season,newsday.com.ng
https://newsday.com.ng/us-secretary-of-state-visits-nigeria-to-meet-buhari-over-covid-19-pandemic-insecurity/,2021-11-13,"US Secretary of State visits Nigeria, to meet Buhari over COVID-19 pandemic, insecurity",newsday.com.ng
https://www.premiumtimesng.com/news/headlines/495199-breaking-cop26-climate-deal-reached-in-glasgow.html,2021-11-13,BREAKING: COP26: Climate deal reached in Glasgow,premiumtimesng.com
https://www.channelstv.com/2021/11/13/climate-change-cop26-deal-clinched-as-nations-rally-to-compromise/,2021-11-13,Climate Change: COP26 Deal Clinched As Nations Rally To Compromise,channelstv.com
https://www.channelstv.com/2021/11/13/deal-reached-at-cop26-climate-summit/,2021-11-13,Climate Change: COP26 Deal Clinched As Nations Rally To Compromise,channelstv.com
http://www.nigeriasun.com/news/271720259/africa-great-green-wall-shifts-focus-to-contain-sahara,2021-11-14,Africa&#039;s Great Green Wall Shifts Focus to Contain Sahara,nigeriasun.com
https://punchng.com/cop26-summit-strikes-hard-fought-deal-un-says-not-enough/,2021-11-13,"COP26 summit strikes hard-fought deal, UN says 'not enough'",punchng.com
https://pmnewsnigeria.com/2021/11/13/cop26-climate-summit-agrees-to-cut-coal-fossil-fuel/,2021-11-13,"COP26 climate summit agrees to cut coal, fossil fuel",pmnewsnigeria.com
https://www.theinfostride.com/africas-6-7tr-fossil-fuels-resources-may-remain-stranded-report/,2021-11-13,Africa’s $6.7tr Fossil Fuels Resources May Remain Stranded,theinfostride.com
https://www.vanguardngr.com/2021/11/phase-down-no-phase-out-tough-climate-deal-struck-at-cop26/,2021-11-13,"Phase Down, No Phase Out: Tough climate deal struck at COP26",vanguardngr.com
https://punchng.com/the-return-of-rebranding/,2021-11-13,The return of rebranding,punchng.com
https://punchng.com/emmanuel-announces-plan-for-10-additional-aircraft-for-ibom-air/,2021-11-13,Emmanuel announces plan for 10 additional aircraft for Ibom Air,punchng.com
https://punchng.com/development-of-automotive-air-conditioning/,2021-11-14,Development of automotive air conditioning,punchng.com
https://solar-power.newsdayngonline.com/milwaukee-celebrates-most-successful-solar-power-group-buy-to-date-milwaukee-courier-weekly-newspaper/,2021-11-14,Milwaukee Celebrates Most Successful Solar Power Group Buy to Date – Milwaukee Courier Weekly Newspaper,newsdayngonline.com
https://von.gov.ng/2021/11/14/cop26-world-leaders-strike-new-global-climate-deal/,2021-11-14,COP26: World leaders strike new global climate deal,von.gov.ng
https://guardian.ng/opinion/nothing-for-you-where-everything-is-for-you/,2021-11-14,Nothing for you where everything is for you,guardian.ng
https://guardian.ng/opinion/fighting-climate-change-and-halting-loss-of-biodiversity/,2021-11-14,Fighting climate change and halting loss of biodiversity,guardian.ng
https://leadership.ng/nigeria-may-take-50-years-to-achieve-energy-transition/,2021-11-14,Nigeria May Take 50 Years To Achieve Energy Transition,leadership.ng
https://www.today.ng/news/africa/bank-extreme-poverty-highest-africa-398928,2021-11-14,World Bank: Extreme poverty highest in Africa,today.ng
https://guardian.ng/news/us-china-trade-taiwan-warnings-ahead-of-biden-xi-summit/,2021-11-14,"US, China trade Taiwan warnings ahead of Biden-Xi summit",guardian.ng
https://authorityngr.com/2021/11/14/how-red-china-aims-to-go-green-without-going-broke/?utm_source=rss&utm_medium=rss&utm_campaign=how-red-china-aims-to-go-green-without-going-broke,2021-11-14,How ‘Red China’ aims to go green without going broke,authorityngr.com
https://authorityngr.com/2021/11/14/cop26-keeps-1-5c-alive-and-finalises-paris-agreement/?utm_source=rss&utm_medium=rss&utm_campaign=cop26-keeps-1-5c-alive-and-finalises-paris-agreement,2021-11-14,COP26 keeps 1.5C alive and finalises Paris Agreement,authorityngr.com
https://www.thenews-chronicle.com/why-un-climate-summit-cop26-overshoot-its-time/,2021-11-14,"Why UN Climate Summit, COP26, Overshoot its Time",thenews-chronicle.com
https://www.thenews-chronicle.com/un-chief-on-what-climate-action-struggle-requires/,2021-11-14,UN Chief on What Climate Action Struggle Requires,thenews-chronicle.com
https://www.thenews-chronicle.com/displacement-crisis-surges-with-more-than-84-million-people-affected-globally/,2021-11-14,Displacement Crisis Surges with More than 84 Million People Affected Globally,thenews-chronicle.com
https://leadership.ng/cop26-uk-doles-out-27-5m-to-accelerate-transition-to-net-zero-by-2050-in-lagos-others/,2021-11-14,"COP26: UK Doles Out £27.5M To Accelerate Transition To Net Zero By 2050 In Lagos, Others",leadership.ng
https://leadership.ng/commit-more-to-climate-financing-emission-cuts-jonathan-tells-world-leaders/,2021-11-14,"Commit More To Climate Financing, Emission Cuts, Jonathan Tells World Leaders",leadership.ng
https://guardian.ng/news/world/uks-queen-suffers-sprained-back/,2021-11-14,UK's Queen suffers 'sprained back',guardian.ng
https://punchng.com/uks-queen-elizabeth-suffers-sprained-back-palace/,2021-11-14,UK's Queen Elizabeth suffers 'sprained back' -Palace,punchng.com
https://nairametrics.com/2021/11/14/nimasa-calls-for-development-of-national-policy-on-waste-management/,2021-11-14,NIMASA calls for development of national policy on waste management,nairametrics.com
https://www.vanguardngr.com/2021/11/how-climate-change-affects-our-2021-harvest-nigerian-farmers/,2021-11-14,How climate change affects our 2021 harvest – Nigerian farmers,vanguardngr.com
https://thenationonlineng.net/how-climate-change-affects-our-2021-harvest-nigerian-farmers/,2021-11-14,How climate change affects our 2021 harvest – Nigerian farmers,thenationonlineng.net
https://thenationonlineng.net/heavy-downpour-no-cause-for-alarm-says-nimet/,2021-11-14,"Heavy downpour: No cause for alarm, says NIMet",thenationonlineng.net
https://von.gov.ng/2021/11/14/poultry-farmers-call-for-maize-export-ban/,2021-11-14,Poultry farmers call for maize export ban,von.gov.ng
https://guardian.ng/news/queen-elizabeth-suffers-sprained-back/,2021-11-14,Queen Elizabeth suffers 'sprained back',guardian.ng
https://www.opinionnigeria.com/that-gathering-of-the-vultures-at-the-eagles-square-and-its-warm-fuzzies-the-writing-on-the-wall-by-jimi-bickersteth/,2021-11-14,That Gathering of the Vultures at the Eagles Square and its Warm Fuzzies – the Writing on the Wall -By Jimi Bickersteth,opinionnigeria.com
https://newsday.com.ng/ipob-vows-to-punish-docile-south-east-governors-if-detained-suspected-biafra-agitators-are-not-freed/,2021-11-14,IPOB vows to punish “docile” South-east governors if detained suspected Biafra agitators are not freed,newsday.com.ng
https://www.sunnewsonline.com/well-hit-600tcf-of-gas-if-subsidy-is-removed-sylva-petroleum-ministerwell-hit-600tcf-of-gas-if-subsidy-is-removed-sylva-petroleum-minister/,2021-11-15,"We’ll hit 600tcf of gas if subsidy is removed –Sylva, Petroleum MinisterWe’ll hit 600tcf of gas if subsidy is removed",sunnewsonline.com
https://www.sunnewsonline.com/bua-chairman-seeks-public-private-partnership-with-nigeria-africa/,2021-11-15,"BUA chairman seeks public-private partnership with Nigeria, Africa",sunnewsonline.com
https://guardian.ng/property/where-town-planning-is-in-flight-cities-deteriorate-says-ayinde/,2021-11-15,"Where town planning is in flight, cities deteriorate, says Ayinde",guardian.ng
https://www.vanguardngr.com/2021/11/cop26-is-most-exclusive-climate-negotiations-since-paris-agreement-african-csos/,2021-11-15,COP26 is ‘most exclusive’ climate negotiations since Paris Agreement — African CSOs,vanguardngr.com
https://guardian.ng/business-services/positioning-nigerian-capital-market-for-gains-of-pia/,2021-11-15,Positioning Nigerian capital market for gains of PIA,guardian.ng
https://thenationonlineng.net/how-federal-govt-plans-to-utilise-fresh-foreign-loans/,2021-11-15,How Federal Govt plans to utilise fresh foreign loans,thenationonlineng.net
https://thenationonlineng.net/soaring-food-prices-tougher-times-ahead/,2021-11-15,Soaring food prices: Tougher times ahead,thenationonlineng.net
https://thenationonlineng.net/sdgs-why-nigeria-walks-a-tightrope/,2021-11-15,SDGs: Why Nigeria walks a tightrope,thenationonlineng.net
https://leadership.ng/climate-change-causes-late-rain-cessation-as-nimet-allays-fears/,2021-11-15,"Climate Change Causes Late Rain Cessation, As NIMET Allays Fears",leadership.ng
https://thenationonlineng.net/cop26-deal-disappointing-say-world-leaders-activists/,2021-11-15,"COP26 deal disappointing, say world leaders, activists",thenationonlineng.net
http://www.cknnigeria.com/2021/11/107-bag-first-class-at-lead-city.html,2021-11-15,1302 Graduands Bag Various Degrees At Lead City University 14th Convocation Ceremony,cknnigeria.com
http://pointblanknews.com/pbn/news/late-rain-cessation-nimet-blames-climate-change-allays-fears/,2021-11-15,"Late Rain Cessation: NIMET Blames Climate Change, Allays Fears",pointblanknews.com
https://www.sunnewsonline.com/nans-laments-hike-in-gas-price/,2021-11-15,NANS laments hike in gas price,sunnewsonline.com
https://www.thenews-chronicle.com/africa-religious-perceptive-in-addressing-climate-change/,2021-11-15,Africa: Religious Perceptive in addressing Climate Change,thenews-chronicle.com
http://www.nigeriasun.com/news/271730003/the-drought-hit-niger-villagers-walking-on-water-too-hard-to-reach,2021-11-15,The drought-hit Niger villagers &#039;walking on water&#039; too hard to reach,nigeriasun.com
https://www.ripplesnigeria.com/nigeria-44-others-commit-to-sustainable-agriculture/,2021-11-15,"Nigeria, 44 others commit to sustainable agriculture",ripplesnigeria.com
https://solar-power.newsdayngonline.com/cg-roxane-announces-rpet-facility-solar-power-installation-and-the-winners-of-its-california-youth-sustainability-awards-in-celebration-of-america-recycles-day-yahoo-finance/,2021-11-15,CG Roxane Announces rPET Facility Solar Power Installation and The Winners of its California Youth Sustainability Awards in Celebration of America Recycles Day – Yahoo Finance,newsdayngonline.com
https://www.pulse.ng/apo/careerbox-launches-in-kenya-bringing-employment-opportunities-for-youth-and-women/sbrdd0p,2021-11-15,CareerBox Launches in Kenya Bringing Employment Opportunities for Youth and Women,pulse.ng
https://www.blueprint.ng/stakeholders-call-for-consistency-in-tackling-environmental-challenges/,2021-11-15,Stakeholders call for consistency in tackling environmental challenges,blueprint.ng
http://saharareporters.com/2021/11/15/how-africas-new-trade-deal-can-revolutionise-continents-food-industry-lanre-peter,2021-11-15,How Africa's New Trade Deal Can Revolutionise the Continent's Food Industry By Lanre-Peter Elufisan,saharareporters.com
https://solar-power.newsdayngonline.com/cg-roxane-announces-rpet-facility-solar-power-installation-and-the-winners-of-its-california-youth-sustainability-awards-in-celebration-of-america-recycles-day-prnewswire/,2021-11-15,CG Roxane Announces rPET Facility Solar Power Installation and The Winners of its California Youth Sustainability Awards in Celebration of America Recycles Day – PRNewswire,newsdayngonline.com
http://www.nigeriasun.com/news/271732507/housing-issues-hit-home-for-new-minnesota-lawmaker,2021-11-16,Housing Issues Hit Home for New Minnesota Lawmaker,nigeriasun.com
https://pmnewsnigeria.com/2021/11/15/biden-signs-1-2t-bipartisan-infrastructure-bill-into-law/,2021-11-15,Biden signs $1.2T bipartisan infrastructure bill into law,pmnewsnigeria.com
https://punchng.com/lack-of-adequate-electricity-hampering-data-centres-in-africa/,2021-11-15,‘Lack of adequate electricity hampering data centres in Africa’,punchng.com
https://www.vanguardngr.com/2021/11/nirsal-editors-and-life-beyond-the-newsroom/,2021-11-16,"NIRSAL, editors and life beyond the newsroom",vanguardngr.com
https://tribuneonlineng.com/how-climate-change-affects-2021-harvest-nigerian-farmers/,2021-11-16,How climate change affects 2021 harvest —Nigerian farmers,tribuneonlineng.com
https://leadership.ng/acf-ohanaeze-afenifere-others-advise-federal-govt-on-way-out/,2021-11-16,"ACF, Ohanaeze, Afenifere, Others Advise Federal Govt On Way Out",leadership.ng
https://tribuneonlineng.com/nacgrab-croptrust-move-to-boost-use-management-of-germplasm-collections-for-crops-production/,2021-11-16,"NACGRAB, CropTrust move to boost use, management of germplasm collections for crops production",tribuneonlineng.com
https://tribuneonlineng.com/were-poised-to-help-african-labour-migrants-resilient-to-end-unfair-labour-practices-ituc-africa-dgs/,2021-11-16,"We’re poised to help African labour migrants, resilient to end unfair labour practices —ITUC-Africa DGS",tribuneonlineng.com
https://von.gov.ng/2021/11/16/farmers-shares-varying-experiences-on-the-effect-of-climate-change/,2021-11-16,Farmers shares varying experiences on the effect of climate change,von.gov.ng
https://www.thisdaylive.com/index.php/2021/11/12/cop26-uk-commits-to-supporting-lagos-other-cities-transit-to-net-zero-by-2050/,2021-11-12,"COP26: UK Commits to Supporting Lagos, Other Cities Transit to Net Zero by 2050",thisdaylive.com
http://www.nigeriasun.com/news/271736211/geoengineering-and-the-support-for-global-south-scientists,2021-11-16,Geoengineering and the support for Global South scientists,nigeriasun.com
https://www.thenews-chronicle.com/cop26-intrigues-tensions-emotions-and-beyond-political-negotiations/,2021-11-16,"COP26: Intrigues, Tensions, Emotions and Beyond Political Negotiations",thenews-chronicle.com
https://thenationonlineng.net/retro-review-of-grand-theft-auto-v/,2021-11-16,Retro-Review of Grand Theft Auto V,thenationonlineng.net
http://nigeriancurrent.com/2021/11/15/cop26-is-most-exclusive-climate-negotiations-since-paris-agreement-african-csos/,2021-11-15,COP26 is “most exclusive” climate negotiations since Paris Agreement – African CSOs,nigeriancurrent.com
https://nairametrics.com/2021/11/16/shell-to-move-headquarters-to-uk-drops-royal-dutch-from-name/,2021-11-16,"Shell to move headquarters to the UK, drops ‘Royal Dutch’ from name",nairametrics.com
https://nairametrics.com/2021/11/16/354173/,2021-11-16,OPEC Vs The United States: Who will win the oil war?,nairametrics.com
