url,date_published,title,newsorg
https://www.altaghyeer.info/en/2021/10/11/sweden-vows-continued-support-for-vital-economies-in-sudan/,2021-10-11,Sweden vows continued support for vital economies in Sudan,altaghyeer.info
https://www.alrakoba.net/31575761/%d9%81%d8%aa%d8%b1%d8%a9-%d8%a7%d9%84%d8%ab%d9%82%d8%a7%d9%81%d8%a7%d8%aa-%d8%a7%d9%84%d9%85%d8%a8%d9%83%d8%b1%d8%a9-%d9%85%d9%86-%d8%aa%d8%a7%d8%b1%d9%8a%d8%ae-%d8%a7%d9%84%d8%b3%d9%88%d8%af%d8%a7/,2021-06-14,فترة الثقافات المبكرة من تاريخ السودان القديم,alrakoba.net
https://www.sudantribune.com/spip.php?article69772,2021-07-07,4.5 million children in S. Sudan in “desperate” need: UNICEF,sudantribune.com
https://sudantribune.com/spip.php?article70554,2021-03-07,Crisis with woman’s face,sudantribune.com
https://sudantribune.com/spip.php?article70388,2021-01-27,Over 8 million people need humanitarian aid in S. Sudan: OCHA,sudantribune.com
https://sudanjem.com/the-current-climate-change-summit-cop26-at-glasgow-in-the-united-kingdom-why-it-matters-to-us/,2021-11-01,The Current Climate Change Summit COP26 at Glasgow in the United Kingdom why it matters to us?,sudanjem.com
