url,date_published,title,newsorg
https://jornaleconomico.sapo.pt/noticias/australia-cria-fundo-de-dois-mil-milhoes-de-dolares-para-recuperar-comunidades-da-devastacao-do-fogo-532137,2020-01-07,Austrália cria fundo de dois mil milhões de dólares para recuperar comunidades da devastação do fogo – O Jornal Económico,sapo.pt
https://jornaleconomico.sapo.pt/noticias/alteracoes-climaticas-poderao-provocar-crise-financeira-mais-grave-que-a-de-2008-537340,2020-01-20,Alterações climáticas poderão provocar crise financeira mais grave que a de 2008 – O Jornal Económico,sapo.pt
https://jornaleconomico.sapo.pt/noticias/pacto-ecologico-europeu-542989,2020-02-03,Pacto ecológico europeu – O Jornal Económico,sapo.pt
https://jornaleconomico.sapo.pt/noticias/seis-empresas-portuguesas-entre-as-melhores-na-area-da-sustentabilidade-547018,2020-02-12,Seis empresas portuguesas entre as melhores na área da sustentabilidade – O Jornal Económico,sapo.pt
https://jornaleconomico.sapo.pt/noticias/webinar-saiba-tudo-sobre-ecoliving-envie-ja-as-suas-questoes-547438,2020-02-19,WEBINAR: Saiba tudo sobre EcoLiving. Envie já as suas questões – O Jornal Económico,sapo.pt
https://24.sapo.pt/atualidade/artigos/um-quinto-das-florestas-australianas-arderam-devido-a-seca-extrema,2020-02-24,Um quinto das florestas australianas arderam devido a seca extrema,sapo.pt
https://jornaleconomico.sapo.pt/noticias/estudo-conclui-que-um-quinto-das-florestas-australianas-arderam-devido-a-seca-extrema-551497,2020-02-24,Estudo conclui que um quinto das florestas australianas arderam devido a seca extrema – O Jornal Económico,sapo.pt
https://jornaleconomico.sapo.pt/noticias/imposto-de-50-dolares-por-tonelada-de-co2-pode-triplicar-incumprimento-do-credito-dos-setores-da-energia-e-petroleo-574522,2020-04-11,Imposto de 50 dólares por tonelada de CO2 pode triplicar incumprimento do crédito dos setores da energia e petróleo – O Jornal Económico,sapo.pt
https://24.sapo.pt/atualidade/artigos/covid-19-confinamento-fez-cair-emissoes-globais-de-dioxido-de-carbono-em-17,2020-05-19,Covid-19: Confinamento fez cair emissões globais de dióxido de carbono em 17%,sapo.pt
https://jornaleconomico.sapo.pt/noticias/confinamento-fez-cair-emissoes-globais-de-dioxido-de-carbono-em-17-590702,2020-05-19,Confinamento fez cair emissões globais de dióxido de carbono em 17% – O Jornal Económico,sapo.pt
https://rr.sapo.pt/2020/05/19/pais/metas-do-acordo-de-paris-sao-missao-quase-impossivel/noticia/193509/?utm_medium=rss,2020-05-19,Metas do Acordo de Paris são “missão quase impossível”,sapo.pt
https://jornaleconomico.sapo.pt/noticias/plano-nacional-energia-e-clima-2030-fixa-meta-de-47-de-energias-renovaveis-591545,2020-05-21,Plano Nacional Energia e Clima 2030 fixa meta de 47% de energias renováveis – O Jornal Económico,sapo.pt
https://jornaleconomico.sapo.pt/noticias/empresas-assumem-compromisso-de-serem-mais-sustentaveis-586104,2020-06-05,Empresas assumem compromisso de serem mais sustentáveis – O Jornal Económico,sapo.pt
https://jornaleconomico.sapo.pt/noticias/subsidiodependencia-fossil-621053,2020-08-03,Subsidiodependência fóssil – O Jornal Económico,sapo.pt
https://24.sapo.pt/atualidade/artigos/oceanos-podem-ja-estar-afetados-pelas-alteracoes-climaticas,2020-08-17,Oceanos podem já estar afetados pelas alterações climáticas,sapo.pt
https://jornaleconomico.sapo.pt/noticias/estudo-conclui-que-mais-de-metade-dos-oceanos-pode-estar-afetada-pelas-alteracoes-climaticas-626420,2020-08-17,Estudo conclui que mais de metade dos oceanos pode estar afetada pelas alterações climáticas – O Jornal Económico,sapo.pt
https://24.sapo.pt/atualidade/artigos/foi-o-primeiro-alerta-de-tornado-de-fogo-um-evento-raro-mas-nao-inedito,2020-08-21,"Foi o primeiro alerta de ""tornado de fogo""",sapo.pt
https://jornaleconomico.sapo.pt/noticias/quase-90-dos-fundos-de-pensoes-europeus-tem-em-conta-riscos-ambientais-conclui-mercer-629384,2020-08-26,"Quase 90% dos fundos de pensões europeus tem em conta riscos ambientais, conclui Mercer – O Jornal Económico",sapo.pt
https://visao.sapo.pt/atualidade/ambiente/2020-09-05-alteracoes-climaticas-aumento-do-degelo-na-antartida-e-na-gronelandia-indicam-pior-cenario/?utm_source=rss&utm_medium=rss&utm_campaign=alteracoes-climaticas-aumento-do-degelo-na-antartida-e-na-gronelandia-indicam-pior-cenario,2020-09-05,"Alterações climáticas: Aumento do degelo na Antártida e na Gronelândia indicam ""pior cenário",sapo.pt
https://24.sapo.pt/atualidade/artigos/desaparecimento-da-camada-de-gelo-a-caminho-do-pior-cenario-climatico,2020-09-08,"Desaparecimento da camada de gelo a caminho do ""pior cenário"" climático",sapo.pt
https://24.sapo.pt/tecnologia/artigos/facebook-lanca-espaco-proprio-dedicado-as-alteracoes-climaticas,2020-09-15,Facebook lança espaço próprio dedicado às alterações climáticas,sapo.pt
https://visao.sapo.pt/atualidade/economia/2020-09-15-facebook-lanca-espaco-proprio-dedicado-as-alteracoes-climaticas/?utm_source=rss&utm_medium=rss&utm_campaign=facebook-lanca-espaco-proprio-dedicado-as-alteracoes-climaticas,2020-09-15,Facebook lança espaço próprio dedicado às alterações climáticas,sapo.pt
https://jornaleconomico.sapo.pt/noticias/ceos-pedem-melhores-politicas-de-acao-climatica-ao-governo-e-congresso-norte-americanos-637626,2020-09-16,CEOs pedem melhores políticas de ação climática ao Governo e Congresso norte-americanos – O Jornal Económico,sapo.pt
https://24.sapo.pt/atualidade/artigos/estudo-sugere-que-nivel-do-mar-pode-subir-ate-39-centimetros-ate-ao-fim-do-seculo,2020-09-17,Estudo sugere que nível do mar pode subir até 39 centímetros até ao fim do século,sapo.pt
https://visao.sapo.pt/atualidade/ambiente/2020-09-17-clima-nivel-do-mar-pode-subir-ate-39-centimetros-ate-ao-fim-do-seculo-estudo/?utm_source=rss&utm_medium=rss&utm_campaign=clima-nivel-do-mar-pode-subir-ate-39-centimetros-ate-ao-fim-do-seculo-estudo,2020-09-17,Visão | Clima: Nível do mar pode subir até 39 centímetros até ao fim do século,sapo.pt
https://jornaleconomico.sapo.pt/noticias/como-prosseguir-retornos-elevados-em-plena-pandemia-640505,2020-09-28,Como prosseguir retornos elevados em plena pandemia? – O Jornal Económico,sapo.pt
https://rr.sapo.pt/2020/10/10/religiao/papa-defende-acao-urgente-para-travar-mudancas-climaticas-radicais-e-castastroficas/noticia/210440/?utm_medium=rss,2020-10-10,"Papa defende ação urgente para travar ""mudanças climáticas radicais e castastróficas""",sapo.pt
https://jornaleconomico.sapo.pt/noticias/__trashed-57-651340,2020-10-29,44% dos portugueses já escolhe investimento sustentável – O Jornal Económico,sapo.pt
https://eco.sapo.pt/2020/10/30/edp-quer-reduzir-emissoes-em-90-para-34-mil-toneladas-de-co2-por-mwh-ate-2030/,2020-10-30,EDP quer reduzir emissões em 90% para 34 mil toneladas de CO2 por MWh até 2030,sapo.pt
http://ionline.sapo.pt/artigo/714403/antonio-costa-ja-felicitou-joe-biden?seccao=Portugal_i,2020-11-07,António Costa já felicitou Joe Biden,sapo.pt
https://rr.sapo.pt/2020/11/20/decidir-europa/gil-nadais-e-a-mobilidade-sustentavel/artigo/215637/?utm_medium=rss,2020-11-20,Gil Nadais e a mobilidade sustentável,sapo.pt
https://eco.sapo.pt/2020/12/07/portugal-sobe-oito-lugares-no-indice-de-desempenho-das-alteracoes-climaticas/,2020-12-07,Portugal sobe oito lugares no Índice de Desempenho das Alterações Climáticas,sapo.pt
https://rr.sapo.pt/2020/12/07/pais/portugal-sobe-oito-lugares-no-indice-de-desempenho-das-alteracoes-climaticas/noticia/217597/?utm_medium=rss,2020-12-07,Portugal sobe oito lugares no Índice de Desempenho das Alterações Climáticas,sapo.pt
https://jornaleconomico.sapo.pt/noticias/portugal-sobe-oito-lugares-no-indice-de-desempenho-das-alteracoes-climaticas-673393,2020-12-07,Portugal sobe oito lugares no Índice de Desempenho das Alterações Climáticas – O Jornal Económico,sapo.pt
https://24.sapo.pt/atualidade/artigos/portugal-sobe-oito-lugares-no-indice-de-desempenho-das-alteracoes-climaticas,2020-12-07,Portugal sobe oito lugares no Índice de Desempenho das Alterações Climáticas,sapo.pt
https://visao.sapo.pt/atualidade/ambiente/2020-12-07-portugal-sobe-oito-lugares-no-indice-de-desempenho-das-alteracoes-climaticas/?utm_source=rss&utm_medium=rss&utm_campaign=portugal-sobe-oito-lugares-no-indice-de-desempenho-das-alteracoes-climaticas,2020-12-07,Portugal sobe oito lugares no Índice de Desempenho das Alterações Climáticas,sapo.pt
https://jornaleconomico.sapo.pt/noticias/lideres-europeus-chegam-a-acordo-para-reduzir-emissoes-de-co2-em-55-ate-2030-675151,2020-12-11,Líderes europeus chegam a acordo para reduzir emissões de CO2 em 55% até 2030 – O Jornal Económico,sapo.pt
https://rr.sapo.pt/2020/12/11/pais/sustentabilidade-dos-vinhos-do-alentejo-distinguida-internacionalmente/noticia/218183/?utm_medium=rss,2020-12-11,Sustentabilidade dos vinhos do Alentejo distinguida internacionalmente,sapo.pt
https://expressodasilhas.cv/pais/2020/12/13/alunos-da-segunda-turma-do-mestrado-em-mudancas-climaticas-e-ciencias-marinhas-recebidos-na-universidade-tecnica-do-atlantico/72548,2020-12-13,Alunos da segunda turma do mestrado em Mudanças Climáticas e Ciências Marinhas recebidos na Universidade Técnica do Atlântico,expressodasilhas.cv
https://barlavento.sapo.pt/ambiente/amal-ve-aprovada-candidatura-aprovada-no-eea-grants,2020-12-22,AMAL vê aprovada candidatura aprovada no EEA Grants,sapo.pt
https://eco.sapo.pt/especiais/estas-empresas-portuguesas-estao-na-lista-vip-da-luta-contra-as-alteracoes-climaticas/,2020-12-25,Estas empresas portuguesas estão na lista VIP da luta contra as alterações climáticas,sapo.pt
