url,date_published,title,newsorg
https://mybroadband.co.za/news/science/333650-hotter-stormier-and-more-extreme-the-future-of-weather.html,2020-01-01,"Hotter, stormier and more extreme – The future of weather",mybroadband.co.za
https://www.timeslive.co.za/news/sci-tech/2020-01-01-will-climate-activists-be-able-to-keep-the-heat-on-after-breakthrough-year/,2020-01-01,Will climate activists be able to keep the heat on after breakthrough year?,timeslive.co.za
https://www.sowetanlive.co.za/news/south-africa/2020-01-01-will-climate-activists-be-able-to-keep-the-heat-on-after-breakthrough-year/,2020-01-01,Will climate activists be able to keep the heat on after breakthrough year?,sowetanlive.co.za
https://www.enca.com/life/pictures-new-year-fireworks-decade-begins-bang,2020-01-01,IN PICTURES: New Year fireworks as decade begins with a bang,enca.com
https://ewn.co.za/2020/01/01/australia-scrambles-to-reach-thousands-stranded-by-bushfires,2020-01-01,Australia scrambles to reach thousands stranded by bushfires,ewn.co.za
https://www.timeslive.co.za/news/world/2020-01-01-australia-scrambles-to-reach-thousands-stranded-by-bushfires/,2020-01-01,Australia scrambles to reach thousands stranded by bushfires,timeslive.co.za
https://www.sowetanlive.co.za/news/south-africa/2020-01-01-australia-scrambles-to-reach-thousands-stranded-by-bushfires/,2020-01-01,Australia scrambles to reach thousands stranded by bushfires,sowetanlive.co.za
https://ewn.co.za/2020/01/01/world-welcomes-2020-but-wildfires-protests-cast-a-pall-over-some-celebrations,2020-01-01,"World welcomes 2020, but wildfires, protests, cast a pall over some celebrations",ewn.co.za
https://businesstech.co.za/news/property/362106/this-is-what-you-can-expect-from-the-property-market-in-south-africa-this-year/,2020-01-01,This is what you can expect from the property market in South Africa this year,businesstech.co.za
https://www.iol.co.za/business-report/international/can-you-own-a-private-jet-if-you-care-about-climate-change-39663165,2020-01-01,Can you own a private jet if you care about climate change?,iol.co.za
https://www.heraldlive.co.za/news/2020-01-01-will-climate-activists-be-able-to-keep-the-heat-on-after-breakthrough-year/,2020-01-01,Will climate activists be able to keep the heat on after breakthrough year?,heraldlive.co.za
https://southafricatoday.net/environment/monitoring-and-law-enforcement-must-be-strengthened-commentary/,2020-01-02,Monitoring and law enforcement must be strengthened (commentary),southafricatoday.net
https://southafricatoday.net/environment/2019-brings-death-by-1000-cuts-to-amazon-part-one/,2020-01-01,"2019 brings death by 1,000 cuts to Amazon — part one",southafricatoday.net
https://ewn.co.za/2020/01/02/australia-orders-evacuation-of-fire-ravaged-towns-before-heatwave,2020-01-02,Australia orders evacuation of fire-ravaged towns before heatwave,ewn.co.za
https://www.sanews.gov.za/south-africa/ongoing-drought-priority-government,2020-01-02,Ongoing drought a priority for government,sanews.gov.za
https://www.heraldlive.co.za/news/world/2020-01-02-australian-bushfires-rage-on-creating-hell-on-earth/,2020-01-02,Australian bushfires rage on creating ‘hell on earth’,heraldlive.co.za
https://citizen.co.za/news/news-world/2223895/australia-orders-evacuation-of-fire-ravaged-towns-before-heatwave/,2020-01-02,Australia orders evacuation of fire-ravaged towns before heatwave,citizen.co.za
https://www.vocfm.co.za/govt-resolute-in-alleviating-impact-of-drought-in-parts-of-sa/,2020-01-02,Govt 'resolute' in alleviating impact of drought in parts of SA,vocfm.co.za
https://mg.co.za/article/2020-01-03-00-an-agenda-for-decent-jobs-in-africa/,2020-01-03,An agenda for decent jobs in Africa,co.za
https://mg.co.za/article/2020-01-03-00-bright-signs-emerge-amid-global-turmoil/,2020-01-03,Bright signs emerge amid global turmoil,co.za
https://southafricatoday.net/world-news/europe/new-austrian-government-to-fight-illegal-migration-climate-change-kurz/,2020-01-02,"New Austrian Government to Fight Illegal Migration, Climate Change",southafricatoday.net
https://www.iol.co.za/news/politics/government-vows-to-alleviate-impact-of-drought-in-parts-of-sa-39969275,2020-01-02,Government vows to alleviate impact of drought in parts of SA,iol.co.za
https://www.iol.co.za/news/world/can-nations-prosper-by-putting-well-being-before-gdp-in-2020-39968070,2020-01-02,Can nations prosper by putting well-being before GDP in 2020?,iol.co.za
https://ewn.co.za/2020/01/03/eskom-warns-of-more-breakdowns-at-power-stations-but-no-load-shedding-yet,2020-01-03,Eskom warns of more breakdowns at power stations but no load shedding yet,ewn.co.za
https://ewn.co.za/2020/01/03/effects-of-climate-change-clearly-visible-says-govt,2020-01-03,"Effects of climate change clearly visible, says govt",ewn.co.za
https://www.vocfm.co.za/imam-fasieg-adams-implicated-in-yet-another-umrah-scandal/,2020-01-03,Imam Fasieg Adams implicated in yet another Umrah scandal,vocfm.co.za
https://www.dailymaverick.co.za/article/2020-01-03-2019-and-in-other-news/,2020-01-03,2019: And in other news…,dailymaverick.co.za
https://ewn.co.za/2020/01/03/australia-urges-people-to-flee-as-fires-set-to-surge-at-weekend,2020-01-03,Australia urges people to flee as fires set to surge at weekend,ewn.co.za
https://www.iol.co.za/news/world/australian-pm-face-the-wrath-of-angry-bushfire-victims-39992994,2020-01-03,Australian PM face the wrath of angry bushfire victims,iol.co.za
https://www.sowetanlive.co.za/business/2020-01-02-from-medicine-to-recycling-6-african-start-ups-doing-business-for-good/,2020-01-02,"From medicine to recycling, 6 African start-ups doing business for good",sowetanlive.co.za
https://businesstech.co.za/news/government/363538/6-planned-laws-for-south-africa-you-should-know-about-in-2020/,2020-01-04,6 planned laws for South Africa you should know about in 2020,businesstech.co.za
https://businesstech.co.za/news/business/364070/8-ways-wine-will-change-in-2020/,2020-01-04,8 ways wine will change in 2020,businesstech.co.za
https://northglennews.co.za/178205/ongoing-drought-priority-government/,2020-01-04,Ongoing drought a priority for government,northglennews.co.za
https://www.iol.co.za/saturday-star/news/why-2020-will-be-a-testing-year-for-mzansi-40032519,2020-01-04,Why 2020 will be a testing year for Mzansi,iol.co.za
https://www.cnbcafrica.com/zdnl-mc/2020/01/03/op-ed-a-new-decade-has-arrived-will-it-be-zimbabwes/,2020-01-03,"Op-Ed: A new decade has arrived, will it be Zimbabwe’s?",cnbcafrica.com
https://www.dispatchlive.co.za/news/2020-01-04-wildlife-ravaged-by-australia-fires-could-take-decades-to-recover/,2020-01-04,Wildlife ravaged by Australia fires could take decades to recover,dispatchlive.co.za
https://southafricatoday.net/environment/environmental-stories-from-around-the-web-jan-3-2020/,2020-01-05,"Environmental stories from around the web, Jan. 3, 2020",southafricatoday.net
https://www.enca.com/news/new-bushfire-flares-southeast-australia-damage-assessment-begins,2020-01-05,New bushfire flares in southeast Australia as damage assessment begins,enca.com
https://southafricatoday.net/environment/from-scorpion-skewers-to-cricket-flour-bug-protein-is-becoming-big-business/,2020-01-05,"From scorpion skewers to cricket flour, bug protein is becoming big business",southafricatoday.net
https://citizen.co.za/news/south-africa/parliament/2224373/5-things-to-watch-out-for-in-parliament-in-2020/,2020-01-05,5 things to watch out for in Parliament in 2020,citizen.co.za
https://ewn.co.za/2020/01/05/australia-s-insurance-koala-population-halved-by-bushfires,2020-01-05,Australia's 'insurance' koala population halved by bushfires,ewn.co.za
https://www.enca.com/news/jakarta-flooding-deaths-rise-53,2020-01-05,Jakarta flooding deaths rise to 53,enca.com
https://sandtonchronicle.co.za/244510/wwf-calls-for-action/,2020-01-05,WWF calls for action,sandtonchronicle.co.za
https://southafricatoday.net/environment/our-most-popular-nature-and-environment-stories/,2020-01-05,Our most popular nature and environment stories,southafricatoday.net
https://www.dailymaverick.co.za/article/2020-01-05-energy-land-and-law-this-year-its-personal/,2020-01-05,"Energy, land and law: This year, it’s personal",dailymaverick.co.za
https://www.iol.co.za/entertainment/movies/news/1917-and-once-upon-a-time-in-hollywood-take-top-honours-at-golden-globes-40136205,2020-01-06,1917' and 'Once Upon a Time in Hollywood' take top honours at Golden Globes,iol.co.za
https://www.itweb.co.za/content/P3gQ2qGXzzBvnRD1,2020-01-06,An electrifying game-changer,itweb.co.za
https://www.iol.co.za/lifestyle/style-beauty/fashion/pics-video-fashion-can-be-activism-at-the-golden-globes-40145323,2020-01-06,PICS + VIDEO: 'Fashion can be activism' at the Golden Globes,iol.co.za
https://www.itweb.co.za/content/rW1xLv55gyKvRk6m,2020-01-06,Four critical changes businesses must make now to survive,itweb.co.za
https://ewn.co.za/2020/01/06/years-of-drought-threaten-sa-s-wildlife-industry,2020-01-06,Years of drought threaten SA's wildlife industry,ewn.co.za
https://www.georgeherald.com/News/Article/International/fire-hit-australia-gets-1-4bn-recovery-fund-as-troops-deployed-202001060854,2020-01-06,Australia gets $1.4 billion recovery fund,georgeherald.com
https://citizen.co.za/lifestyle/your-life-home-life/2224676/hardy-plants-are-the-future/,2020-01-06,Hardy plants are the future,citizen.co.za
https://www.iol.co.za/news/world/australian-government-ready-to-pay-whatever-it-takes-to-fight-wildfires-40156565,2020-01-06,Australian government ready to pay 'whatever it takes' to fight wildfires,iol.co.za
https://www.iol.co.za/business-report/international/watch-after-teslas-record-year-in-norway-rivals-gear-up-for-2020-40011870,2020-01-05,"WATCH: After Tesla's record year in Norway, rivals gear up for 2020",iol.co.za
https://ewn.co.za/2020/01/06/smoke-stalls-rescues-as-australia-plans-for-next-fiery-onslaught,2020-01-06,Smoke stalls rescues as Australia plans for next fiery onslaught,ewn.co.za
https://www.jbaynews.com/ongoing-drought-in-eastern-cape-a-priority-for-government/,2020-01-06,Ongoing drought in Eastern Cape a priority for Government,jbaynews.com
https://www.politicsweb.co.za/documents/workingclass-summit-a-new-era-in-history-of-sa--sa,2020-01-06,Working-Class Summit: A new era in history of SA,politicsweb.co.za
https://www.dailymaverick.co.za/article/2020-01-06-what-to-watch-for-in-commodities-in-2020/,2020-01-06,Business Maverick: What to Watch for in Commodities in 2020,dailymaverick.co.za
https://www.dailymaverick.co.za/opinionista/2020-01-07-making-stakeholder-capitalism-a-reality/,2020-01-07,Making stakeholder capitalism a reality,dailymaverick.co.za
https://www.dailymaverick.co.za/article/2020-01-07-australia-bolsters-defences-as-cost-of-huge-bushfires-rises/,2020-01-07,Australia bolsters defences as cost of huge bushfires rises,dailymaverick.co.za
https://www.georgeherald.com/News/Article/National/years-of-drought-threaten-sa-s-wildlife-industry-202001060109,2020-01-07,Years of drought threaten SA’s wildlife industry,georgeherald.com
https://www.georgeherald.com/News/Article/Business/8-ways-wine-will-change-in-2020-202001061250,2020-01-07,8 ways wine will change in 2020,georgeherald.com
https://www.georgeherald.com/News/Article/Property/creating-a-waterwise-garden-202001060223,2020-01-07,Creating a waterwise garden,georgeherald.com
https://www.iol.co.za/business-report/wef/wef-2020-realising-stakeholders-capitalism-will-require-a-new-breed-of-leaders-in-africa-40154079,2020-01-07,WEF 2020: Realising stakeholders capitalism will require a new breed of leaders in Africa,iol.co.za
https://www.iol.co.za/business-report/international/green-civil-war-in-germany-40151274,2020-01-07,Green civil war in Germany?,iol.co.za
https://citizen.co.za/news/opinion/opinion-editorials/2224899/awards-host-hits-the-nail-on-the-head/,2020-01-07,Awards host hits the nail on the head,citizen.co.za
https://www.sowetanlive.co.za/news/world/2020-01-07-australias-leaders-unmoved-on-climate-action-after-devastating-bushfires/,2020-01-07,Australia's leaders unmoved on climate action after devastating bushfires,sowetanlive.co.za
https://www.iol.co.za/lifestyle/food-drink/recipes/australias-bushfires-could-we-have-prevented-them-by-not-eating-meat-40197854,2020-01-07,Australia's bushfires - could we have prevented them by not eating meat?,iol.co.za
https://www.jbaynews.com/record-low-rainfall-for-the-jeffreys-bay-region/,2020-01-07,Record low rainfall for the Jeffreys Bay region,jbaynews.com
https://ewn.co.za/2020/01/07/firestorms-how-australia-s-bushfires-created-their-own-weather,2020-01-07,Firestorms: How Australia's bushfires created their own weather,ewn.co.za
https://www.iol.co.za/capeargus/news/from-eerste-river-to-davos-for-17-year-old-sa-climate-activist-40203292,2020-01-07,From Eerste River to Davos for 17-year-old SA climate activist,iol.co.za
https://www.cnbcafrica.com/apo/2020/01/07/2020-majority-of-lives-at-risk-concentrated-in-20-countries/,2020-01-07,2020: Majority of lives at risk concentrated in 20 countries,cnbcafrica.com
https://www.georgeherald.com/News/Article/International/eurozone-inflation-rises-to-1-3-in-december-202001070325,2020-01-07,Eurozone inflation rises to 1.3% in December,georgeherald.com
https://mg.co.za/article/2020-01-07-firestorms-how-australias-bushfires-created-their-own-weather/,2020-01-07,Firestorms: How Australia's bushfires created their own weather,co.za
https://mg.co.za/article/2020-01-07-farming-in-south-africa-is-under-threat-from-climate-change-heres-how/,2020-01-07,Farming in South Africa is under threat from climate change. Here’s how,co.za
https://www.dailymaverick.co.za/article/2020-01-07-anc-anniversary-during-a-time-of-crisis/,2020-01-07,ANC anniversary during a time of crisis,dailymaverick.co.za
https://citizen.co.za/lifestyle/lifestyle-travel/2225029/5-top-stress-triggers-for-business-travellers-and-how-to-overcome-them/,2020-01-07,5 top stress triggers for business travellers and how to overcome them,citizen.co.za
https://www.cnbcafrica.com/news/financial/2020/01/07/5-easy-ways-to-be-more-sustainable-and-save-money-in-2020/,2020-01-07,5 easy ways to be more sustainable and save money in 2020,cnbcafrica.com
https://www.dailymaverick.co.za/article/2020-01-08-climate-allies-desmond-tutu-and-al-gore-unite-in-fossil-fuel-divestment-struggle/,2020-01-08,Climate allies Desmond Tutu and Al Gore unite in fossil-fuel divestment struggle,dailymaverick.co.za
https://www.dailymaverick.co.za/article/2020-01-08-in-defence-of-south-african-hope/,2020-01-08,In defence of South African hope,dailymaverick.co.za
https://businesstech.co.za/news/business/364792/weaker-rand-eyes-us-iran-conflict-as-oil-prices-jump/,2020-01-08,Weaker rand eyes US-Iran conflict as oil prices jump,businesstech.co.za
https://www.itweb.co.za/content/KA3WwqdlpX1qrydZ,2020-01-08,Open source harnessed to fight for good,itweb.co.za
https://krugersdorpnews.co.za/399096/water-wednesday-ongoing-drought-relief-priority-government/,2020-01-08,Water Wednesday: Ongoing drought relief is a priority for government,krugersdorpnews.co.za
https://ladysmithgazette.co.za/137690/water-wednesday-ongoing-drought-relief-priority-government/,2020-01-08,Water Wednesday: Ongoing drought relief is a priority for government,ladysmithgazette.co.za
https://risingsunchatsworth.co.za/149859/water-wednesday-ongoing-drought-relief-priority-government/,2020-01-08,Water Wednesday: Ongoing drought relief is a priority for government,risingsunchatsworth.co.za
https://northcoastcourier.co.za/146572/water-wednesday-ongoing-drought-relief-priority-government/,2020-01-08,Water Wednesday: Ongoing drought relief is a priority for government,northcoastcourier.co.za
https://randfonteinherald.co.za/323886/water-wednesday-ongoing-drought-relief-priority-government/,2020-01-08,Water Wednesday: Ongoing drought relief is a priority for government,randfonteinherald.co.za
https://germistoncitynews.co.za/227099/water-wednesday-ongoing-drought-relief-priority-government/,2020-01-08,Water Wednesday: Ongoing drought relief is a priority for government,germistoncitynews.co.za
https://www.georgeherald.com/News/Article/National/water-wednesday-ongoing-drought-relief-is-a-priority-for-government-202001081111,2020-01-08,Water Wednesday: Ongoing drought relief is a priority for government,georgeherald.com
https://kemptonexpress.co.za/222699/water-wednesday-ongoing-drought-relief-priority-government/,2020-01-08,Water Wednesday: Ongoing drought relief is a priority for government,kemptonexpress.co.za
https://sandtonchronicle.co.za/245632/water-wednesday-ongoing-drought-relief-priority-government/,2020-01-08,Water Wednesday: Ongoing drought relief is a priority for government,sandtonchronicle.co.za
https://randburgsun.co.za/383678/water-wednesday-ongoing-drought-relief-priority-government/,2020-01-08,Water Wednesday: Ongoing drought relief is a priority for government,randburgsun.co.za
https://newcastleadvertiser.co.za/185831/water-wednesday-ongoing-drought-relief-priority-government/,2020-01-08,Water Wednesday: Ongoing drought relief is a priority for government,newcastleadvertiser.co.za
https://zululandobserver.co.za/206148/water-wednesday-ongoing-drought-relief-priority-government/,2020-01-08,Water Wednesday: Ongoing drought relief is a priority for government,zululandobserver.co.za
https://albertonrecord.co.za/238461/water-wednesday-ongoing-drought-relief-priority-government/,2020-01-08,Water Wednesday: Ongoing drought relief is a priority for government,albertonrecord.co.za
https://benonicitytimes.co.za/364442/water-wednesday-ongoing-drought-relief-priority-government/,2020-01-08,Water Wednesday: Ongoing drought relief is a priority for government,benonicitytimes.co.za
https://comarochronicle.co.za/196105/water-wednesday-ongoing-drought-relief-priority-government/,2020-01-08,Water Wednesday: Ongoing drought relief is a priority for government,comarochronicle.co.za
https://alexnews.co.za/147925/water-wednesday-ongoing-drought-relief-priority-government/,2020-01-08,Water Wednesday: Ongoing drought relief is a priority for government,alexnews.co.za
https://fourwaysreview.co.za/321951/water-wednesday-ongoing-drought-relief-priority-government/,2020-01-08,Water Wednesday: Ongoing drought relief is a priority for government,fourwaysreview.co.za
https://northcliffmelvilletimes.co.za/304065/water-wednesday-ongoing-drought-relief-priority-government/,2020-01-08,Water Wednesday: Ongoing drought relief is a priority for government,northcliffmelvilletimes.co.za
https://ewn.co.za/2020/01/08/australians-urged-to-leave-early-in-face-of-new-bushfire-threat,2020-01-08,Australians urged to 'leave early' in face of new bushfire threat,ewn.co.za
https://boksburgadvertiser.co.za/356549/water-wednesday-ongoing-drought-relief-priority-government/,2020-01-08,Water Wednesday: Ongoing drought relief is a priority for government,boksburgadvertiser.co.za
https://southlandssun.co.za/124999/water-wednesday-ongoing-drought-relief-priority-government/,2020-01-08,Water Wednesday: Ongoing drought relief is a priority for government,southlandssun.co.za
https://brakpanherald.co.za/206953/water-wednesday-ongoing-drought-relief-priority-government/,2020-01-08,Water Wednesday: Ongoing drought relief is a priority for government,brakpanherald.co.za
https://lowvelder.co.za/519709/water-wednesday-ongoing-drought-relief-priority-government/,2020-01-08,Water Wednesday: Ongoing drought relief is a priority for government,lowvelder.co.za
https://www.dailymaverick.co.za/article/2020-01-06-iss-today-conflict-is-still-africas-biggest-challenge-in-2020/,2020-01-06,ISS Today: Conflict is still Africa’s biggest challenge in 2020,dailymaverick.co.za
https://www.biznews.com/briefs/2020/01/07/great-white-shark-spotted-cape-town,2020-01-07,Great white shark spotted off Cape Town; first in 20 months,biznews.com
https://northglennews.co.za/178467/water-wednesday-ongoing-drought-relief-priority-government/,2020-01-08,Water Wednesday: Ongoing drought relief is a priority for government,northglennews.co.za
https://bereamail.co.za/184176/water-wednesday-ongoing-drought-relief-priority-government/,2020-01-08,Water Wednesday: Ongoing drought relief is a priority for government,bereamail.co.za
https://www.georgeherald.com/News/Article/International/australians-urged-to-leave-early-in-face-of-new-bushfire-threat-202001080256,2020-01-08,Australians urged to 'leave early' in face of new bushfire threat,georgeherald.com
https://www.vocfm.co.za/climate-change-will-compel-government-to-rethink-farming-strategy-didiza/,2020-01-08,Climate change will compel government to rethink farming strategy: Didiza,vocfm.co.za
https://www.georgeherald.com/News/Article/International/2019-second-hottest-year-on-record-eu-202001080303,2020-01-08,2019 second hottest year on record: EU,georgeherald.com
https://www.georgeherald.com/Entertainment/Article/succession-fleabag-top-tv-winners-at-golden-globes-202001061144,2020-01-06,"'Succession,' 'Fleabag' top TV winners at Golden Globes",georgeherald.com
https://southafricatoday.net/environment/jakarta-floods-spark-renewed-calls-for-stronger-environmental-protection/,2020-01-07,Jakarta floods spark renewed calls for stronger environmental protection,southafricatoday.net
https://ewn.co.za/2020/01/08/2019-second-hottest-year-on-record-eu,2020-01-08,2019 second hottest year on record,ewn.co.za
https://risingsunlenasia.co.za/55307/water-wednesday-ongoing-drought-relief-priority-government/,2020-01-08,Water Wednesday: Ongoing drought relief is a priority for government,risingsunlenasia.co.za
https://heidelbergnigelheraut.co.za/48546/water-wednesday-ongoing-drought-relief-priority-government/,2020-01-08,Water Wednesday: Ongoing drought relief is a priority for government,heidelbergnigelheraut.co.za
https://ewn.co.za/2020/01/08/trump-viewed-negatively-around-the-world-pew-survey,2020-01-08,Trump viewed negatively around the world,ewn.co.za
https://bedfordviewedenvalenews.co.za/380531/water-wednesday-ongoing-drought-relief-priority-government/,2020-01-08,Water Wednesday: Ongoing drought relief is a priority for government,bedfordviewedenvalenews.co.za
https://letabaherald.co.za/75841/water-wednesday-ongoing-drought-relief-priority-government/,2020-01-08,Water Wednesday: Ongoing drought relief is a priority for government,letabaherald.co.za
https://www.iol.co.za/news/africa/tutu-and-former-us-vice-president-al-gore-talk-climate-change-40256719,2020-01-08,Tutu and former US vice president Al Gore talk climate change,iol.co.za
https://africanreporter.co.za/124152/water-wednesday-ongoing-drought-relief-priority-government/,2020-01-08,Water Wednesday: Ongoing drought relief is a priority for government,africanreporter.co.za
https://southcoastsun.co.za/157291/water-wednesday-ongoing-drought-relief-priority-government/,2020-01-08,Water Wednesday: Ongoing drought relief is a priority for government,southcoastsun.co.za
https://highwaymail.co.za/350668/water-wednesday-ongoing-drought-relief-priority-government/,2020-01-08,Water Wednesday: Ongoing drought relief is a priority for government,highwaymail.co.za
https://midrandreporter.co.za/232830/water-wednesday-ongoing-drought-relief-priority-government/,2020-01-08,Water Wednesday: Ongoing drought relief is a priority for government,midrandreporter.co.za
https://southafricatoday.net/environment/the-fight-is-on-to-save-the-last-clean-waterway-in-brazils-manaus/,2020-01-09,The fight is on to save the last clean waterway in Brazil’s Manaus,southafricatoday.net
https://www.dailymaverick.co.za/article/2020-01-09-australia-weather-bureau-sees-no-sign-of-cooler-weather-or-rain-to-quell-bushfires/,2020-01-09,Australia weather bureau sees no sign of cooler weather or rain to quell bushfires,dailymaverick.co.za
https://www.enca.com/analysis/trump-viewed-negatively-around-world-pew-survey,2020-01-09,Trump viewed negatively around the world: Pew survey,enca.com
https://www.iol.co.za/the-star/matric-results-2019-the-gentle-art-of-being-privileged-40257564,2020-01-08,Matric Results 2019: The gentle art of being privileged,iol.co.za
http://www.politicsweb.co.za/news-and-analysis/zimbabwe-a-crucial-decade,2020-01-09,Zimbabwe: A crucial decade,politicsweb.co.za
https://www.businesslive.co.za/bd/world/europe/2020-01-07-austrias-greens-and-conservatives-say-they-can-compromise/,2020-01-07,Austria’s Greens and conservatives say they can compromise,businesslive.co.za
https://www.timeslive.co.za/news/south-africa/2020-01-09-watch-rain-brings-joy-to-drought-stricken-karoo-towns-but-its-not-over-yet/,2020-01-09,Rain brings joy to drought-stricken Karoo towns but it's not over yet,timeslive.co.za
https://www.cnbcafrica.com/apo/2020/01/09/unprecedented-terrorist-violence-in-west-africa-sahel-region/,2020-01-09,"‘Unprecedented terrorist violence’ in West Africa, Sahel region",cnbcafrica.com
https://www.cnbcafrica.com/apo/2020/01/09/rotary-establishes-peace-center-at-makerere-university/,2020-01-09,Rotary establishes peace center at Makerere University,cnbcafrica.com
https://www.georgeherald.com/News/Article/International/fire-hit-australian-farmers-vow-to-rise-from-the-ashes-202001090141,2020-01-09,Fire-hit Australian farmers vow to rise from the ashes,georgeherald.com
https://ladysmithgazette.co.za/137768/one-resolution-2020/,2020-01-09,My one resolution for 2020,ladysmithgazette.co.za
https://southafricatoday.net/environment/insights-on-our-2019-reporting-insider/,2020-01-09,Insights on our 2019 reporting (insider),southafricatoday.net
https://www.vocfm.co.za/australians-urged-to-evacuate-as-monster-bushfires-regenerate/,2020-01-09,Australians urged to evacuate as monster bushfires regenerate,vocfm.co.za
