url,date_published,title,newsorg
https://www.zimbabwesituation.com/news/catholic-relief-services-crs-warns-of-worsening-hunger-crisis-in-zimbabwe-zimbabwe/,2020-01-01,Catholic Relief Services (CRS) Warns of Worsening Hunger Crisis in Zimbabwe,zimbabwesituation.com
https://www.thezimbabwemail.com/capital-money-markets/recession-robots-and-rockets-another-roaring-20s-for-world-markets/,2020-01-01,"Recession, robots and rockets: another roaring 20s for world markets?",thezimbabwemail.com
https://zimbabwe-today.com/small-business-stories-that-inspired-in-2019/,2020-01-01,Small business stories that inspired in 2019,zimbabwe-today.com
https://www.voazimbabwe.com/a/zimbabwe-hunger-africa-disease-ebola-hunger-extremism/5228413.html,2020-01-01,"Africa Starts 2020 Battling Extremism, Ebola and Hunger",voazimbabwe.com
https://www.zimeye.net/2020/01/01/catholic-relief-services-declares-severe-drought-for-zimbabwe/,2020-01-01,Catholic Relief Services Declares Severe Drought For Zimbabwe,zimeye.net
http://www.insiderzim.com/us-writer-says-it-pays-to-visit-zimbabwe-to-see-the-ground-truth/,2020-01-02,"US writer says it pays to visit Zimbabwe to see the ""ground truth""",insiderzim.com
https://www.newzimbabwe.com/five-things-ed-can-do-right-in-2020/,2020-01-02,Five things ED can do right in 2020,newzimbabwe.com
https://www.zimeye.net/2020/01/02/government-has-no-love-for-education-sector/,2020-01-02,“Government Has No Love For Education Sector”,zimeye.net
https://www.zimeye.net/2020/01/02/teachers-send-strong-message-to-mnangagwa-government/,2020-01-02,Teachers Send Strong Message To Mnangagwa Government,zimeye.net
https://www.zimeye.net/2020/01/02/teachers-take-on-mnangagwa-government-over-poor-salaries/,2020-01-02,Teachers Take On Mnangagwa Government Over Poor Salaries,zimeye.net
https://www.zimbabweonlinenews.com/africa-starts-2020-battling-extremism-ebola-and-hunger/,2020-01-01,"Africa Starts 2020 Battling Extremism, Ebola and Hunger",zimbabweonlinenews.com
https://www.zimeye.net/2020/01/03/chisvo-shows-majome-pics-of-vic-falls-with-little-water-on-23rd-december/,2020-01-03,Chisvo Shows Majome Pictures Of Vic Falls With Little Water On 23 December,zimeye.net
http://newzimbabwevision.com/heavily-bandaged-wife-of-vp-chiwenga-marry-mubaiwa-completes-a-festive-period-including-christmas-boxing-and-new-year-in-prison/,2020-01-01,"Heavily bandaged wife of VP Chiwenga, Marry Mubaiwa, completes a festive period including Christmas, Boxing and New year in prison.",newzimbabwevision.com
http://newzimbabwevision.com/government-has-increased-hospital-user-fees-and-reintroduced-maternity-fees-ambulance-15-per-kilometre-while-mortuary-services-will-be-fixed-at-150/,2020-01-02,"GOVERNMENT has increased hospital user fees and reintroduced maternity fees, ambulance – $15 per kilometre while mortuary services will be fixed at $150",newzimbabwevision.com
http://newzimbabwevision.com/israeli-prime-minster-benjamin-netanyau-asks-lawmakers-to-grant-him-immunity-from-prosecution-on-bribery-and-corruption-charges-ahead-of-an-election-in-march-that-will-decide-his-personal-and-politic/,2020-01-01,"ISRAELI PRIME MINSTER BENJAMIN NETANYAU ASKS lawmakers to grant him immunity from prosecution on bribery and corruption charges, ahead of an election in March that will decide his personal and political future",newzimbabwevision.com
http://newzimbabwevision.com/a-gang-of-12-machete-wielding-men-suspected-to-be-linked-to-16-armed-robberies-and-two-murders-in-bindura-and-shamva-has-been-arrested-on-charges-of-armed-robbery/,2020-01-01,A GANG of 12 MACHETE-WIELDING MEN suspected to be linked to 16 armed robberies and two murders in Bindura and Shamva has been arrested on charges of armed robbery.,newzimbabwevision.com
https://www.newsday.co.zw/2020/01/five-things-ed-can-do-right-in-2020/,2020-01-03,Five things ED can do right in 2020,newsday.co.zw
https://www.newsday.co.zw/2020/01/unemployed-youths-a-security-threat/,2020-01-03,‘Unemployed youths a security threat’,newsday.co.zw
https://www.thezimbabwedaily.com/news/381550-five-things-ed-can-do-right-in-2020.html,2020-01-03,Five things ED can do right in 2020,thezimbabwedaily.com
https://www.thezimbabwedaily.com/news/381542-unemployed-youths-a-security-threat.html,2020-01-03,‘Unemployed youths a security threat’,thezimbabwedaily.com
https://www.thezimbabwedaily.com/news/381559-five-things-mnangagwa-can-do-right-in-2020.html,2020-01-03,Five things Mnangagwa can do right in 2020,thezimbabwedaily.com
https://www.chronicle.co.zw/letters-to-the-editor-an-open-letter-to-alex-crawford-from-peter-jones/,2020-01-03,Letters to the Editor: An open letter to Alex Crawford from Peter Jones,chronicle.co.zw
https://www.thezimbabwemail.com/columnist/five-things-mnangagwa-can-do-right-in-2020/,2020-01-03,Five things Mnangagwa can do right in 2020,thezimbabwemail.com
https://www.zimeye.net/2020/01/03/government-has-no-love-teachers/,2020-01-03,Government Has No Love…Teachers,zimeye.net
https://www.zimeye.net/2020/01/02/full-text-teachers-confront-government-over-poor-working-conditions/,2020-01-02,Full Text: Teachers Confront Government Over Poor Working Conditions,zimeye.net
https://www.zimeye.net/2020/01/03/either-we-are-being-lied-to-or-taken-for-granted-how-can-there-be-plenty-water-at-vic-falls-yet-nothing-at-downstream-kariba-dam/,2020-01-03,"Either We Are Being Lied To Or Taken For Granted, How Can There Be Plenty Water At Vic Falls Yet Nothing At Downstream Kariba Dam?",zimeye.net
https://www.chronicle.co.zw/when-years-exchange-drought-baton-sticks/,2020-01-04,When years exchange drought baton sticks,chronicle.co.zw
https://www.chronicle.co.zw/inflationary-pressure-prompts-govt-to-introduce-subsidies/,2020-01-04,Inflationary pressure prompts Govt to introduce subsidies,chronicle.co.zw
https://www.voazimbabwe.com/a/zimbabwe-bulawayo-water-rationing/5231512.html,2020-01-03,Zimbabwe's Parched Bulawayo Rations to Save Dwindling Water,voazimbabwe.com
https://www.thezimbabwedaily.com/opinion-analysis/381677-when-years-exchange-drought-baton-sticks.html,2020-01-03,When years exchange drought baton sticks,thezimbabwedaily.com
https://www.zimbabweonlinenews.com/the-fastest-deteriorating-emergencies-to-look-out-for-in-new-year/,2020-01-02,The fastest-deteriorating emergencies to look out for in New Year,zimbabweonlinenews.com
https://zimbabwe-today.com/unemployed-youths-a-security-threat/,2020-01-03,‘Unemployed youths a security threat’,zimbabwe-today.com
https://www.zimeye.net/2020/01/04/open-letter-to-sky-news-reporter-who-reported-that-victoria-falls-had-dried-up/,2020-01-04,Open Letter To Sky News Reporter Who Reported That Victoria Falls Had Dried Up,zimeye.net
https://zimbabwe-today.com/subsidies-shouldnt-bring-indignity-to-beneficiaries/,2020-01-04,Subsidies shouldn’t bring indignity to beneficiaries,zimbabwe-today.com
https://nehandaradio.com/2020/01/04/eddie-cross-so-where-are-we-going-in-the-next-decade-in-zimbabwe/,2020-01-04,Eddie Cross: So where are we going in the next decade in Zimbabwe?,nehandaradio.com
https://www.thezimbabwean.co/2020/01/a-crucial-decade/,2020-01-04,A Crucial Decade,thezimbabwean.co
https://www.thezimbabwedaily.com/news/381863-welfare-scheme-launched1-million-pupils-to-benefit-under-beammore-cash-better-health-services-for-poor.html,2020-01-04,"Welfare scheme launched…1 million pupils to benefit under BEAM…More cash, better health services for poor",thezimbabwedaily.com
https://www.thezimbabwedaily.com/news/381865-stay-away-from-poisonous-illicit-liquors.html,2020-01-04,"Stay away from poisonous, illicit liquors",thezimbabwedaily.com
https://www.thezimbabwedaily.com/news/381958-better-economic-prospects-in-new-decade-for-zimbabwe.html,2020-01-05,Better economic prospects in new decade for Zimbabwe,thezimbabwedaily.com
https://www.zimeye.net/2020/01/05/govt-introduces-new-social-protection-for-children-and-the-vulnerable/,2020-01-05,Govt Introduces New Social Protection For Children And The Vulnerable.,zimeye.net
https://www.zimbabwesituation.com/news/a-crucial-decade/,2020-01-05,A Crucial Decade,zimbabwesituation.com
https://www.zimeye.net/2020/01/05/where-will-this-country-be-in-the-next-ten-years/,2020-01-05,Where Will This Country Be In The Next Ten Years?,zimeye.net
http://newzimbabwevision.com/irans-supreme-leader-vows-severe-revenge-on-those-responsible-for-the-death-of-top-military-commander-qasem-soleimani/,2020-01-04,IRAN’S SUPREME LEADER VOWS SEVERE “REVENGE” on those responsible for the death of top military commander Qasem Soleimani.,newzimbabwevision.com
http://newzimbabwevision.com/accident-two-people-died-after-a-harare-bound-trip-trans-bus-from-nyanga-overturned-near-macheke/,2020-01-04,"ACCIDENT: TWO PEOPLE DIED after a Harare-bound Trip Trans bus, from Nyanga, overturned near Macheke – newzimbabwevision",newzimbabwevision.com
http://newzimbabwevision.com/president-mnangagwa-says-zimbabweans-should-stop-eating-meat-as-it-is-unhealthy-and-be-vegetarians-instead/,2020-01-04,"PRESIDENT MNANGAGWA SAYS Zimbabweans should stop eating meat as it is unhealthy, and be vegetarians instead – newzimbabwevision",newzimbabwevision.com
http://newzimbabwevision.com/chamisa-who-has-promised-mnangagwa-will-fall-from-power-within-the-first-5-weeks-of-2020-actually-pleaded-for-us-invasion-of-zimbabwe-and-sanctions-to-topple-zanu-pf-so-as-to-heighten-the-mdc/,2020-01-05,"‘CHAMISA, actually pleaded for US invasion of Zimbabwe and Sanctions to topple Zanu pf so as to heighten the MDC’s chances of taking power’.",newzimbabwevision.com
https://www.thezimbabwedaily.com/international-news/382056-psychic-claims-a-royal-family-member-will-die-this-year.html,2020-01-05,Psychic claims a royal family member will die this year,thezimbabwedaily.com
https://www.sundaynews.co.zw/farmer-loses-45-beasts-15-596-cattle-succumb-to-drought-in-matabeleland-south-desperate-farmers-selling-cattle-for-as-low-as-zwl-2-000/,2020-01-05,Farmer loses 45 beasts . . . 15 596 cattle succumb to drought in Matabeleland South . . . Desperate farmers selling cattle for as low as ZWL 2 000,sundaynews.co.zw
https://www.zimbabwesituation.com/news/farmer-loses-45-beasts-15-596-cattle-succumb-to-drought-in-matabeleland-south-desperate-farmers-selling-cattle-for-as-low-as-zwl-2-000/,2020-01-06,Farmer loses 45 beasts . . . 15 596 cattle succumb to drought in Matabeleland South . . . Desperate farmers selling cattle for as low as ZWL 2 000,zimbabwesituation.com
https://nehandaradio.com/2020/01/05/farmer-loses-45-beasts-15-596-cattle-succumb-to-drought-in-mat-south/,2020-01-05,"Farmer loses 45 beasts, 15 596 cattle succumb to drought in Mat South",nehandaradio.com
https://www.thezimbabwemail.com/economic-analysis/better-economic-prospects-in-new-decade-for-zimbabwe/,2020-01-06,Better economic prospects in new decade for Zimbabwe,thezimbabwemail.com
https://www.chronicle.co.zw/ed-leads-first-campaign-on-removal-of-illegal-waste-dumps/,2020-01-04,ED leads first campaign on removal of illegal waste dumps,chronicle.co.zw
https://www.zimbabwesituation.com/news/looming-drought-a-test-case-of-human-preparedness/,2020-01-06,Looming drought a test case of human preparedness,zimbabwesituation.com
https://www.sundaymail.co.zw/welfare-scheme-launched-1-million-pupils-to-benefit-under-beam-more-cash-better-health-services-for-poor,2020-01-05,"Welfare scheme launched…1 million pupils to benefit under BEAM…More cash, better health services for poor",sundaymail.co.zw
https://www.sundaymail.co.zw/stay-away-from-poisonous-illicit-liquors,2020-01-05,"Stay away from poisonous, illicit liquors",sundaymail.co.zw
https://www.newsday.co.zw/2020/01/looming-drought-a-test-case-of-human-preparedness/,2020-01-06,Looming drought a test case of human preparedness,newsday.co.zw
https://www.thezimbabwedaily.com/news/382320-more-woes-for-zimbabwe-as-dam-levels-drop.html,2020-01-06,More woes for Zimbabwe as dam levels drop,thezimbabwedaily.com
https://www.thezimbabwemail.com/zimbabwe/more-woes-for-zimbabwe-as-dam-levels-drop/,2020-01-06,More woes for Zimbabwe as dam levels drop,thezimbabwemail.com
https://www.chronicle.co.zw/fire-hit-australia-gets-14bn-recovery-fund-as-troops-deployed/,2020-01-06,"Fire-hit Australia gets $1,4bn recovery fund as troops deployed",chronicle.co.zw
http://www.zimbabwestar.com/news/263631942/more-woes-for-zimbabwe-as-dam-levels-drop,2020-01-07,More woes for Zimbabwe as dam levels drop,zimbabwestar.com
https://www.herald.co.zw/all-hope-not-lost-say-agric-experts/,2020-01-07,"All hope not lost, say agric experts",herald.co.zw
https://www.thezimbabwedaily.com/news/382378-all-hope-not-lost-say-agric-experts.html,2020-01-06,"All hope not lost, say agric experts",thezimbabwedaily.com
http://www.zimbabwenews.net/news/263631942/more-woes-for-zimbabwe-as-dam-levels-drop,2020-01-07,More woes for Zimbabwe as dam levels drop,zimbabwenews.net
https://zimbabwe-today.com/looming-drought-a-test-case-of-human-preparedness/,2020-01-06,Looming drought a test case of human preparedness,zimbabwe-today.com
https://www.newzimbabwe.com/more-woes-for-zimbabwe-as-dam-levels-drop/,2020-01-07,More woes for Zimbabwe as dam levels drop,newzimbabwe.com
http://bulawayo24.com/technology/motors/177004,2020-01-02,Zimbabwe government to import electric vehicles,bulawayo24.com
https://www.zimbabwesituation.com/news/all-hope-not-lost-say-agric-experts/,2020-01-07,"All hope not lost, say agric experts",zimbabwesituation.com
https://iharare.com/a-british-royal-family-member-will-die-this-year-says-fortune-teller-jemima-packington/,2020-01-07,“A British Royal Family Member Will Die This Year”: Jemima Packington,iharare.com
https://www.zimeye.net/2020/01/07/govt-imports-electric-cars-for-cmed/,2020-01-07,Govt Imports Electric Cars For CMED,zimeye.net
https://www.thezimbabwean.co/2020/01/more-woes-for-zimbabwe-as-dam-levels-drop/,2020-01-07,More woes for Zimbabwe as dam levels drop,thezimbabwean.co
https://www.thezimbabwemail.com/car-renew/zimbabwe-govt-to-import-electric-cars/,2020-01-07,Zimbabwe govt to import electric cars,thezimbabwemail.com
https://www.263chat.com/govt-approves-insurance-deal-against-climate-change/,2020-01-07,Govt Approves Insurance Deal Against Climate Change,263chat.com
https://www.zimbabwesituation.com/news/more-woes-for-zimbabwe-as-dam-levels-drop/,2020-01-08,More woes for Zimbabwe as dam levels drop,zimbabwesituation.com
http://newzimbabwevision.com/over-10000-of-12-million-camels-will-be-shot-to-prevent-them-from-drinking-too-much-water-in-drought-afflicted-south-australia/,2020-01-07,"OVER 10,000 camels to be shot to prevent them from drinking too much water in drought-afflicted South Australia.",newzimbabwevision.com
http://newzimbabwevision.com/police-shoot-a-gold-panner-dead-and-injure-five-others-after-a-violent-mob-of-machete-wielding-gold-panners-charge-at-them/,2020-01-07,POLICE SHOOT A GOLD PANNER DEAD AND INJURE FIVE OTHERS AFTER a violent mob of machete wielding gold panners charge at them,newzimbabwevision.com
http://newzimbabwevision.com/twelve-chipinge-machete-wielding-villagers-attacked-a-messenger-of-court-team-critically-injuring-one-as-the-villagers-were-being-evicted-from-a-private-commercial-farm-smithfield-farm-after-illegal/,2020-01-07,"TWELVE CHIPINGE MACHETE WIELDING VILLAGERS attacked a messenger of court team, critically injuring one as the villagers were being evicted from a private commercial farm, Smithfield farm after illegally settling on it.",newzimbabwevision.com
http://newzimbabwevision.com/home-office-accelerates-removal-of-failed-asylum-seekers-permitting-zimbabwean-government-officials-to-interview-potential-returnees/,2020-01-07,"HOME office accelerates removal of failed asylum seekers, permitting Zimbabwean government officials to interview potential returnees",newzimbabwevision.com
http://newzimbabwevision.com/at-least-three-people-have-been-killed-and-dozens-injured-after-a-zupco-bus-skidded-off-the-bulawayo-gwanda-road-near-chipangali-wildlife-sanctuary/,2020-01-08,At least three people have been killed and dozens injured after a ZUPCO bus skidded off the Bulawayo-Gwanda road near Chipangali Wildlife Sanctuary-,newzimbabwevision.com
http://newzimbabwevision.com/self-exiled-ex-minister-walter-mzembi-a-fugitive-from-justice-appointed-interim-leader-of-a-new-opposition-party-the-peoples-party/,2020-01-08,"SELF-EXILED ex minister Walter Mzembi a fugitive from justice, appointed interim leader of a new opposition party, the People’s Party. – newzimbabwevision",newzimbabwevision.com
http://bulawayo24.com/opinion/columnist/177023,2020-01-02,Zimbabwean economy simplified,bulawayo24.com
https://www.263chat.com/un-adopts-usd3-billion-budget/,2020-01-08,UN Adopts USD$3 Billion Budget,263chat.com
http://newzimbabwevision.com/vp-mohadis-estranged-wife-tambudzanivows-to-attach-his-property-to-enable-her-to-get-an-equal-share-of-the-couples-matrimonial-property-following-the-dissolution-of-their-marriage/,2020-01-08,"VP Mohadi’s estranged wife, Tambudzani,vows to attach his property to enable her to get an equal share of the couple’s matrimonial property following the dissolution of their marriage in March 2019.",newzimbabwevision.com
http://newzimbabwevision.com/president-on-3-week-annual-vacation-will-not-leave-zimbabwe-after-chamisa-warned-that-he-will-fall-in-the-first-5-weeks-of-2020/,2020-01-08,"President on 3 week annual vacation, will not leave Zimbabwe after Chamisa warned that he will fall in the first 5 weeks of 2020",newzimbabwevision.com
http://newzimbabwevision.com/smart-train-worlds-first-350km-217-mph-without-a-driver-bullet-train-goes-into-service-in-china/,2020-01-08,SMART TRAIN: WORLD’S FIRST 350km-(217 mph) without a driver bullet train goes into service in China.,newzimbabwevision.com
http://newzimbabwevision.com/176-dead-ukrainian-boeing-737-international-airlines-flight-ps752-to-kyiv-crashed-after-taking-off-from-imam-khomeini-airport-in-tehran-iran-at-0612-local-time-0242-gmt/,2020-01-08,"176 DEAD: UKRAINIAN BOEING-737 International Airlines flight PS752 to Kyiv crashed after taking off from Imam Khomeini airport in Tehran , Iran at 06:12 local time (02:42 GMT).",newzimbabwevision.com
http://newzimbabwevision.com/chivi-man-47-of-mhosva-village-sat-on-his-sleeping-grandfather-101-and-suffocated-him-to-death-for-refusing-to-pray-for-him/,2020-01-08,CHIVI MAN (47) of Mhosva Village sat on his sleeping grandfather (101) and suffocated him to death for refusing to pray for him.,newzimbabwevision.com
http://newzimbabwevision.com/the-queens-granddaughter-zara-tindall-has-been-banned-from-driving-for-six-months-after-being-caught-speeding-at-91mph-near-her-cotswolds-home/,2020-01-08,The Queen’s granddaughter Zara Tindall has been banned from driving for six months after being caught speeding at 91mph near her Cotswolds home.,newzimbabwevision.com
http://newzimbabwevision.com/body-of-child-aged-about-10-found-in-the-undercarriage-of-a-plane-that-had-arrived-in-paris-from-abidjan-at-charles-de-gaulle-airport-early-in-the-morning/,2020-01-08,"BODY of Child aged about 10 found in the undercarriage of a plane that had arrived in Paris from Abidjan, at Charles de Gaulle Airport early in the morning.",newzimbabwevision.com
https://www.voazimbabwe.com/a/donald-trump-popularity-world-wide-survey/5237115.html,2020-01-08,Pew Survey: Trump Viewed Negatively Around the World,voazimbabwe.com
http://newzimbabwevision.com/i-dont-have-a-family-fortune-to-fall-back-on-ex-labour-mp-79468-salary-says-after-she-was-photographed-while-at-local-jobcentre/,2020-01-08,"‘I don’t have a family fortune to fall back on’: says Ex-Labour MP £79,468 p/yr photographed at local Jobcentre – newzimbabwevision",newzimbabwevision.com
http://www.thezimbabwenewslive.com/zimbabwe-to-import-electric-powered-vehicles/,2020-01-08,Zimbabwe to Import Electric Powered Vehicles,thezimbabwenewslive.com
https://www.zimbabweonlinenews.com/years-of-drought-threaten-south-africas-wildlife-industry/,2020-01-07,Years of drought threaten South Africa's wildlife industry,zimbabweonlinenews.com
http://newzimbabwevision.com/mazoe-police-arrested-14-machete-weilding-illegal-miners-who-had-11-machetes-explosives-and-copper-cables-on-wednesday-9-1-20/,2020-01-08,"MAZOE POLICE ARRESTED 14 machete weilding illegal miners who had 11 machetes, explosives and copper cables on Wednesday 9/1/20.",newzimbabwevision.com
https://www.herald.co.zw/value-of-participating-in-tourism-exchanges/,2020-01-09,Value of participating in tourism exchanges,herald.co.zw
https://www.thezimbabwedaily.com/news/382877-editorial-comment-value-of-participating-in-tourism-exchanges.html,2020-01-08,Value of participating in tourism exchanges,thezimbabwedaily.com
http://www.insiderzim.com/zimbabwe-doing-well-but-everyone-has-to-start-doing-things-differently/,2020-01-08,Zimbabwe doing well but everyone has to start doing things differently,insiderzim.com
http://newzimbabwevision.com/11-zim-national-army-zna-officers-were-injured-last-night-after-their-army-bus-landed-on-its-side-near-kuwadzana-6-five-of-the-injured-are-critical/,2020-01-09,"11 Zim National Army (ZNA) officers were injured last night after their army bus landed on its side near Kuwadzana 6, five of the injured are critical.",newzimbabwevision.com
http://newzimbabwevision.com/highlanders-fc-have-appointed-mark-harrison-as-the-teams-new-technical-manager-succeeding-hendrikus-pieter-de-jongh-who-has-joined-fc-platinum/,2020-01-09,"Highlanders FC have appointed Mark Harrison as the team’s new technical manager, succeeding Hendrikus Pieter De Jongh, who has joined FC Platinum",newzimbabwevision.com
https://www.newzimbabwe.com/bulawayo-targets-borehole-rehabilitation-to-ease-city-water-woes/,2020-01-09,Bulawayo targets borehole rehabilitation to ease city water woes,newzimbabwe.com
https://www.newzimbabwe.com/un-switches-from-cash-to-food-donations-to-relieve-zimbabwes-hunger-crisis/,2020-01-09,UN switches from cash to food donations to relieve Zimbabwe's hunger crisis,newzimbabwe.com
https://www.newzimbabwe.com/zimbabwe-among-15-global-hotspots-suffering-food-insecurity-un/,2020-01-09,Zimbabwe Among 15 Global Hotspots Suffering Food Insecurity,newzimbabwe.com
http://newzimbabwevision.com/sa-new-refugee-laws-which-came-into-effect-on-1-january-2020-target-political-dissidentsprohibit-refugees-from-participating-in-political-activities-related-to-their-countries-of-origin/,2020-01-09,"SA: new refugee laws which came into effect on 1 January 2020: ‘target political dissidents,prohibit refugees from participating in political activities related to their countries of origin",newzimbabwevision.com
http://newzimbabwevision.com/a-prison-officer-at-a-maximum-security-jail-has-been-attacked-by-two-inmates-wielding-bladed-weapons-and-wearing-fake-suicide-vests/,2020-01-09,A prison officer at a maximum security jail has been attacked by two inmates wielding bladed weapons and wearing fake suicide vests.,newzimbabwevision.com
https://www.thezimbabwedaily.com/news/383063-manicaland-crop-under-threat-despite-rains.html,2020-01-09,Manicaland crop under threat despite rains,thezimbabwedaily.com
https://www.manicapost.co.zw/manicaland-crop-under-threat-despite-rains/,2020-01-10,Manicaland crop under threat despite rains,manicapost.co.zw
https://www.chronicle.co.zw/bulawayo-supply-dams-stand-at-35/,2020-01-09,Bulawayo supply dams stand at 35%,chronicle.co.zw
https://www.thezimbabwedaily.com/news/383174-a-crucial-decade.html,2020-01-10,A crucial decade,thezimbabwedaily.com
https://www.newsday.co.zw/2020/01/a-crucial-decade/,2020-01-10,A crucial decade,newsday.co.zw
https://www.chronicle.co.zw/editorial-comment-council-must-expedite-water-projects/,2020-01-10,EDITORIAL COMMENT: Council must expedite water projects,chronicle.co.zw
https://www.zimbabwesituation.com/news/world-food-body-puts-zimbabwe-among-15-global-hotspots-suffering-food-insecurity-xinhua/,2020-01-10,World food body puts Zimbabwe among 15 global hotspots suffering food insecurity,zimbabwesituation.com
https://www.newzimbabwe.com/australian-animals-face-extinction-threat-as-bushfire-toll-mounts/,2020-01-10,Australian animals face extinction threat as bushfire toll mounts,newzimbabwe.com
http://newzimbabwevision.com/a-gang-of-47-machete-wielding-thugs-besieged-a-police-base-in-gokwe-in-an-attempt-to-spring-colleagues-from-police-custody-on-6-01-19/,2020-01-10,A GANG OF 47 MACHETE WIELDING THUGS besieged a police base in Gokwe in an attempt to spring colleagues from police custody on 6/01/19 .,newzimbabwevision.com
https://www.thezimbabwean.co/2020/01/world-food-body-puts-zimbabwe-among-15-global-hotspots-suffering-food-insecurity/,2020-01-10,World food body puts Zimbabwe among 15 global hotspots suffering food insecurity,thezimbabwean.co
http://newzimbabwevision.com/woman-21-who-posed-as-teenage-boy-to-sexually-assault-up-to-50-girls-after-grooming-them-is-sentenced-to-eight-years-at-winchester-crown-court/,2020-01-10,"WOMAN, 21, who posed as teenage boy to ‘sexually assault up to 50 girls’ after grooming them is sentenced to eight years at Winchester Crown Court",newzimbabwevision.com
http://newzimbabwevision.com/three-people-battling-for-their-lives-after-consuming-meat-from-animals-that-died-of-anthrax-in-mahusekwa/,2020-01-10,"Three people battling for their lives after consuming meat from animals that died of anthrax in Mahusekwa,",newzimbabwevision.com
http://newzimbabwevision.com/us-president-claims-he-was-overlooked-for-2019-nobel-peace-prize-referring-to-ethiopian-prime-minister-abiy-ahmed-43-africas-youngest-head-of-government/,2020-01-10,"‘US PRESIDENT CLAIMS he was overlooked for 2019 Nobel Peace Prize, referring to Ethiopian Prime Minister Abiy Ahmed, 43, Africa’s youngest head of government’. – newzimbabwevision",newzimbabwevision.com
