url,date_published,title,newsorg
http://newzimbabwevision.com/health-minister-mangwiro-involved-in-the-procurement-of-non-usable-equipment-with-no-brand-names-for-the-manufacturer-in-india/,2020-02-04,HEALTH Minister Mangwiro involved in the procurement of non-usable equipment with no brand names for the manufacturer in India.,newzimbabwevision.com
http://newzimbabwevision.com/silobela-man-42-jailed-five-years-for-fatally-assaulting-his-daughter-15-using-a-fan-beltaccusing-her-of-having-a-boyfriend/,2020-02-04,"SILOBELA MAN 42- jailed five years for fatally assaulting his daughter 15, using a fan belt,accusing her of having a boyfriend – newzimbabwevision",newzimbabwevision.com
http://newzimbabwevision.com/mangagwas-government-has-created-a-form-of-black-apartheid-where-only-the-zanu-pf-elite-were-living-comfortably-chamisa/,2020-02-04,MANGAGWA’S government has created a form of black apartheid where only the Zanu-PF elite were living comfortably.-Chamisa.,newzimbabwevision.com
https://www.chronicle.co.zw/editorial-comment-lets-implement-drought-mitigatory-measures-to-avert-disaster/,2020-02-05,EDITORIAL COMMENT: Let’s implement drought mitigatory measures to avert disaster,chronicle.co.zw
https://www.thezimbabwedaily.com/opinion-analysis/387025-editorial-comment-lets-implement-drought-mitigatory-measures-to-avert-disaster.html,2020-02-04,EDITORIAL COMMENT: Let’s implement drought mitigatory measures to avert disaster,thezimbabwedaily.com
https://www.newsday.co.zw/2020/02/whats-at-stake-for-womens-rights-in-2020/,2020-02-05,What’s at stake for women’s rights in 2020?,newsday.co.zw
https://www.newsday.co.zw/2020/02/intwasa-to-host-tourism-minister/,2020-02-05,Intwasa to host Tourism minister,newsday.co.zw
https://www.zimeye.net/2020/02/05/first-e-cabinet-decision-matrix/,2020-02-05,First e-Cabinet Decision Matrix,zimeye.net
https://www.newzimbabwe.com/low-rainfall-deepen-zim-power-woes/,2020-02-05,Low rainfall deepen Zim power woes,newzimbabwe.com
https://www.zimbabwesituation.com/news/the-solution-to-famine-starts-with-farming-zimbabwe/,2020-02-05,The Solution to Famine Starts with Farming,zimbabwesituation.com
https://www.thezimbabwedaily.com/news/387136-intwasa-to-host-tourism-minister.html,2020-02-05,Intwasa to host Tourism minister,thezimbabwedaily.com
https://www.zimbabwesituation.com/news/first-cabinet-meeting-decisions-matrix/,2020-02-05,First Cabinet meeting decisions matrix,zimbabwesituation.com
https://www.zimbabwesituation.com/news/zim-davos-visit-lures-investors/,2020-02-05,Zim Davos visit lures investors,zimbabwesituation.com
https://www.newzimbabwe.com/muzarabani-corridor-a-vehicle-for-transformative-smart-agriculture-benefits-small-scale-farmers/,2020-02-05,"‘Muzarabani Corridor’ a vehicle for transformative smart agriculture, benefits small-scale farmers",newzimbabwe.com
http://bulawayo24.com/news/national/178434,2020-02-05,Zimbabwe sugar company Tongaat Hulett to harvest maize,bulawayo24.com
https://www.thezimbabwean.co/2020/02/the-solution-to-famine-starts-with-farming/,2020-02-05,The Solution to Famine Starts with Farming,thezimbabwean.co
https://www.263chat.com/more-buck-less-cooling-africa-re-thinks-its-mines/,2020-02-05,"More Buck, Less Cooling :Africa Re-Thinks Its Mines",263chat.com
https://www.zimbabweonlinenews.com/the-solution-to-famine-starts-with-farming/,2020-02-03,The Solution to Famine Starts with Farming,zimbabweonlinenews.com
http://newzimbabwevision.com/a-drunk-zimbabwe-soldier-from-bulawayos-imbizo-barracks-ploughed-into-100-colleagues-on-a-routine-jog-leaving-30-hospitalised-with-broken-bones/,2020-02-05,A DRUNK ZIMBABWE SOLDIER from Bulawayo’s Imbizo Barracks ploughed into 100 colleagues on a routine jog leaving 30 hospitalised with broken bones – newzimbabwevision,newzimbabwevision.com
http://newzimbabwevision.com/more-good-ones-gundwanes-rats-as-bulawayo-city-council-bcc-suspends-rodent-control-services-due-to-chemicals-shortages/,2020-02-05,"‘MORE Good ones (gundwanes), rats’ as Bulawayo City Council (BCC) suspends rodent control services due to chemicals shortages’.",newzimbabwevision.com
http://newzimbabwevision.com/bulawayo-provincial-affairs-minister-judith-ncube-urges-teachers-to-shun-todays-planned-protests-against-fees-increases-and-poor-remuneration-among-other-pertinent-issues-affecting-them-saying-suc/,2020-02-05,"BULAWAYO Provincial Affairs Minister Judith Ncube urges teachers to shun today’s planned protests against fees increases and poor remuneration among other pertinent issues affecting them, saying such actions contributed to poor academic performance in some local schools. – newzimbabwevision",newzimbabwevision.com
http://newzimbabwevision.com/scare-tactics-gmaz-boss-masarara-seeks-to-silence-matutu-and-tsenengamu-over-corruption-allegations-and-instil-fear/,2020-02-05,SCARE TACTICS-(GMAZ) Boss Masarara seeks to silence Matutu and Tsenengamu over corruption allegations and instil fear.,newzimbabwevision.com
http://newzimbabwevision.com/ex-pm-camerons-protection-unit-officer-left-a-loaded-9mm-glock-17-gun-his-passport-and-camerons-passport-in-a-ba-flight-toilet-from-new-york-to-london-heathrow-this-week/,2020-02-05,"Ex PM, Cameron’s protection unit officer, left a loaded ‘9mm Glock 17’ gun, his passport and Cameron’s passport in a BA flight toilet from New York to London Heathrow this week – newzimbabwevision",newzimbabwevision.com
http://newzimbabwevision.com/teenager-pushed-woman-18-off-a-fourth-floor-balcony-when-she-rejected-his-advances-during-house-party-inside-a-luxury-block-of-flats-in-south-london/,2020-02-05,Teenager pushed woman 18 off a fourth-floor balcony when she rejected his advances during house party inside a luxury block of flats in South London – newzimbabwevision,newzimbabwevision.com
http://newzimbabwevision.com/trafigura-pte-limited-has-parted-ways-with-its-zimbabwean-partners-sakunda-holdings-owned-by-controversial-businessman-kuda-tagwirei/,2020-02-05,TRAFIGURA Pte LIMITED HAS PARTED WAYS with its Zimbabwean partners Sakunda Holdings owned by controversial businessman Kuda Tagwirei. – newzimbabwevision,newzimbabwevision.com
http://newzimbabwevision.com/zanu-pf-youth-leaders-label-mnangagwas-ally-kuda-tagwirei-the-most-corrupt-person-in-the-zimbabwe-at-an-extraordinary-press-conference/,2020-02-05,ZANU PF YOUTH leaders label Mnangagwa’s ally Kuda Tagwirei “the most corrupt person in the Zimbabwe” at an extraordinary Press conference,newzimbabwevision.com
http://newzimbabwevision.com/namibian-police-hunt-for-zimbabwean-man-over-murder-of-another-zimbabwean/,2020-02-05,NAMIBIAN POLICE HUNT FOR ZIMBABWEAN man over murder of another Zimbabwean.,newzimbabwevision.com
https://www.thezimbabwemail.com/business/low-rainfall-deepens-zimbabwes-generation-power-problems/,2020-02-05,Low rainfall deepens Zimbabwe’s generation power problems,thezimbabwemail.com
http://newzimbabwevision.com/breaking-news-vice-president-chiwenga-storms-out-of-zanu-pf-politburo-as-matutu-tsenengamu-and-togarepi-are-suspended/,2020-02-05,"BREAKING NEWS: VICE PRESIDENT Chiwenga ‘storms out of Zanu-PF Politburo’ as Matutu, Tsenengamu and Togarepi are suspended’ – newzimbabwevision",newzimbabwevision.com
http://newzimbabwevision.com/vpchiwengas-estranged-wife-marry-will-remain-in-custody-until-friday-for-bail-hearing-before-high-court-judge-justice-erica-ndewere/,2020-02-05,"VPChiwenga’s estranged wife, Marry will remain in custody until Friday for bail hearing before High Court judge, Justice Erica Ndewere.",newzimbabwevision.com
http://newzimbabwevision.com/mnangagwas-millitarised-zanu-pf-regime-imposes-a-punitive-1-million-for-tv-licences-and-142-000-for-online-radio-stations-curtailing-freedom-of-expression/,2020-02-05,"MNANGAGWA’S MILLITARISED ZANU PF REGIME imposes a punitive $1 million for tv licences and $142 000 for online radio stations, curtailing freedom of expression. – newzimbabwevision",newzimbabwevision.com
https://www.thezimbabwemail.com/world-news/germanys-merkel-heading-to-south-africa-for-trade-talks/,2020-02-05,Germany’s Merkel heading to South Africa for trade talks,thezimbabwemail.com
https://www.thezimbabwedaily.com/news/387329-germanys-merkel-heading-to-south-africa-for-trade-talks.html,2020-02-05,Germany’s Merkel heading to South Africa for trade talks,thezimbabwedaily.com
https://www.herald.co.zw/spend-more-time-in-communities-ed/,2020-02-06,Spend more time in communities: ED,herald.co.zw
https://www.herald.co.zw/un-applauds-zims-ict-sector/,2020-02-06,UN applauds Zim’s ICT sector,herald.co.zw
https://www.thezimbabwedaily.com/news/387371-un-applauds-zims-ict-sector.html,2020-02-05,UN applauds Zim’s ICT sector,thezimbabwedaily.com
https://www.263chat.com/analysis-zimbabwean-economy-re-dollarizing-rapidly/,2020-02-04,ANALYSIS: Zimbabwean economy re-dollarizing rapidly,263chat.com
https://bulawayo24.com/index-id-news-sc-national-byo-178491.html,2020-02-01,Mnangagwa wants Zanu-PF leaders to spend more time in communities,bulawayo24.com
https://bulawayo24.com/index-id-opinion-sc-columnist-byo-178540.html,2020-02-06,"Mthuli overrated minister, NO Solutions to Economic Crisis",bulawayo24.com
https://www.newzimbabwe.com/starving-villagers-in-tsholotsho-call-out-for-govt-assistance/,2020-02-06,Starving villagers in Tsholotsho call out for govt assistance,newzimbabwe.com
https://www.zimeye.net/2020/02/06/mthuli-ncube-has-no-solution-to-economic-crisis/,2020-02-06,Mthuli Ncube Has No Solution to Economic Crisis,zimeye.net
https://www.thezimbabwean.co/2020/02/zimbabwe-to-host-high-level-un-conference-on-sdgs/,2020-02-06,Zimbabwe to host high-level UN conference on SDGs,thezimbabwean.co
https://www.thezimbabwedaily.com/news/387511-vegetables-rot-in-food-markets-across-zimbabwe-while-people-starve.html,2020-02-06,Vegetables rot in food markets across Zimbabwe while people starve,thezimbabwedaily.com
https://www.zimeye.net/2020/02/06/dr-mavaza-blasts-mthuli-ncube/,2020-02-06,Dr Mavaza Blasts Mthuli Ncube,zimeye.net
https://www.zimeye.net/2020/02/06/clueless-mthuli-cant-fix-economy/,2020-02-06,Clueless Mthuli Can’t Fix Economy,zimeye.net
https://www.voazimbabwe.com/a/prolonged-drought-botswana-diamond-industry-incapacitated/5276782.html,2020-02-06,"Dry Spell Kills Botswana's 'Edible Diamonds', Hitting Rural Communities",voazimbabwe.com
https://www.zimbabwesituation.com/news/zimbabwe-to-host-high-level-un-conference-on-sdgs/,2020-02-07,Zimbabwe to host high-level UN conference on SDGs,zimbabwesituation.com
https://www.herald.co.zw/first-lady-calls-for-improved-food-preservation/,2020-02-07,First Lady calls for improved food preservation,herald.co.zw
https://www.zimbabweonlinenews.com/first-regular-session-of-the-undp-executive-board/,2020-02-05,First Regular Session of the UNDP Executive Board,zimbabweonlinenews.com
http://newzimbabwevision.com/power-to-the-people-acorn-demaands-that-dan-jarvis-sheffield-city-region-mayor-must-bring-our-buses-back-into-public-control-as-south-yorkshires-bus-network-is-broken/,2020-02-07,"POWER TO THE PEOPLE!-ACORN demands that Dan Jarvis, Sheffield City Region Mayor must bring our buses back into public control as South Yorkshire’s bus network is broken",newzimbabwevision.com
http://newzimbabwevision.com/kwekwe-mine-accident-2-illegal-miners-dead-20-trapped-following-the-collapse-of-a-shaft-at-globe-and-phoenix-mine-last-night/,2020-02-06,"KWEKWE MINE ACCIDENT: 2 illegal miners dead, 20 trapped following the collapse of a shaft at Globe and Phoenix Mine last night – newzimbabwevision",newzimbabwevision.com
http://newzimbabwevision.com/trafigura-sources-fuel-from-terrorists-claims-biti-adding-that-sakunda-and-trafigura-parted-ways-because-the-pressure-was-mounting-on-trafigura-which-is-headquartered-in-switzerland-after-evidence/,2020-02-06,"‘TRAFIGURA SOURCES FUEL FROM TERRORISTS CLAIMS BITI adding that Sakunda and Trafigura parted ways because the pressure was mounting on Trafigura which is headquartered in Switzerland after evidence of the criminal sources of the fuel is supplied emerged.,’ – newzimbabwevision",newzimbabwevision.com
http://newzimbabwevision.com/police-bust-unlicensed-liquor-musombodhiya-liquor-syndicate-at-minister-dr-joram-gumbos-house-in-harare-also-serving-as-a-brewery-at-house-number-19-stellenbosch-sunridge-in-marbelreign/,2020-02-06,"POLICE BUST unlicensed liquor, Musombodhiya liquor syndicate at Minister Dr. Joram Gumbo;s house in Harare also serving as a brewery at House Number 19, Stellenbosch, Sunridge in Marbelreign. – newzimbabwevision",newzimbabwevision.com
http://newzimbabwevision.com/the-former-former-deputy-minister-of-labour-and-social-welfare-and-marondera-east-mp-tracy-mutinhiri-has-resigned-from-the-nelson-chamisa-led-mdc/,2020-02-06,"THE FORMER former Deputy Minister of Labour and Social Welfare and Marondera East MP, Tracy Mutinhiri has resigned from the Nelson Chamisa-led MDC. – newzimbabwevision",newzimbabwevision.com
http://newzimbabwevision.com/bulawayo-strips-the-late-national-hero-takawira-of-the-honour-of-having-a-major-bulawayo-city-road-named-after-him/,2020-02-06,"BULAWAYO strips, the late National Hero Takawira of the honour of having a major Bulawayo city road named after him, – newzimbabwevision",newzimbabwevision.com
http://newzimbabwevision.com/24-mutare-families-fce-eviction-from-land-they-have-lived-on-for-30-years-to-pave-way-for-chinese-investors-who-are-into-brickmoulding/,2020-02-06,24 Mutare families face eviction from land they have lived on for 30 years to pave way for Chinese investors who are into brickmoulding.,newzimbabwevision.com
http://newzimbabwevision.com/six-ak47-armed-zimbabweans-in-two-cars-rob-chitungwiza-forex-dealer-kidnap-three-people-escape-with-loot-and-fire-15-shots/,2020-02-06,"SIX AK47 ARMED ZIMBABWEANS in two cars rob Chitungwiza forex dealer, kidnap three people escape with loot and fire 15 shots",newzimbabwevision.com
https://www.chronicle.co.zw/sa-zambia-to-join-zim-for-infrastructure-summit/,2020-02-06,"SA, Zambia to join Zim for infrastructure summit",chronicle.co.zw
https://www.newzimbabwe.com/mnangagwa-says-no-food-politicisation-in-drought-ravaged-zim/,2020-02-07,Mnangagwa says no food politicisation in drought ravaged Zim,newzimbabwe.com
https://www.thepatriot.co.zw/top-news/eu-must-lift-sanctions-immediately/,2020-02-06,‘EU must lift sanctions immediately’,thepatriot.co.zw
https://www.zimbabweonlinenews.com/first-regular-session-of-the-undp-executive-board-2/,2020-02-06,First Regular Session of the UNDP Executive Board,zimbabweonlinenews.com
https://www.zimbabweonlinenews.com/vegetables-rot-in-food-markets-across-zimbabwe-while-half-the-population-faces-food-insecurity/,2020-02-06,Vegetables rot in food markets across Zimbabwe while half the population faces food insecurity,zimbabweonlinenews.com
https://www.theindependent.co.zw/2020/02/07/harvesting-the-grapes-of-wrath/,2020-02-07,Harvesting the grapes of wrath,theindependent.co.zw
https://www.theindependent.co.zw/2020/02/07/glb-250-arrival-looms/,2020-02-07,GLB 250 arrival looms,theindependent.co.zw
https://www.thezimbabwean.co/2020/02/vegetables-rot-in-food-markets-across-zimbabwe-while-half-the-population-faces-food-insecurity/,2020-02-07,Vegetables Rot in Food Markets across Zimbabwe While Half the Population Faces Food Insecurity,thezimbabwean.co
https://www.zimbabwesituation.com/news/vegetables-rot-in-food-markets-across-zimbabwe-while-half-the-population-faces-food-insecurity/,2020-02-07,Vegetables Rot in Food Markets across Zimbabwe While Half the Population Faces Food Insecurity,zimbabwesituation.com
https://www.zimbabwesituation.com/news/sugar-beans-profitable-crop-in-season/,2020-02-07,"Sugar beans, profitable crop in season!",zimbabwesituation.com
https://www.thezimbabwemail.com/food-drink/vegetables-rot-in-food-markets-across-zimbabwe-while-people-starve/,2020-02-07,Vegetables rot in food markets across Zimbabwe while people starve,thezimbabwemail.com
https://www.chronicle.co.zw/editorial-comment-creation-of-zida-will-boost-investment-inflows/,2020-02-08,EDITORIAL COMMENT: Creation of Zida will boost investment inflows,chronicle.co.zw
https://www.chronicle.co.zw/stop-mourning-over-sanctions-develop-inventions-that-develop-economy/,2020-02-08,"‘Stop mourning over sanctions, develop inventions that develop economy’",chronicle.co.zw
https://www.thezimbabwedaily.com/opinion-analysis/387861-editorial-comment-creation-of-zida-will-boost-investment-inflows.html,2020-02-07,EDITORIAL COMMENT: Creation of Zida will boost investment inflows,thezimbabwedaily.com
https://www.thezimbabwedaily.com/news/387883-technology-is-the-future-president.html,2020-02-07,Technology is the future: President,thezimbabwedaily.com
https://www.thezimbabwedaily.com/news/387881-president-to-oversee-zida.html,2020-02-07,President to oversee Zida,thezimbabwedaily.com
https://www.manicapost.co.zw/wef-opportune-platform-to-lure-investment/,2020-02-07,WEF: Opportune platform to lure investment,manicapost.co.zw
https://www.herald.co.zw/president-to-oversee-zida/,2020-02-08,President to oversee Zida,herald.co.zw
https://www.herald.co.zw/technology-is-the-future-president/,2020-02-08,Technology is the future: President,herald.co.zw
http://newzimbabwevision.com/a-mberengwa-woman-42-her-tailor-and-ex-boyfriend-who-murdered-her-live-in-boyfriend-and-dumped-the-body-in-a-dam-jailed-95-years-in-prison/,2020-02-07,"A Mberengwa woman (42), her tailor and ex boyfriend who murdered her live in boyfriend and dumped the body in a dam ,jailed 95 years in prison.",newzimbabwevision.com
http://newzimbabwevision.com/businessman-lunat-57-of-kumalo-suburb-accused-of-fuelling-the-forex-black-market-money-laundering-and-externalisation-of-over-us13-million/,2020-02-07,"Businessman, Lunat (57) of Kumalo suburb accused of fuelling the forex black market, money laundering and externalisation of over US$1,3 million. – newzimbabwevision",newzimbabwevision.com
http://newzimbabwevision.com/179-were-injured-3-dead-as-pegasus-airlines-aircraft-crashed-on-landing-in-poor-weather-and-broke-up-after-skidding-off-runway-in-istanbul/,2020-02-07,"179 were injured, 3 dead as Pegasus Airlines aircraft crashed on landing in poor weather and broke up after skidding off runway in Istanbul",newzimbabwevision.com
http://newzimbabwevision.com/zesa-holdings-acting-chief-executive-officer-patrick-chivaura-died-on-friday-morning-but-details-of-his-death-still-unknown/,2020-02-07,ZESA Holdings acting chief executive officer Patrick Chivaura died on Friday morning but details of his death still unknown. – newzimbabwevision,newzimbabwevision.com
http://newzimbabwevision.com/vp-mohadi-refuses-to-pay-maintenance-and-wants-the-court-to-dismiss-his-ex-wife-tambudzani-mohadi-13-000-monthly-maintenance-demand/,2020-02-07,VP MOHADI refuses to pay maintenance and wants the court to dismiss his ex-wife Tambudzani Mohadi $13 000 monthly maintenance demand – newzimbabwevision,newzimbabwevision.com
http://newzimbabwevision.com/zimbabwes-vision-2020-harare-has-dirty-slimy-water-coming-out-of-their-taps/,2020-02-07,ZIMBABWE’S VISION 2020-HARARE has dirty slimy water coming out of their taps.,newzimbabwevision.com
http://newzimbabwevision.com/one-dead-and-another-seriously-injured-in-tunnel-collapse-while-illegally-extracting-coke-at-the-hwange-colliery-company-limited-hccl-waste-dump/,2020-02-07,ONE dead and another seriously injured in tunnel collapse while illegally extracting coke at the Hwange Colliery Company Limited (HCCL) waste dump . – newzimbabwevision,newzimbabwevision.com
http://bulawayo24.com/news/national/178686,2020-02-05,"'Stop mourning over sanctions,' says Mnangagwa",bulawayo24.com
http://newzimbabwevision.com/zim-must-use-its-god-given-resources-and-skills-of-its-people-to-develop-the-country-and-stop-mourning-about-western-sanctions-president-mnangagwa/,2020-02-08,"‘Zim must use its God-given resources and skills of its people, to develop the country and stop mourning about Western sanctions’- President Mnangagwa",newzimbabwevision.com
http://newzimbabwevision.com/suspended-tsenengamu-says-mnangagwa-and-chamisa-to-sober-as-leadership-of-zanu-pf-and-the-mdc-is-temporary/,2020-02-08,"SUSPENDED, Tsenengamu, , says Mnangagwa and Chamisa to sober as leadership of Zanu-PF and the MDC is temporary. – newzimbabwevision",newzimbabwevision.com
http://newzimbabwevision.com/a-self-navigating-car-successfully-drives-itself-for-230-miles-370-149-km-the-longest-and-most-complex-journey-so-far-on-uk-roads-by-an-autonomous-vehicle/,2020-02-08,"A Self -navigating car successfully drives itself for 230 miles, (370.149 km) the longest and most complex journey so far on UK roads by an autonomous vehicle",newzimbabwevision.com
http://newzimbabwevision.com/zimbabwe-must-stop-mourning-about-sanctions-but-use-its-god-given-resources-and-skills-of-its-people-to-develop-president-mnangagwa/,2020-02-08,"‘Zim must stop mourning about sanctions but use its God-given resources and skills of its people, to develop ‘-Mnangagwa – newzimbabwevision",newzimbabwevision.com
http://newzimbabwevision.com/us-president-donald-trump-has-dismissed-two-senior-officials-who-testified-against-him-at-his-impeachment-trial/,2020-02-08,US President Donald Trump has dismissed two senior officials who testified against him at his impeachment trial,newzimbabwevision.com
https://www.zimeye.net/2020/02/08/stop-mourning-about-sanctions-mnangagwa-says/,2020-02-08,"“Stop Mourning About Sanctions,” Mnangagwa Says",zimeye.net
http://newzimbabwevision.com/measured-with-tape-humiliated-mother-and-daughters-told-too-big-for-business-class-on-thai-airways-said-its-business-class/,2020-02-08,"MEASURED WITH TAPE, humiliated Mother and daughters told ‘too big’ for business class on Thai Airways",newzimbabwevision.com
https://bulawayo24.com/index-id-news-sc-national-byo-178349.html,2020-02-04,Not all hope has been lost for Filabusi farmers,bulawayo24.com
https://bulawayo24.com/index-id-news-sc-national-byo-178613.html,2020-02-07,Mnangagwa says no to food politicisation,bulawayo24.com
https://www.zimeye.net/2020/02/08/stop-mourning-about-sanctions-ed/,2020-02-08,“Stop Mourning About Sanctions”: ED,zimeye.net
https://www.zimbabwesituation.com/news/president-to-oversee-zida/,2020-02-08,President to oversee Zida,zimbabwesituation.com
http://newzimbabwevision.com/at-least-12-people-have-been-shot-dead-and-many-injured-by-a-thai-soldier-in-the-city-of-nakhon-ratchasima-also-known-as-korat-police-say/,2020-02-08,"At least 12 people have been shot dead and many injured by a Thai soldier in the city of Nakhon Ratchasima (also known as Korat), police say",newzimbabwevision.com
http://newzimbabwevision.com/five-britons-have-tested-positive-for-coronavirus-in-eastern-france-the-french-health-minister-confirmed/,2020-02-08,"Five Britons have tested positive for coronavirus in eastern France, the French health minister confirmed.",newzimbabwevision.com
http://newzimbabwevision.com/scotlands-ex-finance-sec-derek-mackay-tipped-as-a-future-successor-to-first-minister-nicola-sturgeon-resigns-after-sending-270-messages-to-a-16-year-old-schoolboy-over-a-six-month-period-on-insta/,2020-02-08,"SCOTLAND’S ex finance sec Derek Mackay, tipped as a future successor to First Minister Nicola Sturgeon, resigns after sending 270 messages to a 16-year-old schoolboy over a six-month period on Instagram and Facebook. – newzimbabwevision",newzimbabwevision.com
http://newzimbabwevision.com/vp-chiwenqas-estranged-wife-marry-granted-1-500-bail-coupled-with-stringent-conditions-by-high-court-judge-justice-erica-ndewere/,2020-02-08,VP Chiwenga’s estranged wife Marry granted $1 500 bail coupled with stringent conditions by High Court Judge Justice Erica Ndewere. – newzimbabwevision,newzimbabwevision.com
http://newzimbabwevision.com/london-rise-in-attacks-on-albinos-18-murders-5-abductions-in-19-months-by-people-seeking-their-body-parts-for-witchcraft-prompted-amnesty-international-to-call-yesterday-for-authorities/,2020-02-08,"LONDON — Rise in Attacks on Albinos , 18 Murders , 5 Abductions In 19 Months by people seeking their body parts for witchcraft prompted Amnesty International to call yesterday for authorities to do more to punish those responsible – Reuters. Posted on June 8, 2016 by www.newzimbabwevision.com – newzimbabwevision",newzimbabwevision.com
http://newzimbabwevision.com/malawi-mutilation-abduction-and-murder-of-albinos-in-a-country-with-over-10000-albinos-all-for-wealth-charms-from-body-parts-and-to-rape-albinos-as-an-hiv-cure-welcome-to-africa/,2020-02-08,"‘MALAWI mutilation, abduction and murder of Albinos, in a country with over 10,000 Albinos, all for wealth charms from body parts and to rape albinos as an HIV cure,..welcome to Africa!’.",newzimbabwevision.com
https://bulawayo24.com/index-id-news-sc-national-byo-178315.html,2020-02-04,Mthuli Ncube uses Davos to push investment agenda,bulawayo24.com
https://bulawayo24.com/index-id-news-sc-national-byo-178443.html,2020-02-05,"Masvingo community, EMA in sustainable wetlands utilisation",bulawayo24.com
https://bulawayo24.com/index-id-news-sc-national-byo-178485.html,2020-02-05,Zimbabwe to host high-level UN conference on SDGs,bulawayo24.com
https://bulawayo24.com/index-id-news-sc-national-byo-178493.html,2020-02-06,UN applauds Zimbabwe's ICT sector,bulawayo24.com
http://www.zimbabwenews.net/news/263962840/explainer-why-is-inflation-in-south-africa-so-high,2020-02-09,EXPLAINER: Why is inflation in South Africa so high?,zimbabwenews.net
http://www.zimbabwestar.com/news/263962840/explainer-why-is-inflation-in-south-africa-so-high,2020-02-09,EXPLAINER: Why is inflation in South Africa so high?,zimbabwestar.com
