url,date_published,title,newsorg
https://www.egyptindependent.com/caeu-chief-egypt-has-pioneering-experience-in-confronting-climate-change/,2022-10-24,CAEU chief: Egypt has pioneering experience in confronting climate change,egyptindependent.com
https://www.egyptindependent.com/germany-supports-world-food-program-in-egypt-with-110-million-euros/,2022-10-26,Germany supports World Food Program in Egypt with 110 million euros,egyptindependent.com
https://www.egyptindependent.com/us-envoy-for-climate-praises-egypts-role-hosting-cop27/,2022-10-27,US Envoy for Climate praises Egypt’s role hosting COP27,egyptindependent.com
https://www.egyptindependent.com/calls-for-demonstrations-on-11-11-do-not-deserve-attention-mp/,2022-10-28,Calls for demonstrations on 11/11 do not deserve attention: MP,egyptindependent.com
https://www.egyptindependent.com/kigali-is-building-its-way-to-becoming-the-silicon-valley-of-africa/,2022-10-24,Kigali is building its way to becoming ‘the Silicon Valley of Africa’,egyptindependent.com
https://www.egyptindependent.com/fm-voices-optimism-about-upcoming-arab-summit-in-algeria/,2022-10-29,FM voices optimism about upcoming Arab summit in Algeria,egyptindependent.com
https://www.egyptindependent.com/egypt-welcomes-italian-pms-visit-to-attend-cop27/,2022-10-29,Egypt welcomes Italian PM's visit to attend COP27,egyptindependent.com
https://egyptianstreets.com/2022/10/29/uk-prime-minister-rishi-sunak-skips-cop27-in-egypt/,2022-10-29,UK Prime Minister Rishi Sunak Skips COP27 in Egypt,egyptianstreets.com
https://www.egyptindependent.com/egypt-exerting-effective-efforts-to-coordinate-for-cop27/,2022-10-30,Egypt exerting effective efforts to coordinate for COP27,egyptindependent.com
https://www.egyptindependent.com/biden-will-visit-egypt-to-participate-in-cop27-summit-white-house/,2022-10-30,Biden will visit Egypt to participate in COP27 summit: White House,egyptindependent.com
https://www.egyptindependent.com/climate-change-could-displace-millions-from-middle-east-region-report/,2022-10-31,Climate change could displace millions from Middle East region: report,egyptindependent.com
https://www.egyptindependent.com/antarcticas-emperor-penguins-at-risk-of-extinction-due-to-the-climate-crisis/,2022-10-31,Antarctica’s emperor penguins at risk of extinction due to the climate crisis,egyptindependent.com
https://www.egyptindependent.com/world-turns-its-attention-to-sharm-el-sheikh/,2022-11-01,World turns its attention to Sharm El Sheikh,egyptindependent.com
https://www.egyptindependent.com/migration-is-a-human-right-minister/,2022-11-02,Migration is a human right: Minister,egyptindependent.com
https://egyptianstreets.com/2022/11/02/rishi-sunak-confirms-cop27-attendance-reverses-earlier-decision/,2022-11-02,"Rishi Sunak Confirms COP27 Attendance, Reverses Earlier Decision",egyptianstreets.com
https://www.egyptindependent.com/californias-climate-crisis-is-intensifying-quickly-and-taking-a-heavy-toll-on-residents-new-data-reveals/,2022-11-02,"California’s climate crisis is intensifying quickly and taking a heavy toll on residents, new data reveals",egyptindependent.com
https://www.egyptindependent.com/binding-agreement-on-gerd-required-amid-climate-challenges-sisi/,2022-11-02,Binding agreement on GERD required amid climate challenges: Sisi,egyptindependent.com
https://www.egyptindependent.com/urgent-an-american-threat-to-saudi-arabia/,2022-11-02,Urgent: An American threat to Saudi Arabia,egyptindependent.com
https://www.egyptindependent.com/uk-pm-to-attend-cop27-in-sharm-el-sheikh/,2022-11-03,UK PM to attend COP27 in Sharm el-Sheikh,egyptindependent.com
https://www.egyptindependent.com/intl-cooperation-ministry-announces-cop27-activities/,2022-11-03,Int’l Cooperation Ministry announces COP27 activities,egyptindependent.com
https://www.egyptindependent.com/egypt-condemned-the-assassination-attempt-on-former-pakistani-prime-minister-imran-khan-the-foreign-ministry/,2022-11-04,"AFD signs euros 150 mn with Egypt’s NBE, Banque Misr, Banque du Caire",egyptindependent.com
https://www.egyptindependent.com/pm-attends-opening-of-conference-on-smart-green-projects/,2022-11-04,PM attends opening of conference on smart green projects,egyptindependent.com
https://www.egyptindependent.com/cop27-president-designate-meets-unfcccs-bureau-in-sharm-el-sheikh/,2022-11-05,COP27 president-designate meets UNFCCC's bureau in Sharm El Sheikh,egyptindependent.com
https://www.egyptindependent.com/egypt-germany-sign-2-declarations-of-intent-in-natural-gas-green-hydrogen-fields/,2022-11-05,"Egypt, Germany sign 2 declarations of intent in natural gas, green hydrogen fields",egyptindependent.com
https://www.egyptindependent.com/egypt-is-on-the-cusp-of-historic-event-by-hosting-cop27-presidential-spokesperson/,2022-11-05,Egypt is on the cusp of historic event by hosting COP27: Presidential spokesperson,egyptindependent.com
https://www.egyptindependent.com/youth-minister-unfpa-unicef-representatives-discuss-coy17-activities-in-egypt/,2022-11-05,"Youth Minister, UNFPA, UNICEF representatives discuss COY17 activities in Egypt",egyptindependent.com
https://www.egyptindependent.com/uae-papers-highlight-cop27-conference/,2022-11-06,UAE papers highlight COP27 conference,egyptindependent.com
https://www.egyptindependent.com/slovenian-president-egypt-key-partner-in-middle-east-north-africa/,2022-11-06,"Slovenian president : Egypt key partner in Middle East, North Africa",egyptindependent.com
https://www.egyptindependent.com/pm-launches-1st-edition-of-climate-horizons-magazine/,2022-11-06,"PM launches 1st edition of ""Climate Horizons"" magazine",egyptindependent.com
https://www.egyptindependent.com/foreign-ministry-lights-up-hq-with-cop27-word/,2022-11-06,"Foreign Ministry lights up HQ with ""COP27"" word",egyptindependent.com
https://www.egyptindependent.com/hotel-occupancy-in-sharm-el-sheikh-at-100-during-cop27/,2022-11-06,Hotel occupancy in Sharm el-Sheikh at 100% during COP27,egyptindependent.com
https://www.almasryalyoum.com/news/details/2734630,2022-11-06,«التغيرات المناخية».. وزير التعليم العالي يُكرم الفرق الفائزة بهاكاثون الجامعات المصرية,almasryalyoum.com
https://www.youm7.com/story/2022/11/6/وزير-التعليم-العالي-يُكرم-الفرق-الفائزة-بهاكاثون-الجامعات-المصرية/5967052,2022-11-06,وزير التعليم العالي يُكرم الفرق الفائزة بهاكاثون الجامعات المصرية,youm7.com
https://almessa.gomhuriaonline.com/%d9%88%d8%b2%d9%8a%d8%b1-%d8%a7%d9%84%d8%aa%d8%b9%d9%84%d9%8a%d9%85-%d8%a7%d9%84%d8%b9%d8%a7%d9%84%d9%8a-%d9%8a%d9%83%d8%b1%d9%85-%d8%a7%d9%84%d9%81%d8%b1%d9%82-%d8%a7%d9%84%d9%81%d8%a7%d8%a6%d8%b2/,2022-11-06,وزير التعليم العالي يكرم الفرق الفائزة في مسابقة”التغيرات المناخية..الابداع للاستمرارية”,gomhuriaonline.com
https://alwafd.news/أخبار/4557739-تكريم-الفرق-الفائزة-بهاكاثون-الجامعات-المصرية-التغيرات-المناخية,2022-11-06,"تكريم الفرق الفائزة بهاكاثون الجامعات المصرية ""التغيرات المناخية""",alwafd.news
https://www.egyptindependent.com/hundreds-of-elephants-wildebeests-and-zebras-dead-in-kenya-amid-prolonged-drought/,2022-11-06,"Hundreds of elephants, wildebeests and zebras dead in Kenya amid prolonged drought",egyptindependent.com
https://www.egyptindependent.com/ahead-of-cop27-young-african-climate-activists-speak-out/,2022-11-07,"Ahead of COP27, young African climate activists speak out",egyptindependent.com
https://www.egyptindependent.com/some-world-leaders-attend-cop27-despite-crises-putin-most-obvious-absentee/,2022-11-07,"Some world leaders attend COP27 despite crises, Putin most obvious absentee",egyptindependent.com
https://www.egyptindependent.com/video-sisi-receives-ethiopias-abiy-ahmed-at-uncop27/,2022-11-07,Video: Sisi receives Ethiopia’s Abiy Ahmed at UNCOP27,egyptindependent.com
https://www.elfagr.org/4552020,2022-11-07,Taking several measures to educate to conditions and procedures for refunding Value Added Tax (VAT),elfagr.org
https://egyptianstreets.com/2022/11/07/al-sisi-pleads-for-end-to-russia-ukraine-war-at-cop27-launch/,2022-11-07,Al-Sisi Pleads for End to Russia-Ukraine War at COP27 Launch,egyptianstreets.com
https://www.egyptindependent.com/sharm-el-sheikh-airports-capacity-now-up-to-10-million-passengers-annually-official/,2022-11-07,Sharm el-Sheikh Airport’s capacity now up to 10 million passengers annually: Official,egyptindependent.com
https://www.egyptindependent.com/england-to-fulfill-financial-pledge-of-11-7-billion-to-face-climate-change-sunak/,2022-11-08,England to fulfill financial pledge of £ 11.7 billion to face climate change: Sunak,egyptindependent.com
https://www.egyptindependent.com/uae-president-visits-cop27-exhibitions/,2022-11-08,UAE President visits COP27 exhibitions,egyptindependent.com
https://www.egyptindependent.com/saudi-crown-prince-announces-us-2-5-billion-support-for-green-middle-east-initiative/,2022-11-08,Saudi Crown Prince announces US$ 2.5 billion support for Green Middle East Initiative,egyptindependent.com
https://www.egyptindependent.com/this-has-quickly-become-the-key-issue-at-cop27-and-the-most-difficult-to-resolve/,2022-11-08,This has quickly become the key issue at COP27 – and the most difficult to resolve,egyptindependent.com
https://www.egyptindependent.com/pm-egypt-has-promising-opportunities-in-green-hydrogen-renewable-energy-domains/,2022-11-08,"PM: Egypt has promising opportunities in green hydrogen, renewable energy domains",egyptindependent.com
https://egyptianstreets.com/2022/11/08/draft-bill-for-binding-climate-neutrality-submitted-to-egyptian-parliament/,2022-11-08,Draft Bill for Binding Climate Neutrality Submitted to Egyptian Parliament,egyptianstreets.com
https://egyptianstreets.com/2022/11/08/cop27-uae-and-egypt-to-build-one-of-the-worlds-largest-wind-farms/,2022-11-08,COP27: UAE and Egypt to Build One of the World’s Largest Wind Farms,egyptianstreets.com
https://www.egyptindependent.com/twenty-percent-decrease-in-weather-temperature-expected-by-2030-cop26-president20-decrease-in-weather-temperature-expected-by-2030-cop26-president/,2022-11-09,Twenty percent decrease in weather temperature expected by 2030: COP26 president,egyptindependent.com
https://www.youm7.com/story/2022/11/9/صناعة-الملابس-من-مؤتمر-المناخ-نحن-على-طريق-الاستدامة-والاقتصاد/5971260,2022-11-09,صناعة الملابس من مؤتمر المناخ: نحن على طريق الاستدامة والاقتصاد الدائرى الأخضر,youm7.com
https://www.almasryalyoum.com/news/details/2737680,2022-11-09,تصديرى الملابس يعرض منتجات إعادة التدوير وتحويل مخلفات صناعة المنسوجات والملابس فى قمة المناخ,almasryalyoum.com
https://www.egyptindependent.com/egypt-vaticans-pms-and-egyptian-pm-meet-on-sidelines-of-cop27/,2022-11-09,Vatican's PMs and Egyptian PM meet on sidelines of COP27,egyptindependent.com
https://www.egyptindependent.com/photos-first-lady-of-cyprus-visits-saint-catherine/,2022-11-09,Photos: First Lady of Cyprus visits Saint Catherine,egyptindependent.com
https://www.egyptindependent.com/shoukry-stresses-importance-of-sharm-el-sheikh-adaptation-agenda/,2022-11-09,Shoukry stresses importance of Sharm El-Sheikh Adaptation Agenda,egyptindependent.com
https://www.egyptindependent.com/pm-climate-crisis-will-harm-worlds-most-vulnerable-people-first-and-foremost/,2022-11-09,PM: Climate crisis will harm world's most vulnerable people first and foremost,egyptindependent.com
https://www.egyptindependent.com/egyptian-expatriates-around-the-world-account-to-12-million-immigration-minister/,2022-11-09,Egyptian expatriates around the world account to 12 million: Immigration Minister,egyptindependent.com
https://www.egyptindependent.com/youth-session-of-cop27-conference-starts/,2022-11-10,Youth session of COP27 conference starts,egyptindependent.com
https://www.egyptindependent.com/president-el-sisi-meets-tanzanian-president-samia-hassan/,2022-11-10,President El-Sisi meets Tanzanian President Samia Hassan,egyptindependent.com
https://www.egyptindependent.com/shoukry-urges-partners-to-raise-their-contributions-to-climate-action/,2022-11-10,Shoukry urges partners to raise their contributions to climate action,egyptindependent.com
https://www.aljazeera.net/midan/miscellaneous/2022/11/10/%d9%85%d9%86-%d8%b4%d8%b1%d9%83%d8%a7%d8%aa-%d8%a7%d9%84%d9%86%d9%81%d8%b7-%d8%a5%d9%84%d9%89-%d8%b9%d9%85%d8%a7%d9%84%d9%82%d8%a9-%d8%a7%d9%84%d8%aa%d9%83%d9%86%d9%88%d9%84%d9%88%d8%ac%d9%8a%d8%a7,2022-11-10,من شركات النفط إلى عمالقة التكنولوجيا.. لماذا تتهرب الشركات من مسؤوليتها عن التغير المناخي؟,aljazeera.net
https://egyptianstreets.com/2022/11/10/protesters-at-cop27-wear-white-in-solidarity-with-political-prisoners/,2022-11-10,Protesters at COP27 Wear White in Solidarity with Political Prisoners,egyptianstreets.com
https://www.egyptindependent.com/at-cop27-pelosi-says-its-hard-to-speak-about-how-midterms-would-impact-us-climate-action/,2022-11-10,"Pelosi says it's ""hard to speak"" about how midterms would impact US climate action",egyptindependent.com
https://www.egyptindependent.com/us-president-arrives-in-sharm-el-sheikh-to-attend-cop27/,2022-11-11,US president arrives in Sharm el-Sheikh to attend COP27,egyptindependent.com
https://www.egyptindependent.com/us-president-joe-biden-expected-to-arrive-friday-in-sharm-el-sheikh-for-cop27/,2022-11-11,US President Joe Biden expected to arrive Friday in Sharm el-Sheikh for COP27,egyptindependent.com
https://www.egyptindependent.com/video-sisi-asserts-strength-of-egypt-us-ties/,2022-11-11,Video: Sisi asserts strength of Egypt-US ties,egyptindependent.com
https://www.egyptindependent.com/el-wazir-opens-schneider-electric-center-for-cop27-participants/,2022-11-11,El Wazir opens Schneider Electric center for COP27 participants,egyptindependent.com
https://www.egyptindependent.com/sports-minister-launches-el-fit-marathon-in-support-of-cop27/,2022-11-11,Sports minister launches EL FIT marathon in support of COP27,egyptindependent.com
https://egyptianstreets.com/2022/11/11/biden-at-cop27-egypt-is-the-mother-of-the-world/,2022-11-11,Biden at COP27: Egypt is the ‘Mother of the World’,egyptianstreets.com
https://egyptianstreets.com/2022/11/11/us-house-speaker-nancy-pelosi-praises-egypts-climate-action-leadership/,2022-11-11,US House Speaker Nancy Pelosi Praises Egypt’s Climate Action Leadership,egyptianstreets.com
https://www.egyptindependent.com/what-was-the-focus-of-bidens-speech-at-cop27/,2022-11-12,What was the focus of Biden's speech at COP27?,egyptindependent.com
https://www.egyptindependent.com/petroleum-minister-egypt-has-turned-challenges-to-energy-sector-into-success-stories/,2022-11-12,Petroleum Minister: Egypt has turned challenges to energy sector into success stories,egyptindependent.com
https://egyptianstreets.com/2022/11/12/planting-50-billion-trees-the-most-ambitious-initiatives-announced-at-egypts-cop27/,2022-11-12,Planting 50 Billion Trees: The Most Ambitious Initiatives Announced at Egypt’s COP27,egyptianstreets.com
https://www.egyptindependent.com/degrowth-a-dangerous-idea-or-the-answer-to-the-worlds-biggest-crisis/,2022-11-13,Degrowth: A dangerous idea or the answer to the world’s biggest crisis?,egyptindependent.com
https://www.egyptindependent.com/planning-minister-african-continent-owns-great-potentials-to-confront-climate-change/,2022-11-13,Planning Minister: African continent owns great potentials to confront climate change,egyptindependent.com
https://www.egyptindependent.com/environment-minister-egypt-exerted-tireless-efforts-to-accelerate-pace-of-climate-action/,2022-11-13,Environment Minister: Egypt exerted tireless efforts to accelerate pace of climate action,egyptindependent.com
https://www.egyptindependent.com/capmas-72-9-of-egyptians-support-planting-fruit-trees-on-streets/,2022-11-14,CAPMAS: 72.9 of Egyptians support planting fruit trees on streets,egyptindependent.com
https://www.egyptindependent.com/there-is-a-tendency-to-use-egyptian-gas-to-meet-europes-needs-john-kerry/,2022-11-14,There is a tendency to use Egyptian gas to meet Europe's needs: John Kerry,egyptindependent.com
https://www.egyptindependent.com/high-stakes-but-low-expectations-as-xi-and-biden-meet/,2022-11-14,"High stakes, but low expectations as Xi and Biden meet",egyptindependent.com
https://www.egyptindependent.com/global-population-hits-8-billion-as-growth-poses-more-challenges-for-the-planet/,2022-11-15,Global population hits 8 billion as growth poses more challenges for the planet,egyptindependent.com
https://www.egyptindependent.com/egypt-signs-renewable-energy-agreements-worth-83-bln/,2022-11-15,Egypt signs renewable energy agreements worth $83 bln,egyptindependent.com
https://www.egyptindependent.com/experts-reveal-shocking-scenarios-for-the-sinking-of-alexandria/,2022-11-15,Experts reveal shocking scenarios for the sinking of Alexandria,egyptindependent.com
https://egyptianstreets.com/2022/11/15/brazils-lula-to-attend-cop27-and-make-announcements-to-protect-amazon-rainforest/,2022-11-15,Brazil’s Lula to Attend COP27 and Make Announcements to Protect Amazon Rainforest,egyptianstreets.com
https://www.egyptindependent.com/sczone-signs-dlrs-500-mn-contract-for-2nd-container-terminal/,2022-11-16,SCZONE signs dlrs 500 mn contract for 2nd container terminal,egyptindependent.com
https://www.aljazeera.net/news/science/2022/11/16/%d8%aa%d8%ac%d8%a7%d9%88%d8%b2-%d8%a7%d9%84%d8%a7%d8%ad%d8%aa%d8%b1%d8%a7%d8%b1-1-5-%d8%af%d8%b1%d8%ac%d8%a9-%d9%88%d8%a7%d9%82%d8%b9-%d9%84%d8%a7-%d9%85%d8%ad%d8%a7%d9%84%d8%a9,2022-11-16,حصر الاحترار العالمي بحدود 1.5 درجة أصبح مستحيلا.. كيف تواجه الدول أزمة المناخ؟,aljazeera.net
https://www.egyptindependent.com/planning-min-inaugurates-solutions-day-in-presence-of-pm/,2022-11-17,"Planning min. inaugurates ""Solutions Day"" in presence of PM",egyptindependent.com
https://www.egyptindependent.com/egypt-launches-international-campaign-to-promote-sustainable-tourism/,2022-11-17,Video: Egypt launches international campaign to promote sustainable tourism,egyptindependent.com
https://egyptianstreets.com/2022/11/17/cop27-gives-children-and-youth-a-voice-through-first-of-its-kind-pavilion/,2022-11-17,COP27 Gives Children and Youth a Voice Through First-of-its Kind Pavilion,egyptianstreets.com
https://dailynewsegypt.com/2022/11/19/us-embassy-in-cairo-supports-44th-cairo-international-film-festival/,2022-11-19,US Embassy in Cairo supports 44th Cairo International Film Festival,dailynewsegypt.com
https://dailynewsegypt.com/2022/11/18/british-council-supports-17-projects-to-protect-heritage-at-risk-with-14m/,2022-11-18,British Council supports 17 projects to protect heritage at risk with £14m,dailynewsegypt.com
https://dailynewsegypt.com/2022/11/16/egypts-environment-minister-unep-executive-director-discuss-biodiversity-single-use-plastic/,2022-11-16,"Egypt’s Environment Minister, UNEP Executive Director discuss biodiversity, single-use plastic",dailynewsegypt.com
https://dailynewsegypt.com/2022/11/19/irrigation-minister-launches-food-and-agriculture-initiative-during-cop27/,2022-11-19,Irrigation Minister launches ‘Food and Agriculture Initiative’ during COP27,dailynewsegypt.com
https://dailynewsegypt.com/2022/11/19/microsoft-partners-with-egyptian-natural-gas-holding-to-co-develop-egas-sustainability-roadmap/,2022-11-19,Microsoft partners with Egyptian Natural Gas Holding to co-develop EGAS sustainability roadmap,dailynewsegypt.com
https://dailynewsegypt.com/2022/11/17/cop27-important-to-maintain-international-pressure-to-implement-climate-pledges-dbs-bank/,2022-11-17,COP27 important to maintain international pressure to implement climate pledges: DBS Bank,dailynewsegypt.com
https://dailynewsegypt.com/2022/11/17/cib-makes-the-case-for-africa-specific-solutions-to-financing-the-net-zero-transition/,2022-11-17,CIB makes the case for Africa-specific solutions to financing the net-zero transition,dailynewsegypt.com
https://dailynewsegypt.com/2022/11/17/pakistan-prioritise-green-investment-to-mitigate-climate-change-impacts-ahsan-iqbal/,2022-11-17,Pakistan prioritise green investment to mitigate climate change impacts: Ahsan Iqbal,dailynewsegypt.com
https://dailynewsegypt.com/2022/11/17/african-european-youths-feel-there-should-be-more-funding-for-alternative-sources-of-energy-particularly-renewables-eib/,2022-11-17,"African, European youths feel there should be more funding for alternative sources of energy, particularly renewables: EIB",dailynewsegypt.com
https://dailynewsegypt.com/2022/11/18/fortescue-future-industries-takes-major-step-towards-study-and-development-of-green-hydrogen-renewable-energy-with-egypt/,2022-11-18,"Fortescue Future Industries takes major step towards study and development of green hydrogen, renewable energy with Egypt",dailynewsegypt.com
https://dailynewsegypt.com/2022/11/16/saudi-arabias-al-fanar-aims-to-invest-1-8bn-in-first-phase-of-green-hydrogen-station/,2022-11-16,Saudi Arabia’s Al-Fanar aims to invest $1.8bn in first phase of green hydrogen station,dailynewsegypt.com
https://dailynewsegypt.com/2022/11/16/nigeria-to-hold-advanced-talks-with-egypt-for-cooperation-in-the-energy-sector/,2022-11-16,Nigeria to hold advanced talks with Egypt for cooperation in the energy sector,dailynewsegypt.com
https://dailynewsegypt.com/2022/11/17/egypts-cop27s-significance-lies-in-its-focus-on-implementation-adaptation-south-koreas-environment-minister/,2022-11-17,"Egypt’s COP27’s significance lies in its focus on implementation, adaptation: South Korea’s Environment Minister",dailynewsegypt.com
https://dailynewsegypt.com/2022/11/16/sczone-establishes-new-investment-company-to-localise-green-energy-industries/,2022-11-16,SCZone establishes new investment company to localise green energy industries,dailynewsegypt.com
https://dailynewsegypt.com/2022/11/17/eibs-finance-for-climate-and-environmental-action-projects-rose-to-51-in-2021-fayolle/,2022-11-17,EIB’s finance for climate and environmental action projects rose to 51% in 2021: Fayolle,dailynewsegypt.com
https://dailynewsegypt.com/2022/11/16/climate-change-adaptation-fund-key-to-strengthening-adaptation-measures-in-developing-countries-egypts-fm/,2022-11-16,Climate Change Adaptation Fund key to strengthening adaptation measures in developing countries: Egypt’s FM,dailynewsegypt.com
https://dailynewsegypt.com/2022/11/15/eib-global-allianzgi-plan-to-invest-100m-in-renewable-energy-projects/,2022-11-15,"EIB Global, AllianzGI plan to invest $100m in renewable energy projects",dailynewsegypt.com
https://dailynewsegypt.com/2022/11/17/egypts-fm-receives-uaes-industry-minister/,2022-11-17,Egypt’s FM receives UAE’s Industry Minister,dailynewsegypt.com
https://dailynewsegypt.com/2022/11/15/egypt-moves-towards-clean-energy-transformation-building-on-its-2014-structural-reforms-al-mashat/,2022-11-15,"Egypt moves towards clean energy transformation, building on its 2014 structural reforms: Al-Mashat",dailynewsegypt.com
https://dailynewsegypt.com/2022/11/15/egypt-succeeded-in-placing-adaptation-loss-damage-files-on-international-climate-action-climate-champion/,2022-11-15,"Egypt succeeded in placing adaptation, loss, damage files on international climate action: Climate Champion",dailynewsegypt.com
https://dailynewsegypt.com/2022/11/15/africa-grows-green-announces-winning-start-ups-during-cop27/,2022-11-15,Africa Grows Green announces winning start-ups during COP27,dailynewsegypt.com
https://dailynewsegypt.com/2022/11/16/it-is-the-to-work-on-protecting-deltas-and-coastal-areas-ipdc-secretariat/,2022-11-16,It is the to work on protecting deltas and coastal areas: IPDC Secretariat,dailynewsegypt.com
https://www.egyptindependent.com/as-nations-fail-to-reach-consensus-egypt-extends-cop27-summit/,2022-11-19,"As nations fail to reach consensus, Egypt extends COP27 summit",egyptindependent.com
https://www.egyptindependent.com/sports-minister-to-mena-proud-to-show-up-at-cop27/,2022-11-19,Sports minister to MENA: Proud to show up at COP27,egyptindependent.com
https://www.egyptindependent.com/egypt-japan-discuss-environmental-cooperation-on-sidelines-of-cop27/,2022-11-19,"Egypt, Japan discuss environmental cooperation on sidelines of COP27",egyptindependent.com
https://www.dailynewsegypt.com/2022/11/19/egypts-environment-minister-announces-cop27-sustainability-plan/,2022-11-19,Egypt’s Environment Minister announces COP27 sustainability plan,dailynewsegypt.com
https://www.dailynewsegypt.com/2022/11/19/cib-participates-in-ifads-session-on-climate-smart-agriculture-and-de-risking-at-cop27/,2022-11-19,CIB participates in IFAD's session on ‘Climate-Smart Agriculture and De-risking’ at COP27,dailynewsegypt.com
https://www.dailynewsegypt.com/2022/11/19/implementation-mechanisms-for-the-damage-and-loss-agenda-must-be-put-in-place-before-cop28-dominican-republic/,2022-11-19,Implementation mechanisms for the damage and loss agenda must be put in place before COP28: Dominican Republic,dailynewsegypt.com
https://www.dailynewsegypt.com/2022/11/19/cop27-agrees-on-loss-and-damage-fund-for-climate-change-affected-countries/,2022-11-19,COP27 agrees on ‘Loss and Damage Fund’ for climate change-affected countries,dailynewsegypt.com
