url,date_published,title,newsorg
https://www.egyptindependent.com/sisi-reveals-egypts-position-on-taiwans-situation-after-pelosis-visit/,2022-08-08,Sisi reveals Egypt's position on Taiwan's situation after Pelosi's visit,egyptindependent.com
https://egyptianstreets.com/2022/08/08/ahead-of-cop27-egypt-to-receive-e4-million-from-eu-to-support-environmental-protection/,2022-08-08,Ahead of COP27 Egypt to Receive €4 Million from EU to Support Environmental Protection,egyptianstreets.com
https://www.egyptindependent.com/earth-broke-the-record-for-the-shortest-day-since-atomic-clocks-were-invented/,2022-08-08,Earth broke the record for the shortest day since atomic clocks were invented,egyptindependent.com
https://egyptianstreets.com/2022/08/08/how-hobos-magazine-hopes-to-usher-egypts-new-generation-of-children-comics/,2022-08-08,How Hobos Magazine Hopes to Usher Egypt’s New Generation of Children Comics,egyptianstreets.com
https://www.egyptindependent.com/emergency-scooter-introduced-to-health-ministrys-ambulance-fleet/,2022-08-10,‘Emergency scooter’ introduced to Health Ministry’s ambulance fleet,egyptindependent.com
https://www.egyptindependent.com/sisi-appoints-new-chairman-for-suez-canal-economic-zone/,2022-08-13,Sisi appoints new chairman for Suez Canal Economic Zone,egyptindependent.com
https://www.egyptindependent.com/worlds-largest-ice-sheet-crumbling-faster-than-previously-thought-satellite-imagery-shows/,2022-08-13,"World's largest ice sheet crumbling faster than previously thought, satellite imagery shows",egyptindependent.com
https://www.egyptindependent.com/seoul-vows-to-move-families-from-parasite-style-basement-homes-after-flooding-deaths/,2022-08-14,Seoul vows to move families from 'Parasite'-style basement homes after flooding deaths,egyptindependent.com
https://www.egyptindependent.com/a-disastrous-megaflood-is-coming-to-california-experts-say-and-it-could-be-the-most-expensive-natural-disaster-in-history/,2022-08-14,"A disastrous megaflood is coming to California, experts say, and it could be the most expensive natural disaster in history",egyptindependent.com
https://www.egyptindependent.com/al-azhar-environment-ministry-launch-our-climate-is-our-lives-initiative-ahead-of-cop27/,2022-08-15,"Al-Azhar, Environment Ministry launch ‘Our Climate is Our Lives’ initiative ahead of COP27",egyptindependent.com
https://egyptianstreets.com/2022/08/18/what-you-need-to-know-ahead-of-egypts-cop27/,2022-08-18,What You Need to Know Ahead of Egypt’s COP27,egyptianstreets.com
https://www.egyptindependent.com/shoukry-welcomes-appointment-of-simon-stiell-as-un-climate-change-executive-secretary/,2022-08-18,Shoukry welcomes appointment of Simon Stiell as UN Climate Change Executive Secretary,egyptindependent.com
https://www.egyptindependent.com/government-should-deter-families-with-more-than-two-children-mp/,2022-08-19,Government should deter families with more than two children: MP,egyptindependent.com
https://www.egyptindependent.com/lakes-are-drying-up-everywhere-israel-will-pump-water-from-the-med-as-a-solution/,2022-08-19,Lakes are drying up everywhere. Israel will pump water from the Med as a solution,egyptindependent.com
https://egyptianstreets.com/2022/08/19/chasing-a-vagabond-a-father-son-trek-from-alexandria-to-cape-town-using-public-transportation/,2022-08-19,Chasing a Vagabond: a Father-Son Trek from Alexandria to Cape Town Using Public Transportation,egyptianstreets.com
https://www.egyptindependent.com/extreme-heat-is-slamming-the-worlds-three-biggest-economies-all-at-once/,2022-08-20,Extreme heat is slamming the world's three biggest economies all at once,egyptindependent.com
https://www.almasryalyoum.com/news/details/2670742,2022-08-21,مرتبات تتخطى 800 ألف سنويًا.. وظائف خالية في السفارتين الأمريكية والبريطانية بالقاهرة,almasryalyoum.com
https://www.egyptindependent.com/why-the-middle-east-may-be-too-hot-to-live-in-by-the-end-of-the-century/,2022-08-21,Why the Middle East may be too hot to live in by the end of the century,egyptindependent.com
https://www.egyptindependent.com/zebras-in-egypt/,2022-08-21,Zebras in Egypt,egyptindependent.com
https://www.egyptindependent.com/its-a-hopeless-situation-says-footballer-nadia-nadim-a-year-since-the-talibans-takeover-in-afghanistan/,2022-08-22,"It's a hopeless situation,' says footballer Nadia Nadim a year since the Taliban's takeover in Afghanistan",egyptindependent.com
https://www.almasryalyoum.com/news/details/2672242,2022-08-23,ورشة عمل حول التغيرات المناخية على مصر وإقليم سيناء,almasryalyoum.com
https://www.almasryalyoum.com/news/details/2672977,2022-08-23,أسوأ موجة جفاف منذ 500 عام تضرب أكبر أنهار العالم,almasryalyoum.com
https://www.egyptindependent.com/aswan-governor-discusses-establishing-huge-industrial-complex-for-fertilizers/,2022-08-24,Aswan governor discusses establishing huge industrial complex for fertilizers,egyptindependent.com
https://www.egyptindependent.com/undp-and-savola-foods-sign-mou-to-mitigate-impact-of-climate-change-in-egypt/,2022-08-24,UNDP and Savola Foods sign MoU to mitigate impact of climate change in Egypt,egyptindependent.com
https://www.aljazeera.net/midan/miscellaneous/science/2022/8/25/%d8%a7%d9%84%d8%ac%d8%ad%d9%8a%d9%85-%d9%82%d8%a7%d8%af%d9%85-%d9%88%d9%84%d9%86-%d9%8a%d8%aa%d9%88%d9%82%d9%81-%d9%84%d9%85%d8%a7%d8%b0%d8%a7-%d9%8a%d8%b6%d8%b1%d8%a8,2022-08-25,الجحيم قادم ولن يتوقف.. لماذا يضرب الجفاف أوروبا كلها؟ وما الذي يعنيه ذلك؟,aljazeera.net
https://www.egyptindependent.com/chinas-worst-heat-wave-on-record-is-crippling-power-supplies-how-it-reacts-will-impact-us-all/,2022-08-26,China's worst heat wave on record is crippling power supplies. How it reacts will impact us all,egyptindependent.com
https://www.egyptindependent.com/pakistan-floods-hit-33-million-people-in-worst-disaster-in-a-decade-minister-says/,2022-08-27,"Pakistan floods hit 33 million people in worst disaster in a decade, minister says",egyptindependent.com
https://www.egyptindependent.com/chinas-worst-heat-wave-on-record-is-crippling-power-supplies-how-it-reacts-will-impact-us-all-2/,2022-08-27,China's worst heat wave on record is crippling power supplies. How it reacts will impact us all,egyptindependent.com
https://www.egyptindependent.com/chinese-island-plans-to-ban-sales-of-fossil-fuel-powered-vehicles-by-2030/,2022-08-28,Chinese island plans to ban sales of fossil fuel-powered vehicles by 2030,egyptindependent.com
https://www.egyptindependent.com/hundreds-of-children-among-1000-people-killed-by-pakistan-monsoon-rains-and-floods/,2022-08-28,"Hundreds of children among 1,000 people killed by Pakistan monsoon rains and floods",egyptindependent.com
https://egyptianstreets.com/2022/08/28/how-egypts-cop27-will-position-africa-as-a-climate-tech-destination/,2022-08-28,How Egypt’s COP27 Will Position Africa as a Climate Tech Destination,egyptianstreets.com
https://www.egyptindependent.com/greenland-ice-losses-set-to-raise-global-sea-levels-by-nearly-a-foot-new-research-shows/,2022-08-30,"Greenland ice losses set to raise global sea levels by nearly a foot, new research shows",egyptindependent.com
https://www.egyptindependent.com/coffee-crops-will-decrease-by-80-globally-due-to-climate-change-egyptian-official/,2022-08-30,Coffee crops will decrease by 80% globally due to climate change: Egyptian official,egyptindependent.com
https://www.egyptindependent.com/zimbabwean-president-receives-sisis-invitation-to-attend-cop27/,2022-08-31,Zimbabwean president receives Sisi’s invitation to attend COP27,egyptindependent.com
https://www.egyptindependent.com/egypt-to-launch-egypt-international-cooperation-forums-2nd-edition-on-september-7/,2022-08-31,Egypt to launch Egypt-International Cooperation Forum's 2nd edition on September 7,egyptindependent.com
https://mubasher.aljazeera.net/news/politics/2022/8/31/%d9%81%d9%8a-%d8%a2%d8%ae%d8%b1-%d9%8a%d9%88%d9%85-%d9%84%d9%88%d9%84%d8%a7%d9%8a%d8%aa%d9%87%d8%a7-%d9%85%d9%81%d9%88%d8%b6%d8%a9-%d8%ad%d9%82%d9%88%d9%82-%d8%a7%d9%84%d8%a5%d9%86%d8%b3%d8%a7%d9%86,2022-08-31,في آخر يوم لولايتها.. مفوضة حقوق الإنسان تنتقد إسرائيل لعدم منحها تأشيرات لموظفين أمميين,aljazeera.net
https://mubasher.aljazeera.net/news/2022/9/1/%d9%88%d9%83%d8%a7%d9%84%d8%a9-%d8%a7%d9%84%d9%81%d8%b6%d8%a7%d8%a1-%d8%a7%d9%84%d8%a3%d9%88%d8%b1%d8%a8%d9%8a%d8%a9-%d8%aa%d9%83%d8%b4%d9%81-%d8%a3%d8%b3%d8%a8%d8%a7%d8%a8-%d8%ad%d8%af%d9%88%d8%ab,2022-09-01,تقرير سابق تنبأ بتعرض البلاد لتغير المناخ.. وكالة الفضاء الأوربية تكشف أسباب الفيضانات المدمرة في باكستان,aljazeera.net
https://www.egyptindependent.com/egypts-safaga-resort-wins-best-eco-friendly-hotel-award/,2022-09-03,Egypt's Safaga resort wins Best eco-friendly hotel award,egyptindependent.com
https://www.egyptindependent.com/pakistans-melting-glaciers-are-erupting-and-worsening-floods/,2022-09-03,Pakistan's melting glaciers are 'erupting' and worsening floods,egyptindependent.com
https://www.egyptindependent.com/major-economies-accused-of-backsliding-on-emissions-as-g20-climate-meet-ends-in-failure/,2022-09-03,Major economies accused of 'backsliding' on emissions as G20 climate meet ends in failure,egyptindependent.com
https://www.egyptindependent.com/sebastian-vettel-believes-world-needs-to-rethink-our-behaviors-to-tackle-climate-change/,2022-09-04,Sebastian Vettel believes world needs to 'rethink our behaviors' to tackle climate change,egyptindependent.com
https://www.egyptindependent.com/egyptair-offers-discounts-to-delegations-participating-in-cop27/,2022-09-05,EgyptAir offers discounts to delegations participating in COP27,egyptindependent.com
https://www.egyptindependent.com/doomsday-glacier-which-could-raise-sea-level-by-several-feet-is-holding-on-by-its-fingernails-scientists-say/,2022-09-06,"Doomsday glacier,' which could raise sea level by several feet, is holding on 'by its fingernails,' scientists say",egyptindependent.com
https://www.egyptindependent.com/irrigation-min-wmo-chief-discuss-cooperation-in-water-resources/,2022-09-07,"Irrigation min., WMO chief discuss cooperation in water resources",egyptindependent.com
https://egyptianstreets.com/2022/09/06/chasing-blue-skies-egypts-unique-destinations-for-autumn-travel/,2022-09-06,Chasing Skies: Egypt’s Unique Destinations for Autumn Travel,egyptianstreets.com
https://www.elfagr.org/4505831,2022-09-08,The EFG Hermes Foundation for Social Development Partnership Agreement with the Ministry of Education,elfagr.org
https://www.aljazeera.net/news/cultureandart/2022/9/9/%d8%b5%d8%b1%d8%a7%d8%b9%d8%a7%d8%aa-%d8%a7%d9%84%d8%a3%d8%b2%d9%85%d9%86%d8%a9-%d8%a7%d9%84%d8%ad%d8%af%d9%8a%d8%ab%d8%a9-%d9%87%d9%84-%d9%8a%d8%b3%d8%aa%d8%b7%d9%8a%d8%b9,2022-09-09,تكنولوجيا قاتلة ولا انتصارات.. هل تخمد العلوم نيران الحروب أم تؤججها؟,aljazeera.net
https://www.egyptindependent.com/environment-and-development-forum-2022-kicks-off/,2022-09-11,Environment and Development Forum 2022 kicks off,egyptindependent.com
https://www.egyptindependent.com/global-action-not-enough-to-face-climate-change-egypt-fm/,2022-09-11,Global action not enough to face climate change,egyptindependent.com
https://www.egyptindependent.com/how-sunlight-could-turn-seawater-into-freshwater-for-coastal-communities/,2022-09-14,How sunlight could turn seawater into freshwater for coastal communities,egyptindependent.com
https://www.wataninet.com/2022/09/%d8%b9%d9%84%d9%88%d9%85-%d8%a8%d9%86%d9%8a-%d8%b3%d9%88%d9%8a%d9%81-%d8%aa%d9%86%d8%b8%d9%85-%d9%85%d8%a4%d8%aa%d9%85%d8%b1%d9%8b%d8%a7-%d8%b9%d9%84%d9%85%d9%8a%d9%8b%d8%a7-%d8%aa%d8%ad%d8%aa-%d8%b9/,2022-09-15,علوم بني سويف تنظم مؤتمرًا علميًا تحت عنوان “التغيرات المناخية تقييم الآثار وتقديم الحلول”,wataninet.com
https://www.aljazeera.net/news/politics/2022/9/17/%d8%b1%d8%b3%d8%a7%d8%a6%d9%84-%d8%a7%d9%84%d9%85%d9%88%d8%a7%d8%a1%d9%85%d8%a9-%d8%a7%d9%84%d8%a5%d8%b3%d8%aa%d8%b1%d8%a7%d8%aa%d9%8a%d8%ac%d9%8a%d8%a9-%d8%a8%d9%8a%d9%86,2022-09-17,بعد قمة منظمة شنغهاي.. إلى أي مدى تربك العلاقات الصينية الروسية واشنطن؟,aljazeera.net
https://www.egyptindependent.com/environment-minister-egypt-launched-national-strategy-on-climate-to-provide-better-life-for-citizens/,2022-09-17,Environment Minister: Egypt launched national strategy on climate to provide better life for citizens,egyptindependent.com
https://www.egyptindependent.com/egypt-azerbaijan-discuss-boosting-bilateral-cooperation/,2022-09-17,"Egypt, Azerbaijan discuss boosting bilateral cooperation",egyptindependent.com
https://www.egyptindependent.com/mexico-and-its-relationship-with-egypt-on-mexican-independence-day/,2022-09-16,Mexico and its relationship with Egypt on Mexican Independence Day,egyptindependent.com
https://www.egyptindependent.com/indonesia-brazil-biggest-culprits-in-tropical-forest-loss-linked-to-industrial-mining-study/,2022-09-18,"Indonesia, Brazil biggest culprits in tropical forest loss linked to industrial mining: study",egyptindependent.com
https://www.egyptindependent.com/guatemala-invited-to-world-leaders-summit-in-sharm/,2022-09-18,Guatemala invited to World Leaders Summit in Sharm,egyptindependent.com
https://www.egyptindependent.com/as-summer-nears-its-end-ema-reveals-weather-forecast-for-the-next-3-days/,2022-09-18,"As summer nears its end, EMA reveals weather forecast for the next 3 days",egyptindependent.com
https://www.egyptindependent.com/grand-egyptian-museum-wins-green-building-award-from-arab-water-council/,2022-09-19,Grand Egyptian Museum wins Green Building award from Arab Water Council,egyptindependent.com
https://www.egyptindependent.com/egypts-sisi-calls-king-charles-iii-to-offer-condolences/,2022-09-19,Egypt’s Sisi calls King Charles III to offer condolences,egyptindependent.com
https://www.egyptindependent.com/egypts-exports-of-ready-made-garments-hit-1-44-bn-in-seven-months/,2022-09-19,Egypt's exports of ready-made garments hit $1.44 bn in seven months,egyptindependent.com
https://www.egyptindependent.com/health-ministry-outlines-medical-security-plan-for-cop27/,2022-09-20,Health ministry outlines medical security plan for COP27,egyptindependent.com
https://www.egyptindependent.com/why-the-current-oil-boom-for-arab-states-may-be-their-last/,2022-09-20,Why the current oil boom for Arab states may be their last,egyptindependent.com
https://www.aljazeera.net/midan/miscellaneous/2022/9/23/%d9%85%d9%86-%d8%a7%d9%84%d8%a3%d8%b1%d8%b2-%d9%84%d9%84%d8%a8%d8%b7%d8%a7%d8%b7%d8%b3-%d9%87%d8%b0%d9%87-%d8%a7%d9%84%d8%a3%d8%b7%d8%a8%d8%a7%d9%82-%d8%b3%d8%aa%d8%ae%d8%aa%d9%81%d9%8a-%d9%85%d9%86,2022-09-23,من الأرز إلى البطاطس.. هذه الأطباق ستختفي من مائدتك قريبا بسبب التغير المناخي,aljazeera.net
https://www.egyptindependent.com/what-happened-in-pakistan-will-not-stay-in-pakistan-flood-ravaged-country-warns-un/,2022-09-24,"‘What happened in Pakistan will not stay in Pakistan,’ flood-ravaged country warns UN",egyptindependent.com
https://www.egyptindependent.com/planning-minister-water-issues-top-cop-27/,2022-09-24,Planning Minister: Water issues top COP 27,egyptindependent.com
https://www.youm7.com/story/2022/9/24/هيلارى-مانتل-في-سطور-كتبت-أول-أعمالها-فى-جدة-و/5917232,2022-09-24,"هيلارى مانتل في سطور.. كتبت أول أعمالها فى جدة و""قصر الذئاب"" تميمة الحظ",youm7.com
https://www.egyptindependent.com/egyptian-chinese-fms-call-for-advancing-bilateral-cooperation/,2022-09-26,"Egyptian, Chinese FMs call for advancing bilateral cooperation",egyptindependent.com
https://www.egypttoday.com/Article/1/119062/Egypt%E2%80%99s-Minister-of-Interior-receives-Singaporean-Senior-Minister-Teo-Chee,2022-09-12,Egypt’s Minister of Interior receives Singaporean Senior Minister Teo Chee Hean,egypttoday.com
https://www.egyptindependent.com/govt-signs-6-2-mln-project-with-undp-eu-to-support-egypts-hosting-of-cop27/,2022-09-28,"Govt signs $6.2 mln project with UNDP, EU to support Egypt's hosting of COP27",egyptindependent.com
https://www.egyptindependent.com/fm-egypt-keen-on-success-of-cop27/,2022-09-29,FM: Egypt keen on success of COP27,egyptindependent.com
https://www.egyptindependent.com/egypt-working-on-listing-water-issues-within-cop-27/,2022-09-28,Egypt working on listing water issues within COP 27,egyptindependent.com
https://www.egyptindependent.com/egypt-ranks-2nd-regionally-in-volume-of-foreign-investments-in-ict-startups-minister/,2022-09-29,Egypt ranks 2nd regionally in volume of foreign investments in ICT startups: minister,egyptindependent.com
https://www.egyptindependent.com/the-8th-edition-of-the-africa-women-innovation-and-entrepreneurship-forum-awief/,2022-09-30,The 8th edition of the Africa Women Innovation and Entrepreneurship Forum (AWIEF),egyptindependent.com
https://www.egyptindependent.com/sisi-asserts-egypts-support-to-pakistan-after-devastating-floods/,2022-09-30,Sisi asserts Egypt's support to Pakistan after devastating floods,egyptindependent.com
https://www.egyptindependent.com/environment-min-directs-to-finalize-comprehensive-waste-management-plan/,2022-09-30,Environment min. directs to finalize comprehensive waste management plan,egyptindependent.com
https://mubasher.aljazeera.net/news/miscellaneous/2022/10/2/%d8%af%d9%88%d9%84%d8%a9-%d9%85%d9%87%d8%af%d8%af%d8%a9-%d8%a8%d8%a7%d9%84%d8%a7%d8%ae%d8%aa%d9%81%d8%a7%d8%a1-%d9%88%d8%a7%d9%84%d8%a7%d9%86%d8%aa%d9%82%d8%a7%d9%84-%d8%a5%d9%84%d9%89,2022-10-02,دولة مهددة بالاختفاء والانتقال إلى عالم “ميتافيرس” الافتراضي.. إليك الأسباب,aljazeera.net
https://www.egyptindependent.com/up-to-5-million-egyptian-families-now-benefit-from-takaful-and-karama-pensions/,2022-10-03,Up to 5 million Egyptian families now benefit from ‘Takaful and Karama’ pensions,egyptindependent.com
https://egyptianstreets.com/2022/10/03/this-egyptian-app-introduces-co-ownership-to-face-soaring-vacation-home-prices/,2022-10-03,This Egyptian App Introduces Co-Ownership to Face Soaring Vacation Home Prices,egyptianstreets.com
https://www.egyptindependent.com/shoukry-hopes-cop27-would-yield-results-that-meet-peoples-aspirations/,2022-10-04,Shoukry hopes COP27 would yield results that meet peoples' aspirations,egyptindependent.com
https://egyptianstreets.com/2022/10/04/to-reduce-traffic-congestion-egypt-receives-usd-400-million-to-advance-low-carbon-transportation/,2022-10-04,"To Reduce Traffic Congestion, Egypt Receives USD 400 Million to Advance Low-Carbon Transportation",egyptianstreets.com
https://egyptianstreets.com/2022/10/04/environmental-activists-raise-concerns-over-egypt-and-coca-colas-partnership-for-cop27/,2022-10-04,Environmental Activists Raise Concerns Over Egypt and Coca-Cola’s Partnership for COP27,egyptianstreets.com
https://www.egyptindependent.com/cib-announces-it-will-be-sponsoring-giza-zoo-chairman/,2022-10-05,CIB announces it will be sponsoring Giza Zoo: Chairman,egyptindependent.com
https://www.egyptindependent.com/netherlands-to-participate-in-cop-27-with-high-level-delegation/,2022-10-05,Netherlands to participate in COP 27 with high-level delegation,egyptindependent.com
https://www.egyptindependent.com/finance-min-says-sisi-reshaping-egypts-economy/,2022-10-05,Finance min. says Sisi reshaping Egypt's economy,egyptindependent.com
https://www.wataninet.com/2022/10/%d8%ac%d8%a7%d9%85%d8%b9%d8%a9-%d9%83%d9%81%d8%b1%d8%a7%d9%84%d8%b4%d9%8a%d8%ae-%d8%aa%d9%86%d8%b8%d9%85-%d9%85%d8%a4%d8%aa%d9%85%d8%b1-%d8%a7%d9%84%d8%aa%d8%ba%d9%8a%d8%b1%d8%a7%d8%aa-%d8%a7%d9%84/,2022-10-06,جامعة كفرالشيخ تنظم مؤتمر” التغيرات المناخية والحاجة إلى نهج عالم واحد صحة واحدة CLIMATE,wataninet.com
https://www.youm7.com/story/2022/10/6/جامعة-كفر-الشيخ-تنظم-مؤتمرا-عن-التغير-المناخى/5931721,2022-10-06,جامعة كفر الشيخ تنظم مؤتمرا عن التغير المناخى,youm7.com
https://www.egyptindependent.com/fm-participates-in-climate-vulnerable-forum/,2022-10-06,FM participates in Climate Vulnerable Forum,egyptindependent.com
https://www.egyptindependent.com/heat-killed-the-most-people-in-the-uk-this-summer-since-records-began-in-2004/,2022-10-10,Heat killed the most people in the UK this summer since records began in 2004,egyptindependent.com
https://egyptianstreets.com/2022/10/10/90-world-leaders-to-attend-cop27-in-egypt/,2022-10-10,90 World Leaders to Attend COP27 in Egypt,egyptianstreets.com
https://www.egyptindependent.com/this-wearable-device-is-helping-workers-beat-extreme-heat/,2022-10-11,This wearable device is helping workers beat extreme heat,egyptindependent.com
https://www.egyptindependent.com/campaign-to-promote-egyptian-tourism-in-premier-league/,2022-10-13,Campaign to promote Egyptian Tourism in Premier League,egyptindependent.com
https://www.egyptindependent.com/tree-for-every-building-initiative-launches-in-ras-gharib/,2022-10-11,‘Tree for Every Building’ initiative launches in Ras Gharib,egyptindependent.com
https://egyptianstreets.com/2022/10/13/we-dont-celebrate-rainfall-like-before-egypts-bedouins-send-a-message-on-climate-change-ahead-of-cop27/,2022-10-13,“We Don’t Celebrate Rainfall Like Before”: Egypt’s Bedouins Send a Message Ahead of COP27,egyptianstreets.com
https://www.egyptindependent.com/egypt-supports-negotiated-solutions-to-counter-global-crises/,2022-10-14,Egypt supports negotiated solutions to counter global crises,egyptindependent.com
https://www.almasryalyoum.com/news/details/2716337,2022-10-15,جامعة كفرالشيخ تنظم مؤتمراً لمواجهة التغيرات المناخية,almasryalyoum.com
https://www.egyptindependent.com/sisi-receives-message-from-congolese-president/,2022-10-15,Sisi receives message from Congolese president,egyptindependent.com
https://www.egyptindependent.com/egypt-aims-to-plant-7-7-million-trees-during-the-current-fiscal-year-minister/,2022-10-17,"Egypt aims to plant 7.7 million trees during the current fiscal year, minister",egyptindependent.com
https://www.egyptindependent.com/egypt-seeks-to-solve-gerd-crisis-and-avoid-any-harm-sisi-assures/,2022-10-17,"Egypt seeks to solve GERD crisis and avoid any harm, Sisi assures",egyptindependent.com
https://www.egyptindependent.com/dar-al-ifta-7th-intl-conf-kicks-off-with-participation-of-scholars-from-90-countries/,2022-10-18,Dar Al Ifta 7th Intl. conf. kicks off with participation of scholars from 90 countries,egyptindependent.com
https://www.egyptindependent.com/egypt-is-one-of-the-most-drought-prone-countries-in-the-world-minister/,2022-10-18,"Egypt is one of the most drought-prone countries in the world, minister",egyptindependent.com
https://www.egyptindependent.com/egypts-water-deficit-21-billion-cubic-meters-per-year-food-gap-more-than-us10-bln-minister/,2022-10-18,"Egypt’s water deficit 21 billion cubic meters per year, food gap more than US$10 bln: minister",egyptindependent.com
https://www.egyptindependent.com/global-co2-emissions-from-fossil-fuels-to-rise-by-less-than-1-this-year-as-renewables-and-evs-take-off/,2022-10-19,Global CO2 emissions from fossil fuels to rise by less than 1% this year as renewables and EVs take off,egyptindependent.com
https://almessa.gomhuriaonline.com/%d8%a7%d9%84%d8%aa%d8%ba%d9%8a%d8%b1%d8%a7%d8%aa-%d8%a7%d9%84%d9%85%d9%86%d8%a7%d8%ae%d9%8a%d8%a9-%d8%a8%d9%8a%d9%86-%d8%a7%d9%84%d9%85%d8%ae%d8%a7%d8%b7%d8%b1-%d9%88%d8%a7%d9%84%d8%aa%d8%a3%d9%82/,2022-10-20,“التغيرات المناخية بين المخاطر والتأقلم” .. في ندوة بهندسة الإسكندرية,gomhuriaonline.com
https://www.youm7.com/story/2022/10/20/هندسة-الإسكندرية-تنظم-ندوة-بعنوان-التغيرات-المناخية-بين-المخاطر-والتأقلم/5947926,2022-10-20,"هندسة الإسكندرية تنظم ندوة بعنوان ""التغيرات المناخية بين المخاطر والتأقلم""",youm7.com
https://www.elfagr.org/4538368,2022-10-20,"""التغيرات المناخية بين المخاطر والتأقلم"".. عنوان ندوة بـ ""هندسة الإسكندرية""",elfagr.org
https://www.almasryalyoum.com/news/details/2720974,2022-10-20,استعدادًا لـ«COP 27».. مؤتمر بـ«هندسة الإسكندرية»: «الزراعة والسياحة» من أكثر القطاعات تأثرا بالتغيرات المناخية (صور),almasryalyoum.com
https://www.egyptindependent.com/kharga-city-named-arab-environomental-capital-for-2022/,2022-10-21,Kharga city named Arab Environomental Capital for 2022,egyptindependent.com
https://www.egyptindependent.com/sisi-lauds-deeply-rooted-relations-with-south-korea/,2022-10-21,Sisi lauds deeply-rooted relations with South Korea,egyptindependent.com
https://egyptianstreets.com/2022/10/22/the-influence-of-talk-shows-on-egyptian-society-harmless-or-alarming/,2022-10-22,The Influence of Talk Shows on Egyptian Society: Harmless or Alarming?,egyptianstreets.com
https://egyptianstreets.com/2022/10/22/the-sounds-of-africas-climate-crisis-guardians-of-the-river/,2022-10-22,The Sounds of Africa’s Climate Crisis: Guardians of the River,egyptianstreets.com
