url,date_published,title,newsorg
https://www.maraviexpress.com/ministry-of-education-instructs-learners-in-southern-region-not-to-report-for-school-from-tuesday/,2022-01-24,Ministry of Education instructs learners in Southern Region not to report for school from Tuesday,maraviexpress.com
https://www.mwnation.com/malawians-feel-tropical-cyclone-ana-impacts/,2022-01-25,Malawians feel Tropical Cyclone Ana impacts,mwnation.com
https://www.maravipost.com/bachelet-deplores-military-coup-in-burkina-faso/,2022-01-25,Bachelet deplores military coup in Burkina Faso,maravipost.com
https://malawi24.com/2022/01/25/ndirande-police-urges-residents-to-move-away-from-river/,2022-01-25,Ndirande Police urge residents to move away from river,malawi24.com
https://malawi24.com/2022/01/25/govt-suspends-classes-in-southern-region/,2022-01-25,Govt suspends classes in Southern Region,malawi24.com
https://www.maravipost.com/madagascar-deadly-tropical-storms-cause-flooding-landslides/,2022-01-26,"Madagascar: Deadly tropical storms cause flooding, landslides",maravipost.com
https://www.mwnation.com/a-dark-disastrous-night-after-storm-ana/,2022-01-26,"A dark, disastrous night after storm Ana",mwnation.com
https://malawi24.com/2022/01/26/escom-spends-k26-million-buying-envelopes/,2022-01-26,Escom spends K26 million buying envelopes,malawi24.com
https://www.malawivoice.com/2022/01/26/president-chakwera-is-a-failure-he-should-have-fired-himself-along-with-his-cabinet-says-dpp/,2022-01-26,PRESIDENT CHAKWERA IS A FAILURE: He should have fired himself along with his cabinet-Says DPP,malawivoice.com
https://www.malawivoice.com/2022/01/26/mp-navicha-calls-for-accelerated-tree-planting-to-combat-climate-change/,2022-01-26,MP Navicha calls for accelerated tree-planting to combat climate change,malawivoice.com
https://www.faceofmalawi.com/2022/01/27/tropical-storm-ana-kills-46-in-madagascar-mozambique-and-malawi/,2022-01-27,"Tropical storm Ana kills 46 in Madagascar, Mozambique and Malawi",faceofmalawi.com
https://www.mwnation.com/storm-kills-19/,2022-01-27,Storm kills 19,mwnation.com
https://www.maraviexpress.com/ministry-of-agriculture-assures-of-speedy-continuation-of-construction-works-of-shire-valley-transformation-project-after-floods-damages-some-construction-structures/,2022-01-27,Ministry of Agriculture assures of speedy continuation of construction works of Shire Valley Transformation Project after floods damages some construction structures,maraviexpress.com
https://www.maravipost.com/un-assisting-thousands-affected-by-tropical-storm-ana-in-mozambique/,2022-01-27,UN assisting thousands affected by Tropical Storm Ana in Mozambique,maravipost.com
https://www.maravipost.com/bill-melinda-gates-foundation-appoints-board-of-trustees-four-new-members-join-co-chairs-bill-gates-and-melinda-french-gates-to-shape-foundation-governance-and-increase-impact%ef%bf%bc/,2022-01-27,Bill Melinda Gates Foundation Appoints Board of Trustees – Four New Members Join Co-Chairs Bill Gates and Melinda French Gates to Shape Foundation Governance and Increase Impact￼,maravipost.com
https://www.maravipost.com/in-central-sahel-needs-are-growing-faster-than-generosity/,2022-01-28,"In central Sahel, ‘needs are growing faster than generosity’",maravipost.com
https://www.maravipost.com/african-development-bank-group-president-and-african-union-commission-chairperson-discuss-africas-challenges-and-solutions-at-impromptu-dakar/,2022-01-28,African Development Bank Group President and African Union Commission Chairperson discuss Africa’s challenges and solutions at impromptu Dakar...,maravipost.com
https://www.faceofmalawi.com/2022/01/28/chakwera-completes-cabinet/,2022-01-28,Chakwera Completes Cabinet,faceofmalawi.com
https://www.faceofmalawi.com/2022/01/28/msungama-rashid-gaffer-agnes-nkusa-nkhoma-msulu-fired-from-cabinet/,2022-01-28,"Msungama, Rashid Gaffer, Agnes Nkusa Nkhoma, Msulu fired from Cabinet",faceofmalawi.com
http://malawi24.com/2022/01/28/chakwera-fires-minister-of-finance/,2022-01-28,Chakwera fires Malawi Finance Minister,malawi24.com
https://www.nyasatimes.com/escom-angers-parley-for-resisting-single-buyer-model/,2022-01-28,ESCOM angers parley for resisting single buyer model,nyasatimes.com
https://www.nyasatimes.com/chakwera-earns-praise-over-his-gender-sensitive-cabinet/,2022-01-28,Chakwera earns praise over his gender-sensitive Cabinet,nyasatimes.com
https://www.mwnation.com/chakweras-balancing-act/,2022-01-29,Chakwera’s balancing act,mwnation.com
https://www.maravipost.com/my-take-on-it-while-flouting-all-manner-of-rules-laws-and-customs-who-do-you-think-you-are/,2022-01-29,"My Take On It: While flouting all manner of rules, laws, and customs, who do you think you are!",maravipost.com
https://www.maraviexpress.com/malawi-relief-fund-appeals-to-well-wishers-to-join-it-in-assisting-cyclone-ana-flood-victims/,2022-01-29,Malawi Relief Fund appeals to well-wishers to join it in assisting Cyclone Ana flood victims,maraviexpress.com
https://times.mw/politicians-compromising-forests-protection-work/,2022-01-30,Politicians compromising forests protection work,times.mw
https://times.mw/cyclone-ana-death-toll-hits-25/,2022-01-30,Cyclone Ana death toll hits 25,times.mw
https://www.maravipost.com/u-s-epa-and-who-partner-to-protect-public-health/,2022-01-30,U.S. EPA and WHO partner to protect public health,maravipost.com
https://www.maravipost.com/improve-resistance-to-neglected-tropical-diseases-who-urges/,2022-01-30,"Improve resistance to neglected tropical diseases, WHO urges",maravipost.com
https://www.maravipost.com/storytelling-vital-in-climate-justice-advocacy/,2022-01-31,Storytelling vital in Climate justice advocacy,maravipost.com
https://www.nyasatimes.com/cyclone-ana-kills-32-people-in-malawi/,2022-01-30,Cyclone Ana kills 32 people in Malawi,nyasatimes.com
https://www.malawivoice.com/2022/01/31/unicaf-lilongwe-water-board-plant-1500-trees/,2022-01-31,"Unicaf, Lilongwe Water Board Plant 1500 Trees",malawivoice.com
https://www.mwnation.com/dont-cling-on-to-single-buyer-function-escom-told/,2022-01-31,"Don’t cling on to single buyer function, Escom told",mwnation.com
https://www.faceofmalawi.com/2022/01/31/chakwera-assures-flood-affected-people-of-govts-support/,2022-01-31,Chakwera Assures Flood-Affected People Of Govt's Support,faceofmalawi.com
https://times.mw/musts-drive-to-promote-culture-heritage/,2022-01-31,"Must's drive to promote culture, heritage",times.mw
https://www.nyasatimes.com/nsanje-and-chikwawa-socio-economic-development-trust-urges-government-to-prioritize-rehabilitation-of-destroyed-road-network/,2022-01-31,Nsanje and Chikwawa Socio-Economic Development Trust urges government to prioritize rehabilitation of destroyed road network,nyasatimes.com
https://www.maraviexpress.com/nsanje-and-chikwawa-socio-economic-development-trust-urges-government-to-prioritize-rehabilitation-of-destroyed-road-network/,2022-01-31,Nsanje and Chikwawa Socio-Economic Development Trust urges government to prioritize rehabilitation of destroyed road network,maraviexpress.com
https://www.mwnation.com/130-megawatts-off-the-grid/,2022-02-01,130 megawatts off the grid,mwnation.com
https://www.mwnation.com/vulnerable-people-left-behind/,2022-02-01,Vulnerable people left behind,mwnation.com
https://www.faceofmalawi.com/2022/02/01/rotary-club-in-climate-change-initiative/,2022-02-01,Rotary club in climate change initiative,faceofmalawi.com
https://www.nyasatimes.com/chakwera-visits-tropical-cyclone-victims-in-chikhwawa/,2022-02-01,Chakwera visits tropical Cyclone victims in Chikhwawa,nyasatimes.com
https://www.nyasatimes.com/quantel-commences-construction-of-a-mk60-billion-solar-farm/,2022-02-01,Quantel commences construction of a MK60 billion ‘Solar Farm’,nyasatimes.com
https://www.maravipost.com/leadership-recruitment-and-our-constitution-by-reuben-abati/,2022-02-02,Leadership Recruitment And Our Constitution By Reuben Abati,maravipost.com
https://times.mw/lazarus-chakwera-courts-african-leaders-on-cyclone-ana/,2022-02-01,Lazarus Chakwera courts African leaders on Cyclone Ana,times.mw
https://www.faceofmalawi.com/2022/02/02/chakwera-off-to-ethiopia-this-week/,2022-02-02,Chakwera Off To Ethiopia This Week,faceofmalawi.com
https://times.mw/disaster-threatens-economic-recovery/,2022-02-02,Disaster threatens economic recovery,times.mw
https://times.mw/malawi-faces-drought/,2022-02-02,Malawi faces drought,times.mw
https://www.nyasatimes.com/chakwera-to-attend-aus-35th-ordinary-session-in-addis-ababa/,2022-02-02,Chakwera to attend AU’s 35th Ordinary Session in Addis Ababa,nyasatimes.com
https://www.nyasatimes.com/dodma-says-it-did-carry-out-storm-warning-awareness-in-lower-shire-ahead-of-cyclone-ana/,2022-02-02,DoDMA says it did carry out storm warning awareness in Lower Shire ahead of Cyclone Ana,nyasatimes.com
https://www.faceofmalawi.com/2022/02/02/rwanda-set-to-host-commonwealth-meeting-in-june/,2022-02-02,Rwanda set to host Commonwealth meeting in June,faceofmalawi.com
https://www.maravipost.com/malawi-president-chakwera-is-held-accountable-for-campaign-promises/,2022-02-02,Malawi President Chakwera is held accountable for campaign promises,maravipost.com
https://www.maravipost.com/afdb-president-akinwumi-adesina-awarded-honorary-doctoral-degree-at-federal-university-of-technology-minna-calls-on-graduating-class-to-create-a/,2022-02-02,"AfDB President, Akinwumi Adesina awarded honorary doctoral degree at Federal University of Technology Minna: Calls on graduating class to create a...",maravipost.com
https://www.maravipost.com/teleworking-during-covid-risks-benefits-and-steps-to-a-new-normal/,2022-02-02,"Teleworking during COVID: Risks, benefits and steps to a ‘new normal’",maravipost.com
https://www.nyasatimes.com/gertrude-kabwazi-achieving-the-impossible/,2022-02-03,Gertrude Kabwazi: Achieving the impossible.,nyasatimes.com
https://www.nyasatimes.com/youth-network-project-to-plant-10m-trees-in-schools/,2022-02-03,Youth Network project to plant 10m trees in schools,nyasatimes.com
https://www.maraviexpress.com/government-to-increase-access-to-information-through-provision-of-affordable-internet-services/,2022-02-03,Government to increase access to information through provision of affordable internet services,maraviexpress.com
https://www.maravipost.com/technology-and-climate-in-support-of-a-pragmatic-approach/,2022-02-03,Technology and climate: in support of a pragmatic approach,maravipost.com
https://times.mw/man-made-forest-flourishes/,2022-02-04,Man-made forest flourishes,times.mw
https://times.mw/hail-or-sunshine-nsondole-stands-tall/,2022-02-04,"Hail or sunshine, Nsondole stands tall",times.mw
https://www.maravipost.com/kenya-under-fire-over-calls-to-weaken-forest-protections/,2022-02-04,Kenya under fire over calls to 'weaken' forest protections,maravipost.com
https://www.maravipost.com/chakwera-in-ethiopia-for-au-meeting/,2022-02-04,Chakwera in Ethiopia for AU meeting,maravipost.com
https://www.nyasatimes.com/disaster-looms-for-malawi-now-is-the-time-to-act/,2022-02-04,Disaster looms for Malawi – Now is the time to act,nyasatimes.com
https://www.maravipost.com/russians-not-ukrainians-should-brace-up-for-attack-by-owei-lakemfa/,2022-02-05,"Russians, Not Ukrainians Should Brace Up For Attack, By Owei Lakemfa",maravipost.com
https://www.maravipost.com/guterres-says-africa-is-source-of-hope-for-the-world/,2022-02-05,Guterres says Africa is ‘source of hope’ for the world,maravipost.com
https://malawi24.com/2022/02/05/lets-find-lasting-solutions-to-our-problems-chakwera-urges-africans/,2022-02-05,Let’s find lasting solutions to our problems – Chakwera urges Africans,malawi24.com
https://www.maravipost.com/africa-cannot-outsource-its-healthcare-security-to-the-benevolence-of-others/,2022-02-06,“Africa cannot outsource its healthcare security to the benevolence of others”,maravipost.com
https://www.maravipost.com/ynac-partners-lilongwes-mphanje-primary-school-in-tree-planting/,2022-02-06,YNAC partners Lilongwe's Mphanje primary school in tree planting,maravipost.com
https://www.maravipost.com/guterres-says-africa-is-source-of-hope-for-the-world%ef%bf%bc%ef%bf%bc%ef%bf%bc%ef%bf%bc/,2022-02-07,Guterres says Africa is ‘source of hope’ for the world￼￼￼￼,maravipost.com
https://www.faceofmalawi.com/2022/02/07/chakwera-arrives-from-addis-ababa/,2022-02-07,Chakwera Arrives From Addis Ababa,faceofmalawi.com
https://www.faceofmalawi.com/2022/02/07/au-assembly-vital-for-malawis-development-chakwera/,2022-02-07,AU assembly vital for Malawi’s development – Chakwera,faceofmalawi.com
https://malawi24.com/2022/02/07/govt-issues-flood-warning-for-north-central-malawi/,2022-02-07,"Govt issues flood warning for North, Central Malawi",malawi24.com
https://malawi24.com/2022/02/07/malawians-tired-of-chakweras-colourful-speeches-nankhumwa/,2022-02-07,Malawians tired of Chakwera's colourful speeches – Nankhumwa,malawi24.com
https://www.malawivoice.com/2022/02/07/au-assembly-vital-for-malawis-development-chakwera/,2022-02-07,AU Assembly Vital For Malawi’s Development – Chakwera,malawivoice.com
https://www.maravipost.com/water-ministry-warns-malawis-north-central-region-residents-over-possible-floods/,2022-02-07,"Water Ministry warns Malawi's North, Central region residents over possible floods",maravipost.com
https://www.maravipost.com/moderate-tropical-ana-devastates-malawi-lower-shires-social-economic-sectors/,2022-02-07,Moderate Tropical Ana devastates Malawi lower-shire's social-economic sectors,maravipost.com
https://www.maravipost.com/full-transcript-of-honourable-kondwani-nankhumwas-devastating-responses-to-chakweras-sona/,2022-02-07,Full transcript of Honourable Kondwani Nankhumwa's devastating responses to Chakwera's SONA,maravipost.com
https://www.maravipost.com/chakwera-is-back-from-au-but-whats-malawians-benefit/,2022-02-08,Chakwera is back from AU: But what's Malawians benefit?,maravipost.com
https://www.faceofmalawi.com/2022/02/08/govt-issues-flood-warning/,2022-02-08,Govt Issues Flood Warning,faceofmalawi.com
https://times.mw/africa-faces-similar-challenges-lazarus-chakwera/,2022-02-08,Africa faces similar challenges—Lazarus Chakwera,times.mw
https://www.mwnation.com/keturah-for-end-to-gender-based-violence/,2022-02-07,Keturah for end to gender based violence,mwnation.com
https://www.maravipost.com/severe-drought-threatens-13-million-with-hunger-in-horn-of-africa/,2022-02-08,Severe drought threatens 13 million with hunger in Horn of Africa,maravipost.com
https://www.maravipost.com/nyncc-advances-livestock-animals-welfare-for-maximum-production/,2022-02-08,"NYNCC advances livestock, animals' welfare for maximum production",maravipost.com
https://www.mwnation.com/general-alliance-committed-to-reforestation/,2022-02-08,General Alliance committed to reforestation,mwnation.com
https://www.maravipost.com/the-role-of-gas-as-an-enabler-of-the-energy-transition/,2022-02-09,The role of gas as an enabler of the energy transition,maravipost.com
https://www.maravipost.com/peace-is-indispensable-says-un-deputy-chief-in-ethiopia-hearing-stories-of-conflict-and-hope/,2022-02-09,"‘Peace is indispensable’ says UN deputy chief in Ethiopia, hearing stories of conflict and hope",maravipost.com
https://www.maravipost.com/ethiopia-in-much-better-place-to-resolve-tigray-conflict-mohammed/,2022-02-09,Ethiopia in 'much better place' to resolve Tigray conflict: Mohammed,maravipost.com
https://times.mw/calls-for-windfall-tax-grow/,2022-02-09,Calls for windfall tax grow,times.mw
https://www.mwnation.com/making-zomba-green-again/,2022-02-10,Making Zomba green again,mwnation.com
https://www.maravipost.com/sustainability-as-a-team-sport-how-to-build-a-sustainable-business-in-2022/,2022-02-10,Sustainability as a team sport: how to build a sustainable business in 2022,maravipost.com
https://www.maravipost.com/teaching-key-to-better-ocean-protection-says-unesco-chief/,2022-02-11,"Teaching key to better ocean protection, says UNESCO chief",maravipost.com
https://www.malawivoice.com/2022/02/11/cyclone-ana-survivors-laud-undp-for-relentless-support/,2022-02-11,Cyclone Ana Survivors Laud UNDP For Relentless Support,malawivoice.com
https://www.maravipost.com/african-union-welcomes-11-48-million-grant-from-the-african-development-fund-to-strengthen-delivery-of-agenda-2063/,2022-02-11,African Union welcomes $11.48 million grant from the African Development Fund to strengthen delivery of Agenda 2063,maravipost.com
https://www.faceofmalawi.com/2022/02/12/chakwera-to-fly-to-brussels-for-6th-eu-au-summit/,2022-02-12,Chakwera to Fly to Brussels for EU-AU 6th Summit,faceofmalawi.com
https://malawi24.com/2022/02/15/chakwera-to-travel-to-belgium/,2022-02-15,Chakwera to travel to Belgium,malawi24.com
https://malawi24.com/2022/02/15/rotary-club-of-lilongwe-urges-leaners-to-embrace-tree-planting-culture/,2022-02-15,Rotary Club of Lilongwe urges leaners to embrace tree planting culture,malawi24.com
https://www.nyasatimes.com/construction-of-shire-valley-irrigation-canals-intake-needs-to-be-redesigned-after-been-compromised-by-cyclone-ana/,2022-02-15,Construction of Shire Valley irrigation canal’s intake needs to be redesigned after been compromised by Cyclone Ana,nyasatimes.com
https://www.maraviexpress.com/construction-of-shire-valley-irrigation-canals-intake-needs-to-be-redesigned-after-been-compromised-by-cyclone-ana/,2022-02-15,Construction of Shire Valley irrigation canal’s intake needs to be redesigned after been compromised by Cyclone Ana,maraviexpress.com
https://www.malawivoice.com/2022/02/15/malawi-president-chakwera-off-to-brussels-to-restore-africa-europe-partnership/,2022-02-15,"Malawi President Chakwera Off to Brussels to Restore Africa, Europe Partnership",malawivoice.com
https://www.maravipost.com/somalia-elections-must-be-finalized-amid-worsening-drought-security-council-hears/,2022-02-15,"Somalia: Elections must be finalized amid worsening drought, Security Council hears",maravipost.com
https://www.maravipost.com/nyncc-advances-sexual-reproduction-health-amid-effects-of-climate-change/,2022-02-16,NYNCC advances sexual reproduction health amid effects of climate change,maravipost.com
https://www.maravipost.com/unep-establishes-copenhagen-climate-centre-in-collaboration-with-unops/,2022-02-16,UNEP establishes Copenhagen Climate Centre in collaboration with UNOPS,maravipost.com
https://www.nyasatimes.com/malawi-supports-untoc-protocol-on-combating-illicit-wildlife-trafficking/,2022-02-16,Malawi supports UNTOC Protocol on combating illicit wildlife trafficking,nyasatimes.com
https://www.nyasatimes.com/undule-partners-media-and-ngo-in-tree-planting-initiative-in-karonga/,2022-02-16,Undule partners media and NGO in tree-planting initiative in Karonga,nyasatimes.com
https://www.maraviexpress.com/flood-victims-in-balaka-south-forced-to-repatriate-and-seek-refuge-in-their-relations-homes/,2022-02-17,Flood victims in Balaka South forced to repatriate and seek refuge in their relations’ homes,maraviexpress.com
https://www.maravipost.com/five-dowa-women-convicted-for-illegal-forests-products-possession/,2022-02-17,Five Dowa women convicted for illegal forests products possession,maravipost.com
https://malawi24.com/2022/02/17/mkaka-takes-over-government-land/,2022-02-17,Mkaka takes over government land,malawi24.com
https://www.maravipost.com/african-development-bank-group-president-attends-6th-european-union-african-union-summit/,2022-02-17,African Development Bank Group President attends 6th European Union-African Union Summit,maravipost.com
https://www.nyasatimes.com/digital-track-of-disaster-information-crucial-says-undp/,2022-02-17,"Digital track of disaster information crucial, says UNDP",nyasatimes.com
https://www.nyasatimes.com/minister-mkaka-admits-building-on-land-designated-for-public-road/,2022-02-17,SGVH Kauma backs Minister Mkaka on Area 43 plot,nyasatimes.com
https://www.mwnation.com/malawi-to-face-fresh-storm-dumako/,2022-02-17,Malawi to face fresh storm Dumako,mwnation.com
https://www.maravipost.com/african-development-bank-group-global-community-of-practice-g-cop-seminar/,2022-02-17,African Development Bank Group - Global Community of Practice (G-CoP) Seminar,maravipost.com
https://www.malawivoice.com/2022/02/17/ibm-tech-to-help-cushion-malawi-farmers-from-climate-change/,2022-02-17,IBM tech to help cushion Malawi farmers from climate change,malawivoice.com
https://www.nyasatimes.com/tropical-storm-dumako-to-hit-south-malawi/,2022-02-18,Tropical Storm Dumako to hit South Malawi,nyasatimes.com
https://malawi24.com/2022/02/18/heavy-rains-expected-between-today-and-tomorrow/,2022-02-18,Heavy rains expected between today and tomorrow,malawi24.com
https://www.faceofmalawi.com/2022/02/18/chakwera-appeals-for-help-for-flood-victims-at-au-eu-summit-in-brussels/,2022-02-18,Chakwera appeals for help for flood victims at AU-EU Summit in Brussels,faceofmalawi.com
https://times.mw/raining-cats-dogs-raincoats/,2022-02-18,"Raining cats, dogs, raincoats",times.mw
https://www.nyasatimes.com/ibm-tech-to-help-cushion-malawi-farmers-from-climate-change/,2022-02-18,IBM tech to help cushion Malawi farmers from climate change,nyasatimes.com
https://www.maraviexpress.com/roads-authority-assures-public-of-speedy-reopening-of-salima-golomoti-m005-road/,2022-02-18,Roads Authority assures public of speedy reopening of Salima-Golomoti M005 Road,maraviexpress.com
https://www.nyasatimes.com/govt-warns-of-intense-rainfall-from-friday-as-tropical-dumako-triggers-new-wave-of-floods/,2022-02-19,Govt warns of intense rainfall from Friday as tropical Dumako triggers new wave of floods,nyasatimes.com
https://www.nyasatimes.com/roads-authority-assures-public-of-speedy-reopening-of-salima-golomoti-m005-road/,2022-02-18,Roads Authority assures public of speedy reopening of Salima-Golomoti M005 Road,nyasatimes.com
https://www.mwnation.com/budget-highlights-low-growth-high-debt-levels/,2022-02-19,"Budget highlights low growth, high debt levels",mwnation.com
https://malawi24.com/2022/02/19/un-says-wildlife-crime-in-malawi-needs-to-be-fully-addressed/,2022-02-19,UN says wildlife crime in Malawi needs to be fully addressed,malawi24.com
https://www.faceofmalawi.com/2022/02/19/2022-2023-national-budget-getting-to-know-what-is-dubbed-people-centred-budget/,2022-02-19,2022/2023 NATIONAL BUDGET: Getting to Know what is Dubbed ‘People-Centred’ Budget,faceofmalawi.com
https://www.maravipost.com/world-neglected-tropical-diseases-day-who-calls-for-equitable-health-services-for-all/,2022-02-19,World Neglected Tropical Diseases Day: WHO calls for equitable health services for all,maravipost.com
https://www.maravipost.com/tonnes-of-covid-19-health-care-waste-expose-urgent-need-to-improve-waste-management-systems/,2022-02-19,Tonnes of COVID-19 health care waste expose urgent need to improve waste management systems,maravipost.com
https://www.mwnation.com/mozambican-flood-victims-cry-foul/,2022-02-20,Mozambican flood victims cry foul,mwnation.com
https://www.maravipost.com/malawi-varsity-students-body-pens-finance-minister-demanding-increased-budgetary-allocation-to-loans-board/,2022-02-20,Malawi varsity students body pens Finance Minister demanding increased budgetary allocation to Loans Board,maravipost.com
https://www.maravipost.com/malawis-meteorological-services-department-workers-vow-to-go-on-sit-in-over-horrible-working-conditions/,2022-02-20,Malawi's Meteorological Services Department workers vow to go on sit-in over horrible working conditions,maravipost.com
https://www.maravipost.com/crucial-changes-needed-to-protect-workers-health-while-teleworking/,2022-02-21,Crucial changes needed to protect workers’ health while teleworking,maravipost.com
https://www.maravipost.com/the-effects-of-covid-19-on-local-food-systems-and-rural-livelihoods/,2022-02-21,The effects of COVID-19 on local food systems and rural livelihoods,maravipost.com
https://www.maravipost.com/women-building-a-sustainable-future-fighting-back-the-desert-amid-nigers-refugee-and-climate-crises/,2022-02-21,"Women building a sustainable future: fighting back the desert, amid Niger’s refugee and climate crises",maravipost.com
https://www.nyasatimes.com/cisonecc-urges-govt-to-promote-transparency-and-accountability-in-climate-financing/,2022-02-21,CISONECC urges govt to promote transparency and accountability in climate financing,nyasatimes.com
https://www.maravipost.com/covid-19-health-workers-face-dangerous-neglect-warn-who-ilo/,2022-02-21,"COVID-19: Health workers face ‘dangerous neglect’, warn WHO, ILO",maravipost.com
https://www.maravipost.com/cisonecc-at-chakweras-mercy-for-disaster-risk-management-bill-enactment/,2022-02-22,CISONECC at Chakwera's mercy for Disaster Risk Management bill enactment,maravipost.com
https://www.maravipost.com/african-development-bank-group-approves-379-6-million-desert-to-power-financing-facility-for-the-g5-sahel-countries/,2022-02-22,African Development Bank Group approves $379.6 million Desert to Power financing facility for the G5 Sahel countries,maravipost.com
https://times.mw/expect-more-tropical-cyclones/,2022-02-22,‘Expect more tropical cyclones’,times.mw
https://www.mwnation.com/csos-want-govt-to-invest-in-disaster-risk-reduction/,2022-02-22,CSOs want govt to invest in disaster risk reduction,mwnation.com
https://www.maravipost.com/former-malawi-finance-minister-felix-mlusu-faulted-for-admarcs-failure/,2022-02-22,Former Malawi Finance Minister Felix Mlusu faulted for ADMARC's failure,maravipost.com
https://www.maravipost.com/at-least-55-of-crises-can-be-predicted-but-less-than-1-of-humanitarian-funding-is-released-early/,2022-02-22,“At least 55% of crises can be predicted but less than 1% of humanitarian funding is released early”,maravipost.com
