url,date_published,title,newsorg
https://www.maravipost.com/cop27-leaders-event-accelerating-adaptation-in-africa/,2022-11-07,COP27 Leaders’ Event: Accelerating Adaptation in Africa,maravipost.com
https://www.maravipost.com/cop-27-in-egypt-multiple-parties-call-for-action-in-favor-of-developing-countries/,2022-11-08,COP 27 in Egypt : multiple parties call for action in favor of developing countries,maravipost.com
https://mwnation.com/chakwera-drums-up-support-for-poor-countries-agendas/,2022-11-08,Chakwera drums up support for poor countries agendas,mwnation.com
https://mwnation.com/chakwera-touts-k27bn-energy-investment/,2022-11-08,Chakwera touts K27bn energy investment,mwnation.com
https://mwnation.com/neno-youths-embark-on-disaster-interventions/,2022-11-08,Neno youths embark on disaster interventions,mwnation.com
https://www.faceofmalawi.com/2022/11/08/kenyan-president-william-rutos-bodyguards-take-quick-action-after-what-unidentified-man-attempted-to-do-in-egypt/,2022-11-08,Kenyan President William Ruto's Bodyguards Take Quick Action After What Unidentified Man Attempted To Do In Egypt,faceofmalawi.com
https://www.maravipost.com/climate-summit-opens-in-egypt-as-africa-pushes-for-gas-exploitation/,2022-11-08,Climate summit opens in Egypt as Africa pushes for gas exploitation,maravipost.com
https://malawi24.com/2022/11/08/chakwera-asks-for-urgency-in-addressing-climate-change/,2022-11-08,Chakwera asks for urgency in addressing climate change,malawi24.com
https://times.mw/lazarus-chakwera-for-climate-adaptation/?utm_source=rss&utm_medium=rss&utm_campaign=lazarus-chakwera-for-climate-adaptation&utm_source=rss&utm_medium=rss&utm_campaign=lazarus-chakwera-for-climate-adaptation,2022-11-08,Lazarus Chakwera for climate adaptation,times.mw
https://www.maravipost.com/african-union-welcomes-the-netherlands-contribution-of-eur-110-million-for-the-africa-adaptation-acceleration-program-at-cop27/,2022-11-08,African Union welcomes the Netherlands’ contribution of EUR 110 million for the Africa Adaptation Acceleration Program at COP27,maravipost.com
https://www.maravipost.com/cop27-announcement-of-the-winners-of-2022-youthadapt-awards/,2022-11-08,COP27: Announcement of the Winners of 2022 YouthADAPT Awards,maravipost.com
https://www.capitalradiomalawi.com/2022/11/06/cop27-watershed-moment-as-un-climate-summit-begins/,2022-11-06,COP27: ‘Watershed moment’ as UN climate summit begins,capitalradiomalawi.com
https://www.maravipost.com/cop27-imf-calls-for-climate-smart-investment-in-africa/,2022-11-09,COP27: IMF calls for climate-smart investment in Africa,maravipost.com
https://www.maravipost.com/uk-steps-up-climate-adaptation-finance-support-for-africa/,2022-11-09,UK steps up climate adaptation finance support for Africa,maravipost.com
https://www.nyasatimes.com/chakwera-secures-k28bn-energy-deal-at-cop27-in-egypt/,2022-11-09,Chakwera secures K28bn energy deal at Cop27 in Egypt,nyasatimes.com
https://www.nyasatimes.com/techniques-used-by-nba-players-to-stay-fit/,2022-11-08,Techniques Used by NBA Players to Stay Fit,nyasatimes.com
https://www.maravipost.com/ten-countries-commit-to-sustainable-commodities-in-africa/,2022-11-09,Ten countries commit to sustainable commodities in Africa,maravipost.com
https://www.maravipost.com/africa-marks-special-day-at-cop27-with-a-resolve-to-tackle-climate-change-relentlessly/,2022-11-09,Africa marks special day at COP27 with a resolve to tackle climate change relentlessly,maravipost.com
https://www.maravipost.com/nestle-partners-with-africa-food-prize-to-strengthen-food-security-and-climate-change-resilience/,2022-11-09,Nestlé partners with Africa Food Prize to strengthen food security and climate change resilience,maravipost.com
https://mwnation.com/mgunda-bags-african-writers-award/,2022-11-09,Mgunda bags African Writer’s Award,mwnation.com
https://www.faceofmalawi.com/2022/11/09/zambia-president-hakainde-hichilema-back-from-egypt-chakwera-is-still-nowhere/,2022-11-09,Zambia President Hakainde Hichilema back from Egypt: Chakwera is still nowhere,faceofmalawi.com
https://www.maravipost.com/global-leaders-rally-support-and-finance-for-the-africa-adaptation-acceleration-program-to-tackle-climate-change-in-africa/,2022-11-09,Global Leaders Rally Support and Finance for the Africa Adaptation Acceleration Program to Tackle Climate Change in Africa,maravipost.com
https://www.maraviexpress.com/malawi-partners-with-african-carbon-markets-initiative-on-carbon-credit/?utm_source=rss&utm_medium=rss&utm_campaign=malawi-partners-with-african-carbon-markets-initiative-on-carbon-credit,2022-11-08,Malawi partners with African Carbon Markets Initiative on carbon credit,maraviexpress.com
https://mwnation.com/electricity-and-clean-cooking-go-together/,2022-11-10,Electricity and clean cooking go together,mwnation.com
https://www.maravipost.com/the-award-winning-ghanaian-climate-activist-who-steered-his-nation-away-from-coal/,2022-11-10,The award-winning Ghanaian climate activist who steered his nation away from coal,maravipost.com
https://www.capitalradiomalawi.com/2022/11/09/cop27-mw-malawi-partners-acmi-to-scale-up-carbon-credit-production/,2022-11-09,COP27-Mw: Malawi partners ACMI to scale up carbon credit production,capitalradiomalawi.com
https://www.faceofmalawi.com/2022/11/10/chakwera-pushes-for-share-in-climate-financing/,2022-11-10,Chakwera pushes for share in climate financing,faceofmalawi.com
https://www.maravipost.com/africa-development-bank-partners-with-university-of-oxford-on-sustainable-finance-capacity-building/,2022-11-10,Africa Development Bank partners with University of Oxford on sustainable finance capacity-building,maravipost.com
https://www.faceofmalawi.com/2022/11/10/more-blackouts-to-come-as-kapichira-restoration-project-to-miss-december-deadline/,2022-11-10,More Blackouts To Come As Kapichira Restoration Project To Miss December Deadline,faceofmalawi.com
https://mwnation.com/mera-takes-out-fuel-brokers-fee/,2022-11-10,Mera takes out fuel brokers fee,mwnation.com
https://www.maravipost.com/terrorism-intensifying-across-africa-exploiting-instability-and-conflict/,2022-11-10,"Terrorism intensifying across Africa, exploiting instability and conflict",maravipost.com
https://www.malawivoice.com/2022/11/10/extreme-weather-shocks-affecting-malawis-social-protection-programmes/,2022-11-10,Extreme weather shocks affecting Malawi’s social protection programmes,malawivoice.com
https://www.malawivoice.com/2022/11/10/shocking-chakwera-takes-whole-village-to-egypt-despite-forex-economic-woes/,2022-11-10,"SHOCKING: Chakwera takes whole village to Egypt despite forex, economic woes",malawivoice.com
https://www.malawivoice.com/2022/11/10/increased-generation-of-carbon-credits-possible-chakwera/,2022-11-10,Increased generation of carbon credits possible- Chakwera,malawivoice.com
https://www.maravipost.com/african-development-bank-first-investor-to-commit-in-tdb-class-c-green-shares-launched-at-cop27/,2022-11-10,African Development Bank first investor to commit in TDB Class C Green+ shares launched at COP27,maravipost.com
https://www.maravipost.com/world-needs-us-to-be-climate-leader-says-ugandan-activist-vanessa-nakate/,2022-11-11,"World needs US 'to be climate leader', says Ugandan activist Vanessa Nakate",maravipost.com
https://www.nyasatimes.com/chakwera-returns-from-cop-27-with-a-promise-to-push-for-climate-financing/,2022-11-11,Chakwera returns from COP 27 with a promise to push for climate financing,nyasatimes.com
https://www.nyasatimes.com/electricity-tower-vandals-plunge-malawi-into-total-darkness/,2022-11-11,Electricity tower vandals plunge Malawi into total darkness,nyasatimes.com
https://malawi24.com/2022/11/11/malawians-told-to-brace-for-five-cyclones/,2022-11-11,Malawians told to brace for five cyclones,malawi24.com
https://times.mw/malawi-will-keep-pushing-for-climate-funding-lazarus-chakwera/?utm_source=rss&utm_medium=rss&utm_campaign=malawi-will-keep-pushing-for-climate-funding-lazarus-chakwera&utm_source=rss&utm_medium=rss&utm_campaign=malawi-will-keep-pushing-for-climate-funding-lazarus-chakwera,2022-11-11,Malawi will keep pushing for climate funding—Lazarus Chakwera,times.mw
https://www.maravipost.com/2-million-in-prizes-awarded-at-cop27-to-african-youth-led-businesses/,2022-11-11,2 million in prizes awarded at COP27 to African youth-led businesses,maravipost.com
https://www.maravipost.com/my-take-on-it-unity-of-purpose-unity-in-deed-called-for-in-africa/,2022-11-12,"My Take On It: Unity of purpose, unity in deed called for in Africa",maravipost.com
https://www.maravipost.com/african-development-bank-rallies-partners-to-support-the-flagship-desert-to-power-initiative-to-light-up-the-sahel/,2022-11-12,African Development Bank rallies partners to support the flagship Desert to Power initiative to light up the Sahel,maravipost.com
https://www.maravipost.com/ivory-coast-cocoa-farmers-fear-unpredictable-climate-to-lower-crop-yields/,2022-11-12,Ivory Coast cocoa farmers fear unpredictable climate to lower crop yields,maravipost.com
https://times.mw/will-cop27-deliver-or-be-a-climate-forum-of-empty-promises/?utm_source=rss&utm_medium=rss&utm_campaign=will-cop27-deliver-or-be-a-climate-forum-of-empty-promises&utm_source=rss&utm_medium=rss&utm_campaign=will-cop27-deliver-or-be-a-climate-forum-of-empty-promises,2022-11-12,Will COP27 deliver or be a climate forum of empty promises?,times.mw
https://times.mw/ldcs-urged-to-invest-in-climate-expertise/?utm_source=rss&utm_medium=rss&utm_campaign=ldcs-urged-to-invest-in-climate-expertise&utm_source=rss&utm_medium=rss&utm_campaign=ldcs-urged-to-invest-in-climate-expertise,2022-11-12,LDCs urged to invest in climate expertise,times.mw
https://www.maravipost.com/cop27-african-and-global-partners-launch-multi-billion-alliance-for-green-infrastructure/,2022-11-12,COP27: African and global partners launch multi-billion alliance for green infrastructure,maravipost.com
https://mwnation.com/biden-announces-150m-to-africa/,2022-11-13,Biden announces $150m to Africa,mwnation.com
https://www.maravipost.com/challenges-of-farmers-under-the-spotlight-at-cop-27/,2022-11-14,Challenges of farmers under the spotlight at COP 27,maravipost.com
https://www.malawivoice.com/2022/11/14/government-applauds-two-youthful-malawian-innovation-awardees/,2022-11-14,Government applauds two youthful Malawian innovation awardees,malawivoice.com
https://www.maravipost.com/drc-activists-say-industrialised-nations-must-pay-for-for-global-warming-impact/,2022-11-14,DRC activists say industrialised nations must pay for for global warming impact,maravipost.com
https://www.maravipost.com/particularly-exposed-to-climate-shocks-african-cities-are-turning-to-adaptation-and-resilience/,2022-11-14,"Particularly exposed to climate shocks, African cities are turning to adaptation and resilience",maravipost.com
https://www.maravipost.com/cop27-experts-explore-avenues-to-mobilize-more-robust-financing-for-climate-action/,2022-11-14,COP27: experts explore avenues to mobilize more robust financing for climate Action,maravipost.com
https://www.maravipost.com/cop27-egypt-and-a-hundred-partners-including-the-african-development-bank-launch-guidebook-for-just-financing-to-address-climate-challenges/,2022-11-15,"COP27: Egypt and a hundred partners, including the African Development Bank, launch “Guidebook for Just Financing” to address climate challenges",maravipost.com
https://www.maravipost.com/who-launches-4th-health-for-all-film-festival/,2022-11-15,WHO launches 4th Health for All Film Festival,maravipost.com
https://www.maravipost.com/on-world-cities-day-2022-who-calls-on-countries-to-act-local-to-go-global/,2022-11-15,"On World Cities Day 2022, WHO calls on countries to “Act Local to Go Global”",maravipost.com
https://www.maravipost.com/natural-gas-is-not-an-ideological-issue-its-a-pragmatic-one-says-afdbs-adesina/,2022-11-15,"‘Natural gas is not an ideological issue, it’s a pragmatic one,’ says AfDB’s Adesina",maravipost.com
https://mwnation.com/malawi-3-other-african-states-to-receive-k3-6bn/,2022-11-15,"Malawi, 3 other African States to receive K3.6bn",mwnation.com
https://www.maravipost.com/climate-activists-call-on-countries-to-stop-funding-new-gas-projects-in-africa/,2022-11-16,Climate activists call on countries to stop funding new gas projects in Africa,maravipost.com
https://mwnation.com/ngo-promotes-food-security-in-karonga/,2022-11-16,NGO promotes food security in Karonga,mwnation.com
https://www.maraviexpress.com/johnston-village-in-kasungu-earns-praise-from-flanders-govt-for-its-climate-change-resilience/?utm_source=rss&utm_medium=rss&utm_campaign=johnston-village-in-kasungu-earns-praise-from-flanders-govt-for-its-climate-change-resilience,2022-11-16,Johnston Village in Kasungu earns praise from Flanders Govt. for its climate change resilience,maraviexpress.com
https://www.maravipost.com/for-the-cop-27-climate-summit-a-new-story-on-africa-climate-action/,2022-11-16,For the COP-27 Climate Summit: A New Story on Africa Climate Action,maravipost.com
https://www.maravipost.com/african-development-bank-invests-20-million-in-private-equity-fund-targeting-renewable-energy-projects-in-sub-saharan-africa/,2022-11-16,African Development Bank invests $20 million in private equity fund targeting renewable energy projects in sub-Saharan Africa,maravipost.com
https://www.maravipost.com/african-development-bank-predicts-economic-slowdown-in-east-africa-in-2022-but-bounce-back-in-2023/,2022-11-16,"African Development Bank predicts economic slowdown in East Africa in 2022, but bounce back in 2023",maravipost.com
https://www.maravipost.com/egypt-imprisoned-activist-calls-off-hunger-strike/,2022-11-16,Egypt: Imprisoned activist calls off hunger strike,maravipost.com
https://www.maraviexpress.com/dodma-reducing-risks-of-floods-by-dredging-flood-prone-rivers-in-nsanje/?utm_source=rss&utm_medium=rss&utm_campaign=dodma-reducing-risks-of-floods-by-dredging-flood-prone-rivers-in-nsanje,2022-11-16,DoDMA reducing risks of floods by dredging flood-prone rivers in Nsanje,maraviexpress.com
https://www.maravipost.com/financing-nature-for-resilient-communities-and-economies/,2022-11-16,Financing nature for resilient communities and economies,maravipost.com
https://www.maravipost.com/cop27-germany-commits-e40-million-to-african-development-bank-groups-climate-action-window-initiative-for-fragile-african-states/,2022-11-16,COP27: Germany commits €40 million to African Development Bank Group’s Climate Action Window initiative for fragile African states,maravipost.com
https://www.maravipost.com/doses-of-ebola-candidate-vaccines-expected-to-be-shipped-to-uganda-next-week-who/,2022-11-17,Doses of Ebola candidate vaccines expected to be shipped to Uganda next week: WHO,maravipost.com
https://www.maravipost.com/invest-more-in-africas-sahel-or-risk-decades-of-armed-conflict-and-displacement/,2022-11-17,"Invest more in Africa’s Sahel, or risk decades of armed conflict and displacement",maravipost.com
https://mwnation.com/african-insurers-pledge-14bn-climate-finance/,2022-11-17,African insurers pledge $14bn climate finance,mwnation.com
https://www.maravipost.com/cop27-on-gender-day-african-development-bank-rallies-global-support-for-women-to-build-climate-resilience-2/,2022-11-17,COP27: On Gender Day African Development Bank rallies global support for women to build climate resilience,maravipost.com
https://mwnation.com/african-youths-push-for-climate-change-financing/,2022-11-17,African youths push for climate change financing,mwnation.com
https://mwnation.com/malawi-signs-carbon-trading-deal-with-switzerland/,2022-11-17,Malawi signs carbon trading deal with Switzerland,mwnation.com
https://www.maravipost.com/sudan-human-rights-must-be-at-the-core-of-democratic-transition-urges-turk/,2022-11-17,"Sudan: Human rights must ‘be at the core’ of democratic transition, urges Türk",maravipost.com
https://mwnation.com/can-we-get-serious-on-kapichira-rehab-energy/,2022-11-17,"Can we get serious on Kapichira rehab, energy?",mwnation.com
https://mwnation.com/raiply-loses-34ha-of-trees-to-bushfire/,2022-11-17,Raiply loses 34ha of trees to bushfire,mwnation.com
https://mwnation.com/undp-model-village-project-pays-off/,2022-11-17,UNDP model village project pays off,mwnation.com
https://www.maravipost.com/climate-change-induced-by-human-activity-behind-floods-in-nigeria/,2022-11-17,Climate change induced by human activity behind floods in Nigeria,maravipost.com
https://malawi24.com/2022/11/17/misconception-still-contributing-to-low-uptake-of-covid-19-vaccin/,2022-11-17,Misconception still contributing to low uptake of Covid-19 vaccine,malawi24.com
https://www.maraviexpress.com/cama-demands-of-chakwera-to-identify-sustainable-multiple-sources-of-generating-funds-than-over-reliance-on-borrowing-or-grants/?utm_source=rss&utm_medium=rss&utm_campaign=cama-demands-of-chakwera-to-identify-sustainable-multiple-sources-of-generating-funds-than-over-reliance-on-borrowing-or-grants,2022-11-17,CAMA demands of Chakwera to identify sustainable multiple sources of generating funds than over-reliance on borrowing or grants,maraviexpress.com
https://www.maravipost.com/solar-powered-piped-water-schemes-are-helping-zimbabwes-urban-communities-amid-water-scarcity-and-climate-change/,2022-11-17,Solar-powered piped water schemes are helping Zimbabwe’s urban communities amid water scarcity and climate change,maravipost.com
https://www.maravipost.com/cop27-spain-swiss-confederation-announce-eur-10-million-support-to-african-development-bank-groups-urban-and-municipal-development-fund/,2022-11-17,"COP27: Spain, Swiss Confederation announce EUR 10 million support to African Development Bank Group’s Urban and Municipal Development Fund",maravipost.com
https://www.maravipost.com/bill-melinda-gates-foundation-reaffirms-commitment-to-african-countries-to-help-accelerate-progress-in-health-agriculture-gender-equality-and-other-critical-areas/,2022-11-17,"Bill Melinda Gates Foundation Reaffirms Commitment to African Countries to Help Accelerate Progress in Health, Agriculture, Gender Equality and Other Critical Areas",maravipost.com
https://www.maravipost.com/worlds-largest-soil-carbon-project-in-kenya-receives-award-during-cop27/,2022-11-17,￼World’s largest soil carbon project in Kenya receives award during COP27,maravipost.com
https://times.mw/cop27-fiddling-as-world-warms/?utm_source=rss&utm_medium=rss&utm_campaign=cop27-fiddling-as-world-warms&utm_source=rss&utm_medium=rss&utm_campaign=cop27-fiddling-as-world-warms,2022-11-17,CoP27 fiddling as world warms,times.mw
https://www.malawivoice.com/2022/11/17/malawi-switzerland-sign-carbon-trading-pact/,2022-11-17,"Malawi, Switzerland sign carbon trading pact",malawivoice.com
https://www.maravipost.com/what-you-need-to-know-about-the-afcfta-guided-trade-initiative/,2022-11-17,What you need to know about the AfCFTA Guided Trade Initiative,maravipost.com
https://www.maravipost.com/ebrd-afdb-and-afd-launch-tool-to-support-private-businesses-and-public-sector-improve-gender-responsiveness/,2022-11-17,"EBRD, AfDB and AFD launch tool to support private businesses and public sector improve gender responsiveness",maravipost.com
https://www.maravipost.com/cop27-african-ministers-explore-ways-to-scale-up-food-production-to-feed-the-continent-bolster-resilience/,2022-11-17,"COP27: African ministers explore ways to scale up food production to feed the continent, bolster resilience",maravipost.com
https://www.maravipost.com/towards-climate-resilient-ocean-economies-in-africa/,2022-11-18,Towards Climate Resilient Ocean Economies in Africa,maravipost.com
https://mwnation.com/iceland-norway-wfp-support-food-response/,2022-11-18,"Iceland, Norway, WFP support food response",mwnation.com
https://www.nyasatimes.com/minister-nyalonje-asks-stakeholders-to-provide-more-support-to-inclusive-education-in-malawi/,2022-11-18,Minister NyaLonje asks stakeholders to provide more support to inclusive education in Malawi,nyasatimes.com
https://www.nyasatimes.com/kulima-better-project-helps-44-000-farmers-phasing-out-dec-2022/,2022-11-18,"KULIMA-BETTER Project helps 44, 000 farmers, phasing out Dec. 2022",nyasatimes.com
https://malawi24.com/2022/11/18/malawi-switzerland-sign-agreement-on-climate-change/,2022-11-18,"Malawi, Switzerland sign agreement on climate change",malawi24.com
https://mwnation.com/ive-nothing-to-depend-on/,2022-11-18,‘I’ve nothing to depend on’,mwnation.com
https://www.maravipost.com/bright-msaka-is-he-malawis-hope-for-2025/,2022-11-18,Bright Msaka: Is he Malawi's hope for 2025?,maravipost.com
https://www.maravipost.com/africa-development-bank-and-african-union-commission-sign-9-73-million-grant-agreement-to-drive-digital-market-development-in-africa/,2022-11-18,Africa Development Bank and African Union Commission sign $9.73 million grant agreement to drive digital market development in Africa,maravipost.com
https://www.maravipost.com/soil-a-little-known-carbon-sink-is-a-diminishing-resource-in-kenya/,2022-11-18,"Soil, a little-known carbon sink, is a diminishing resource in Kenya",maravipost.com
https://www.maravipost.com/opinion-time-to-empower-regional-development-banks-for-sdg-financing/,2022-11-19,Opinion: Time to empower regional development banks for SDG financing,maravipost.com
https://mwnation.com/chakweras-burning-charcoal/,2022-11-19,Chakwera’s burning charcoal,mwnation.com
https://www.maravipost.com/addis-ababa-beautifying-sheger-river-development-project/,2022-11-19,Addis Ababa “Beautifying Sheger” River Development Project,maravipost.com
https://www.nyasatimes.com/rains-kill-5-in-mchinji-nkhotakota/,2022-11-19,"Rains kill 5 in Mchinji, Nkhotakota",nyasatimes.com
https://www.maraviexpress.com/next-time-someone-promises-an-economic-miracle-out-of-the-blues-do-not-listen-to-them-kabambe/?utm_source=rss&utm_medium=rss&utm_campaign=next-time-someone-promises-an-economic-miracle-out-of-the-blues-do-not-listen-to-them-kabambe,2022-11-19,"Next time someone promises an economic miracle out of the blues, do not listen to them—Kabambe",maraviexpress.com
https://www.maravipost.com/agony-of-chakweras-tonse-govt-workshop-ban-mponera-businesses-on-deathbed/,2022-11-19,Agony of Chakwera's Tonse Govt workshop ban: Mponera businesses on deathbed,maravipost.com
https://www.malawivoice.com/2022/11/19/chakwera-launches-2022-23-affordable-inputs-programme/,2022-11-19,Chakwera Launches 2022/23 Affordable Inputs Programme,malawivoice.com
https://mwnation.com/rainstorms-kill-5-displace-450/,2022-11-21,"Rainstorms kill 5, displace 450",mwnation.com
https://www.nyasatimes.com/next-time-someone-promises-an-economic-miracle-out-of-the-blues-do-not-listen-to-them-kabambe/,2022-11-21,"Next time someone promises an economic miracle out of the blues, do not listen to them—Kabambe",nyasatimes.com
https://malawi24.com/2022/11/21/milken-institute-and-motsepe-foundation-announce-new-2m-prize-competition-in-green-energy/,2022-11-21,Milken Institute and Motsepe Foundation announce new $2M prize competition in green energy,malawi24.com
https://www.maraviexpress.com/cdh-investment-bank-calls-for-exports-development-as-foreign-exchange-generation/?utm_source=rss&utm_medium=rss&utm_campaign=cdh-investment-bank-calls-for-exports-development-as-foreign-exchange-generation,2022-11-21,CDH Investment Bank calls for exports development as foreign exchange generation,maraviexpress.com
https://www.maravipost.com/thousands-tune-in-virtually-to-hear-bill-gates-on-innovating-for-food-security-climate-change-in-africa/,2022-11-21,Thousands Tune in Virtually to Hear Bill Gates on Innovating for Food Security Climate Change in Africa,maravipost.com
https://mwnation.com/irrigation-liberates-women/,2022-11-21,Irrigation liberates women,mwnation.com
https://mwnation.com/climate-crisis-pushes-the-poor-into-poverty-trap/,2022-11-21,Climate crisis pushes the poor into poverty trap,mwnation.com
https://www.nyasatimes.com/pml-moves-to-explore-geothermal-energy/,2022-11-21,PML moves to explore geothermal energy,nyasatimes.com
https://www.nyasatimes.com/cdh-investment-bank-calls-for-exports-development-as-foreign-exchange-generation/,2022-11-21,CDH Investment Bank calls for exports development as foreign exchange generation,nyasatimes.com
https://times.mw/whole-grain-impact-on-global-food-security/?utm_source=rss&utm_medium=rss&utm_campaign=whole-grain-impact-on-global-food-security&utm_source=rss&utm_medium=rss&utm_campaign=whole-grain-impact-on-global-food-security,2022-11-22,Whole grain impact on global food security,times.mw
https://www.maravipost.com/the-2022-u-s-africa-business-forum-and-multiple-sideline-events-in-washington-dc/,2022-11-22,The 2022 U.S.-Africa Business Forum and Multiple Sideline Events in Washington DC,maravipost.com
https://www.nyasatimes.com/pangs-of-government-workshops-ban-puts-mponela-hospitality-businesses-on-death-bed/,2022-11-23,Pangs of government workshops ban puts Mponela hospitality businesses on death-bed,nyasatimes.com
https://www.maravipost.com/stronger-action-required-to-address-changing-dynamics-of-piracy-in-the-gulf-of-guinea/,2022-11-22,Stronger action required to address changing dynamics of piracy in the Gulf of Guinea,maravipost.com
https://www.maravipost.com/ghana-african-development-fund-approves-27-9-million-grant-for-savannah-agriculture-value-chain-development-project-sadp/,2022-11-23,Ghana: African Development Fund approves $27.9 million grant for Savannah Agriculture Value Chain Development Project (SADP),maravipost.com
https://mwnation.com/rainstorm-survivors-get-relief-food-items/,2022-11-23,"Rainstorm survivors get relief food, items",mwnation.com
