url,date_published,title,newsorg
https://www.nouvelobs.com/planete/20220307.OBS55400/cette-menace-invisible-qui-pese-sur-la-foret-amazonienne.html,2022-03-07,Cette menace invisible qui pèse sur la forêt amazonienne,nouvelobs.com
https://www.nouvelobs.com/planete/20220501.OBS57877/apparition-exceptionnelle-d-un-ours-polaire-dans-le-sud-du-canada.html,2022-05-01,Apparition exceptionnelle d’un ours polaire dans le sud du Canada,nouvelobs.com
https://www.senenews.com/actualites/international/apres-les-fidji-la-ministre-australienne-des-affaires-etrangeres-aux-samoa_403515.html,2022-06-02,"Après les Fidji, la ministre australienne des Affaires étrangères aux Samoa",senenews.com
https://www.rewmi.com/entre-canicule-secheresse-et-feux-de-brousse-le-mois-de-juillet-parmi-les-mois-les-plus-chauds-jamais-releves/,2022-08-10,"Entre canicule, sécheresse et feux de brousse : Le mois de Juillet parmi les mois les plus chauds jamais relevés",rewmi.com
https://www.nouvelobs.com/ecologie/20220829.OBS62526/la-fonte-au-groenland-rend-inevitable-une-forte-elevation-de-la-mer-selon-une-etude.html,2022-08-29,"La fonte au Groenland rend inévitable une forte élévation de la mer, selon une étude",nouvelobs.com
https://www.nouvelobs.com/planete/20221108.OBS65639/l-europe-a-connu-son-mois-d-octobre-le-plus-chaud-jamais-enregistre-selon-copernicus.html,2022-11-08,"L’Europe a connu son mois d’octobre le plus chaud jamais enregistré, selon Copernicus",nouvelobs.com
https://www.seneweb.com/news/International/entre-ldquo-espoir-rdquo-et-ldquo-frustr_n_393737.html,2022-11-20,Entre “espoir” et “frustration”: ce qu'il faut retenir de la COP27,seneweb.com
https://lequotidien.sn/macky-sall-has-excelled-as-an-african-voice-speaking-up-for-african-priorities/,2022-12-09,Macky Sall Has Excelled as an African Voice Speaking up for African Priorities,lequotidien.sn
