url,date_published,title,newsorg
https://www.thesierraleonetelegraph.com/commonwealth-secretary-general-patricia-scotland-visits-sierra-leone/,2022-01-25,Commonwealth Secretary-General Patricia Scotland visits Sierra Leone,thesierraleonetelegraph.com
https://www.sierraleonetimes.com/news/272222936/bringing-dry-land-in-the-sahel-back-to-life,2022-01-26,Bringing dry land in the Sahel back to life,sierraleonetimes.com
http://www.thepatrioticvanguard.com/1-5-million-children-lack-life-saving-treatment-for-severe-wasting-in-eastern-and-southern-africa,2022-01-22,"1.5 million children lack life-saving treatment for severe wasting in Eastern and Southern Africa, alerts UNICEF",thepatrioticvanguard.com
https://www.sierraleonetimes.com/news/272231406/state-department-releases-annual-trafficking-in-persons-report,2022-01-26,State Department Releases Annual Trafficking in Persons Report,sierraleonetimes.com
http://www.thepatrioticvanguard.com/thoronka-urges-fellow-sierra-leoneans-to-apply-for-chegg-prize,2022-01-27,Thoronka urges fellow Sierra Leoneans to apply for Chegg prize,thepatrioticvanguard.com
https://www.sierraleonenews.net/news/272231406/state-department-releases-annual-trafficking-in-persons-report,2022-01-28,State Department Releases Annual Trafficking in Persons Report,sierraleonenews.net
https://www.sierraleonenews.net/news/272222936/bringing-dry-land-in-the-sahel-back-to-life,2022-01-28,Bringing dry land in the Sahel back to life,sierraleonenews.net
https://www.sierraleonenews.net/news/272238220/in-central-sahel-needs-are-growing-faster-than-generosity,2022-01-28,"In central Sahel, needs are growing faster than generosity",sierraleonenews.net
https://www.sierraleonenews.net/news/272237913/15-mln-people-in-central-sahel-will-need-aid-in-2022-un,2022-01-28,15 mln people in central Sahel will need aid in 2022: UN,sierraleonenews.net
https://www.sierraleonetimes.com/news/272238220/in-central-sahel-needs-are-growing-faster-than-generosity,2022-01-28,"In central Sahel, needs are growing faster than generosity",sierraleonetimes.com
https://www.sierraleonetimes.com/news/272237913/15-mln-people-in-central-sahel-will-need-aid-in-2022-un,2022-01-28,15 mln people in central Sahel will need aid in 2022: UN,sierraleonetimes.com
https://www.thesierraleonetelegraph.com/nestle-announces-innovative-plan-to-tackle-child-labour-risks-increase-farmer-income-and-achieve-full-traceability-in-cocoa/,2022-01-29,"Nestlé announces innovative plan to tackle child labour risks, increase farmer income and achieve full traceability in cocoa",thesierraleonetelegraph.com
https://www.thesierraleonetelegraph.com/afdb-approves-10-million-grant-to-enhance-liberias-climate-information-systems/,2022-01-31,AfDB approves $10 million grant to enhance Liberia’s climate Information systems,thesierraleonetelegraph.com
https://www.thesierraleonetelegraph.com/africa-cannot-outsource-its-healthcare-security-to-the-benevolence-of-others-says-afdb-president/,2022-02-07,“Africa cannot outsource its healthcare security to the benevolence of others” says AfDB President,thesierraleonetelegraph.com
https://www.sierraleonepress.com/commonwealth-who-to-strengthen-cooperation-on-public-health-issues/,2022-02-09,"Commonwealth, WHO to strengthen cooperation on public health issues",sierraleonepress.com
https://www.sierraleonepress.com/tigergraph-launches-million-dollar-challenge-to-inspire-innovative-uses-of-graph/,2022-02-09,TigerGraph Launches Million-Dollar Challenge to Inspire Innovative Uses of Graph,sierraleonepress.com
https://www.thesierraleonetelegraph.com/au-welcomes-11-48-million-grant-from-the-african-development-fund-to-deliver-agenda-2063/,2022-02-14,AU welcomes $11.48 million grant from the African Development Fund to deliver Agenda 2063,thesierraleonetelegraph.com
https://www.sierraleonetimes.com/news/272298858/millets-the-mighty-midgets,2022-02-15,Millets: The mighty midgets,sierraleonetimes.com
https://www.sierraleonenews.net/news/272298858/millets-the-mighty-midgets,2022-02-15,Millets: The mighty midgets,sierraleonenews.net
https://www.sierraleonetimes.com/news/272300571/why-west-africa-has-had-so-many-coups-and-how-to-prevent-more,2022-02-16,Why West Africa has had so many coups and how to prevent more,sierraleonetimes.com
https://www.sierraleonepress.com/africa-eu-to-meet-after-rifts-over-covid-vaccines/,2022-02-16,"Africa, EU to Meet After Rifts Over COVID Vaccines",sierraleonepress.com
https://www.sierraleonepress.com/somalia-elections-must-be-finalized-amid-worsening-drought-security-council-hears/,2022-02-16,"Somalia: Elections must be finalized amid worsening drought, Security Council hears",sierraleonepress.com
https://slconcordtimes.com/massive-deforestation-along-freetown-peninsular/,2022-02-16,Massive deforestation along Freetown peninsular,slconcordtimes.com
https://statehouse.gov.sl/sierra-leones-president-julius-maada-bio-departs-for-6th-european-union-africa-union-summit-in-brussels/,2022-02-16,Sierra Leone’s President Julius Maada Bio Departs for 6th European Union-Africa Union Summit in Brussels,statehouse.gov.sl
https://globaltimes-sl.com/en/2022/02/16/eu-au-summit-president-bio-departs-for-brussels-today/,2022-02-16,EU/AU Summit… President Bio Departs For Brussels Today – Global Times Newspaper,globaltimes-sl.com
https://www.sierraleonetimes.com/news/272307549/eu-africa-summit-vaccines-climate-investment-security-top-agenda,2022-02-17,"EU-Africa Summit: Vaccines, Climate Investment, Security Top Agenda",sierraleonetimes.com
https://www.sierraleonenews.net/news/272307549/eu-africa-summit-vaccines-climate-investment-security-top-agenda,2022-02-18,"EU-Africa Summit: Vaccines, Climate Investment, Security Top Agenda",sierraleonenews.net
https://www.sierraleonenews.net/news/272309143/jihadism-and-coups-in-west-africas-sahel-region-a-complex-relationship,2022-02-18,Jihadism and coups in West Africa&#039;s Sahel region: a complex relationship,sierraleonenews.net
https://www.sierraleonetimes.com/news/272309143/jihadism-and-coups-in-west-africas-sahel-region-a-complex-relationship,2022-02-18,Jihadism and coups in West Africa&#039;s Sahel region: a complex relationship,sierraleonetimes.com
https://www.sierraleonenews.net/news/272312780/africas-sahel-region-faces-worsening-food-crisis,2022-02-19,Africa&#039;s Sahel Region Faces Worsening Food Crisis,sierraleonenews.net
https://www.sierraleonetimes.com/news/272312780/africas-sahel-region-faces-worsening-food-crisis,2022-02-19,Africa&#039;s Sahel Region Faces Worsening Food Crisis,sierraleonetimes.com
https://www.thesierraleonetelegraph.com/u-s-sponsors-preservation-project-to-save-old-fourah-bay-college-building-in-freetown/,2022-02-18,U.S. sponsors preservation project to save Old Fourah Bay College building in Freetown,thesierraleonetelegraph.com
https://slconcordtimes.com/environment-protection-agency-working-towards-formulating-air-quality-and-pollution-regulation-in-sierra-leone/,2022-02-22,Environment Protection Agency working towards formulating air quality and pollution regulation in Sierra Leone,slconcordtimes.com
https://slconcordtimes.com/epa-launches-initial-national-adaptation-plan/,2022-02-22,EPA Launches Initial National Adaptation Plan,slconcordtimes.com
https://www.sierraleonepress.com/mali-humanitarian-response-plan-january-december-2022-january-2022/,2022-02-23,Mali Humanitarian Response Plan January-December 2022 (January 2022),sierraleonepress.com
https://www.sierraleonepress.com/huawei-to-highlight-green-power-target-network-at-mwc-2022/,2022-02-23,Huawei to Highlight Green Power Target Network at MWC 2022,sierraleonepress.com
https://www.thesierraleonetelegraph.com/barrack-obama-may-have-kenya-but-i-have-sierra-leone-says-us-congressman-meeks-visiting-sierra-leone/,2022-02-22,"Barrack Obama may have Kenya, but I have Sierra Leone – says US Congressman Meeks visiting Sierra Leone",thesierraleonetelegraph.com
https://slconcordtimes.com/nyc-launches-book-on-climate-change-adaptation/,2022-02-24,NYC launches book on climate change adaptation,slconcordtimes.com
http://www.thepatrioticvanguard.com/wto-appoints-ambassador-gberie-as-new-chair-of-trips,2022-02-26,WTO appoints Ambassador Gberie as new Chair of TRIPS,thepatrioticvanguard.com
https://www.sierraleonetimes.com/news/272341030/rising-sea-levels-may-threaten-70-of-africas-heritage-sites-by-2050,2022-02-27,Rising sea levels may threaten 70% of Africa&#039;s heritage sites by 2050,sierraleonetimes.com
https://www.sierraleonenews.net/news/272341030/rising-sea-levels-may-threaten-70-of-africas-heritage-sites-by-2050,2022-02-28,Rising sea levels may threaten 70% of Africa&#039;s heritage sites by 2050,sierraleonenews.net
http://www.thepatrioticvanguard.com/ifc-appoints-kyle-kelhofer-as-senior-country-manager-for-benin-ghana-liberia-sierra-leone-togo,2022-02-28,"IFC appoints Kyle Kelhofer as Senior Country Manager for Benin, Ghana, Liberia, Sierra Leone, Togo",thepatrioticvanguard.com
https://www.thesierraleonetelegraph.com/ifc-appoints-kyle-kelhofer-as-senior-country-manager-for-benin-ghana-liberia-sierra-leone-and-togo/,2022-03-01,"IFC appoints Kyle Kelhofer as Senior Country Manager for Benin, Ghana, Liberia, Sierra Leone, and Togo",thesierraleonetelegraph.com
https://slconcordtimes.com/ifc-gets-new-country-manager-for-benin-ghana-liberia-sierra-leone-and-togo/,2022-03-01,"IFC gets new Country Manager for Benin, Ghana, Liberia, Sierra Leone, and Togo",slconcordtimes.com
https://www.sierraleonetimes.com/news/272349031/the-challenges-of-governing-lagos-the-city-that-keeps-growing,2022-03-02,"The challenges of governing Lagos, the city that keeps growing",sierraleonetimes.com
https://www.sierraleonenews.net/news/272349031/the-challenges-of-governing-lagos-the-city-that-keeps-growing,2022-03-02,"The challenges of governing Lagos, the city that keeps growing",sierraleonenews.net
https://slconcordtimes.com/climate-change-un-secretary-general-says-nearly-half-of-humanity-is-living-in-danger/,2022-03-02,Climate Change: UN Secretary-General says nearly half of humanity is living in danger,slconcordtimes.com
https://www.thesierraleonetelegraph.com/africa-is-the-place-to-invest-says-visiting-us-congressional-delegation/,2022-03-02,Africa is the place to invest – says visiting US congressional delegation,thesierraleonetelegraph.com
https://cocorioko.net/nearly-half-of-humanity-is-living-in-the-danger-zone-now-un-secretary-general-warns/,2022-03-02,"“Nearly half of humanity is living in the danger zone now,” UN Secretary General warns – Cocorioko",cocorioko.net
https://www.thesierraleonetelegraph.com/uneca-african-energy-chamber-seforall-launch-team-energy-africa-initiative/,2022-03-04,"UNECA, African Energy Chamber, SEforALL launch Team-Energy Africa Initiative",thesierraleonetelegraph.com
https://slconcordtimes.com/environment-minister-addresses-special-session-of-uneps-50th-anniversary/,2022-03-07,Environment Minister addresses special session of UNEP’s 50th anniversary,slconcordtimes.com
https://www.sierraleonetimes.com/news/272371356/at-unsc-india-highlights-govt-initiatives-like-mudra-to-empower-women,2022-03-09,"At UNSC, India highlights govt initiatives like Mudra to empower women",sierraleonetimes.com
https://www.sierraleonetimes.com/news/272370509/russia-ukraine-war-decoding-how-african-countries-voted-at-the-un,2022-03-09,Russia-Ukraine war: decoding how African countries voted at the UN,sierraleonetimes.com
https://www.sierraleonetimes.com/news/272370390/malian-army-accused-of-killings-denies-culpability,2022-03-09,"Malian Army Accused of Killings, Denies Culpability",sierraleonetimes.com
https://www.sierraleonetimes.com/news/272372282/un-chief-strongly-condemns-attack-on-peacekeepers-in-mali,2022-03-09,UN chief strongly condemns attack on peacekeepers in Mali,sierraleonetimes.com
https://slconcordtimes.com/international-womens-day-concord-times-remembers-past-sierra-leonean-female-icons/,2022-03-09,International Women’s Day: Concord Times remembers past Sierra Leonean female icons,slconcordtimes.com
https://www.thesierraleonetelegraph.com/world-bank-approves-new-grant-for-sierra-leone-to-strengthen-social-safety/,2022-03-09,World Bank approves new grant for Sierra Leone to strengthen social safety,thesierraleonetelegraph.com
https://www.sierraleonepress.com/pind-fund-for-peace-documentary-on-peacebuilding-honored-as-gold-silver-winners-in-four-categories-at-the-webbys-inaugural-anthem-awards/,2022-03-10,PIND & Fund for Peace Documentary on Peacebuilding Honored as Gold & Silver Winners in Four Categories at The Webby’s Inaugural Anthem Awards,sierraleonepress.com
https://slconcordtimes.com/world-bank-approves-40-million-grant-to-strengthen-social-safety-nets/,2022-03-10,World Bank approves $40 million grant to strengthen social safety nets,slconcordtimes.com
https://statehouse.gov.sl/sierra-leones-president-julius-maada-bio-addresses-opening-of-global-diplomacy-forum-discusses-opportunities-for-peace-and-security/,2022-03-11,"Sierra Leone’s President Julius Maada Bio Addresses Opening of Global Diplomacy Forum, Discusses Opportunities for Peace and Security",statehouse.gov.sl
https://www.thesierraleonetelegraph.com/president-bio-addresses-global-diplomacy-forum-in-turkey/,2022-03-13,President Bio addresses global diplomacy forum in Turkey,thesierraleonetelegraph.com
https://www.sierraleonenews.net/news/272392543/top-architecture-prize-goes-to-climate-minded-african-kere,2022-03-16,Top architecture prize goes to climate-minded African Kere,sierraleonenews.net
https://www.sierraleonetimes.com/news/272392543/top-architecture-prize-goes-to-climate-minded-african-kere,2022-03-16,Top architecture prize goes to climate-minded African Kere,sierraleonetimes.com
https://www.sierraleonenews.net/news/272396340/china-aggressive-illegal-fishing-hurting-world-marine-resources,2022-03-17,China's aggressive illegal fishing hurting world's marine resources,sierraleonenews.net
https://www.sierraleonetimes.com/news/272396340/china-aggressive-illegal-fishing-hurting-world-marine-resources,2022-03-17,China's aggressive illegal fishing hurting world's marine resources,sierraleonetimes.com
https://www.sierraleonepress.com/un-adopts-resolution-promoting-bicycles-to-combat-climate-change/,2022-03-17,UN adopts resolution promoting bicycles to combat climate change,sierraleonepress.com
https://cocorioko.net/sierra-leones-gender-minister-presents-status-of-women-report-to-the-66th-session-of-the-united-nations/,2022-03-18,Sierra Leone’s Gender Minister presents status of women Report to the 66th Session of the United Nations*,cocorioko.net
https://slconcordtimes.com/epa-ends-regional-consultations-for-the-development-of-air-quality-and-pollution-regulations/,2022-03-18,EPA ends regional consultations for the development of air quality and pollution regulations,slconcordtimes.com
https://www.sierraleonenews.net/news/272408543/minister-sajjan-announces-funding-of-83-million-on-trip-to-west-africa,2022-03-22,Minister Sajjan announces funding of $83 million on trip to West Africa,sierraleonenews.net
https://www.thesierraleonetelegraph.com/ipcc-report-human-induced-climate-change-causing-widespread-losses/,2022-03-20,IPCC Report: Human-induced climate change causing widespread losses,thesierraleonetelegraph.com
https://www.thesierraleonetelegraph.com/kigali-forum-marks-a-new-development-era-for-africa/,2022-03-20,Kigali forum marks a new development era for Africa,thesierraleonetelegraph.com
https://www.thesierraleonetelegraph.com/un-global-compact-laying-the-foundation-for-sustainable-resilient-and-responsible-business/,2022-03-20,"UN Global Compact: Laying the foundation for sustainable, resilient and responsible business",thesierraleonetelegraph.com
https://www.thesierraleonetelegraph.com/afdb-approves-strategy-for-addressing-fragility-and-building-resilience-in-africa-2022-2026/,2022-03-22,AfDB approves strategy for addressing fragility and building resilience in Africa 2022-2026,thesierraleonetelegraph.com
https://globaltimes-sl.com/en/2022/03/21/bo-endorse-hon-sualiho-koroma-for-mayor/,2022-03-21,Bo Endorse Hon. Sualiho Koroma For Mayor,globaltimes-sl.com
https://www.sierraleonetimes.com/news/272415592/malis-ex-prime-minister-soumeylou-maiga-dies-in-detention,2022-03-24,Mali&#039;s Ex-Prime Minister Soumeylou Maiga Dies in Detention,sierraleonetimes.com
https://www.sierraleonenews.net/news/272415592/malis-ex-prime-minister-soumeylou-maiga-dies-in-detention,2022-03-24,Mali&#039;s Ex-Prime Minister Soumeylou Maiga Dies in Detention,sierraleonenews.net
http://www.thepatrioticvanguard.com/forests-and-sustainable-production-and-consumption,2022-03-22,Forests and Sustainable Production and Consumption,thepatrioticvanguard.com
https://www.sierraleonepress.com/global-center-on-adaptation-showcases-findings-of-ghanas-national-assessment-to-enhance-the-resilience-of-its-national-infrastructure-systems/,2022-03-24,Global Center on Adaptation showcases findings of Ghana’s National Assessment to Enhance the Resilience of its National Infrastructure Systems,sierraleonepress.com
https://www.sierraleonepress.com/millions-in-east-africa-face-hunger-if-rainy-season-fails-again/,2022-03-24,Millions in East Africa Face Hunger if Rainy Season Fails Again,sierraleonepress.com
https://www.thesierraleonetelegraph.com/africa-and-europe-a-time-for-action/,2022-03-29,Africa and Europe: A time for action,thesierraleonetelegraph.com
https://www.thesierraleonetelegraph.com/freetown-city-council-and-tbi-host-workshop-to-build-disaster-risk-management-capacity/,2022-04-02,Freetown City Council and TBI host workshop to build disaster risk management capacity,thesierraleonetelegraph.com
https://slconcordtimes.com/water-supply-4-years-of-bios-new-direction-administration/,2022-04-04,Water supply: 4 years of Bio’s New Direction Administration,slconcordtimes.com
https://www.sierraleonepress.com/human-rights-council-adopts-11-resolutions-extends-three-mandates-on-belarus-syria-and-mali-and-appoints-11-special-procedure-mandate-holders/,2022-04-05,"Human Rights Council adopts 11 resolutions – extends three mandates on Belarus, Syria and Mali, and appoints 11 Special Procedure mandate holders",sierraleonepress.com
https://www.sierraleonepress.com/cs-global-partners-commonwealth-of-dominica-signs-roadmap-for-cooperation-with-kingdom-of-morocco/,2022-04-07,CS Global Partners: Commonwealth of Dominica Signs Roadmap for Cooperation with Kingdom of Morocco,sierraleonepress.com
https://www.thesierraleonetelegraph.com/mayor-of-freetown-aki-sawyerr-receives-vote-of-confidence-from-imf-team-on-working-visit-to-sierra-leone/,2022-04-07,Mayor of Freetown Aki-Sawyerr receives vote of confidence from IMF team on working visit to Sierra Leone,thesierraleonetelegraph.com
https://www.sierraleonetimes.com/news/272464328/sub-saharan-africa-under-threat-from-multiple-humanitarian-crises,2022-04-09,Sub-Saharan Africa under threat from multiple humanitarian crises,sierraleonetimes.com
https://www.sierraleonenews.net/news/272464328/sub-saharan-africa-under-threat-from-multiple-humanitarian-crises,2022-04-09,Sub-Saharan Africa under threat from multiple humanitarian crises,sierraleonenews.net
https://www.thesierraleonetelegraph.com/women-must-be-at-the-centre-of-africas-transformative-free-trade-area/,2022-04-10,Women must be at the centre of Africa’s transformative free trade area,thesierraleonetelegraph.com
https://www.thesierraleonetelegraph.com/blue-economy-presents-vast-opportunities-for-africa/,2022-04-10,Blue economy presents vast opportunities for Africa,thesierraleonetelegraph.com
https://www.switsalone.com/41108_african-development-bank-to-support-1500-women-traders-in-liberia-and-sierra-leone/,2022-04-11,"African Development Bank to support 1,500 women traders in Liberia and Sierra Leone",switsalone.com
https://www.sierraleonetimes.com/news/272476411/africom-commander-warns-against-neglect-of-africa,2022-04-13,Africom Commander Warns Against Neglect of Africa,sierraleonetimes.com
https://www.sierraleonetimes.com/news/272477155/africans-not-surprised-by-macron-le-pen-run-off,2022-04-13,"Africans not surprised by Macron, Le Pen run-off",sierraleonetimes.com
https://www.sierraleonenews.net/news/272481019/the-information-age-is-starting-to-transform-fishing-worldwide,2022-04-15,The information age is starting to transform fishing worldwide,sierraleonenews.net
https://www.sierraleonetimes.com/news/272481019/the-information-age-is-starting-to-transform-fishing-worldwide,2022-04-15,The information age is starting to transform fishing worldwide,sierraleonetimes.com
https://www.sierraleonepress.com/harris-condemns-russia-in-meeting-with-tanzanian-president/,2022-04-16,Harris Condemns Russia in Meeting With Tanzanian President,sierraleonepress.com
https://cocorioko.net/freetown-wins-global-mayors-challenge/,2022-04-19,*Freetown Wins Global Mayors Challenge!*:,cocorioko.net
https://cocorioko.net/new-proposed-apc-constitution-faces-objections/,2022-04-19,New proposed APC constitution faces objections,cocorioko.net
https://slconcordtimes.com/bafs-to-publish-crop-suitability-soil-report/,2022-04-20,BAFS to publish crop suitability soil report,slconcordtimes.com
https://www.sierraleonepress.com/chinese-stationery-leader-mg-designated-as-official-partner-of-bfa-2022/,2022-04-20,Chinese Stationery Leader M&G Designated as Official Partner of BFA 2022,sierraleonepress.com
https://www.sierraleonepress.com/no-rain-and-no-resources-millions-of-families-across-the-horn-of-africa-pushed-closer-to-catastrophe-each-day/,2022-04-20,No rain and no resources; millions of families across the horn of Africa pushed closer to catastrophe each day,sierraleonepress.com
https://www.sierraleonepress.com/un-confirms-2021-among-seven-hottest-years-on-record/,2022-04-20,UN confirms 2021 among seven hottest years on record,sierraleonepress.com
https://slconcordtimes.com/climate-change-albinism-and-me/,2022-04-20,"Climate change, albinism and me",slconcordtimes.com
https://www.thesierraleonetelegraph.com/wfp-assistance-relieved-thousands-as-hunger-levels-rose-in-sierra-leone/,2022-04-20,WFP assistance relieved thousands as hunger levels rose in Sierra Leone,thesierraleonetelegraph.com
https://www.thesierraleonetelegraph.com/ndma-cracks-down-on-illegal-burning-of-freetown-guma-forest-reserve-and-arrests-two-people/,2022-04-21,NDMA cracks down on illegal burning of Freetown Guma Forest Reserve and arrests two people,thesierraleonetelegraph.com
https://www.sierraleonepress.com/egypt-signs-deals-to-boost-production-of-green-energy/,2022-04-22,Egypt Signs Deals To Boost Production Of Green Energy,sierraleonepress.com
https://www.sierraleonepress.com/us-pres-biden-says-will-cooperate-with-re-elected-macron-in-defending-democracy/,2022-04-26,US Pres Biden says will cooperate with re-elected Macron in ‘defending democracy’,sierraleonepress.com
https://www.sierraleonepress.com/africa-must-prepare-for-the-inevitability-of-a-global-food-crisis-says-african-development-bank-president-akinwumi-adesina/,2022-04-26,"Africa must prepare for the inevitability of a global food crisis says African Development Bank President, Akinwumi Adesina",sierraleonepress.com
https://www.sierraleonepress.com/huawei-promotes-sustainable-data-centers-at-global-data-center-facility-forum-2022/,2022-04-27,Huawei Promotes Sustainable Data Centers at Global Data Center Facility Forum 2022,sierraleonepress.com
https://www.thesierraleonetelegraph.com/sierra-leones-un-resident-coordinator-congratulates-the-people-of-sierra-leone-on-the-countrys-61st-independence-anniversary/,2022-04-27,Sierra Leone’s UN Resident Coordinator congratulates the people of Sierra Leone on the country’s 61st Independence Anniversary,thesierraleonetelegraph.com
https://www.thesierraleonetelegraph.com/former-president-koroma-of-sierra-leone-and-others-convey-message-of-support-for-the-south-african-people/,2022-04-25,Former President Koroma of Sierra Leone and others convey message of support for the South African people,thesierraleonetelegraph.com
https://www.sierraleonenews.net/news/272523477/investor-interest-in-africa-at-all-time-high-but-risks-remain,2022-04-28,"Investor Interest in Africa at All-Time High, But Risks Remain",sierraleonenews.net
https://www.sierraleonetimes.com/news/272523477/investor-interest-in-africa-at-all-time-high-but-risks-remain,2022-04-28,"Investor Interest in Africa at All-Time High, But Risks Remain",sierraleonetimes.com
https://cocorioko.net/independence-anniversary-message-un-resident-representative-calls-for-inclusive-politics/,2022-04-28,Independence Anniversary Message,cocorioko.net
http://www.thepatrioticvanguard.com/new-year-message-by-president-bio,2022-01-02,New Year message by President Bio,thepatrioticvanguard.com
http://www.thepatrioticvanguard.com/new-year-statement-by-prime-minister-trudeau,2022-01-02,New Year: Statement by Prime Minister Trudeau,thepatrioticvanguard.com
http://www.sierraleonetimes.com/news/272087341/ecowas-planning-extraordinary-summit-on-mali-next-sunday-commission,2022-01-04,ECOWAS planning Extraordinary Summit on Mali next Sunday: Commission,sierraleonetimes.com
http://www.sierraleonetimes.com/news/272100828/fc-cincinnati-sign-free-agent-f-dominique-badji,2022-01-05,FC Cincinnati sign free agent F Dominique Badji,sierraleonetimes.com
http://www.sierraleonetimes.com/news/272099807/omicron-variant-of-covid-19-detected-in-cape-verde,2022-01-05,Omicron variant of COVID-19 detected in Cape Verde,sierraleonetimes.com
https://www.thesierraleonetelegraph.com/president-bio-presents-governments-report-card-in-new-years-national-broadcast/,2022-01-02,President Bio presents government’s report card in New Year’s national broadcast,thesierraleonetelegraph.com
