url,date_published,title,newsorg
https://www.sierraleonepress.com/the-road-to-cop-deadly-floods-deepen-food-crisis-in-west-and-central-africa-amid-climate-crisis/,2022-10-08,THE ROAD TO COP: Deadly floods deepen food crisis in West and Central Africa amid climate crisis,sierraleonepress.com
https://www.sierraleonepress.com/27-countries-reported-cholera-outbreaks-throughout-2022-who/,2022-10-11,27 countries reported cholera outbreaks throughout 2022: WHO,sierraleonepress.com
https://www.sierraleonepress.com/nearly-200-dead-in-niger-floods-263000-people-affected-and-30000-homes-destroyed/,2022-10-11,"Nearly 200 dead in Niger floods; 263,000 people affected and 30,000 homes destroyed",sierraleonepress.com
https://www.sierraleonepress.com/un-refugee-agency-appeals-for-greater-protection-to-people-fleeing-conflict-persecution/,2022-10-11,"UN Refugee Agency Appeals for Greater Protection to People Fleeing Conflict, Persecution",sierraleonepress.com
http://www.thepatrioticvanguard.com/sierra-leone-slpp-canada-chapter-boosts-food-production,2022-10-09,Sierra Leone: SLPP-Canada Chapter boosts food production,thepatrioticvanguard.com
https://www.switsalone.com/42408_meet-the-20-year-old-sierra-leonean-who-built-a-500-megawatt-fuel-free-generator/,2022-10-14,Meet the 20-year-old Sierra Leonean who built a 500-megawatt fuel-free generator,switsalone.com
https://globaltimes-sl.com/2022/10/13/%f0%9d%90%88%f0%9d%90%82%f0%9d%90%89%f0%9d%90%91-%f0%9d%90%82%f0%9d%90%9a%f0%9d%90%a6%f0%9d%90%a9%f0%9d%90%9a%f0%9d%90%a2%f0%9d%90%a0%f0%9d%90%a7%f0%9d%90%ac-%f0%9d%90%85%f0%9d%90%a8%f0%9d%90%ab/,2022-10-13,𝐈𝐂𝐉𝐑 𝐂𝐚𝐦𝐩𝐚𝐢𝐠𝐧𝐬 𝐅𝐨𝐫 𝐄𝐧𝐯𝐢𝐫𝐨𝐧𝐦𝐞𝐧𝐭𝐚𝐥 𝐉𝐮𝐬𝐭𝐢𝐜𝐞,globaltimes-sl.com
http://www.thepatrioticvanguard.com/deliberate-effort-to-leave-no-one-behind,2022-10-06,Deliberate effort to leave no one behind,thepatrioticvanguard.com
http://www.thepatrioticvanguard.com/canada-greener-homes-initiativeof-canada,2022-10-15,Canada Greener Homes Initiative,thepatrioticvanguard.com
https://www.sierraleonepress.com/three-challenges-for-rural-women-amid-a-cost-of-living-crisis/,2022-10-17,Three challenges for rural women amid a cost-of-living crisis,sierraleonepress.com
https://www.sierraleonepress.com/teens-tackle-21st-century-challenges-at-robotics-contest/,2022-10-17,Teens Tackle 21st-Century Challenges at Robotics Contest,sierraleonepress.com
http://www.sierraleonenews.net/news/272944104/indian-scientist-puts-crop-that-fights-hidden-hunger-on-the-map,2022-10-18,Indian Scientist Puts Crop That Fights &#039;Hidden Hunger&#039; On the Map,sierraleonenews.net
http://www.sierraleonetimes.com/news/272944104/indian-scientist-puts-crop-that-fights-hidden-hunger-on-the-map,2022-10-18,Indian Scientist Puts Crop That Fights &#039;Hidden Hunger&#039; On the Map,sierraleonetimes.com
https://www.politicosl.com/articles/lebanese-school-tops-mbsse-essay-writing-completion,2022-10-17,Lebanese School tops MBSSE essay writing completion,politicosl.com
https://www.switsalone.com/42459_nile-valley-unit-project-member-nisreen-al-sabahi-wins-helmy-shaarawy-for-african-studies-award/,2022-10-24,Nile Valley Unit Project member Nisreen Al-Sabahi wins Helmy Shaarawy for African Studies Award,switsalone.com
https://www.switsalone.com/42448_freetown-amongst-best-climate-projects-recognized-at-2022-c40-cities-bloomberg-philanthropies-awards/,2022-10-24,City of Freetown wins Bloomberg Award For Treeplanting Project,switsalone.com
https://www.sierraleonepress.com/wfp-at-cop-27-climate-adaptation-solutions-needed-to-halt-global-food-crisis/,2022-10-25,WFP at COP 27: Climate adaptation solutions needed to halt global food crisis,sierraleonepress.com
https://www.sierraleonepress.com/cholera-outbreaks-threaten-childrens-survival-in-the-middle-east-en-ar/,2022-10-25,Cholera outbreaks threaten children’s survival in the Middle East [EN/AR],sierraleonepress.com
https://www.sierraleonepress.com/unhcrs-grandi-sounds-alarm-as-drought-grips-horn-of-africa/,2022-10-26,UNHCR’s Grandi sounds alarm as drought grips Horn of Africa,sierraleonepress.com
https://www.sierraleonepress.com/fao-advocates-for-scaling-up-the-early-warning-and-anticipatory-action-approaches-at-a-regional-meeting/,2022-10-26,FAO advocates for scaling up the early warning and anticipatory action approaches at a regional meeting,sierraleonepress.com
http://www.thepatrioticvanguard.com/african-union-commission-chairperson-moussa-faki-mahamat-to-visit-canada,2022-10-22,African Union Commission Chairperson Moussa Faki Mahamat to visit Canada,thepatrioticvanguard.com
https://cocorioko.net/sierra-leone-and-neighbour-liberia-among-10-hungriest-african-countries-in-2022/,2022-10-27,Sierra Leone and neighbour Liberia among 10 hungriest African countries in 2022,cocorioko.net
http://www.thepatrioticvanguard.com/canada-trudeau-welcomes-new-british-pm-rishi-sunak,2022-10-25,Canada: Trudeau welcomes new British PM,thepatrioticvanguard.com
https://www.sierraleonepress.com/iaeas-grossi-sees-great-hopes-for-nuclear-power-as-ministerial-conference-opens-in-washington/,2022-10-27,IAEA’s Grossi Sees ‘Great Hopes’ for Nuclear Power as Ministerial Conference Opens in Washington,sierraleonepress.com
http://www.sierraleonetimes.com/news/272996643/over-one-million-deaths-in-africa-linked-to-air-pollution-exposure-report,2022-10-28,Over one million deaths in Africa linked to air pollution exposure: Report,sierraleonetimes.com
http://www.sierraleonenews.net/news/272996643/over-one-million-deaths-in-africa-linked-to-air-pollution-exposure-report,2022-10-28,Over one million deaths in Africa linked to air pollution exposure: Report,sierraleonenews.net
https://www.switsalone.com/42478_sierra-leonean-scientist-professor-ogunlade-robert-davidson-is-dead-at-73/,2022-10-28,Sierra Leonean scientist Professor Ogunlade Robert Davidson is dead at 73,switsalone.com
https://www.sierraleonepress.com/deloitte-global-selects-joe-ucuzoglu-as-next-global-ceo-deloitte-global-ceo-punit-renjen-announces-retirement-after-record-growth/,2022-10-31,Deloitte Global Selects Joe Ucuzoglu as Next Global CEO; Deloitte Global CEO Punit Renjen Announces Retirement After Record Growth,sierraleonepress.com
https://www.sierraleonepress.com/sec-hillary-clinton-canadas-deputy-pm-chrystia-freeland-oprah-winfrey-malala-christine-lagarde-michelle-obama-global-women-leaders-from-over-14-countries-sign-an-open-letter-calli/,2022-10-31,"Sec. Hillary Clinton, Canada’s Deputy PM Chrystia Freeland, Oprah Winfrey, Malala, Christine Lagarde, Michelle Obama & Global Women Leaders from Over 14 Countries Sign an Open Letter Calling for UN Action Against Iran",sierraleonepress.com
https://www.sierraleonepress.com/emga-secures-us-20m-debt-finance-for-costa-ricas-banco-improsa/,2022-11-01,EMGA Secures US$ 20M Debt Finance for Costa Rica’s Banco Improsa,sierraleonepress.com
http://www.sierraleonenews.net/news/273020513/g20-countries-pushed-to-make-bigger-climate-commitments-at-cop27,2022-11-01,G20 Countries Pushed to Make Bigger Climate Commitments at COP27,sierraleonenews.net
http://www.thepatrioticvanguard.com/currency-depreciations-risk-intensifying,2022-10-26,"Currency depreciations risk intensifying global food, energy crisis",thepatrioticvanguard.com
https://cocorioko.net/in-rural-sierra-leone-fatmatas-kids-wont-be-eating-tonight/,2022-10-31,"In rural Sierra Leone, Fatmata’s kids won’t be eating tonight",cocorioko.net
https://www.sierraleonepress.com/cop27-will-ukraine-war-destroy-progress-on-tackling-climate-emergency/,2022-11-03,COP27: Will Ukraine War Destroy Progress on Tackling Climate Emergency?,sierraleonepress.com
https://globaltimes-sl.com/2022/11/03/%f0%9d%90%87%f0%9d%90%a8%f0%9d%90%a7-%f0%9d%90%92%f0%9d%90%9a%f0%9d%90%9a-%f0%9d%90%84%f0%9d%90%a6%f0%9d%90%9e%f0%9d%90%ab%f0%9d%90%ac%f0%9d%90%a8%f0%9d%90%a7-%f0%9d%90%8b%f0%9d%90%9a%f0%9d%90%a6/,2022-11-03,𝐇𝐨𝐧. 𝐒𝐚𝐚 𝐄𝐦𝐞𝐫𝐬𝐨𝐧 𝐋𝐚𝐦𝐢𝐧𝐚 𝐓𝐚𝐥𝐤𝐬 𝐓𝐞𝐫𝐫𝐨𝐫𝐢𝐬𝐦 𝐈𝐧 𝐌𝐚𝐩𝐮𝐭𝐨,globaltimes-sl.com
http://www.sierraleonetimes.com/news/273032748/lack-of-accountability-in-journalists-murders-is-staggering,2022-11-04,Lack of accountability in journalists murders is staggering,sierraleonetimes.com
http://www.sierraleonetimes.com/news/273035768/ecuador-iraq-to-meet-in-pre-world-cup-friendly,2022-11-04,"Ecuador, Iraq to meet in pre-World Cup friendly",sierraleonetimes.com
https://www.sierraleonepress.com/cop27-needs-a-tremendous-focus-on-action-commonwealth-of-dominica-looking-to-share-scalable-solutions/,2022-11-04,"COP27 needs a tremendous focus on action, Commonwealth of Dominica looking to share scalable solutions",sierraleonepress.com
https://www.sierraleonepress.com/un-study-one-third-of-planets-major-glaciers-will-be-gone-by-2050/,2022-11-04,UN Study: One-Third of Planet’s Major Glaciers Will Be Gone by 2050,sierraleonepress.com
http://www.sierraleonenews.net/news/273038315/interview-china-plays-crucial-role-in-wetlands-conservation,2022-11-05,Interview: China plays crucial role in wetlands conservation,sierraleonenews.net
http://www.sierraleonetimes.com/news/273040870/un-weekly-roundup-oct-31-nov-4-2022,2022-11-05,"UN Weekly Roundup: Oct. 31-Nov. 4, 2022",sierraleonetimes.com
http://www.sierraleonetimes.com/news/273038315/interview-china-plays-crucial-role-in-wetlands-conservation,2022-11-05,Interview: China plays crucial role in wetlands conservation,sierraleonetimes.com
http://www.sierraleonenews.net/news/273040870/un-weekly-roundup-oct-31-nov-4-2022,2022-11-05,"UN Weekly Roundup: Oct. 31-Nov. 4, 2022",sierraleonenews.net
http://www.sierraleonenews.net/news/273052932/intl-drought-resilience-alliance-launched-at-cop27,2022-11-08,Int&#039;l Drought Resilience Alliance launched at COP27,sierraleonenews.net
http://www.sierraleonenews.net/news/273054949/xinhua-middle-east--summary-at-2200-gmt-nov-7,2022-11-08,"Xinhua Middle East news summary at 2200 GMT, Nov. 7",sierraleonenews.net
http://www.sierraleonetimes.com/news/273054949/xinhua-middle-east--summary-at-2200-gmt-nov-7,2022-11-08,"Xinhua Middle East news summary at 2200 GMT, Nov. 7",sierraleonetimes.com
http://www.sierraleonetimes.com/news/273054456/senegalese-journalist-arrested-on-national-security-charges,2022-11-08,Senegalese Journalist Arrested on National Security Charges,sierraleonetimes.com
http://www.sierraleonetimes.com/news/273052932/intl-drought-resilience-alliance-launched-at-cop27,2022-11-08,Int&#039;l Drought Resilience Alliance launched at COP27,sierraleonetimes.com
http://www.sierraleonetimes.com/news/273054252/uganda-still-struggling-to-tackle-ebola-as-the-death-toll-passes-50,2022-11-08,Uganda still struggling to tackle Ebola as the death toll passes 50,sierraleonetimes.com
http://www.sierraleonetimes.com/news/273052804/namibia-senegal-join-african-petroleum-producers-organization,2022-11-08,"Namibia, Senegal join African Petroleum Producers&#039; Organization",sierraleonetimes.com
http://www.sierraleonetimes.com/news/273052846/closely-working-for-early-release-of-sailors-held-in-guinea-indian-mission,2022-11-08,Closely working for early release of sailors held in Guinea: Indian mission,sierraleonetimes.com
http://www.sierraleonetimes.com/news/273052813/xinhua-world--summary-at-1530-gmt-nov-7,2022-11-08,"Xinhua world news summary at 1530 GMT, Nov. 7",sierraleonetimes.com
https://www.sierraleonepress.com/world-bank-approves-south-africas-497m-request-for-komati-power-plants-decommission-repurposing/,2022-11-07,"World Bank approves South Africa’s $497m request for Komati power plant’s decommission, repurposing",sierraleonepress.com
https://www.sierraleonepress.com/usaid-and-nasa-renew-partnership-to-address-climate-crisis-food-security-and-humanitarian-challenges/,2022-11-07,"USAID and NASA Renew Partnership to Address Climate Crisis, Food Security, and Humanitarian Challenges",sierraleonepress.com
https://www.sierraleonepress.com/who-rise-in-ebola-outbreaks-in-africa-linked-to-climate-change/,2022-11-07,WHO: Rise in Ebola Outbreaks in Africa Linked to Climate Change,sierraleonepress.com
https://www.sierraleonepress.com/un-climate-conference-opened-in-egypt-in-hopes-to-turn-finance-pledges-into-action/,2022-11-08,UN Climate Conference Opened In Egypt In Hopes To Turn Finance Pledges Into Action,sierraleonepress.com
http://www.sierraleonenews.net/news/273057188/ambition-levels-in-india-are-high-when-it-comes-to-renewables-says-french-president-macron-at-cop27,2022-11-08,"""Ambition levels in India are high when it comes to renewables,"" says French President Macron at COP27",sierraleonenews.net
http://www.sierraleonenews.net/news/273059884/climate-change-means-farmers-in-west-africa-need-more-ways-to-combat-pests,2022-11-09,Climate change means farmers in West Africa need more ways to combat pests,sierraleonenews.net
http://www.sierraleonetimes.com/news/273059884/climate-change-means-farmers-in-west-africa-need-more-ways-to-combat-pests,2022-11-09,Climate change means farmers in West Africa need more ways to combat pests,sierraleonetimes.com
https://www.sierraleonepress.com/global-energy-alliance-for-people-and-planet-reports-strong-first-year/,2022-11-09,Global Energy Alliance for People and Planet Reports Strong First Year,sierraleonepress.com
https://www.sierraleonepress.com/invest-in-africa-to-save-the-globe-from-climate-change-says-kenyan-pres-ruto/,2022-11-09,"Invest in Africa to save the globe from climate change, says Kenyan Pres Ruto",sierraleonepress.com
https://www.sierraleonepress.com/iaea-at-cop27-new-report-shows-how-nuclear-technology-supports-climate-change-adaptation-in-africa/,2022-11-10,IAEA at COP27: New Report Shows How Nuclear Technology Supports Climate Change Adaptation in Africa,sierraleonepress.com
https://www.thesierraleonetelegraph.com/global-energy-alliance-to-boost-energy-access-and-reduce-emissions-in-12-countries-including-sierra-leone/,2022-11-09,Global Energy Alliance to boost energy access and reduce emissions in 12 countries including Sierra Leone,thesierraleonetelegraph.com
https://www.thesierraleonetelegraph.com/mayor-aki-sawyerr-representing-freetown-and-c40cities-at-cop27/,2022-11-09,Mayor Aki-Sawyerr representing Freetown and C40Cities at COP27,thesierraleonetelegraph.com
http://www.sierraleonetimes.com/news/273080565/argentina-announce-squad-for-fifa-world-cup-2022-messi-to-lead,2022-11-12,"Argentina announce squad for FIFA World Cup 2022, Messi to lead",sierraleonetimes.com
http://www.sierraleonetimes.com/news/273080428/senegal-unveils-26-man-squad-for-fifa-world-cup,2022-11-12,Senegal unveils 26-man squad for FIFA World Cup,sierraleonetimes.com
http://www.sierraleonetimes.com/news/273082037/rohit-paudel-promoted-to-captain-of-nepal-national-cricket-team,2022-11-12,Rohit Paudel promoted to captain of Nepal national cricket team,sierraleonetimes.com
http://www.sierraleonetimes.com/news/273081779/plastic-man-in-senegal-on-mission-against-trash,2022-11-12,&#039;Plastic Man&#039; in Senegal on Mission Against Trash,sierraleonetimes.com
http://www.sierraleonenews.net/news/273081779/plastic-man-in-senegal-on-mission-against-trash,2022-11-12,&#039;Plastic Man&#039; in Senegal on Mission Against Trash,sierraleonenews.net
https://www.sierraleonepress.com/second-committee-approves-two-resolutions-including-on-sovereignty-of-palestinians-over-their-natural-resources-oil-slick-on-lebanese-shores/,2022-11-12,"Second Committee Approves Two Resolutions, Including on Sovereignty of Palestinians over Their Natural Resources, Oil Slick on Lebanese Shores – Sierra Leone Press",sierraleonepress.com
https://www.sierraleonepress.com/fao-director-general-discusses-technology-green-initiative-with-the-minister-for-environment-water-and-agriculture-of-saudi-arabia-in-riyadh/,2022-11-12,"FAO Director-General discusses technology, Green Initiative with the Minister for Environment, Water and Agriculture of Saudi Arabia in Riyadh",sierraleonepress.com
http://www.sierraleonenews.net/news/273085111/nigeria-buhari-calls-for-more-western-commitment-on-climate-action,2022-11-14,Nigeria&#039;s Buhari Calls for More Western Commitment on Climate Action,sierraleonenews.net
https://www.thesierraleonetelegraph.com/young-africans-at-cop27-say-they-want-action-not-words/,2022-11-13,"Young Africans at COP27 say they want action, not words",thesierraleonetelegraph.com
https://www.thesierraleonetelegraph.com/afcfta-the-environmental-case-for-continental-africa-free-trade-area/,2022-11-13,AfCFTA – The environmental case for continental Africa free trade area,thesierraleonetelegraph.com
https://www.thesierraleonetelegraph.com/you-cant-keep-a-good-woman-like-freetown-mayor-aki-sawyerr-down-op-ed/,2022-11-13,You can’t keep a good woman like Freetown Mayor Aki-Sawyerr down – Op ed,thesierraleonetelegraph.com
http://www.sierraleonenews.net/news/273095831/pm-modi-meets-uk-rishi-sunak-for-first-time-at-g20-summit,2022-11-15,PM Modi meets UK's Rishi Sunak for first time at G20 Summit,sierraleonenews.net
http://www.sierraleonetimes.com/news/273095831/pm-modi-meets-uk-rishi-sunak-for-first-time-at-g20-summit,2022-11-16,PM Modi meets UK's Rishi Sunak for first time at G20 Summit,sierraleonetimes.com
http://www.sierraleonenews.net/news/273100311/pm-modi-holds-bilateral-talks-with-french-president-on-sidelines-of-g20-summit,2022-11-17,PM Modi holds bilateral talks with French President on sidelines of G20 Summit,sierraleonenews.net
https://slconcordtimes.com/world-population-reaches-8-billion/,2022-11-16,World population reaches 8 billion,slconcordtimes.com
https://cocorioko.net/the-worlds-response-to-climate-change-has-been-too-slow-ms-madeleine-diouf-sarr/,2022-11-15,“The world’s response to climate change has been too slow”-Ms Madeleine Diouf Sarr,cocorioko.net
http://www.sierraleonenews.net/news/273105603/climate-change-fueled-rains-behind-deadly-nigeria-floods-study-finds,2022-11-18,"Climate Change Fueled Rains Behind Deadly Nigeria Floods, Study Finds",sierraleonenews.net
http://www.sierraleonetimes.com/news/273109037/senegal-celebrates-day-of-fonio-as-food-insecurity-looms,2022-11-18,Senegal Celebrates Day of Fonio as Food Insecurity Looms,sierraleonetimes.com
http://www.sierraleonetimes.com/news/273108466/nigerian-troops-kill-50-militants-in-operations,2022-11-18,Nigerian troops kill 50 militants in operations,sierraleonetimes.com
http://www.sierraleonenews.net/news/273109037/senegal-celebrates-day-of-fonio-as-food-insecurity-looms,2022-11-18,Senegal Celebrates Day of Fonio as Food Insecurity Looms,sierraleonenews.net
https://www.sierraleonepress.com/wonderful-jinhua-fascinating-africa-cloud-exhibition-of-china-africa-cultural-cooperation-and-exchange-week-is-opened-overseas-africa-edition/,2022-11-18,"“Wonderful Jinhua, Fascinating Africa” Cloud Exhibition of China-Africa Cultural Cooperation and Exchange Week Is Opened (Overseas – Africa Edition) – Sierra Leone Press",sierraleonepress.com
https://www.sierraleonepress.com/state-grid-green-and-low-carbon-development-report-was-released-at-unfccc-cop-27-china-pavilion/,2022-11-18,State Grid Green and Low-carbon Development Report was released at UNFCCC COP 27 China Pavilion – Sierra Leone Press,sierraleonepress.com
https://www.thesierraleonetelegraph.com/delivering-an-african-agenda-at-an-african-cop/,2022-11-13,Delivering an African agenda at an African COP,thesierraleonetelegraph.com
https://www.thesierraleonetelegraph.com/why-cop27-matters-to-sierra-leone/,2022-11-14,Why COP27 matters to Sierra Leone,thesierraleonetelegraph.com
http://www.sierraleonetimes.com/news/273113419/phool-mohammad-murder-case-court-sentences-life-imprisonment-to-30-accused,2022-11-19,Phool Mohammad murder case: Court sentences life imprisonment to 30 accused,sierraleonetimes.com
http://www.sierraleonetimes.com/news/273114829/senegal-celebrates-day-of-fonio-as-food-insecurity-looms,2022-11-19,Senegal Celebrates &#039;Day of Fonio&#039; as Food Insecurity Looms,sierraleonetimes.com
http://www.sierraleonenews.net/news/273114829/senegal-celebrates-day-of-fonio-as-food-insecurity-looms,2022-11-19,Senegal Celebrates &#039;Day of Fonio&#039; as Food Insecurity Looms,sierraleonenews.net
http://www.sierraleonetimes.com/news/273115640/ecuador-seeking-best-ever-world-cup-showing-alfaro,2022-11-19,Ecuador seeking best ever World Cup showing: Alfaro,sierraleonetimes.com
http://www.thepatrioticvanguard.com/industrialization-from-the-ground-up-transforming-rural-spaces-through-agro-industry,2022-11-20,Industrialization from the ground up: transforming rural spaces through agro-industry,thepatrioticvanguard.com
http://www.sierraleonetimes.com/news/273127537/netherlands-claims-2-0-victory-against-senegal-in-fifa-world-cup-group-a,2022-11-22,Netherlands claims 2-0 victory against Senegal in FIFA World Cup Group A,sierraleonetimes.com
http://www.sierraleonetimes.com/news/273127673/three-peacekeepers-in-mali-wounded-in-ied-blast-un,2022-11-22,Three peacekeepers in Mali wounded in IED blast: UN,sierraleonetimes.com
http://www.sierraleonetimes.com/news/273127616/blame-me-for-defeat-to-netherlands-cisse,2022-11-22,Blame me for defeat to Netherlands: Cisse,sierraleonetimes.com
http://www.sierraleonetimes.com/news/273127615/un-chief-appoints-new-resident-coordinator-for-central-african-republic,2022-11-22,UN chief appoints new resident coordinator for Central African Republic,sierraleonetimes.com
http://www.sierraleonetimes.com/news/273127579/netherlands-beat-senegal-in-world-cup-group-a,2022-11-22,Netherlands beat Senegal in World Cup Group A,sierraleonetimes.com
http://www.sierraleonetimes.com/news/273127574/fifa-world-cup-2022-gakpo-klaassen-guide-netherlands-to-2-0-win-over-senegal,2022-11-22,"FIFA World Cup 2022: Gakpo, Klaassen guide Netherlands to 2-0 win over Senegal",sierraleonetimes.com
http://www.sierraleonetimes.com/news/273127557/netherlands-beat-senegal-in-world-cup-group-a-updated-2,2022-11-22,Netherlands beat Senegal in World Cup Group A (updated 2),sierraleonetimes.com
http://www.sierraleonetimes.com/news/273127531/world-cup-roundup-england-stings-iran-6-2-in-opener,2022-11-22,World Cup roundup: England stings Iran 6-2 in opener,sierraleonetimes.com
http://www.sierraleonetimes.com/news/273127474/england-routs-iran-6-2-at-world-cup,2022-11-22,England Routs Iran 6-2 at World Cup,sierraleonetimes.com
http://www.sierraleonetimes.com/news/273127356/starters-of-netherlands-against-senegal-in-world-cup-group-a,2022-11-22,Starters of Netherlands against Senegal in World Cup Group A,sierraleonetimes.com
http://www.sierraleonetimes.com/news/273127354/starters-of-senegal-against-netherlands-in-world-cup-group-a,2022-11-22,Starters of Senegal against Netherlands in World Cup Group A,sierraleonetimes.com
http://www.sierraleonetimes.com/news/273127840/fifa-world-cup-absence-of-sadio-mane-is-a-problem-for-us-says-senegal-manager-after-loss-to-netherlands,2022-11-22,"FIFA World Cup: Absence of Sadio Mane is a problem for us, says Senegal manager after loss to Netherlands",sierraleonetimes.com
http://www.sierraleonetimes.com/news/273127818/fifa-world-cup-not-satisfied-with-our-messy-ball-possession-says-netherlands-manager-after-win-over-senegal,2022-11-22,"FIFA World Cup: Not satisfied with our messy ball possession, says Netherlands manager after win over Senegal",sierraleonetimes.com
http://www.sierraleonetimes.com/news/273127747/roundup-big-win-for-england-happy-return-for-wales-on-world-cup-day-2,2022-11-22,"Roundup: Big win for England, happy return for Wales on World Cup Day 2",sierraleonetimes.com
http://www.sierraleonetimes.com/news/273127738/van-gaal-hails-efficient-netherlands-win,2022-11-22,Van Gaal hails &quot;efficient&quot; Netherlands win,sierraleonetimes.com
https://www.thesierraleonetelegraph.com/we-need-investments-in-critical-sectors-president-bio-tells-a-group-of-politicians-in-london/,2022-11-22,“We need investments in critical sectors” President Bio tells a group of politicians in London,thesierraleonetelegraph.com
https://cocorioko.net/we-need-investments-in-critical-sectors-president-bio-tells-group-of-politicians-in-london/,2022-11-22,"“We need investments in critical sectors”, President Bio tells group of politicians in London",cocorioko.net
http://www.thepatrioticvanguard.com/yainkain-from-sierra-leone-among-shortlist-of-african-entrepreneurs,2022-11-23,"Yainkain, from Sierra Leone, among shortlist of African entrepreneurs",thepatrioticvanguard.com
https://www.sierraleonepress.com/africa-and-the-caribbean-face-similar-climate-challenges-dominica-gears-itself-to-meet-global-warming/,2022-11-25,"Africa and the Caribbean face similar climate challenges, Dominica gears itself to meet global warming",sierraleonepress.com
http://www.sierraleonetimes.com/news/273132108/qatar-scores-first-ever-world-cup-goal-in-3-1-defeat-to-senegal-in-group-a,2022-11-26,Qatar scores first ever World Cup goal in 3-1 defeat to Senegal in Group A,sierraleonetimes.com
http://www.sierraleonetimes.com/news/273132049/fifa-world-cup-2022-dia-helps-senegal-take-1-0-lead-against-qatar-in-half-time,2022-11-26,FIFA World Cup 2022: Dia helps Senegal take 1-0 lead against Qatar in half-time,sierraleonetimes.com
http://www.sierraleonetimes.com/news/273132109/world-cup-will-finish-but-football-continues-says-qatar-coach-sanchez,2022-11-26,"World Cup will finish, but football continues, says Qatar coach Sanchez",sierraleonetimes.com
http://www.sierraleonetimes.com/news/273132042/world-cup-roundup-iran-stuns-wales-with-late-goals,2022-11-26,World Cup roundup: Iran stuns Wales with late goals,sierraleonetimes.com
http://www.sierraleonetimes.com/news/273132036/hosts-qatar-on-brink-of-early-world-cup-exit,2022-11-26,Hosts Qatar on brink of early World Cup exit,sierraleonetimes.com
