url,date_published,title,newsorg
https://www.thesierraleonetelegraph.com/how-did-the-united-nations-organisation-become-a-political-boomerang/,2022-07-03,How did the United Nations Organisation become a political boomerang?,thesierraleonetelegraph.com
https://www.sierraleonepress.com/sierra-leone-launches-re-denominated-currency-to-strengthen-value/,2022-07-05,Sierra Leone launches re-denominated currency to strengthen value,sierraleonepress.com
https://www.sierraleonepress.com/multiple-crises-threatening-stability-and-development-in-sahel/,2022-07-05,Multiple Crises Threatening Stability and Development in Sahel,sierraleonepress.com
https://www.sierraleonepress.com/spain-urges-nato-to-address-threats-from-north-africa/,2022-07-06,Spain Urges NATO to Address Threats from North Africa,sierraleonepress.com
http://www.critiqueecho.com/political-legacies-the-inheritance-of-great-examples/,2022-07-08,Political Legacies: The Inheritance of Great examples,critiqueecho.com
https://www.thesierraleonetelegraph.com/african-heads-of-state-reaffirm-commitment-to-recovering-from-crises-and-achieve-economic-transformation/,2022-07-09,African Heads of State reaffirm commitment to recovering from crises and achieve economic transformation,thesierraleonetelegraph.com
https://www.thesierraleonetelegraph.com/on-the-road-to-cop27-making-africas-case-in-the-climate-global-debate/,2022-07-13,On the road to COP27: Making Africa’s case in the climate global debate,thesierraleonetelegraph.com
https://www.sierraleonepress.com/hitachi-energy-wins-order-to-connect-one-of-the-worlds-largest-offshore-wind-farms-to-the-uk-power-grid/,2022-07-14,Hitachi Energy wins order to connect one of the world’s largest offshore wind farms to the UK power grid,sierraleonepress.com
https://slconcordtimes.com/biodiversity-crisis-1-in-5-people-rely-on-wild-species-for-income-food-report/,2022-07-15,Biodiversity crisis: 1 in 5 people rely on wild species for income food -Report,slconcordtimes.com
https://www.thesierraleonetelegraph.com/taking-charge-of-africas-oceans-and-blue-resources/,2022-07-19,Taking charge of Africa’s oceans and blue resources,thesierraleonetelegraph.com
https://cocorioko.net/ex-president-ernest-koroma-tells-arusha-democracy-conference-democratic-backslide-in-africa-a-worrying-trend-that-should-be-of-utmost-concern/,2022-07-21,Ex-President Ernest Koroma tells Arusha Democracy Conference “Democratic Backslide” in Africa a worrying trend that should be of utmost concern,cocorioko.net
https://cocorioko.net/at-arusha-democracy-conference-freetown-mayor-yvonne-aki-sawyer-highlights-lack-of-value-for-democracy-at-local-government-level/,2022-07-21,"At Arusha Democracy Conference, Freetown Mayor Yvonne Aki-Sawyer highlights lack of value for democracy at Local Government level – Cocorioko",cocorioko.net
https://www.thesierraleonetelegraph.com/democratic-good-governance-thrives-where-there-is-collective-approach-to-leadership-former-president-koroma-tells-arusha-conference/,2022-07-21,"Democratic good governance thrives where there is collective approach to leadership, former president Koroma tells Arusha conference",thesierraleonetelegraph.com
https://www.thesierraleonetelegraph.com/mayor-aki-sawyerr-speaks-in-arusha-at-the-africa-drive-for-democracy-conference/,2022-07-21,Mayor Aki-Sawyerr speaks in Arusha at the Africa Drive for Democracy conference,thesierraleonetelegraph.com
https://www.thesierraleonetelegraph.com/green-hydrogen-a-viable-option-for-transforming-africas-energy-sector/,2022-07-25,Green hydrogen: – A viable option for transforming Africa’s energy sector,thesierraleonetelegraph.com
https://www.sierraleonepress.com/carnegie-council-calls-on-international-community-to-participate-in-global-ethics-day-on-october-19/,2022-07-27,Carnegie Council Calls on International Community to Participate in Global Ethics Day on October 19,sierraleonepress.com
http://www.sierraleonetimes.com/news/272635741/nigerian-troops-kill-20-extremist-militants-in-ne-region,2022-07-29,Nigerian troops kill 20 extremist militants in NE region,sierraleonetimes.com
http://www.sierraleonetimes.com/news/272636977/macron-insulted-african-nations-lavrov,2022-07-30,Macron insulted African nations Lavrov,sierraleonetimes.com
https://www.sierraleonepress.com/top-us-diplomat-travels-to-asia-africa-as-global-powers-fight-for-influence/,2022-07-30,"Top US Diplomat Travels to Asia, Africa as Global Powers Fight for Influence",sierraleonepress.com
http://www.sierraleonetimes.com/news/272638468/despite-deaths-africa-left-to-fight-monkeypox-without-vaccine,2022-08-01,"Despite deaths, Africa left to fight monkeypox without vaccine",sierraleonetimes.com
http://www.sierraleonetimes.com/news/272638652/senegal-parliamentary-poll-seen-as-test-for-president-macky-sall,2022-08-01,Senegal parliamentary poll seen as test for President Macky Sall,sierraleonetimes.com
http://www.sierraleonetimes.com/news/272639019/uae-leaders-congratulate-president-of-benin-on-independence-day,2022-08-01,UAE leaders congratulate President of Benin on Independence Day,sierraleonetimes.com
https://www.thesierraleonetelegraph.com/work-in-sierra-leone-to-improve-resilience-to-emergencies-in-the-face-of-climate-change/,2022-08-01,Work in Sierra Leone to improve resilience to emergencies in the face of climate change,thesierraleonetelegraph.com
http://www.sierraleonetimes.com/news/272639677/mali-government-lashes-out-at-macron,2022-08-02,Mali&#039;s Government Lashes Out at Macron,sierraleonetimes.com
http://www.sierraleonetimes.com/news/272639595/sierra-leonean-doctors-start-nationwide-strike-over-economic-hardship,2022-08-02,Sierra Leonean doctors start nationwide strike over economic hardship,sierraleonetimes.com
https://www.thesierraleonetelegraph.com/world-bank-approves-315m-west-africa-regional-food-systems-resilience-program/,2022-08-02,World Bank approves $315 million West Africa regional Food Systems Resilience Program,thesierraleonetelegraph.com
http://www.sierraleonetimes.com/news/272642581/maccabi-haifa-beat-apollon-limassol-in-uefa-champions-league-qualifier,2022-08-04,Maccabi Haifa beat Apollon Limassol in UEFA Champions League qualifier,sierraleonetimes.com
https://www.sierraleonepress.com/millions-of-hungry-people-in-horn-of-africa-resort-to-extreme-measures-2/,2022-08-04,Millions of Hungry People in Horn of Africa Resort to Extreme Measures,sierraleonepress.com
http://www.sierraleonetimes.com/news/272643844/xinhua-world--summary-at-0100-gmt-aug-5,2022-08-05,"Xinhua world news summary at 0100 GMT, Aug. 5",sierraleonetimes.com
http://www.sierraleonetimes.com/news/272645584/blinken-heads-to-africa-to-counter-russian-influence-on-the-continent,2022-08-07,Blinken heads to Africa to counter Russian influence on the continent,sierraleonetimes.com
http://www.sierraleonenews.net/news/272645877/us-secretary-of-state-arrives-in-south-africa,2022-08-07,US Secretary of State Arrives in South Africa,sierraleonenews.net
http://www.sierraleonenews.net/news/272645584/blinken-heads-to-africa-to-counter-russian-influence-on-the-continent,2022-08-07,Blinken heads to Africa to counter Russian influence on the continent,sierraleonenews.net
http://www.thepatrioticvanguard.com/world-bank-scales-up-its-financing-for-food-security-in-west-africa,2022-08-03,World Bank scales up its financing for food security in West Africa,thepatrioticvanguard.com
https://slconcordtimes.com/environment-impacts-of-illegal-mining-activities-threat-to-water-security-human-health-and-potential-national-public-health-emergency/,2022-08-08,"Environment: Impacts of illegal mining activities: Threat to water security, human health, and potential national public health emergency",slconcordtimes.com
http://www.sierraleonenews.net/news/272649932/trophy-hunting-why-a-uk-import-ban-threatens-wildlife-conservation,2022-08-11,Trophy hunting: why a UK import ban threatens wildlife conservation,sierraleonenews.net
http://www.sierraleonetimes.com/news/272649932/trophy-hunting-why-a-uk-import-ban-threatens-wildlife-conservation,2022-08-11,Trophy hunting: why a UK import ban threatens wildlife conservation,sierraleonetimes.com
https://www.sierraleonepress.com/amid-mixed-results-for-africas-effective-governance-peace-security-speakers-in-security-council-spotlight-ways-to-end-violence-build-capacity-for-growth/,2022-08-16,"Amid mixed results for Africa’s effective governance, peace, security, speakers in Security Council spotlight ways to end violence, build capacity for growth",sierraleonepress.com
http://www.sierraleonenews.net/news/272655618/india-contributes-usd-400000-to-un-trust-funds-underlines-unwavering-support-for-human-rights,2022-08-17,"India contributes USD 400,000 to UN trust funds, underlines unwavering support for human rights",sierraleonenews.net
http://www.sierraleonetimes.com/news/272658340/ghana-has-developed-a-maritime-policy-here-is-what-it-means,2022-08-19,Ghana has developed a maritime policy. Here is what it means,sierraleonetimes.com
https://slconcordtimes.com/orange-sl-launches-weda-masta-product/,2022-08-19,Orange-SL launches ‘Weda Masta’ product,slconcordtimes.com
http://www.sierraleonenews.net/news/272659836/nigerian-president-marks-humanitarian-day-in-war-impacted-borno-state,2022-08-20,Nigerian President Marks Humanitarian Day in War-Impacted Borno State,sierraleonenews.net
https://www.sierraleonepress.com/african-migratory-birds-threatened-by-hot-dry-weather/,2022-08-22,"African Migratory Birds Threatened by Hot, Dry Weather",sierraleonepress.com
https://www.sierraleonepress.com/the-worlds-cotton-supply-is-shrinking-hit-by-drought-and-heat/,2022-08-22,The world’s cotton supply is shrinking hit by drought and heat,sierraleonepress.com
https://www.thesierraleonetelegraph.com/majority-of-sierra-leoneans-are-experiencing-a-climate-of-fear-of-political-reprisals-op-ed/,2022-08-22,Majority of Sierra Leoneans are experiencing a climate of fear of political reprisals – Op ed,thesierraleonetelegraph.com
https://www.sierraleonepress.com/cbi-index-2022-offers-a-glimpse-into-the-future-of-the-citizenship-by-investment-industry-cs-global-partners/,2022-08-22,CBI Index 2022 offers a glimpse into the future of the citizenship by investment industry: CS Global Partners,sierraleonepress.com
https://www.thesierraleonetelegraph.com/airseed-technologies-aims-to-plant-100-million-trees-by-2024/,2022-08-23,Airseed Technologies aims to plant 100 million trees by 2024,thesierraleonetelegraph.com
https://slconcordtimes.com/natural-disasters-will-always-happen-what-we-do-is-to-minimize-the-impact-save-the-children-country-director/,2022-08-24,Natural disasters will always happen; what we do is to minimize the impact -Save the Children Country Director,slconcordtimes.com
https://www.sierraleonepress.com/people-facing-acute-food-insecurity-reach-345-million-worldwide-wfp/,2022-08-26,People facing acute food insecurity reach 345 million worldwide: WFP,sierraleonepress.com
https://www.thesierraleonetelegraph.com/persons-of-interest-or-interested-persons-which-is-it-mr-ben-kaifala/,2022-08-28,"Persons of Interest or Interested Persons, which is it, Mr Ben Kaifala?",thesierraleonetelegraph.com
https://cocorioko.net/flooding-and-landslide-disaster-once-again-freetown-mayor-yvonne-aki-sawyer-is-aghast-as-she-visits-disaster-scenes/,2022-08-29,Flooding and landslide disaster once again,cocorioko.net
https://cocorioko.net/sierra-leoneans-respond-to-the-latest-mudslide-disaster-in-freetown-dr-julius-spencer-suggests-how-to-mitigate-the-recurring-calamity/,2022-08-29,Sierra Leoneans respond to the latest mudslide disaster in Freetown,cocorioko.net
https://www.thesierraleonetelegraph.com/lives-lost-and-homes-destroyed-as-freetown-experiences-heavy-rains/,2022-08-29,Lives lost and homes destroyed as Freetown experiences heavy rains,thesierraleonetelegraph.com
https://www.sierraleonepress.com/globeleq-partners-with-government-of-egypt-to-develop-a-large-scale-green-hydrogen-project/,2022-08-30,GLOBELEQ PARTNERS WITH GOVERNMENT OF EGYPT TO DEVELOP A LARGE-SCALE GREEN HYDROGEN PROJECT,sierraleonepress.com
https://www.sierraleonepress.com/un-deputy-chief-calls-for-action-to-deliver-sustainable-development-in-africa-2/,2022-08-30,UN deputy chief calls for action to deliver sustainable development in Africa,sierraleonepress.com
https://slconcordtimes.com/mismanagement-of-the-citys-resources-contributes-to-flooding-across-freetown-president-bio/,2022-08-30,Mismanagement of the city’s resources contributes to flooding across Freetown -President Bio,slconcordtimes.com
https://www.thesierraleonetelegraph.com/reflections-on-61-years-of-sierra-leones-independence/,2022-04-27,Reflections on 61 years of Sierra Leone’s ‘Independence’,thesierraleonetelegraph.com
https://slconcordtimes.com/health-care-facilities-lack-basic-hygiene-services-who-unicef/,2022-08-31,"Health care facilities lack basic hygiene services – WHO, UNICEF",slconcordtimes.com
https://www.thesierraleonetelegraph.com/freetown-city-council-launches-market-cover-project-to-benefit-thousands-of-women/,2022-08-31,Freetown City Council launches market cover project to benefit thousands of women,thesierraleonetelegraph.com
http://www.thepatrioticvanguard.com/ndma-and-partners-hold-meeting-on-august-28th-flooding,2022-08-30,"NDMA , partners, hold meeting on August 28th flooding",thepatrioticvanguard.com
https://www.thesierraleonetelegraph.com/boosting-intra-african-trade-will-power-post-covid-19-recovery-and-foster-food-security-says-aissatou-diallo/,2022-09-03,Boosting intra-African trade will power post-COVID-19 recovery and foster food security – says Aissatou Diallo,thesierraleonetelegraph.com
https://www.sierraleonepress.com/african-leadership-world-must-double-down-on-climate-adaptation-to-secure-africa/,2022-09-06,African Leadership: World Must Double Down on Climate Adaptation to Secure Africa,sierraleonepress.com
https://www.sierraleonepress.com/in-the-face-of-climate-change-migration-offers-an-adaptation-strategy-in-africa/,2022-09-06,"In The Face of Climate Change, Migration offers an Adaptation Strategy in Africa",sierraleonepress.com
https://apctimes.com/from-cape-to-cairo-the-discussion-on-africas-energy-transition-must-start-in-africa/,2022-03-05,From Cape to Cairo: The Discussion on Africa’s Energy Transition Must Start in Africa,apctimes.com
http://www.sierraleonetimes.com/news/272734836/under-know-bjp-jp-nadda-announces-to-start-interaction-programme-soon-with-the-political-parties-in-other-nations,2022-09-08,"Under ""know BJP"" JP Nadda announces to start interaction programme soon with the political parties in other nations",sierraleonetimes.com
http://www.sierraleonetimes.com/news/272734250/world-cup-trophy-presented-to-senegalese-president-macky-sall,2022-09-08,World Cup Trophy presented to Senegalese President Macky Sall,sierraleonetimes.com
http://www.sierraleonetimes.com/news/272733124/togo-extends-state-of-emergency-due-to-militant-attacks,2022-09-08,Togo Extends State of Emergency Due to Militant Attacks,sierraleonetimes.com
http://www.sierraleonetimes.com/news/272736398/decades-of-human-progress-set-back-by-global-crises-un-warns,2022-09-09,"Decades of human progress set back by global crises, UN warns",sierraleonetimes.com
http://www.sierraleonenews.net/news/272736398/decades-of-human-progress-set-back-by-global-crises-un-warns,2022-09-09,"Decades of human progress set back by global crises, UN warns",sierraleonenews.net
https://www.sierraleonepress.com/climate-change-conflict-forcing-more-people-in-africa-to-flee/,2022-09-08,"Climate Change, Conflict Forcing More People in Africa to Flee",sierraleonepress.com
http://www.thepatrioticvanguard.com/president-bio-speaks-on-five-year-education-sector-plan,2022-09-08,President Bio speaks on five-year Education Sector Plan,thepatrioticvanguard.com
https://www.sierraleonepress.com/civil-society-leaders-urge-action-on-debt-inflation-and-climate-change-renew-calls-for-russia-to-be-held-accountable-for-war-crimes/,2022-09-09,"CIVIL SOCIETY LEADERS URGE ACTION ON DEBT, INFLATION, AND CLIMATE CHANGE, RENEW CALLS FOR RUSSIA TO BE HELD ACCOUNTABLE FOR WAR CRIMES",sierraleonepress.com
https://www.sierraleonepress.com/us-mourns-loss-of-britains-longest-serving-monarch/,2022-09-09,US Mourns Loss of Britain’s Longest-Serving Monarch,sierraleonepress.com
http://www.sierraleonenews.net/news/272742544/ioc-approves-olympic-forest-network-to-address-climate-change,2022-09-10,IOC approves Olympic Forest Network to address climate change,sierraleonenews.net
https://www.sierraleonepress.com/un-weekly-roundup-september-3-9-2022/,2022-09-10,"UN Weekly Roundup: September 3-9, 2022",sierraleonepress.com
https://www.sierraleonepress.com/as-cost-of-climate-change-rises-un-urges-compensation/,2022-09-10,"As Cost of Climate Change Rises, UN Urges Compensation",sierraleonepress.com
https://www.sierraleonepress.com/gates-foundation-goalkeepers-report-says-progress-still-possible-despite-setbacks-to-global-goals/,2022-09-13,Gates Foundation Goalkeepers Report Says Progress Still Possible Despite Setbacks to Global Goals,sierraleonepress.com
https://www.thesierraleonetelegraph.com/transforming-education-is-not-cheap-says-president-bio-as-he-unveils-new-national-education-sector-plan/,2022-09-12,Transforming education is not cheap – says President Bio as he unveils new National Education Sector Plan,thesierraleonetelegraph.com
http://www.sierraleonenews.net/news/272758757/us-pledges-support-for-cleaner-energy-in-nigeria,2022-09-15,US Pledges Support for Cleaner Energy in Nigeria,sierraleonenews.net
https://slconcordtimes.com/save-the-children-supports-116-flood-affected-female-led-households/,2022-09-14,Save the Children supports 116 flood affected female-led households,slconcordtimes.com
http://www.sierraleonenews.net/news/272762424/us-pledges-support-for-climate-change-mitigation-in-africa,2022-09-16,US Pledges Support for Climate Change Mitigation in Africa,sierraleonenews.net
https://www.thesierraleonetelegraph.com/freetowns-mayor-aki-sawyerr-speaking-at-bill-melinda-gates-goalkeepers-event-in-new-york/,2022-09-17,Freetown’s Mayor Aki-Sawyerr speaking at Bill & Melinda Gates Goalkeepers event in New York,thesierraleonetelegraph.com
https://www.sierraleonepress.com/ukraine-food-security-in-spotlight-during-un-leaders-week/,2022-09-19,"Ukraine, Food Security in Spotlight During UN Leaders Week",sierraleonepress.com
https://www.sierraleonepress.com/un-summit-returns-in-person-to-world-of-divisions/,2022-09-19,UN summit returns in person to world of divisions,sierraleonepress.com
https://www.sierraleonepress.com/gates-foundation-honors-four-leaders-with-2022-goalkeepers-global-goals-awards-for-their-inspiring-efforts-to-drive-progress-for-all/,2022-09-21,Gates Foundation Honors Four Leaders With 2022 Goalkeepers Global Goals Awards for Their Inspiring Efforts to Drive Progress for All,sierraleonepress.com
https://www.sierraleonepress.com/secretary-antony-j-blinken-remarks-at-the-strengthening-atlantic-cooperation-ministerial-meeting/,2022-09-21,Secretary Antony J. Blinken Remarks at the Strengthening Atlantic Cooperation Ministerial Meeting,sierraleonepress.com
https://www.sierraleonepress.com/gates-foundation-announces-1-27-billion-in-health-and-development-commitments-to-advance-progress-toward-the-global-goals/,2022-09-22,Gates Foundation Announces $1.27 Billion in Health and Development Commitments to Advance Progress Toward the Global Goals,sierraleonepress.com
https://www.sierraleonepress.com/africa-is-doing-its-part-but-must-do-more-says-rwandan-president-kagame/,2022-09-22,"Africa is doing its part but must do more, says Rwandan President Kagame",sierraleonepress.com
https://globaltimes-sl.com/2022/09/22/%f0%9d%90%92%f0%9d%90%93%f0%9d%90%80%f0%9d%90%93%f0%9d%90%84%f0%9d%90%8c%f0%9d%90%84%f0%9d%90%8d%f0%9d%90%93-%f0%9d%90%81%f0%9d%90%98-%f0%9d%90%8f%f0%9d%90%91%f0%9d%90%84%f0%9d%90%92%f0%9d%90%88/,2022-09-22,𝐒𝐓𝐀𝐓𝐄𝐌𝐄𝐍𝐓 𝐁𝐘 𝐏𝐑𝐄𝐒𝐈𝐃𝐄𝐍𝐓 𝐁𝐈𝐎 𝐀𝐓 𝐓𝐇𝐄 𝟕𝟕𝐓𝐇 𝐒𝐄𝐒𝐒𝐈𝐎𝐍 𝐎𝐅 𝐓𝐇𝐄 𝐔𝐍𝐈𝐓𝐄𝐃 𝐍𝐀𝐓𝐈𝐎𝐍𝐒 𝐆𝐄𝐍𝐄𝐑𝐀𝐋 𝐀𝐒𝐒𝐄𝐌𝐁𝐋𝐘 “𝐆𝐄𝐍𝐄𝐑𝐀𝐋 𝐃𝐄𝐁𝐀𝐓𝐄”,globaltimes-sl.com
http://www.sierraleonenews.net/news/272789309/political-leaders-call-for-collective-action-against-climate-change,2022-09-23,Political leaders call for collective action against climate change,sierraleonenews.net
http://www.sierraleonetimes.com/news/272789309/political-leaders-call-for-collective-action-against-climate-change,2022-09-24,Political leaders call for collective action against climate change,sierraleonetimes.com
http://www.sierraleonetimes.com/news/272789095/ecowas-leaders-to-slap-gradual-sanctions-on-guinea-junta,2022-09-24,Ecowas leaders to slap gradual sanctions on Guinea&#039;s junta,sierraleonetimes.com
https://cocorioko.net/freetown-mayors-councillor-arrested-at-airport-on-way-to-new-york/,2022-09-22,Freetown City Councillor arrested at Airport on way to New York,cocorioko.net
http://www.sierraleonetimes.com/news/272790509/g-balasubramanian-concurrently-accredited-as-next-indian-envoy-to-benin,2022-09-24,G. Balasubramanian concurrently accredited as next Indian envoy to Benin,sierraleonetimes.com
http://www.sierraleonetimes.com/news/272795598/team-melli-to-return-to-iran-on-thursday,2022-09-25,Team Melli to Return to Iran on Thursday,sierraleonetimes.com
https://www.thesierraleonetelegraph.com/empowering-women-to-boost-africas-water-security/,2022-09-25,Empowering women to boost Africa’s water security,thesierraleonetelegraph.com
http://www.sierraleonetimes.com/news/272796067/chinese-equatorial-guinean-fms-meet-on-sidelines-of-unga-session,2022-09-26,"Chinese, Equatorial Guinean FMs meet on sidelines of UNGA session",sierraleonetimes.com
http://www.sierraleonenews.net/news/272798260/high-level-panel-on-security-development-in-sahel-launched-at-un,2022-09-26,"High-level panel on security, development in Sahel launched at UN",sierraleonenews.net
https://statehouse.gov.sl/sierra-leones-president-julius-maada-bio-reiterates-ecowas-africa-wide-support-for-a-non-permanent-seat-in-the-unsc-for-2024-2025/,2022-09-23,"Sierra Leone’s President Julius Maada Bio Reiterates ECOWAS, Africa-wide Support for a non-permanent seat in the UNSC for 2024-2025",statehouse.gov.sl
https://www.sierraleonepress.com/cnbm-open-day-build-a-forest-factoryand-guard-our-green-home/,2022-09-26,CNBM Open Day: Build a “forest factory”and guard our green home,sierraleonepress.com
https://www.sierraleonepress.com/dominica-paves-clear-path-to-climate-resiliency-amid-climate-related-disasters/,2022-09-26,Dominica paves clear path to climate resiliency amid climate-related disasters,sierraleonepress.com
http://www.sierraleonenews.net/news/272803182/lassa-virus-endemic-area-could-significantly-grow-in-coming-decades,2022-09-28,Lassa virus endemic area could significantly grow in coming decades,sierraleonenews.net
http://www.sierraleonetimes.com/news/272803182/lassa-virus-endemic-area-could-significantly-grow-in-coming-decades,2022-09-28,Lassa virus endemic area could significantly grow in coming decades,sierraleonetimes.com
https://www.sierraleonepress.com/nobel-prize-season-arrives-amid-war-nuclear-fears-hunger-2/,2022-10-03,"Nobel Prize Season Arrives Amid War, Nuclear Fears, Hunger",sierraleonepress.com
https://www.sierraleonepress.com/around-1-6-billion-tonnes-of-food-is-wasted-fao-report/,2022-10-04,Around 1.6 billion tonnes of food is wasted – FAO report,sierraleonepress.com
https://www.sierraleonepress.com/un-report-fiscal-policies-of-advanced-economies-risk-global-recession/,2022-10-04,UN Report: Fiscal Policies of Advanced Economies Risk Global Recession,sierraleonepress.com
https://www.sierraleonepress.com/african-countries-convene-in-addis-to-find-solutions-for-continents-food-problems/,2022-10-05,African countries convene in Addis to find solutions for continent’s food problems,sierraleonepress.com
https://www.thesierraleonetelegraph.com/british-high-commissioner-in-talks-with-sierra-leones-minister-of-planning-and-economic-development/,2022-10-06,British High Commissioner in talks with Sierra Leone’s Minister of Planning and Economic Development,thesierraleonetelegraph.com
http://www.thepatrioticvanguard.com/evergreen-appoints-new-ceo,2022-09-20,Evergreen appoints new CEO,thepatrioticvanguard.com
https://cocorioko.net/what-the-un-secretary-told-the-general-assembly-our-world-is-in-big-trouble/,2022-10-03,What the UN Secretary General told the General Assembly,cocorioko.net
https://cocorioko.net/62nd-independence-anniversary-president-buhari-addresses-the-nation/,2022-10-03,NIGERIA’S 62ND INDEPENDENCE ANNIVERSARY,cocorioko.net
http://www.thepatrioticvanguard.com/reflections-on-61-years-of-sierra-leone-s-independence-between-quest-for-nationhood-and-free,2022-04-27,Reflections on 61 Years of Sierra Leone’s Independence,thepatrioticvanguard.com
https://www.sierraleonepress.com/amid-global-crises-multilateral-support-critical-for-most-vulnerable-states-delegates-underline-as-second-committee-takes-up-macroeconomic-policy/,2022-10-08,"Amid Global Crises, Multilateral Support Critical for Most Vulnerable States, Delegates Underline, as Second Committee Takes Up Macroeconomic Policy",sierraleonepress.com
https://www.sierraleonepress.com/stronger-regulation-cross-border-coordination-key-to-stopping-terrorism-across-africa-funded-by-illegal-trafficking-in-natural-resources-speakers-tell-security-council/,2022-10-08,"Stronger Regulation, Cross-Border Coordination Key to Stopping Terrorism across Africa Funded by Illegal Trafficking in Natural Resources, Speakers Tell Security Council",sierraleonepress.com
