url,date_published,title,newsorg
https://www.thesierraleonetelegraph.com/message-of-introspection-for-transformative-change-in-sierra-leone-from-dr-samura-kamara/,2022-01-02,Message of introspection for transformative change in Sierra Leone from Dr Samura Kamara,thesierraleonetelegraph.com
https://www.thesierraleonetelegraph.com/why-we-need-african-energy-banks-now/,2022-01-04,Why we need African Energy Banks now,thesierraleonetelegraph.com
https://www.thesierraleonetelegraph.com/deforestation-increases-risk-of-flash-flooding-in-fast-growing-west-african-coastal-cities/,2022-01-04,Deforestation increases risk of flash flooding in fast-growing West African coastal cities,thesierraleonetelegraph.com
https://www.sierraleonepress.com/west-and-central-africa-transhumance-response-plan-2022/,2022-01-07,West and Central Africa Transhumance Response Plan 2022,sierraleonepress.com
http://cocorioko.net/former-president-ernest-koroma-sends-new-year-message-of-hope/,2022-01-05,Former President Ernest Koroma sends New Year message of Hope,cocorioko.net
https://globaltimes-sl.com/en/2022/01/06/national-broadcast-on-new-years-eve-by-president-julius-maada-bio-freetown-31st-december-2021/,2022-01-06,NATIONAL BROADCAST ON NEW YEAR’S EVE BY PRESIDENT JULIUS MAADA BIO. FREETOWN – 31ST DECEMBER 2021,globaltimes-sl.com
https://slconcordtimes.com/climate-failure-and-social-crisis-top-global-risks-2022/,2022-01-12,Climate Failure and Social Crisis Top Global Risks 2022,slconcordtimes.com
https://slconcordtimes.com/give-africa-right-to-manufacture-its-own-vaccines-nigerias-vice-president-osinbajo-tells-davos/,2022-01-24,Give Africa right to manufacture its own vaccines … Nigeria’s Vice-President Osinbajo tells Davos,slconcordtimes.com
https://www.sierraleonepress.com/dr-jane-goodall-delivers-an-important-message-of-hope-at-the-2022-procter-gamble-ama-sustainability-summit/,2022-01-25,Dr Jane Goodall delivers an important message of hope at the 2022 Procter & Gamble AMA Sustainability Summit,sierraleonepress.com
https://www.sierraleonepress.com/african-scientists-face-difficulty-utilizing-climate-change-mitigation-funds/,2022-04-22,African Scientists Face Difficulty Utilizing Climate Change Mitigation Funds,sierraleonepress.com
http://www.sierraleonetimes.com/news/272408708/minister-sajjan-announces-funding-of-83-million-on-trip-to-west-africa,2022-05-07,Minister Sajjan announces funding of $83 million on trip to West Africa,sierraleonetimes.com
http://www.sierraleonetimes.com/news/272408544/backgrounder---canada-announces-funding-for-projects-in-west-africa,2022-05-07,Canada announces funding for projects in West Africa,sierraleonetimes.com
https://globaltimes-sl.com/en/2022/04/21/wfp-rescues-540000-sierra-leoneans/,2022-04-21,"WFP Rescues 540,000 Sierra Leoneans",globaltimes-sl.com
https://www.thesierraleonetelegraph.com/mayor-aki-sawyerr-speaks-at-inaugural-forum-on-global-resilience/,2022-05-06,Mayor Aki-Sawyerr speaks at inaugural forum on Global resilience,thesierraleonetelegraph.com
https://www.thesierraleonetelegraph.com/blacker-a-symbol-of-mental-health-struggles-and-freedom-of-speech-in-sierra-leone-op-ed/,2022-05-05,Blacker: A symbol of mental health struggles and freedom of speech in Sierra Leone – Op ed,thesierraleonetelegraph.com
http://www.sierraleonenews.net/news/272542666/growing-african-mangrove-forests-aim-to-combat-climate-woes,2022-05-08,Growing African Mangrove Forests Aim to Combat Climate Woes,sierraleonenews.net
http://www.sierraleonenews.net/news/272538588/un-secretary-general-antonio-guterres-makes-first-visit-to-nigeria,2022-05-08,UN Secretary-General Antonio Guterres Makes First Visit to Nigeria,sierraleonenews.net
http://www.sierraleonenews.net/news/272538500/un-secretary-general-antonio-guterres-makes-first-visit-nigeria,2022-05-08,UN Secretary-General Antonio Guterres Makes First Visit Nigeria,sierraleonenews.net
http://www.sierraleonenews.net/news/272408708/minister-sajjan-announces-funding-of-83-million-on-trip-to-west-africa,2022-05-08,Minister Sajjan announces funding of $83 million on trip to West Africa,sierraleonenews.net
http://www.sierraleonenews.net/news/272408544/backgrounder---canada-announces-funding-for-projects-in-west-africa,2022-05-08,Canada announces funding for projects in West Africa,sierraleonenews.net
http://www.sierraleonetimes.com/news/272542666/growing-african-mangrove-forests-aim-to-combat-climate-woes,2022-05-08,Growing African Mangrove Forests Aim to Combat Climate Woes,sierraleonetimes.com
http://www.sierraleonetimes.com/news/272543023/ase-of-rare-disease-confirmed-in-england,2022-05-08,ase of rare disease confirmed in England,sierraleonetimes.com
https://slconcordtimes.com/concord-times-bags-scca-media-partnership-award/,2022-05-09,Concord Times bags SCCA Media Partnership Award,slconcordtimes.com
https://slconcordtimes.com/uba-sierra-leone-bags-national-climate-partnership-award/,2022-05-09,UBA Sierra Leone bags national climate partnership award,slconcordtimes.com
http://www.sierraleonetimes.com/news/272544785/three-things-that-can-go-wrong-at-an-illegal-oil-refinery-in-nigeria,2022-05-10,Three things that can go wrong at an illegal oil refinery in Nigeria,sierraleonetimes.com
http://www.sierraleonetimes.com/news/272544719/196-states-meet-to-combat-desertification-at-cop-15-summit-in-abidjan,2022-05-10,196 states meet to combat desertification at COP 15 summit in Abidjan,sierraleonetimes.com
http://www.sierraleonenews.net/news/272544785/three-things-that-can-go-wrong-at-an-illegal-oil-refinery-in-nigeria,2022-05-10,Three things that can go wrong at an illegal oil refinery in Nigeria,sierraleonenews.net
http://www.sierraleonenews.net/news/272544719/196-states-meet-to-combat-desertification-at-cop-15-summit-in-abidjan,2022-05-10,196 states meet to combat desertification at COP 15 summit in Abidjan,sierraleonenews.net
https://www.thesierraleonetelegraph.com/sierra-leones-president-bio-makes-bid-for-seat-on-united-nations-security-council/,2022-05-10,Sierra Leone’s President Bio makes bid for seat on United Nations Security Council,thesierraleonetelegraph.com
https://slconcordtimes.com/at-state-opening-of-fifth-parliament-president-bio-highlights-achievements-legislative-plans/,2022-05-11,"At State opening of Fifth Parliament: President Bio highlights achievements, legislative plans",slconcordtimes.com
http://www.sierraleonetimes.com/news/272547597/the-war-in-ukraine-africa-risks-paying-a-heavy-price-for-neutrality,2022-05-12,The war in Ukraine: Africa risks paying a heavy price for neutrality,sierraleonetimes.com
https://www.thesierraleonetelegraph.com/president-bio-delivers-state-of-the-nation-report-amid-thundering-noise-from-opposition-mps/,2022-05-11,President Bio delivers state of the nation report amid thundering noise from opposition MPs,thesierraleonetelegraph.com
http://www.sierraleonenews.net/news/272547597/the-war-in-ukraine-africa-risks-paying-a-heavy-price-for-neutrality,2022-05-12,The war in Ukraine: Africa risks paying a heavy price for neutrality,sierraleonenews.net
https://cocorioko.net/presidential-address-by-head-of-state-julius-maada-bio-at-state-opening-of-fifth-session-of-fifth-parliament-of-the-second-republic-of-sierra-leone/,2022-05-12,Presidential address by Head of State Julius Maada Bio at State Opening of Fifth Session of Fifth Parliament of the Second Republic of Sierra Leone – Cocorioko,cocorioko.net
https://www.sierraleonepress.com/accelerated-application-processing-aap-fast-tracks-citizenship-by-investment-applications/,2022-05-13,Accelerated Application Processing (AAP) fast tracks Citizenship by Investment applications,sierraleonepress.com
https://www.thesierraleonetelegraph.com/concerns-grow-over-slpp-governments-use-of-the-acc-to-ban-mayor-aki-sawyerr-from-politics/,2022-05-15,Concerns grow over SLPP government’s use of the ACC to ban Mayor Aki-Sawyerr from politics,thesierraleonetelegraph.com
http://www.sierraleonetimes.com/news/272553645/flower-garland-seller-daughter-gets-admission-in-university-of-california-for-phd,2022-05-17,Flower garland seller's daughter gets admission in University of California for PhD,sierraleonetimes.com
http://www.sierraleonenews.net/news/272554722/cop15-securing-land-rights-is-crucial-to-land-restoration-in-africa,2022-05-18,COP15: Securing land rights is crucial to land restoration in Africa,sierraleonenews.net
http://www.sierraleonetimes.com/news/272554722/cop15-securing-land-rights-is-crucial-to-land-restoration-in-africa,2022-05-18,COP15: Securing land rights is crucial to land restoration in Africa,sierraleonetimes.com
https://cocorioko.net/the-biased-slpp-anti-corruption-commission-acc-to-indict-innocent-freetown-mayor-but-has-ignored-slpp-thieves-like-the-first-lady-and-others/,2022-05-18,The biased SLPP Anti-Corruption Commission to indict innocent Freetown Mayor while ignoring SLPP thieves like the First Lady and others.,cocorioko.net
https://www.sierraleonepress.com/landmark-meeting-urges-prioritization-of-water-and-sanitation-to-get-health-climate-and-economic-targets-back-on-track/,2022-05-18,"Landmark Meeting Urges Prioritization of Water and Sanitation to get Health, Climate and Economic Targets Back on Track – Sierra Leone Press",sierraleonepress.com
https://slconcordtimes.com/seeking-truth-from-the-facts-of-bios-state-opening-speech/,2022-05-18,Seeking truth from the facts of Bio’s State Opening Speech,slconcordtimes.com
https://www.sierraleonepress.com/pollution-behind-1-in-6-global-deaths-in-2019-study/,2022-05-20,Pollution behind 1 in 6 global deaths in 2019: Study,sierraleonepress.com
https://slconcordtimes.com/chinas-position-on-some-global-hot-spot-issues/,2022-05-20,China’s position on some global hot-spot issues:,slconcordtimes.com
http://www.sierraleonenews.net/news/272560974/covid-pandemic-ukraine-war-color-who-international-meeting,2022-05-23,"COVID Pandemic, Ukraine War Color WHO International Meeting",sierraleonenews.net
http://www.sierraleonetimes.com/news/272560974/covid-pandemic-ukraine-war-color-who-international-meeting,2022-05-23,"COVID Pandemic, Ukraine War Color WHO International Meeting",sierraleonetimes.com
http://www.sierraleonenews.net/news/272561156/german-chancellor-scholz-kicks-off-africa-trip-in-senegal,2022-05-23,German Chancellor Scholz Kicks off Africa Trip in Senegal,sierraleonenews.net
http://www.critiqueecho.com/cfm-sign-development-funding-agreement-with-fwt-and-twt/,2022-05-23,CFM Sign Development Funding Agreement with FWT and TWT,critiqueecho.com
http://www.sierraleonenews.net/news/272561763/rising-sea-levels-are-driving-faster-erosion-along-senegal-coast,2022-05-24,Rising sea levels are driving faster erosion along Senegal&#039;s coast,sierraleonenews.net
http://www.sierraleonetimes.com/news/272561763/rising-sea-levels-are-driving-faster-erosion-along-senegal-coast,2022-05-24,Rising sea levels are driving faster erosion along Senegal&#039;s coast,sierraleonetimes.com
https://www.sierraleonepress.com/african-accountancy-profession-is-broadly-optimistic-about-the-economic-future/,2022-05-24,African accountancy profession is broadly optimistic about the economic future,sierraleonepress.com
https://slconcordtimes.com/air-water-pollution-still-main-of-deaths-report/,2022-05-24,"Air, water pollution still main of deaths -Report",slconcordtimes.com
https://www.thesierraleonetelegraph.com/new-research-from-the-mo-ibrahim-foundation-shines-light-on-africas-precarious-position-in-the-climate-debate/,2022-05-25,New research from the Mo Ibrahim Foundation shines light on Africa’s precarious position in the climate debate,thesierraleonetelegraph.com
https://www.sierraleonepress.com/new-national-geographic-series-chasing-answers-spotlights-kausts-emergence-as-a-global-scientific-research-hub/,2022-05-25,New National Geographic Series Chasing Answers Spotlights KAUST’s Emergence as a Global Scientific Research Hub,sierraleonepress.com
https://www.thesierraleonetelegraph.com/mayor-aki-sawyerr-is-appointed-commissioner-for-global-commission-on-the-economics-of-water-at-davos-summit/,2022-05-26,Mayor Aki-Sawyerr is appointed Commissioner for Global Commission on the Economics of Water at Davos summit,thesierraleonetelegraph.com
http://www.sierraleonetimes.com/news/272565605/vice-president-venkaiah-naidu-to-visit-gabon-senegal-and-qatar,2022-05-27,"Vice President Venkaiah Naidu to visit Gabon, Senegal and Qatar",sierraleonetimes.com
http://www.sierraleonetimes.com/news/272565548/zayed-chf-to-restore-sheikh-zayed-hassan-ii-mosque-in-senegal,2022-05-27,Zayed CHF to restore 'Sheikh Zayed-Hassan II Mosque' in Senegal,sierraleonetimes.com
http://www.sierraleonetimes.com/news/272565547/fire-kills-11-newborn-babies-at-senegal-hospital,2022-05-27,Fire Kills 11 Newborn Babies at Senegal Hospital,sierraleonetimes.com
http://www.thepatrioticvanguard.com/africa-s-2021-economic-rebound-impacted-by-lingering-covid-19-pandemic-and-russia-ukraine-war,2022-05-27,Africa’s 2021 economic rebound impacted by lingering Covid-19 pandemic and Russia-Ukraine war,thepatrioticvanguard.com
https://slconcordtimes.com/unicef-menstrual-health-hygiene-needs-still-unmet-in-africa/,2022-05-27,"UNICEF: menstrual health, hygiene needs still unmet in Africa",slconcordtimes.com
https://www.sierraleonepress.com/we-dont-have-food-african-leaders-meet-as-crises-grow/,2022-05-28,‘We Don’t Have Food’: African Leaders Meet as Crises Grow,sierraleonepress.com
http://www.sierraleonenews.net/news/272568544/sahel-should-be-seen-as-region-of-opportunity-despite-multiple-crises,2022-05-29,Sahel should be seen as region of opportunity despite multiple crises,sierraleonenews.net
http://www.sierraleonetimes.com/news/272568544/sahel-should-be-seen-as-region-of-opportunity-despite-multiple-crises,2022-05-29,Sahel should be seen as region of opportunity despite multiple crises,sierraleonetimes.com
http://www.sierraleonenews.net/news/272568838/us-gulf-coast-preps-for-another-dangerous-hurricane-season,2022-05-30,US Gulf Coast Preps for Another Dangerous Hurricane Season,sierraleonenews.net
http://www.sierraleonetimes.com/news/272568838/us-gulf-coast-preps-for-another-dangerous-hurricane-season,2022-05-30,US Gulf Coast Preps for Another Dangerous Hurricane Season,sierraleonetimes.com
https://www.thesierraleonetelegraph.com/cop27-angolas-permanent-representative-to-the-un-says-its-time-for-climate-justice-for-africa/,2022-05-29,COP27 – Angola’s Permanent Representative to the UN says it’s time for climate justice for Africa,thesierraleonetelegraph.com
https://www.sierraleonepress.com/weathers-unwanted-guest-nasty-la-nina-keeps-popping-up-2/,2022-05-30,Weather’s Unwanted Guest: Nasty La Nina Keeps Popping up,sierraleonepress.com
http://www.sierraleonetimes.com/news/272571263/vice-president-m-venkaiah-naidu-meets-gabon-president-in-libreville,2022-06-01,Vice President M. Venkaiah Naidu meets Gabon President in Libreville,sierraleonetimes.com
http://www.sierraleonetimes.com/news/272571331/vice-president-naidu-holds-delegation-level-talk-with-gabon-pm-in-libreville,2022-06-01,Vice President Naidu holds delegation-level talk with Gabon PM in Libreville,sierraleonetimes.com
https://www.sierraleonepress.com/un-global-compact-launches-africa-business-leaders-coalition-to-advance-climate-action-and-sustainable-growth-across-the-continent/,2022-06-01,UN Global Compact launches Africa Business Leaders Coalition to advance climate action and sustainable growth across the continent,sierraleonepress.com
http://www.sierraleonetimes.com/news/272573705/venkaiah-naidu-visits-monument-of-african-renaissance-in-dakar-pays-floral-tribute-to-mahatma-gandhi,2022-06-03,"Venkaiah Naidu visits Monument of African Renaissance in Dakar, pays floral tribute to Mahatma Gandhi",sierraleonetimes.com
http://www.thepatrioticvanguard.com/the-deputy-prime-minister-and-minister-of,2022-06-03,Canada: Deputy Prime Minister and Minister of Finance meets with US Secretary of the Treasury,thepatrioticvanguard.com
https://slconcordtimes.com/eu-supports-sierra-leone-school-green-club-in-poetry-and-arts-competition/,2022-06-03,EU Supports Sierra Leone School Green Club in Poetry and Arts Competition,slconcordtimes.com
https://www.sierraleonepress.com/african-union-chair-meets-putin-to-discuss-food-insecurity/,2022-06-04,African Union Chair Meets Putin to Discuss Food Insecurity,sierraleonepress.com
https://www.sierraleonepress.com/egypts-renewable-electricity-generation-up-17-2-percent-in-2021/,2022-06-06,Egypt’s Renewable Electricity Generation Up 17.2 Percent In 2021,sierraleonepress.com
https://www.sierraleonepress.com/only-one-earth-4-ways-nuclear-science-is-helping-the-environment/,2022-06-06,Only One Earth: 4 Ways Nuclear Science is Helping the Environment,sierraleonepress.com
https://www.thesierraleonetelegraph.com/president-bio-welcomes-commonwealth-lawmakers-meeting-in-freetown/,2022-06-08,President Bio welcomes Commonwealth lawmakers meeting in Freetown,thesierraleonetelegraph.com
https://www.switsalone.com/41579_who-urges-government-authorities-to-include-mental-health-support-in-climate-change-action-plans/,2022-06-07,WHO urges government authorities to include mental health support in climate change action plans,switsalone.com
http://www.thepatrioticvanguard.com/mobilizing-collective-action-for-a-sustainable-ocean-economy,2022-06-08,Mobilizing collective action for a sustainable ocean economy,thepatrioticvanguard.com
http://www.sierraleonetimes.com/news/272580539/indian-vice-president-visits-gabon-senegal-cements-bilateral-ties,2022-06-09,"Indian Vice President visits Gabon, Senegal, cements bilateral ties",sierraleonetimes.com
http://www.sierraleonenews.net/news/272580539/indian-vice-president-visits-gabon-senegal-cements-bilateral-ties,2022-06-09,"Indian Vice President visits Gabon, Senegal, cements bilateral ties",sierraleonenews.net
http://www.sierraleonenews.net/news/272581389/au-chair-urges-ukraine-to-demine-odesa-port-to-ease-wheat-exports,2022-06-10,AU Chair Urges Ukraine to Demine Odesa Port to Ease Wheat Exports,sierraleonenews.net
http://www.sierraleonenews.net/news/272581166/world-bank-approves-145-mln-usd-for-urban-improvement-in-ghana,2022-06-10,World Bank approves 145 mln USD for urban improvement in Ghana,sierraleonenews.net
https://www.sierraleonepress.com/herbal-square-to-launch-herbaromatrade-global-b2b-marketplace-exclusively-for-herbal-and-aromatherapy-products/,2022-06-10,Herbal Square to Launch “HerbaromaTrade” — Global B2B Marketplace Exclusively for Herbal and Aromatherapy Products,sierraleonepress.com
http://www.thepatrioticvanguard.com/british-writer-yrsa-daley-ward,2022-06-12,British writer Yrsa Daley-Ward,thepatrioticvanguard.com
https://www.sierraleonepress.com/imf-calls-for-accelerated-anti-corruption-fight-during-pandemic-in-africa/,2022-06-14,IMF Calls for Accelerated Anti-Corruption Fight During Pandemic in Africa,sierraleonepress.com
http://www.thepatrioticvanguard.com/greetings-from-kabala-republic,2022-06-14,Greetings from Kabala Republic,thepatrioticvanguard.com
https://www.sierraleonepress.com/huawei-informa-tech-held-africa-green-ict-webinar-2022-to-light-up-a-sustainable-africa/,2022-06-15,Huawei & Informa Tech held Africa Green ICT Webinar 2022 to Light up a Sustainable Africa,sierraleonepress.com
https://statehouse.gov.sl/sierra-leones-president-julius-maada-visits-miro-forestry-company-talks-on-the-rising-demand-for-wood-and-devastating-impacts-on-natural-ecosystems/,2022-06-15,"Sierra Leone’s President Julius Maada Visits MIRO Forestry Company, Talks on the Rising Demand for Wood and Devastating Impacts on Natural Ecosystems",statehouse.gov.sl
https://www.thesierraleonetelegraph.com/growing-hunger-high-food-prices-in-africa-dont-have-to-become-worse-tragedy/,2022-06-17,"Growing hunger, high food prices in Africa don’t have to become worse tragedy",thesierraleonetelegraph.com
http://www.sierraleonenews.net/news/272592682/nigerian-refugees-in-niger-thrive-in-opportunity-villages,2022-06-21,Nigerian Refugees in Niger Thrive in Opportunity Villages,sierraleonenews.net
https://www.sierraleonepress.com/climate-change-could-intensify-violence-against-women-study-says/,2022-06-21,"Climate Change Could Intensify Violence Against Women, Study Says",sierraleonepress.com
https://www.thesierraleonetelegraph.com/the-battle-to-save-the-soul-of-sierra-leone-is-a-must-where-do-you-stand-op-ed/,2022-06-21,The battle to save the soul of Sierra Leone is a must: where do you stand? Op ed,thesierraleonetelegraph.com
https://slconcordtimes.com/at-commonwealth-youth-forum-young-people-vow-to-take-the-reins-of-their-future/,2022-06-21,At Commonwealth Youth Forum: Young people vow to take the reins of their future,slconcordtimes.com
http://www.sierraleonenews.net/news/272595641/us-state-secretary-blinken-to-attend-g7-summit-set-to-take-place-in-germany,2022-06-23,US State Secretary Blinken to attend G7 Summit set to take place in Germany,sierraleonenews.net
http://www.thepatrioticvanguard.com/rwanda-to-host-2022-world-circular-economy-forum-in-december,2022-06-23,Rwanda to host 2022 World Circular Economy Forum in December,thepatrioticvanguard.com
http://www.sierraleonetimes.com/news/272598305/macron-ends-french-eu-presidency-with-four-global-summits,2022-06-25,Macron ends French EU presidency with four global summits,sierraleonetimes.com
http://www.sierraleonenews.net/news/272598305/macron-ends-french-eu-presidency-with-four-global-summits,2022-06-25,Macron ends French EU presidency with four global summits,sierraleonenews.net
http://www.thepatrioticvanguard.com/prime-minister-trudeau-announces-canadian-support-to-address-global-food-security-crisis-in-rwanda,2022-06-24,Kigali: Canada to provide $250 million to help address global food security crisis,thepatrioticvanguard.com
https://statehouse.gov.sl/sierra-leones-president-julius-maada-bio-attends-opening-ceremony-of-chogm-holds-bilateral-meetings-with-leaders-of-rwanda-singapore-and-belize/,2022-06-24,"Sierra Leone’s President Julius Maada Bio Attends Opening Ceremony of CHOGM, Holds Bilateral Meetings with Leaders of Rwanda, Singapore and Belize",statehouse.gov.sl
http://www.sierraleonetimes.com/news/272599684/as-summit-host-spain-urges-nato-to-watch-its-southern-flank,2022-06-27,"As Summit Host, Spain Urges NATO to Watch its Southern Flank",sierraleonetimes.com
http://www.sierraleonenews.net/news/272599684/as-summit-host-spain-urges-nato-to-watch-its-southern-flank,2022-06-27,"As Summit Host, Spain Urges NATO to Watch its Southern Flank",sierraleonenews.net
http://www.sierraleonenews.net/news/272599674/g7-summit-opens-amid-lower-expectations-protests,2022-06-27,"G7 summit opens amid lower expectations, protests",sierraleonenews.net
https://www.sierraleonepress.com/taps-in-south-africas-eastern-cape-go-dry/,2022-06-27,Taps in South Africa’s Eastern Cape Go Dry,sierraleonepress.com
http://www.sierraleonenews.net/news/272600036/g7-aims-to-raise-600-billion-to-counter-china-belt-and-road,2022-06-27,G7 Aims to Raise $600 Billion to Counter China&#039;s Belt and Road,sierraleonenews.net
https://www.sierraleonepress.com/chogm-commonwealth-ends-summit-with-call-for-action-on-climate-change-trade/,2022-06-27,"CHOGM: Commonwealth ends summit with call for action on climate change, trade",sierraleonepress.com
http://www.sierraleonenews.net/news/272601693/g-7-aims-to-raise-600-billion-to-counter-china-belt-and-road,2022-06-28,G-7 Aims to Raise $600 Billion to Counter China&#039;s Belt and Road,sierraleonenews.net
https://www.sierraleonepress.com/g7-aims-to-raise-us600-billion-to-counter-chinas-belt-and-road/,2022-06-28,G7 aims to raise US$600 billion to counter China’s Belt and Road,sierraleonepress.com
https://www.sierraleonepress.com/global-environment-facility-approves-18-million-to-support-fao-led-projects-in-africa-and-latin-america/,2022-06-28,Global Environment Facility approves $18 million to support FAO-led projects in Africa and Latin America,sierraleonepress.com
https://www.sierraleonepress.com/huawei-awarded-the-global-first-carbon-footprint-verification-for-inverters-issued-by-bsi/,2022-06-29,Huawei Awarded the Global First Carbon Footprint Verification for Inverters Issued by BSI,sierraleonepress.com
https://www.sierraleonepress.com/us-eyes-biden-xi-meeting-in-coming-weeks-sees-growing-convergence-on-china/,2022-06-29,"US eyes Biden, Xi meeting in coming weeks, sees growing convergence on China",sierraleonepress.com
http://www.thepatrioticvanguard.com/sierra-leone-s-president-julius-maada-bio-attends-opening-ceremony-of-chogm-holds-bilateral,2022-06-26,"Sierra Leone’s President Julius Maada Bio attends opening ceremony of CHOGM, holds bilateral meetings with leaders of Rwanda, Singapore and Belize",thepatrioticvanguard.com
https://statehouse.gov.sl/sierra-leones-president-julius-maada-bio-opens-unescos-milestone-education-event-makes-a-case-for-considerable-long-term-social-returns/,2022-06-29,"Sierra Leone’s President Julius Maada Bio Opens UNESCO’s Milestone Education Event, Makes a Case for Considerable Long-term Social Returns",statehouse.gov.sl
http://www.thepatrioticvanguard.com/paris-france-wednesday-29-june-2022-his,2022-06-30,President Bio at UNESCO,thepatrioticvanguard.com
https://www.sierraleonepress.com/norway-makes-fishing-vessel-data-accessible-to-the-world/,2022-06-30,Norway makes fishing vessel data accessible to the world,sierraleonepress.com
https://www.sierraleonepress.com/the-european-union-supports-dominicas-efforts-to-become-climate-resilient/,2022-06-30,The European Union supports Dominica’s efforts to become climate-resilient,sierraleonepress.com
http://www.critiqueecho.com/how-did-the-united-nations-organisation-become-a-political-boomerang/,2022-07-03,How did The United Nations Organisation Become A Political Boomerang?,critiqueecho.com
